,국가,대학교명,내용,요약,요약번역,분류,5분류
1717,남아프리카 공화국,Cape Town,"Although accurate statistics are hard to come by, South Africa clearly suffers from high levels of gender-based violence, which disproportionately affects women. The Gender Health and Justice Research Unit (GHJRU) works to improve service provision to victims of crime, violence and human rights violations, facilitate violence prevention, and promote access to justice in Southern and Eastern Africa through interdisciplinary research, advocacy and education.",Violence against women and children is a major problem in South Africa.,여성과 아동에 대한 폭력은 남아프리카 공화국의 주요 문제입니다.,5,1
1672,핀란드,Eastern Finland,"In 2020, women accounted for 53% of UEF’s teaching and
research staff and 74% of other staff. 63% of all degree students
were women.",The number of women working at the University of Edinburgh has continued to rise., 에든버러 대학교에서 일하는 여성의 수는 계속해서 증가하고 있습니다.,5,1
1422,인도네시아,IPB,"Our students developed a quartered
card game innovation into an alternative
learning method for elementary school
students in improving the score of natural
science subjects in the national exam. This
innovation, Quarter or ""Quarter Pinter""
(Smart Quarter) was selected as one of the
thousands proposals that were awarded a
grant from the Ministry of Research,
Technology and Higher Education
(Kemristekdikti). The quarter is the
answer to the needs of educators and
parents in understanding natural science
lessons and includes riddles in the game
content to support elementary students'
knowledge.",Our students developed a quartered card game innovation into an alternative learning method for elementary school students in improving the score of natural science subjects in the national exam.,우리 학생들은 국가 시험에서 자연 과학 과목의 점수를 향상시키기 위해 초등학생을 위한 대안 학습 방법으로 4분의 1 카드 게임 혁신을 개발했습니다.,4,1
1647,핀란드,Eastern Finland,"Our university has the most multidisciplinary
Faculty of Health Sciences
in Finland, with around 3,000 degree
students and more than 550 doctoral
students. The faculty trains a wide
range of professionals for key fields
in the health care sector, including
physicians, dentists, pharmacists,
head dispensers, nutritionists, and
experts in biomedicine, nursing and
health promotion.",The University of Helsinki is one of Finland's leading research universities.,헬싱키 대학교는 핀란드 최고의 연구 대학 중 하나입니다.,3,1
1354,미국,Texas at Dallas,"Learn More
Educate yourself about Quality Education by visiting the free virtual courses offered by the SDG Academy
Learn more about the targets and indicators at the UN Global Goals website
Learn more about the great work the Office of Diversity and Community Engagement does to make UT Dallas a more inclusive space
Visit the UTD Website to hear the story of UTD’s founding, and how we have grown
Read more about how education remains inequitable today, and how a history of racism in the United States has shaped our education system",Find out more about the University of Texas at Dallas., 달라스에 있는 텍사스 대학교에 대해 자세히 알아보세요.,4,1
567,뉴질랜드,Auckland,"An initiative was launched where staff and students could donateunused clothing items for students who were exploring their genderidentity or who were actively transitioning. The intention of theproject is to provide a safe place where gender-diverse students canobtain gender-affirming clothing, without needing to shop in stronglygendered retail outlets.",A gender-diverse clothing bank has been set up at the University of Aberdeen., 에버딘 대학교에 성별이 다양한 의류 은행이 설립되었습니다.,5,1
843,태국,Chulalongkorn,"While Thailand has made significant progress in manysocial spheres, gender equality still lags far behind. Topromote gender equality, Chulalongkorn Universitycommissioned outside researchers to conduct a studyto identify factors that would lead to a more equalgender environment in its communities. The research report published in 2018 – “EqualOpportunity and Gender Enabling Environment in thePromotion of Gender Equality in ChulalongkornUniversity” – aimed to create a body of knowledge andforge an understanding of the issue of gender equalityamong university staff, from administrators on down tothe rank-and-file. It found, among other things, that while femalefaculty members were capable of climbing theacademic ladder, they often hit the same “glassceiling” that women in other segments of society do. The study recommended that the university adoptpolicies that support equality in all dimensions andlaunch campaigns to educate people on the relevantconcepts, especially that of gender equality.",Chulalongkorn University has launched a campaign to promote gender equality., 출라롱콘 대학교는 성평등 증진을 위한 캠페인을 시작했습니다.,5,1
1220,영국,Northampton,"184
of our students
graduated with
qualifications that
entitled them to teach
at primary school level.","At our graduation ceremony, we celebrated the achievements of our students who have achieved qualifications to teach at primary school level.",졸업식에서 우리는 초등학교 수준의 교사 자격을 획득한 학생들의 성취를 축하했습니다.,4,1
873,호주,Charles Sturt,"The Charles Sturt Equine Isolation Facility in
Wagga Wagga is ready to take high-risk patients.
The facility features six independently operated
stables with separate airflow and plumbing and a
designated treatment and exam room. We work in
times where there are risks to human health and
this facility provides a safeguard to the health
of all patients in the hospital and the personnel
involved in the management of animals in the
isolation facility. Any animal that has, through a risk
assessment, the possibility of having a contagious
disease, will be admitted to this facility to allow us
to deliver state-of-the-art care and uphold rigorous
infection control. The completion of the facility
fulfils ongoing accreditation requirements of the
university, while also providing a biosecurity asset
to be used on a global, national, and regional scale.
This facility will be a fantastic teaching aid while
ensuring clients receive quality care and treatment",A new state-of-the-art isolation facility for horses has opened in New South Wales., 뉴사우스웨일즈에 최신식 말 격리 시설이 새로 문을 열었습니다.,4,1
472,영국,Manchester,"Cloudy with a Chance of PainCloudy with a Chance of Pain is theworld’s first smartphone-based study toinvestigate the association between painand the weather. This large-scale citizenscience project welcomes anyone in theUK with arthritis or chronic pain aged 17and over to take part. Our researchers arenow analysing more than 5 million piecesof symptom data alongside weatherdata from across the UK and thisinformation will be used to generatepain forecasts, allowing people to plantheir weekly activities.",People with arthritis or chronic pain are being invited to take part in a study to find out how the weather affects their symptoms., 관절염이나 만성 통증이 있는 사람들은 날씨가 증상에 어떤 영향을 미치는지 알아보기 위한 연구에 참여하도록 초대받고 있습니다.,3,1
1814,미국,UC Davis,"SDG 2–related centers at UC Davis
Aggie Compass Basic Needs Center
Agricultural Experiment Station (UCANR)
Agricultural Sustainability Institute
Agronomy Research and Information Center
Blum Center for Developing Economies
California Animal Health and Food Safety Laboratory System
California Center for Urban Horticulture
California Crop Improvement Association
California Institute of Food and Agricultural Research
Center for Animal Disease Modeling and Surveillance
Center for Food Animal Health
Center for Aquatic Biology & Aquaculture
Center for Health & Nutrition Research
Chile Life Sciences Innovation Center
Clarity and Leadership for Environmental Awareness and Research
Global Healthshare Initiative (CLEAR Initiative)
Conservation Agriculture Systems Innovation Center
Dairy Research and Information Center
Foods for Health Institute
Food Loss and Waste Collaborative
Food Recovery Network
Foundation Plant Services
Fruit and Nut Research and Information Center
Global Fellowships for Agricultural Development
Honey & Pollination Center
Innovation Institute for Food and Health
Institute for Global Nutrition
Nutrition Education Program
Plant Breeding Center
Postharvest Technology Center
Program in International and Community Nutrition
Public Intellectual Property Resource for Agriculture
Robert Mondavi Institute
Sustainable Agriculture Research And Education Program (SAREP)
Seed Biotechnology Center
UC Cooperative Extension (UCANR)
UC Davis Coffee Center
UC Davis Olive Center
UC Davis Student Farm
University of California Agricultural Issues Center
University of California CalFresh Nutrition Education Program
USAID Feed the Future Innovation Lab for Assets and Market Access
USAID Feed the Future Innovation Lab for Genomics to Improve Poultry
USAID Feed the Future Innovation Lab for Climate Resilient Chickpea
USAID Feed the Future Innovation Lab Climate Resilient Millet
USAID Feed the Future Innovation Lab for Horticulture
USDA Western Human Nutrition Research Center
Western Institute for Food Safety & Security
World Food Center","University of California, Davis", 캘리포니아 대학교 데이비스,2,1
1832,미국,UC Davis,"SDG 3–related centers at UC Davis
Comprehensive Cancer Center
Center for Health and Technology
Center for Healthcare Policy and Research
Center for Mind and Brain
Center for Precision Medicine
Center for Reducing Health Disparities
Center for Vector-borne Diseases
MIND Institute
One Health Institute | UC Davis
PREDICT
School of Medicine
School of Medicine Student Run Clinics
School of Nursing
Western Center for Agricultural Health and Safety
Western Institute for Food Safety and Security","University of California, Davis", 캘리포니아 대학교 데이비스,3,1
1861,미국,UC Davis,"SDG 5–related centers at UC Davis
Designated Emphasis in Feminist Theory and Research
Family Protection and Legal Assistance Clinic
Feminist Research Institute
Girls' Outdoor Adventure in Leadership and Science
Gender Research Cluster
Hatch Project
UC Davis ADVANCE
Women’s and Gender History
Women's Resources and Research Center","University of California, Davis", 캘리포니아 대학교 데이비스,5,1
1022,영국,Essex,"In January 2020, we began working with
all departments to achieve a 60/40 gender
distribution of men to women in every grade
– although not an ideal target, it is a good
first step. It would lead to the mean gender
gap being reduced to 9.3% and the median to
around 11.1%. We will continue to work with
departments to achieve this goal by 2025.
We place great importance on supporting
women’s development in the workplace and
identifying visible role models at all levels. And
we are committed to building a more agile and
flexible working culture – this is likely to have a
positive effect on the gender pay gap over time.",We are committed to reducing the gender pay gap., 우리는 성별 임금격차를 줄이기 위해 최선을 다하고 있습니다.,5,1
521,영국,Bournemouth,"Library and open accessWe work hard to provide a comprehensivelibraries and learning support service toour community. As well as our two libraries– The Sir Michael Cobham Library andWeston Library – we offer a wide range ofonline resources, including e-books ande-journals. We welcome visitors to bothThe Sir Michael Cobham Library and toWeston Library to use its resources.",We are a community-led library and learning support service.,우리는 지역 사회 주도 도서관 및 학습 지원 서비스입니다.,4,1
1284,호주,Victoria,"Engagement
HealthWest Partnership and Victoria
University worked together on Project
Momentum: Working Together with
Men to engage younger male
students and staff in prevention of
violence against women. The project
created a guide for creating and
supporting projects of this kind.
The project conducted a number
of activities in 2020 for exploring
ideas of manhood and the narratives
surrounding ‘real men’, including
the Enter the Man Box art installation
for VU O Week and workshops on the
Man Box Story.",Working with young men to prevent violence against women., 여성에 대한 폭력을 예방하기 위해 청년들과 함께 일합니다.,5,1
906,캐나다,McMaster,"Hamilton Community Food Centre (HCFC), a project of the Neighbour
to Neighbour Centre (N2N), offers food-based programs that bring
everyone together to grow, cook, share and advocate for good food.
Researcher Tina Moffat received funding to evaluate the youth
food programming at the HCFC, part of a growing movement of food
centres across Canada that move beyond charity models of food
banks to give food-insecure populations access to nutritious food in
a dignified manner.","A food centre in Hamilton, Ont., is the first of its kind in Canada.", 온타리오주 해밀턴에 있는 푸드 센터는 캐나다 최초입니다.,2,1
2085,영국,East Anglia,"Promoting trainee teacher mental health
Current mental health resources in teacher training programmes are focused on the role of educators in supporting their pupils. The Mental Health and Wellbeing Trainee Teachers Project, is a new initiative looking into the support trainee teachers themselves may need. The study explores the extent of the current provision of mental health and wellbeing support provided to trainee teachers, and the type of provision that would be needed and suitable in the future. Data collection and initial analysis has begun, with the group planning to inform teacher training providers of the support required to positively influence trainee teacher mental health and wellbeing.",A new project is looking into the mental health and wellbeing of trainee teachers., 새로운 프로젝트는 연수생 교사의 정신 건강과 웰빙을 조사하고 있습니다.,4,1
1763,덴마크,Aalborg,"COVID-19 ACTIONS
During the COVID-19 pandemic, AAU initiated several projects
to support Danish and international efforts in understanding
and managing this pandemic. Examples:",The Danish Ministry of Foreign Affairs has been involved in a number of international projects on climate change., 덴마크 외무부는 기후 변화에 관한 여러 국제 프로젝트에 참여했습니다.,3,1
1369,영국,Exeter,"Together, this work has increased diagnostic rates for genetic disease from less than 15% (2013) to  more than 70% by 2020, reduced hospitalisations, prevented major neurological and physical impairments, and enabled estimated savings of over $100 million in community healthcare costs. As a consequence of Exeterled research, local clinicians are now able to recognise a patient’s disorder and   order a cost-effective (~$50) genetic test, enabling diagnoses for around 50% of families. Exeter researchers, Dr Baple and Professor Crosby, also support regular clinics for patients translating research discoveries directly into clinical care.",Researchers at the University of Exeter have made significant contributions to the diagnosis and treatment of genetic diseases., 엑서터 대학의 연구원들은 유전 질환의 진단과 치료에 상당한 기여를 했습니다.,1,1
1985,캐나다,Brock,"FREE ACCESS TO MENSTRUAL PRODUCTS ON CAMPUS 
Menstruation is something that people born with a uterus have to deal with that causes an additional strain on finances, with the high costs of menstrual products such as tampons, pads, menstrual cups etc. can be a burden that some cannot afford. As it is something that half of the population has to deal with for the majority of their lives it is unfair that these products are high in prices as people do not choose to menstruate, it is simply something that occurs if you have a uterus.  ","As part of International Women's Day, I would like to highlight the issue of menstrual products.", 세계 여성의 날의 일환으로 저는 생리용품 문제를 강조하고 싶습니다.,5,1
613,뉴질랜드,Auckland,"Women entrepreneursWomen are underrepresented in business, which affects the well-beingof individuals and their families. Supporting more women entrepreneursand innovators to thrive is about future-proofing and growing thesocial and economic well-being of families and their communities. TheUniversity’s Centre for Innovation and Entrepreneurship has activelysought to increase the participation of women through role modelling,communication campaigns, actively recruiting more women to volunteeras mentors and speakers, and initiating social innovation programmes proven to appeal to women. The University has led New Zealand into thetop-ranked position for female founder graduates. An internationalstudy found New Zealand has the world’s highest percentage of femalegraduates who found start-ups, at 13.4 percent. Of these, almost halfare from the University of Auckland. These results were provided by thebusiness banking app Tide. Its Pioneering Women study analysed datafrom Crunchbase for companies that had raised at least US$1 million. Thesums involved indicate that founders identified in the study are generatingsubstantial enterprises. Of the 79,140 enterprises, only 6,940 hadfemale founders.",The University of Auckland is committed to supporting women entrepreneurs and innovators., 오클랜드 대학교는 여성 기업가와 혁신가를 지원하기 위해 최선을 다하고 있습니다.,5,1
1457,캐나다,Manitoba,"This program explores a wide range of womencentred
social, political and cultural issues. As a
dynamic and interdisciplinary program, students
study diverse theoretical and practical approaches,
including popular culture and consumption,
violence against women, lesbian/gay/queer
studies, women in science and technology, human
geography, Indigenous feminism, masculinity
studies, and history.",This master's degree in women's studies is designed to prepare students for graduate study in a variety of fields., 이 여성학 석사 학위는 학생들이 다양한 분야의 대학원 과정을 준비할 수 있도록 설계되었습니다.,5,1
1438,인도네시아,IPB,"Student from the Faculty of Human
Ecology, IPB University, initiated a
women's empowerment program called
FIA (Female in Action). She formed FIA, a
women's empowerment startup based on
entertainment art and technology in
i n t e n s i v e t r a i n i n g a n d i n n o v a t i v e
education. FIA is expected to be a solution
to change the mindset, become a driver
for women to develop their passion and
skills. The FIA launched an app called FIA
4.0, the first women's empowerment
application in Indonesia.",A young Indonesian woman has started a women's empowerment startup., 인도네시아의 한 젊은 여성이 여성 역량 강화 스타트업을 시작했습니다.,5,1
75,캐나다,Waterloo,"END HUNGER, ACHIEVE
FOOD SECURITY AND IMPROVED
NUTRITION, AND PROMOTE
SUSTAINABLE AGRICULTURE
SDG 2 focuses on ensuring access to adequate healthy food while supporting resilient agriculture practices that respect workers and the land. At the University of Waterloo, implementation of
SDG 2 is reflected in academic work to develop sustainable agricultural and food distribution practices worldwide
while improving the access to healthy and sustainable food choices for those in the campus community.",The University of Waterloo has become one of the first universities in the world to implement an adequate food system.,워털루 대학교는 적절한 식품 시스템을 구현한 세계 최초의 대학교 중 하나가 되었습니다.,2,1
1626,핀란드,Eastern Finland,"Home economics is taught in the
School of Applied Educational Science
and Teacher Training. The
studies focus on the viewpoints
of sustainable development and
well-being.",The studies focus on the viewpoints of sustainable development and well-being., 연구는 지속 가능한 개발과 웰빙의 관점에 초점을 맞춥니다.,2,1
1023,영국,Essex,"It’s important not to consider gender as a binary
concept. We know that many members of our
community identify outside the gender binary
and/or as trans, and we remain committed
to creating a welcoming environment for all
members of our community.","As part of our commitment to equality, we have introduced a new policy on gender identity.", 평등에 대한 약속의 일환으로 우리는 성 정체성에 대한 새로운 정책을 도입했습니다.,5,1
1666,핀란드,Eastern Finland,"Gender equality has traditionally
been a great source of pride for
Finns, and the country’s comprehensive
school has been considered
a cornerstone of gender equality.
However, as gender awareness
has increased, more critical views
of the Finnish school system have
emerged. It has been noted that
instead of promoting equality,
schools can also maintain unequal
structures. In her ongoing doctoral
dissertation, researcher and former
classroom teacher Salla Myyry looks
at how interpretations of gender
equality have changed in basic education
curricula from 2004 to 2014.",The Finnish education system has a long tradition of promoting gender equality.,핀란드 교육 시스템은 양성 평등을 장려하는 오랜 전통을 가지고 있습니다.,5,1
837,태국,Chulalongkorn,"University study is a highly stressful pursuit. Students whofind it hard to cope sometimes either drop out or engage inunhealthy lifestyles, such as taking alcohol or drugs. Aspart of its overall wellness strategy, ChulalongkornUniversity has established the Chula Student WellnessCenter, which offers psychological services for bothstudents and staff.",Chulalongkorn University has set up a wellness centre to help students cope with the demands of university study., 출라롱콘 대학교는 학생들이 대학 공부의 요구에 대처할 수 있도록 웰니스 센터를 설립했습니다.,3,1
982,호주,Sydney,"Gender equality is fundamental to our sustainable future. Despite many advances, gender inequality and
gender-based discrimination still holds back sustainable development. In a 2016 gender gap report by the
World Economic Forum, Australia ranked 46th, demonstrating there is much work to be done locally.
The University of Sydney is committed to gender equality and improving workplace culture and, globally,
was one of the first universities to admit women on the same basis as men. The University supports women in
leadership, and recently shared advice from prominent female academics on what makes a good leader. Our
Sydney Ideas program runs regular events to share our work on gender, equality and diversity.
The Faculty of Science runs a Women in Science (WISCI) project to progress gender equity in the faculty.
Read about some of the scientific breakthroughs by Sydney Science women. The Faculty of Engineering offers a
range of scholarships for women to encourage more female participation in engineering.","On International Women's Day, the University of Sydney celebrates the achievements of women around the world.", 세계 여성의 날에 시드니 대학교는 전 세계 여성의 업적을 기립니다.,5,1
359,호주,RMIT,"Women Transforming Justice
RMIT’s Centre for Innovative Justice (CIJ) is conducting an ongoing
evaluation of Women Transforming Justice (WTJ), a collaboration
between the Fitzroy Legal Service (incorporating Darebin Community
Legal Centre), the Law and Advocacy Centre for Women (LACW)
and Flat Out. The project is funded by the Legal Services Board and
provides gender-informed legal assistance specifically to women
seeking bail, combined with follow up case management and other
support to women either while they are in custody or the community.
WTJ recognises the very particular needs of a growing cohort within
our community: women on remand – as well as the disproportionate
impacts that recent bail and other legislative reforms have had on
women and their children.
The CIJ’s evaluation over the life of the project is assessing its
implementation, the specific needs of women on remand and the
extent to which the service is meeting these needs. Importantly, the
evaluation is also measuring to the extent possible how the project
is raising awareness of these needs within the legal system and
prompting a shift towards a more evidence-based, gender-informed
approach.",A gender-informed legal assistance project for women on remand in Melbourne is being evaluated.,멜번에서 구금된 여성을 위한 성별 정보 법률 지원 프로젝트가 평가되고 있습니다.,5,1
742,영국,Oxford,We will incorporate world-class features and amenities in our buildings that support the success of our customers and help them live healthy and active lives.,We are committed to providing our customers with a world-class experience., 우리는 고객에게 세계적 수준의 경험을 제공하기 위해 최선을 다하고 있습니다.,3,1
752,영국,Oxford,we will incorporate world-class features and amenities in our buildings that support the success of our customers and help them live healthy and active lives.,We are committed to providing our customers with a world-class experience., 우리는 고객에게 세계적 수준의 경험을 제공하기 위해 최선을 다하고 있습니다.,3,1
