,국가,대학교명,내용,요약,요약번역,분류,5분류
609,뉴질랜드,Auckland,"Gender issues in software engineering / Code review, where software code contributions are examined byothers, is a common practice on software teams. While it bringssignificant advantages such as improved code quality and knowledgesharing, software developers report that it can also create toxic, unsupportive environments. Yet, many software developers argue it ismore important to maintain software quality than to worry about thefeelings of developers who receive harsh feedback. This attitude couldbe a contributing factor to the low gender diversity on software teams.A project headed by Kelly Blincoe from the Department of Electrical,Computer and Software Engineering is investigating software developers’attitudes towards negative feedback in code review, with a lens on genderdifferences. The project is funded by a Google Faculty Research Award. ",The lack of women in software development could be a contributing factor to the low gender diversity on software teams., 소프트웨어 개발에 여성이 부족한 것은 소프트웨어 팀의 성별 다양성이 낮은 원인이 될 수 있습니다.,5,1
201,영국,Glasgow,"Addressing inequalities is a key factor of reducing poverty and one of our six Glasgow Research Beacons, which represent areas of research excellence and significant investment for the University. The College of Social Sciences leads on research to help address the drivers of inequality, deprivation and marginalisation, including showcasing inequality-related research at themed UN International days. A recent University exhibition, Beyond Development: Local Visions of Global Poverty, brings poverty into focus and explores it from the perspectives of marginalised communities around the world. Academics at the University are also leading work to support refugees and asylum seekers as part of the New Scots partnership between the Scottish Government, the Convention of Scottish Local Authorities (COSLA) and the Scottish Refugee Council. The partnership helps support the integration of refugees and asylum seekers in their new Scottish communities.",The University of Glasgow is at the forefront of research into poverty and inequality., 글래스고 대학교는 빈곤과 불평등에 대한 연구의 최전선에 있습니다.,1,1
796,호주,Wollongong,"Recovery Camp’s mission is for students and people with lived experience of mental illness realise their personal strengths and their contribution to the mental health and recovery of others. The research program combines professional experience placement for health students, with a recovery-oriented experience for those living with a mental illness. The program also provides support for carers of people with a mental illness and continuing professional development opportunities for practicing health professionals. Recovery Camp has provided over 65,000 hours of clinical placement to over 800 health students.",Recovery Camp is a professional development and research program for health students and people with lived experience of mental illness., 회복 캠프는 정신 질환의 경험이 있는 건강 학생과 사람들을 위한 전문 개발 및 연구 프로그램입니다.,3,1
1467,호주,Griffith,"PROVIDING STUDENTS WITH FRESH FRUIT AND VEGETABLES.In 2021, the Student Representative Council, in partnership with the Fruit Box Group provided Griffith students with fresh, low-cost fruit and vegetables. Introduced in response to the COVID-19 pandemic, the program recognises increased financial pressures on students.",Griffith University has become the first Australian university to introduce a student-run food bank., 그리피스 대학교는 학생이 운영하는 푸드 뱅크를 도입한 최초의 호주 대학교가 되었습니다.,2,1
2059,영국,East Anglia,"Research - 451 publications in SciVal 2016 - 2021
A new UK centre of excellence for food security
The yields of major staple foods such as grains, fruits and vegetables are expected to decrease by 3 - 10 % with every degree of global warming. In collaboration with our partners on the Norwich Research Park, the new Norwich Institute for Sustainable Development works to mitigate these stark predictions and improve global food security. Their work focuses on combating the threats from ever more extreme and unpredictable weather events, working with farmers all over the world to develop solutions to make agriculture more resilient",Climate change is one of the greatest threats to global food security., 기후 변화는 세계 식량 안보에 대한 가장 큰 위협 중 하나입니다.,2,1
55,이탈리아,Bologna,"Students can have a free access to the “SexuallyTransmitted Disease Center” of the Universityhospital. They are provided with specialist visitsand treatment of sexually transmitted diseasesand genital localization diseases, information,education, prevention and counselling (alsopsychological)",Students at the University of Groningen are offered free medical treatment for sexually transmitted diseases.,흐로닝언 대학교의 학생들은 성병에 대한 무료 치료를 받습니다.,3,1
708,이탈리아,Bologna,"Baby Pit-Stop is a special quiet area for motherswho are students, PhD students, research fellows,academics, staff, and visiting friends and relatives, tofeed and change their babies at UniBo (SustainableMulticampus Project).",A baby changing station has been set up at the University of Aberdeen., 애버딘 대학교에 아기 기저귀 교환대가 설치되었습니다.,5,1
