,국가,대학교명,내용,요약,요약번역,분류,5분류
538,뉴질랜드,Auckland,"Funded by the Health Research Council and headed by the University ofAuckland, the DIET programme is an ongoing series of research projectsaimed at promoting healthy eating patterns. The DIET team worksclosely with food retailers to look at product placement and promotionand to evaluate food-labelling practices. Other projects includecataloguing nutritional data for foods sold in New Zealand, investigatingthe impact of low-sodium diets, and supporting organisations toimplement healthy eating policies. ",A team of researchers in New Zealand is working to improve the nutritional content of food sold in the country., 뉴질랜드의 연구원 팀은 뉴질랜드에서 판매되는 식품의 영양 성분을 개선하기 위해 노력하고 있습니다.,2,1
2046,홍콩,CUHK,"Advocating gender equality
To promote gender equality and women’s human rights, the Gender Studies Programme co-organized two international conferences.  The conference ‘Gender and (Im)mobility in Uncertain Times’ was organized in March 2021 with the Diversity and Inclusion Office, and the ‘International Conference on Gender: Moving Towards Gender Equality and A Sustainable Society’ was organized in December 2021 with the Hong Kong Federation of Women’s Centre.  The first conference presented the findings of recent research on workplace dynamics, family relations and gender norms across societies during the pandemic, while the second conference illustrated the development of women’s services in a diversified manner through keynote speeches, learning groups and experiential workshops.",Two international conferences were held at the University of Hong Kong to promote gender equality and women’s human rights.,성평등과 여성인권 증진을 위해 홍콩대학교에서 두 차례의 국제회의가 열렸다.,5,1
45,이탈리아,Bologna,"Through PLOTINA project and our Gender Equality Plan (GEP) we promote and favour women's access to university studies even in those areas of study traditionally most frequented by men. The Gender Equality Plan (GEP) is a flexible tool, comparable to a Positive Action Plan, which is constructed taking into account the peculiarities and needs of each single University or Research Center. Moreover, to contrast gender biases in the evaluation and recruitment of professors and researchers, we produced and diffused a formative downloadable video. Last, but not least, our University participates in a national project that allows transgender students to adopt the name they want without being discriminated against at any time during their university career",Our University participates in a number of national and international projects aimed at promoting gender equality., 우리 대학은 성평등 증진을 목표로 하는 다수의 국내 및 국제 프로젝트에 참여하고 있습니다.,5,1
618,뉴질랜드,Auckland,"HARDSHIP SUPPORT AND AUSA HARDSHIPGRANTThe University provides various grants under its ‘hardship support’ initiativefor students enrolled for more than two weeks. It supports students facedwith financial difficulties that may be affecting their studies. The AucklandUniversity Students’ Association (AUSA) Hardship Grant helps studentsin hardship with basic necessities of life under the categories of food,accommodation, travel and medical.",The University of Auckland has a number of financial support schemes for its students., 오클랜드 대학교에는 학생들을 위한 다양한 재정 지원 제도가 있습니다.,1,1
1334,미국,Texas at Dallas,"Learn More
Check out SDG Academy to take interactive educational courses pertaining to SDG 2: Zero Hunger
Learn more about the targets and indicators at the UN Global Goals website
Check out the Comet Cupboard to donate or receive needed resources
Visit the North Texas Food Bank to learn about food insecurity in the greater Dallas community",Find out more about the United Nations Global Goals and how you can help., 유엔 글로벌 목표와 귀하가 도울 수 있는 방법에 대해 자세히 알아보십시오.,2,1
628,뉴질랜드,Auckland,"COMBATTING TROPICAL DISEASEUniversity of Auckland researchers from the Maurice Wilkins Centre forMolecular Biodiscovery, in collaboration with the Drugs for NeglectedDiseases Initiative in Geneva, have developed a new drug, DNDi-0690,for the often-fatal tropical disease Leishmaniasis. The drug is currently inclinical trials. This disease affects people in 98 countries, with two millionnew cases in 2018, and causes up to 50,000 premature deaths yearly.",Scientists in New Zealand have developed a new drug to treat a neglected tropical disease., 뉴질랜드 과학자들이 방치된 열대성 질병을 치료하는 신약을 개발했습니다.,3,1
1378,영국,Exeter,"Inequality and low social mobility continue to be major national challenges in the UK,        entrenched from birth to work, due to failures in education and employment policies. The University of Exeter ’ s Centre for Social Mobility is the UK social mobility through evidence’ s first centre dedicated to improving informed practice and policy, collaboratively developed with professionals, practitioners and other stakeholders. Its goal is to help disadvantaged young people to access higher education and succeed at university and in adult life. The centre has demonstrated impact, through research cocreated with key stakeholders, across a number of important areas, to improve social mobility. It has: 1) Informed professional guidelines and best practice in how university evaluation of outreach is undertaken; 2) Changed         institutional widening participation policies and practices in Higher Education to improve       educational outcomes for disadvantaged students; 3) Informed guidance and advice on the use of contextualised admissions to support access to Higher Education","The Centre for Social Mobility at the University of Exeter is the UK's first centre dedicated to improving informed practice and policy, collaboratively developed with professionals, practitioners and other stakeholders."," 엑서터 대학교의 사회 이동 센터는 정보에 입각한 관행과 정책을 개선하는 데 전념하는 영국 최초의 센터로 전문가, 실무자 및 기타 이해 관계자와 공동으로 개발했습니다.",4,1
570,뉴질랜드,Auckland,"The Faculty of Arts hosted the 'Choose to Challeng' event incelebration of International Women’s Day. The event includedseminars on a range of topics by University academics, as well as abreak-out session facilitated by the Campus Feminist Collective. Theevent gave students the opportunity to consider issues of power,activism, and gender in politics.",Students at the University of Cape Town have been given the opportunity to consider the role of women in politics., 케이프타운 대학의 학생들은 정치에서 여성의 역할에 대해 생각할 기회를 얻었습니다.,5,1
1638,핀란드,Eastern Finland,"The Metabolic Diseases research
community looks for solutions to
obesity, diabetes and heart disease.","The Metabolic Diseases Research community looks at solutions to obesity, diabetes and heart disease."," 대사 질환 연구 커뮤니티는 비만, 당뇨병 및 심장 질환에 대한 솔루션을 찾습니다.",3,1
1257,호주,Victoria,"Engagement
A Brief Interventions Toolkit was
deployed on the headspace website,
accessed by thousands of young
people, to provide solutions-focused,
skills-based material to help handle
life’s challenges, without needing to
speak to a clinician. The toolkit of
micro-intervention modules for use
by young people to deal with personal
trials, draws on the research by
Professor Alex Parker into physical
activity and problem solving by young
people with mental health concerns.",A toolkit for young people with mental health concerns has been developed by the University of Bath., 정신 건강 문제가 있는 청소년을 위한 도구 키트가 배스 대학교에서 개발되었습니다.,3,1
1230,영국,Northampton,"64%
We are proud that over
64% of our students
are female.
53%
of our senior managers
are women.
82%
of our medical students
are women.
61%
of our staff are female.",More than half of our senior managers are women., 우리 고위 관리자의 절반 이상이 여성입니다.,5,1
5,영국,Leicester,Three members of the Business School wrote the Government Equalities Office report ‘The effects of menopause transition on women’s economic participation in the UK’. This resulted in Leicester becoming the first university in the UK to have a menopause policy.,A group of students from the Business School at the University of Leicester have made history by being the first in the UK to have a menopause policy., 레스터 대학교 경영대학원 학생들이 영국에서 최초로 폐경 정책을 시행함으로써 역사를 만들었습니다.,5,1
1998,영국,Sheffield,"Local food, Covid-19 and the future of the UK's food systems
The local food sector came into focus during the Covid-19 pandemic as the UK’s mainstream food systems experienced shocks and shifts. This project examines this period and shows how we can enhance the resilience of the local food sector and of the wider food system in the UK. The pandemic not only substantiated the importance of the local food sector, it also provided an opportunity to envision a food systems transformation centred on strengthening local food systems. Research in this area can help improve levels of food security so more people can gain access to food.",The local food sector is an important part of the UK’s food system but its importance has been under scrutiny in recent years., 지역 식품 부문은 영국 식품 시스템의 중요한 부분이지만 최근 몇 년 동안 그 중요성에 대한 정밀 조사가 이루어졌습니다.,2,1
438,호주,Western Sydney,"VINEYARD CREEK CULTURAL ECOLOGY Separated from the main Parramatta South campus by a rail corridor, Vineyard Creek is an area of significant natural and cultural heritage. A series of transitional ecological communities from the mangroves of the edge of Parramatta River upstream support a range of native species, including Burramatta eels. Elders have been observed on the spring tides returning up into the creek, completing a lifecycle out to the Coral Sea and back. The area may have had significant use by the local aboriginal groups, though disturbances have included quarrying for sandstone in the colonial era, and subsequent impacts of rail development. Dr Maryella Hatfield and a group of students from the School of Humanities and Communication Arts have undertaken videography sessions, with discussion of related issues and opportunities. Dr Brenda Dobia has also taken groups of education students out on site. Bush regeneration efforts are ongoing, in a manner consistent with a Bushland Management Strategy","The University of Sydney's Parramatta South campus is located on the banks of Vineyard Creek, a tributary of the Parramatta River.",시드니 대학교의 파라마타 사우스 캠퍼스는 파라마타 강의 지류인 빈야드 크릭 유역에 위치하고 있습니다.,4,1
726,호주,Western Sydney,"VINEYARD CREEK CULTURAL ECOLOGY Separated from the main Parramatta South campus by a rail corridor, Vineyard Creek is an area of significant natural and cultural heritage. A series of transitional ecological communities from the mangroves of the edge of Parramatta River upstream support a range of native species, including Burramatta eels. Elders have been observed on the spring tides returning up into the creek, completing a lifecycle out to the Coral Sea and back. The area may have had significant use by the local aboriginal groups, though disturbances have included quarrying for sandstone in the colonial era, and subsequent impacts of rail development. Dr Maryella Hatfield and a group of students from the School of Humanities and Communication Arts have undertaken videography sessions, with discussion of related issues and opportunities. Dr Brenda Dobia has also taken groups of education students out on site. Bush regeneration efforts are ongoing, in a manner consistent with a Bushland Management Strategy","The University of Sydney's Parramatta South campus is located on the banks of Vineyard Creek, a tributary of the Parramatta River.",시드니 대학교의 파라마타 사우스 캠퍼스는 파라마타 강의 지류인 빈야드 크릭 유역에 위치하고 있습니다.,4,1
1137,미국,Lynn,"Ambassador Corps
Students worked with women’s organizations in Costa Rica and Colombia to bring women's empowerment to the forefront of experiential learning opportunities.",Students in the Ambassador Corps worked with women's organizations in Costa Rica and Colombia to bring women's empowerment to the forefront of experiential learning opportunities.,대사단의 학생들은 코스타리카와 콜롬비아의 여성 단체와 협력하여 경험적 학습 기회의 최전선에 여성의 권한을 부여했습니다.,5,1
1990,캐나다,Brock,"SOLIDARITÉ DES FEMMES ET FAMILLES IMMIGRANTES FRANCOPHONES DU NIAGARA (SOFIFRAN) 
SOFIFRAN is a project designed to help with the social and economic combination of francophone women immigrants in the Niagara Region. It is a 36-month project, where work with child care services, school boards, city councils, transportation companies, and others will establish a model to address the barriers francophone immigrant women face to employment.",francophone immigrant women face barriers to employment in the Niagara Region., 불어권 이민자 여성은 나이아가라 지역에서 고용 장벽에 직면해 있습니다.,5,1
630,뉴질랜드,Auckland,"ADDICTION RESEARCHA landmark $5 million donation as part of the For All Our Futures Campaignhas enabled the appointment of a fully endowed Chair in Addiction. TheChair, Professor Benedikt Fischer, has built a multidisciplinary team thatwill strengthen New Zealand’s expertise in this important area of healthand also influence Government policies to deal with addiction problems(alcohol, drugs, gambling).",The Addiction Research Centre at the University of Auckland is the first of its kind in New Zealand., 오클랜드 대학교의 중독 연구 센터는 뉴질랜드 최초의 중독 연구 센터입니다.,3,1
754,영국,Oxford,We will incorporate world class features and amenities in our buildings that support the success of our customers and help them live healthy and active lives.,We are committed to providing our customers with the best possible service., 우리는 고객에게 최상의 서비스를 제공하기 위해 최선을 다하고 있습니다.,3,1
1225,영국,Northampton,"The drive for gender equality globally remains an
ongoing battle and is an area that the University of
Northampton is fully committed to supporting. Our
work in this area encompasses supporting females
being taught in compulsory education and in higher
education, as well as equity for women in the
workplace. We are also committed to preventing
violence against women, and other forms of
exploitation and harm. We are proud of our work
to ensure that we promote gender equality and
actively support women in their lives and careers","As part of International Women's Day, the University of Northampton would like to take this opportunity to highlight our commitment to gender equality.", 세계 여성의 날의 일환으로 노샘프턴 대학교는 이 기회를 통해 성평등에 대한 우리의 약속을 강조하고자 합니다.,5,1
1243,호주,Victoria,"Vasileios Stavropoulos worked with
Turkish and UK researchers to develop
a new food addiction scale for the
measurement, prevalence and
psychological risk factors associated
with addictive food consumption.",A researcher at the University of Athens has developed a new scale for measuring food addiction., 아테네 대학의 연구원이 음식 중독을 측정하는 새로운 척도를 개발했습니다.,2,1
1283,호주,Victoria,"The United Nations Population Fund,
Avenir Health, John Hopkins University
and VISES researchers collaborated
on assessing the impact of COVID 19
on family planning and ending gender
based violence .",A new study suggests that the use of contraceptives is linked to a reduction in violence against women., 새로운 연구는 피임약의 사용이 여성에 대한 폭력의 감소와 관련이 있음을 시사합니다.,5,1
1991,캐나다,Brock,"Individual Actions
If you wish to help by volunteering, there are some great opportunities where you can help make a change such as:  

Big Brothers/Big Sisters mentoring program provides girls and young women with a role model to talk to and share the experiences of growing up with.  
Canadian Federation of University Women, a local, provincial, national, and international organization of women. A non-profit group who are committed to the: pursuit of knowledge, promotion of education, and the improvement of the status of women and their human rights. 
Encourage gender training and education at your company. 
Represent gender equality in your home. 
Look to and support women leaders. 
Stand up for woman rights. 
Let media outlets know it is not alright to portray women as inferior, less intelligent or incompetent compared to males.  
Increase female leadership roles in the workplace. 
Encourage scholarships for girls to attend school, especially those in science, technology, and engineering. 
Set a good example to youth and ensure you use equal decision making skills. ","As part of International Women's Day, here are some ways you can help.", 세계 여성의 날의 일환으로 여러분이 도울 수 있는 몇 가지 방법이 있습니다.,5,1
531,뉴질랜드,Auckland,"Dr Louise Humpage, from the University of Auckland’s School ofSocial Science, conducted research examining the experiencesof income-support recipients during the national lockdown in2020. She drew attention to the fact thatexisting policies and clawbacks largelyeliminated the benefit increase thatoccurred in April of that year, andthat many participants reportedfeelings of stress and stigma inaccessing their entitlements. Shehopes to encourage governmentto ensure that adequate andequitable levels of support areavailable to everyone who needs it.","New Zealand’s income-support system is not fit for purpose, according to a new study.", 새로운 연구에 따르면 뉴질랜드의 소득 지원 시스템은 목적에 적합하지 않습니다.,1,1
1217,영국,Northampton,"The Activity Quarter
and our Active Campus
The University leads on the
Activity Quarter Project. Local
partners include Public Health,
Northamptonshire Sport, West
Northamptonshire Council and
Delapré Abbey. This work promotes
a physical activity and supports
social prescribing in a large
geographical area of Northampton
town. Our Active Campus project
(led by our Sport and Physical
Activity Group) promotes physical
activity for staff and students.
Our Sports Dome and all-weather
pitches are used by local groups,
seven days a week. Northampton
Town FC and Northampton Saints
Rugby Club use our outstanding
facilities for training purposes.
We worked specifically with
Table Tennis England to bring
Ping! and table tennis tables to
campus for community use. We
have since expanded the amount
of sport equipment on campus,
purchasing table football tables,
table tennis tables and badminton
equipment as part of “Play, don’t
Pay” to encourage free, recreational
sport participation. Similarly,
the Residential Life team have
expanded their free sport offer
to students to other activities
including fitness classes, netball
and racket sports.
The Sport and Physical Activity
Group have evaluated walking
activity and stair use in the post
Covid-19 campus, and have had
approval to start a Waterside
Campus Park Run. We are also
opening an open access community
Sport Injury Clinic run by students.
Our Student Information Desk
provides a range of services for
students to support health
and wellbeing.",The University of Northampton promotes physical activity in the local community., 노샘프턴 대학교는 지역 사회에서 신체 활동을 장려합니다.,3,1
673,뉴질랜드,Cantebury,"Gender Pay Gap inAcademia / UC’s Associate Professors Ann Browerand Alex James analysed Performancebased Research Fund (PBRF) scoresand academic ranks of all academicsin New Zealand for their researchpaper on gender pay in New ZealandUniversities. Their finding of a ‘genderperformance pay gap’ is a world-first.It was made possible by measuringthe research performance scores ofall New Zealand university academicstaff from 2003 - 2012 – nearly 6000individuals. Their finding shows that,when women and men perform at thesame productivity level, women stillearn less.",Women academics in New Zealand are paid less than their male counterparts for doing the same job., 뉴질랜드의 여성 학자들은 같은 일을 해도 남성보다 적은 급여를 받습니다.,5,1
67,이탈리아,Bologna,"The University of Bologna applies the national policy against any formof gender pay gap as stated in the Italian Constitutional Chart, art. 37,where it is written: “Working women are entitled to equal rights and,for comparable jobs, equal pay as men”. Thus, at a specific academicposition corresponds a specific pay equal for both genders.To monitor the application of this national policy and the eliminationof the gender pay gap, the University provides its data per year in itsGender Equality Annual Report, where it is included also the indicator“University Gender Inequality Index (UGII)”.",The gender pay gap is defined as the difference between the pay of men and women working in the same job., 성별 임금격차는 같은 직업에 종사하는 남녀의 임금차이로 정의된다.,5,1
1574,영국,LSE,A case study from the Department of Accounting (Dr Pik Liew) has been accepted for showcase by Advance HE – a sector-wide organisation that looks at learning and teaching.,A Swansea University department has been chosen to showcase its work at a national conference., 스완지 대학교의 한 부서가 전국 회의에서 자신의 작업을 선보이도록 선택되었습니다.,4,1
1769,덴마크,Aalborg,"STUDY AND WORK ENVIRONMENT
Physical work and study environment: At AAU, continuous
assessment of the quality of both work and study environments
is key to providing the optimal physical conditions for
research, teaching and learning. At Campus Service, attention
is given to safe use of equipment and chemicals in laboratories,
as well as the overall work and study environment,
including ergonomic furniture, proper lighting and ventilation
etc.",The aim of Campus Service is to provide a safe and healthy work and study environment for students and staff., 캠퍼스 서비스의 목표는 학생과 교직원에게 안전하고 건강한 작업 및 학습 환경을 제공하는 것입니다.,3,1
1965,캐나다,Brock,"If you notice someone close to you such as a friend, family member or coworkers is acting differently reach out to them to make sure they are okay, offer them some help with tasks that might be draining and ensure they have someone to talk. ",If you are worried about someone you know is having a difficult time contact your local mental health service., 아는 사람이 어려운 시간을 보내고 있는 것이 걱정된다면 지역 정신 건강 서비스에 연락하십시오.,3,1
1229,영국,Northampton,"Research
The University also conducts a
wide-variety of research into issues
related to gender equality. These
projects include: the Understanding
Agency and Resistance Strategies
exploring children’s experiences
of coping with domestic violence;
promoting gender equality in public
services; and using education to
promote gender equality in Turkey.",The Department of Women’s and Gender Equality at the University of Oxford conducts research on issues relating to women’s and gender’s rights., 옥스퍼드 대학교 여성 및 성평등학과는 여성 및 젠더의 권리와 관련된 문제에 대한 연구를 수행합니다.,5,1
1239,호주,Victoria,"Victoria University research into
sustainable agriculture on the water
footprint of food exports found
Australia loses about 35,000 gigalitres
of freshwater a year embedded in
agricultural exports. That is roughly
equivalent to all Australia’s stored
reservoir water. As Australia has
volatile water resources, measuring
the water footprint of products is
critical for national policy. The study
found 65% of the nation’s agricultural
products are exported for relatively
low benefit, when water is factored
into the cost. The report was coauthored
by Dr Muhammad Tariq and
Dr Nitin Muttil and two Bachelor of
Civil Engineering students Riley
Damnics and Zohreh Rajabi, along
with Muhammad Laiq Ur Rahman
Shahid from the University of
Engineering and Technology Taxila.
Dr Tariq and Dr Muttil mentored the
students in after-class sessions
toward a goal of publication.","Australia loses billions of litres of water a year to agriculture exports, according to a new study.", 새로운 연구에 따르면 호주는 농업 수출로 인해 연간 수십억 리터의 물을 잃습니다.,2,1
