,Unnamed: 0,국가,대학교명,내용,번역,영한_재번역,추출요약,분류,5분류
303,4815,인도네시아,IPB University,"We also works with the Indonesian
Institute of Sciences (LIPI) Bogor on
research including resource sharing
equipment. In addition, currently IPB
University has 18 research consortiums in
total. The consortium is KOICATALENTA,
INTPREP Peat Restoration, AIC PAIR P a r t n
e r s h i p A u s t r a l i a - I n d o n e s I a
Research, VSS4F/WOOD, CENTA, CRCRACE
2030, SPIN-ANGIN, Orang Utan R e s e a r c
h , T I M T r a c e , R I S T E K-DIKBUDMIRA,
Food and Fertilizer Technology Center for
Asian and Pacific R e g i o n , U K I C I S U K - I n
d o n e s I a Consortium, NPUST IERC,
Erasmus+ Spirits","우리는 또한 인도네시아 사람과 함께 일합니다.
보고론 과학 연구소
자원 공유를 포함한 연구
장비. 또한 현재 IPB
대학에는 18개의 연구 컨소시엄이 있다.
총합입니다 컨소시엄은 코이카탈렌타이고
INTPREP 이탄 복원, AIC PAURE 파트 n
호주로 배를 몰다.
연구, VSS4F/WOOD, CENTA, CRCRACE
2030년, SPIN-ANGIN, Orange Utan resear c
h, 팀 레이스, 리스테크-디크 버드미라,
식품비료기술센터
아시아 태평양 지역, UKICI SUK - In
컨소시엄, NPUT IERC,
에라스무스+정령","우리는 또한 자원 공유 장비를 포함한 연구에 관한 인도네시아 과학 연구소 (LIPI) Bogor와 협력합니다.또한 현재 IPB University에는 총 18 개의 연구 컨소시엄이 있습니다.컨소시엄은 Koicatalenta, intprep Peat 복원, AIC 쌍 P A R T N E R S H I P A U S T R A L I A-I N D O N E S I A-I N D O N E S I A-I N D O N E S I I A-I N D O N E S I I A-I N D O N E S I I A RESTREP, VSS4F/WOOD, CENTA, CRACRACE 2030, SPIN-ONGIN, ORANT UTAN RE S E S E A R C H, T I M T R A C E S S K-DIKUDUS 및 및 r i S K-DIKUDID.아시아 및 태평양을위한 비료 기술 센터, U K I C I S U K -I N D O N E S I 컨소시엄, NPUST IERC, ERASMUS+ SPIRIT"," 및 태평양을위한 비료 기술 센터, U K I C I S U K -I N D O N E S I 컨소시엄, NPUST IERC, ERASMUS+ SPIRIT",17,5
304,4816,인도네시아,IPB University,"I P B U n i v e r s i t y h a s s t a r t e d t o
implement the 2020 IPB Curriculum. The
c u r r i c u l u m i s a l i g n e d i n b r i n g i n g
universities towards a kampus merdeka.
According to situation, currently IPB
University has carried out various
transformations in responding to VUCA
(volatility, uncertainty, complexity,
ambiguity) and the Industrial Revolution
4.0. In responding to change, the one who
can survive is agile learners. Besides being
strong with soft skills, we encourage to
p r o d u c e l e a r n i n g p e o p l e . I n t h i s
curriculum, thesis can be done in groups.
The goal is to practice collaboration skills.
For Example In conducting smart farming
research, students need collaboration
between agronomy and computer science
students.","IPB University가 시작되었습니다.
2020년 IPB 커리큘럼을 시행합니다. 그
컬럼은 육류와 관련이 있다.
캄푸스 메르데카를 향한 대학들
상황에 따라 현재 IPB
대학은 다양한 활동을 해왔다.
VUCA 대응의 혁신
(변동성, 불확실성, 복잡성,
모호성)과 산업 혁명
4.0. 변화에 대응하여
민첩한 학습자가 살아남을 수 있다. 있는 것 말고도
부드러운 기술을 가지고 강인하게, 우리는 장려한다.
people을 배우게 한다. 이것은
교과과정, 논문은 그룹으로 이루어질 수 있다.
목표는 협업 기술을 연습하는 것입니다.
예를 들어 스마트팜을 수행하는 경우
연구, 학생들은 협업이 필요하다.
농업과 컴퓨터 과학 사이에
학생들.","I p b u n i v e r s i t y h a s s s t a r t e d t o 구현 2020 IPB 커리큘럼.Kampus Merdeka를 향한 대학.상황에 따르면, 현재 IPB University는 VUCA (변동성, 불확실성, 복잡성, 모호성) 및 산업 혁명 4.0에 대한 다양한 변화를 수행했습니다.변화에 응답함에있어 살아남을 수있는 사람은 민첩한 학습자입니다.부드러운 기술로 강한 것 외에도, 우리는 p r o d u c e l e a r n i n g p e o p l e를 권장합니다.교과 과정, 논문은 그룹으로 수행 할 수 있습니다.목표는 협업 기술을 연습하는 것입니다.예를 들어 스마트 농업 연구를 수행 할 때 학생들은 농업과 컴퓨터 과학 학생들 사이의 협력이 필요합니다.",I p b u n i v e r s i t y h a s s s t a r t e d t o 구현 2020 IPB 커리큘럼,17,5
305,4872,캐나다,University of Manitoba,"The University of Manitoba is working to strengthen
global partnerships of sustainable development
through experiential learning opportunities,
international research projects and student
engagement activities including the following:","""매니토바 대학교는 이 학교를 강화하기 위해 노력하고 있습니다.
지속가능한 발전을 위한 글로벌 파트너십
경험적 학습의 기회를 통해
국제 연구 프로젝트와 학생
다음을 포함한 참여 활동:""","매니토바 대학교 (University of Manitoba)는 경험 학습 기회, 국제 연구 프로젝트 및 다음을 포함한 학생 참여 활동을 통해 지속 가능한 개발의 글로벌 파트너십을 강화하기 위해 노력하고 있습니다.","매니토바 대학교 (University of Manitoba)는 경험 학습 기회, 국제 연구 프로젝트 및 다음을 포함한 학생 참여 활동을 통해 지속 가능한 개발의 글로벌 파트너십을 강화하기 위해 노력하고 있습니다.",17,5
306,4873,캐나다,University of Manitoba,"Alternative Reading Week
The Indigenous Scholar’s Network has expanded
its service-learning and community-based
research opportunities with global Indigenous
communities. Alternative Reading Week
encourages students to spend Reading Week
abroad learning about other cultures through
community-based experiences. The most current
destinations include Belize (pictured above) and
Ecuador as well as an Ecuador Service-Learning
Experience and Chile Service Learning Experience","""대체 독서 주간""
원주민 학자의 네트워크가 확장되었다.
서비스 학습 및 지역사회 기반
글로벌 원주민과의 연구 기회
지역 사회 대안 독서 주간
학생들이 독서 주간을 보내도록 격려하다
통해 다른 문화에 대해 배우는 해외
지역 사회에서의 경험 가장 최신의
목적지는 벨리즈(위 사진)와
에콰도르 및 에콰도르 서비스 학습
체험 및 칠레 서비스 학습 체험""",Alternative Reading Week 원주민 학자의 네트워크는 글로벌 원주민 커뮤니티와 서비스 학습 및 커뮤니티 기반 연구 기회를 확대했습니다.대체 독서 주간은 학생들이 지역 사회 기반 경험을 통해 다른 문화에 대해 해외에서 학습하는 주간을 보내도록 권장합니다.최신 목적지에는 벨리즈 (위 그림)와 에콰도르뿐만 아니라 에콰도르 서비스 학습 경험 및 칠레 서비스 학습 경험이 있습니다.,Alternative Reading Week 원주민 학자의 네트워크는 글로벌 원주민 커뮤니티와 서비스 학습 및 커뮤니티 기반 연구 기회를 확대했습니다,17,5
307,4874,캐나다,University of Manitoba,"Engineers Without Borders
This University of Manitoba Student Chapter is a
student volunteer organization which promotes
environmental and social sustainability at the
University of Manitoba and within other developing
countries. They are comprised of students from
multiple disciplinary areas of study. Some of their
recent projects include promoting fair trade on
campus, working toward a fair trade campus
designation and developmental planning in Africa.","국경 없는 엔지니어
이 매니토바 대학의 학생 지부는
을 촉진하는 학생 봉사 단체
환경 및 사회적 지속 가능성
매니토바 대학교 및 기타 개발도상국 내
나라들. 그들은 다음의 학생들로 구성되어 있다.
다양한 학문 분야 그들 중 일부는
최근의 프로젝트들은 공정 무역을 촉진하는 것을 포함한다.
캠퍼스, 공정무역 캠퍼스를 위해 일하는 것
아프리카의 지정과 개발 계획.","국경이없는 엔지니어이 매니토바 대학교 학생 챕터는 매니토바 대학교와 다른 개발 도상국에서 환경 및 사회적 지속 가능성을 장려하는 학생 자원 봉사 단체입니다.그들은 여러 징계 분야의 학생들로 구성되어 있습니다.최근의 프로젝트 중 일부는 캠퍼스에서의 공정 거래 홍보, 아프리카의 공정 무역 캠퍼스 지정 및 개발 계획을 향한 작업을 포함합니다.",국경이없는 엔지니어이 매니토바 대학교 학생 챕터는 매니토바 대학교와 다른 개발 도상국에서 환경 및 사회적 지속 가능성을 장려하는 학생 자원 봉사 단체입니다,17,5
308,4875,캐나다,University of Manitoba,"Campus as a Living Lab: The Sustainability Research in Action (SRA) program connects University of Manitoba
faculty and staff with students who are passionate about solving sustainability challenges on campus through
research projects. The Office of Sustainability helps to coordinate these initiatives while providing a platform for
the community to access the completed research. The SRA program promotes a culture of sustainable change
through growth, education, and action.","살아있는 실험실로서의 캠퍼스: 매니토바 대학교를 연결하는 지속가능성 연구(SRA) 프로그램
교직원과 교내에서 지속가능성 문제를 해결하는데 열정을 쏟는 학생들을 위해
연구 계획 지속가능성 사무소는 이러한 이니셔티브를 조정하면서 다음을 위한 플랫폼을 제공할 수 있도록 지원합니다.
완성된 연구에 접근할 수 있는 지역 사회 SRA 프로그램은 지속 가능한 변화의 문화를 촉진합니다.
성장, 교육, 그리고 행동을 통해","살아있는 실험실로서의 캠퍼스 : SRA (Sustainability Research In Action) 프로그램은 Manitoba University of Manitoba 교수를 연결하여 연구 프로젝트를 통해 캠퍼스에서 지속 가능성 문제를 해결하는 데 열정적 인 학생들을 연결합니다.지속 가능성 사무소는 이러한 이니셔티브를 조정하는 동시에 커뮤니티가 완성 된 연구에 액세스 할 수있는 플랫폼을 제공하는 데 도움이됩니다.SRA 프로그램은 성장, 교육 및 행동을 통해 지속 가능한 변화의 문화를 장려합니다.",살아있는 실험실로서의 캠퍼스 : SRA (Sustainability Research In Action) 프로그램은 Manitoba University of Manitoba 교수를 연결하여 연구 프로젝트를 통해 캠퍼스에서 지속 가능성 문제를 해결하는 데 열정적 인 학생들을 연결합니다,17,5
309,4942,호주,Griffith,"PARTNERING WITH OUR SCHOOLS AND COMMUNITIES Griffith supports education and awareness about the SDGs through the 2030 SDGs GAME delivered by SDGs trained facilitator, Ms Delwyn Langdon, Manager of Griffith’s EcoCentre. The 2030 SDGs Game is a multiplayer, in-person, card-based game that simulates taking the “real world” into the year 2030. In 2021, the game was delivered to staff and students of Griffith, along with representatives from government, health, community groups and education facilities. The EcoCentre also delivers community awareness and education programs, in partnership with industry, government and the community. In 2021, it hosted over 9000 primary and secondary students, providing immersive sustainability education experiences.","Griffith는 SDGs 교육을 받은 촉진자, Griffith's EcoCenter 매니저인 Ms Delwyn Langdon이 제공하는 2030 SDGs 게임을 통해 SDGs에 대한 교육과 인식을 지원합니다. 2030 SDGs 게임(SDGs Game)은 카드 기반의 멀티플레이어 게임으로, 현실 세계를 2030년으로 받아들이는 것을 시뮬레이션한다. 2021년, 이 게임은 그리피스의 직원과 학생들에게 정부, 보건, 지역사회 단체, 교육 시설의 대표들과 함께 전달되었다. 또한 에코 센터는 산업, 정부 및 지역사회와 협력하여 지역사회의 인식 및 교육 프로그램을 제공합니다. 2021년에는 9,000명 이상의 초중등학생을 유치하여 몰입형 지속가능성 교육 경험을 제공하였다.","Griffith는 학교 및 지역 사회와 파트너십을 맺고 SDGS 교육 촉진자 인 Griffith의 Ecocentre의 관리자 인 Delwyn Langdon이 제공 한 2030 SDGS 게임을 통해 SDG에 대한 교육 및 인식을 지원합니다.2030 SDGS 게임은 2030 년으로“실제 세계”를 가져가는 것을 시뮬레이션하는 멀티 플레이어, 직접, 카드 기반 게임입니다. 2021 년에 게임은 Griffith의 직원과 학생들에게 정부, Health의 대표자들과 함께 제공되었습니다., 지역 사회 그룹 및 교육 시설.Ecocentre는 또한 업계, 정부 및 지역 사회와 협력하여 지역 사회 인식 및 교육 프로그램을 제공합니다.2021 년에는 9000 명 이상의 초등 및 중등 학생을 주최하여 몰입 형 지속 가능성 교육 경험을 제공했습니다.",Griffith는 학교 및 지역 사회와 파트너십을 맺고 SDGS 교육 촉진자 인 Griffith의 Ecocentre의 관리자 인 Delwyn Langdon이 제공 한 2030 SDGS 게임을 통해 SDG에 대한 교육 및 인식을 지원합니다,17,5
310,4943,호주,Griffith,"A FUTURE-FOCUSED SUSTAINABILITY WEEK In 2021, Griffith’s Sustainability week delivered a range of initiatives to prompt staff, students and the community consider their role in shaping a future for all. Key initiatives included: • The Museum of Futures - a pop-up exhibition delivered in partnership with artist and experiential futurist, Claire Marshall. Participants engaged with 10 objects telling the story of two possible futures: a utopia where we tackle climate change and a dystopia where the extreme climate has changed our current way of life forever. • The SDG Pledge Wall – Towards 2025:Working with the SDGs. Students and staff at Logan and Nathan campus were invited to write a pledge to make a difference by sharing their commitment to sustainability with the Griffith Community. • Our Perspectives – A collaborative art piece for the Museum of Futures by the Tallowood and Baronia Kindergartens Nathan Campus. Children created a collaged artwork reflecting their observations of their environment & community now (2021) and what it might look like in the future (2051). The children visited Nathan Campus to share and talk about their artwork and what sustainability means to them.","미래에 초점을 맞춘 지속가능성 주간 2021년, 그리피스의 지속가능성 주간은 직원, 학생 및 지역사회가 모두를 위한 미래를 형성하는 데 그들의 역할을 고려하도록 촉구하는 다양한 이니셔티브를 전달했습니다. 주요 이니셔티브는 다음과 같습니다. • 미래 박물관 - 예술가이자 경험적 미래학자 클레어 마샬과 협력하여 제공되는 팝업 전시회입니다. 참가자들은 우리가 기후 변화에 대처하는 유토피아와 극한 기후가 우리의 현재 삶의 방식을 영원히 바꾸어 놓은 디스토피아, 두 가지 가능한 미래에 대한 이야기를 들려주는 10개의 물체에 참여했습니다. • SDG 공약의 벽 – 2025년을 향해:SDG와 함께 일합니다. Logan과 Nathan 캠퍼스의 학생들과 직원들은 Griffith Community와 지속가능성에 대한 그들의 약속을 공유함으로써 변화를 만들겠다는 서약을 쓰도록 초대받았다. • 우리의 관점 – Tallowood와 Baronia 유치원 Nathan Campus의 미래 박물관을 위한 공동 예술 작품입니다. 아이들은 현재(2021년)와 미래의 모습(2051년)에 대한 관찰을 반영하여 콜라보레이션된 예술 작품을 만들었습니다. 아이들은 자신들의 예술작품과 지속가능성이 그들에게 어떤 의미인지를 공유하고 이야기하기 위해 네이선 캠퍼스를 방문했습니다.","2021 년의 미래에 초점을 맞춘 지속 가능성 주간 인 Griffith의 지속 가능성 주간은 직원, 학생 및 지역 사회가 모든 사람의 미래를 형성하는 데 자신의 역할을 고려하기 위해 다양한 이니셔티브를 제공했습니다. 주요 이니셔티브는 다음과 같습니다. • 미래 박물관 - 예술가 및 체험 미래 학자 인 Claire Marshall과 제휴하여 전달되는 팝업 전시회. 참가자들은 우리가 기후 변화를 다루는 유토피아와 극도의 기후가 현재의 삶의 방식을 영원히 바꾸었던 디스토피아의 두 가지 가능한 미래에 대한 이야기를 들려주는 10 개의 물체와 관련이 있습니다. • SDG 서약 벽 - 2025 년까지 : SDG와 협력합니다. Logan과 Nathan 캠퍼스의 학생과 교직원은 그리피스 커뮤니티와 지속 가능성에 대한 헌신을 공유함으로써 차이를 만들 겠다는 서약을 작성하도록 초대되었습니다. • 우리의 관점 - Tallowood와 Baronia Kindergartens Nathan 캠퍼스의 미래 박물관을위한 공동 예술 작품. 어린이들은 현재 환경과 공동체에 대한 관찰을 반영하는 콜링 된 예술 작품 (2021)과 미래의 모습 (2051)을 만들었습니다. 아이들은 Nathan 캠퍼스를 방문하여 작품과 지속 가능성이 무엇을 의미하는지 이야기하고 이야기했습니다.","2021 년의 미래에 초점을 맞춘 지속 가능성 주간 인 Griffith의 지속 가능성 주간은 직원, 학생 및 지역 사회가 모든 사람의 미래를 형성하는 데 자신의 역할을 고려하기 위해 다양한 이니셔티브를 제공했습니다. 주요 이니셔티브는 다음과 같습니다. • 미래 박물관 - 예술가 및 체험 미래 학자 인 Claire Marshall과 제휴하여 전달되는 팝업 전시회. 참가자들은 우리가 기후 변화를 다루는 유토피아와 극도의 기후가 현재의 삶의 방식을 영원히 바꾸었던 디스토피아의 두 가지 가능한 미래에 대한 이야기를 들려주는 10 개의 물체와 관련이 있습니다. • SDG 서약 벽 - 2025 년까지 : SDG와 협력합니다. Logan과 Nathan 캠퍼스의 학생과 교직원은 그리피스 커뮤니티와 지속 가능성에 대한 헌신을 공유함으로써 차이를 만들 겠다는 서약을 작성하도록 초대되었습니다. • 우리의 관점 - Tallowood와 Baronia Kindergartens Nathan 캠퍼스의 미래 박물관을위한 공동 예술 작품. 어린이들은 현재 환경과 공동체에 대한 관찰을 반영하는 콜링 된 예술 작품 (2021)과 미래의 모습 (2051)을 만들었습니다. 아이들은 Nathan 캠퍼스를 방문하여 작품과 지속 가능성이 무엇을 의미하는지 이야기하고 이야기했습니다.",17,5
311,4944,호주,Griffith,"IINTERNATIONAL PARTNERSHIPS FOR THE SDGS In 2021, Griffith’s Asia Institute, led by Professor Caitline Byrne, launched the collaborative Australia-Indonesia Program reinforcing Griffith’s commitment to engaging with Indonesia through a strategic and mutually beneficial way. The bilateral Program brings together expertise and coordinates opportunities across the two nations with the focus on sustainable development and climate change.","2021년, Caitline Byrne 교수가 이끄는 Griffith의 아시아 연구소는 전략적이고 상호 이익이 되는 방법을 통해 Griffith의 인도네시아와의 관계를 강화하는 호주-인도네시아 협력 프로그램을 시작했습니다. 양자 프로그램은 지속 가능한 개발과 기후 변화에 초점을 맞추어 두 나라 전체에 걸쳐 전문 지식을 모으고 기회를 조정한다.",Caitline Byrne 교수가 이끄는 Griffith 's Asia Institute는 2021 년 SDGS의 INTERNATIONAL PARTNESHIPS를 통해 전략적이고 상호 상호 유익한 방식으로 인도네시아와의 관계에 대한 협력적인 호주-인도네시아 프로그램 강화의 약속을 시작했습니다.양자 프로그램은 지속 가능한 발전과 기후 변화에 중점을 둔 전문 지식과 두 국가의 기회를 조정합니다., 프로그램은 지속 가능한 발전과 기후 변화에 중점을 둔 전문 지식과 두 국가의 기회를 조정합니다.,17,5
312,4975,타이완,NTU,"Singapore Sustainability Symposium (S3): In partnership with Singapore’s Ministries, Sustainable Earth Office (SEO), Institute of Advanced Studies at NTU, and NTU’s academic and private sector collaborators, the fourth annual Singapore Sustainability Symposium was organised.","싱가포르 지속가능성 심포지엄(S3): 싱가포르 정부부처, 지속가능지구국(SEO), NTU 고등연구소, NTU의 학술 및 민간 부문 협력자들과 협력하여 제4회 싱가포르 지속가능성 심포지엄을 개최하였습니다.","싱가포르 지속 가능성 심포지엄 (S3) : 싱가포르의 부처, SEO (Sustainable Earth Office), NTU의 고급 연구 연구소 및 NTU의 학업 및 민간 부문 협력자와 제휴하여 싱가포르의 연례 연례 지속 가능성 심포지엄이 조직되었습니다.","싱가포르 지속 가능성 심포지엄 (S3) : 싱가포르의 부처, SEO (Sustainable Earth Office), NTU의 고급 연구 연구소 및 NTU의 학업 및 민간 부문 협력자와 제휴하여 싱가포르의 연례 연례 지속 가능성 심포지엄이 조직되었습니다.",17,5
313,4976,타이완,NTU,International Sustainable Campus Network: We have been a member of the International Sustainable Campus Network since 2012.,국제 지속가능 캠퍼스 네트워크는 다음과 같습니다. 우리는 2012년부터 국제 지속가능 캠퍼스 네트워크의 회원입니다.,국제 지속 가능한 캠퍼스 네트워크 : 2012 년부터 국제 지속 가능한 캠퍼스 네트워크의 회원이었습니다.,국제 지속 가능한 캠퍼스 네트워크 : 2012 년부터 국제 지속 가능한 캠퍼스 네트워크의 회원이었습니다.,17,5
314,4977,타이완,NTU,Global Compact Network Singapore (GCNS): Nanyang Business School (NBS) is both a member and a strategic partner of the Global Compact Network Singapore (GCNS). GCNS is a local chapter of the UN Global Compact.,GCNS(Global Compact Network Singapore): NBS(Nanyang Business School)는 GCNS(Global Compact Network Singapore)의 멤버이자 전략적 파트너입니다. GCNS는 UN Global Compact의 현지 지부입니다.,GCNS (Global Compact Network Singapore) : Nanyang Business School (Nanyang Business School)은 GCNS (Global Compact Network Singapore)의 회원이자 전략적 파트너입니다.GCNS는 UN Global Compact의 지역 장입니다., UN Global Compact의 지역 장입니다.,17,5
315,4978,타이완,NTU,NEWRI and JFE Engineering Corporation Collaboration: A new Innovation Centre of Environmental Technology was set up to help contribute to Singapore’s sustainable development goals and focus on efficient waste treatment capabilities.,NEWRI과 JFE엔지니어링 회사 공동 작업:.새로운 혁신 센터 환경 기술의 싱가포르의 지속 가능한 개발 목표에 효과적이고 효율적 폐기물 처리 능력에 초점을 맞추기여하기 위해 세워졌다.,Newri 및 JFE Engineering Corporation Collaboration : 싱가포르의 지속 가능한 개발 목표에 기여하고 효율적인 폐기물 처리 기능에 중점을 둔 새로운 환경 기술 혁신 센터가 설립되었습니다.,Newri 및 JFE Engineering Corporation Collaboration : 싱가포르의 지속 가능한 개발 목표에 기여하고 효율적인 폐기물 처리 기능에 중점을 둔 새로운 환경 기술 혁신 센터가 설립되었습니다.,17,5
316,4979,타이완,NTU,"Ecosperity Young Leaders Dialogue (YLD): The Conference is organised annually by Singapore’s Temasek Holdings. In 2017, it was co-organised by NBS and Singapore Technologies Endowment Programme (STEP).",생태계의 젊은 지도자 대화(YLD): 이 회의는 싱가포르의 테마섹 홀딩스에 의해 매년 개최됩니다. 2017년에는 NBS와 싱가포르 기술 기부 프로그램(STEP)이 공동 조직했습니다.,Ecosperity Young Leaders Dialogue (YLD) :이 회의는 싱가포르의 Temasek Holdings에 의해 매년 조직됩니다.2017 년에는 NBS 및 Singapore Technologies Endowment Program (단계)에 의해 공동 조직되었습니다., 년에는 NBS 및 Singapore Technologies Endowment Program (단계)에 의해 공동 조직되었습니다.,17,5
317,4980,타이완,NTU,"NTU and National University of Singapore to set up Singapore Energy Centre in 2019: The Energy Centre will explore ideas to meet the current and future energy challenges in Asia. The centre will focus on nextgeneration technology in areas such as climate change adaption, energy efficiency, water access etc.","NTU와 싱가포르 국립대학교는 2019년에 싱가포르 에너지 센터를 설립할 예정입니다. 에너지 센터는 아시아의 현재와 미래의 에너지 문제를 해결하기 위한 아이디어를 탐구할 것입니다. 이 센터는 기후 변화 어댑테이션, 에너지 효율성, 용수 접근 등과 같은 분야에서 차세대 기술에 초점을 맞출 것입니다.","NTU와 싱가포르 국립 대학교는 2019 년 싱가포르 에너지 센터를 설립 할 예정입니다.이 센터는 기후 변화 적응, 에너지 효율, 물 접근 등과 같은 영역에서 차세대 기술에 중점을 둘 것입니다."," 센터는 기후 변화 적응, 에너지 효율, 물 접근 등과 같은 영역에서 차세대 기술에 중점을 둘 것입니다.",17,5
