,Unnamed: 0,국가,대학교명,내용,번역,영한_재번역,추출요약,분류,5분류
195,3059,오스트레일리아,Charles Sturt University,"Following an interview on Radio Australia’s Pacific
Beat program in September where he discussed
developments in contemporary Fijian politics,
Professor Dominic O’Sullivan was invited by the
United Nations to deliver a paper on Pacific
politics to staff of its Departments of Political and
Peacebuilding Affairs and Peace Operations in New
York and Suva on 22 October","오스트레일리아 퍼시픽의 인터뷰에 이어
9월 비트 프로그램에서 그가 토론했던 곳
현대 피지 정치의 발전,
도미닉 오설리반 교수님이 초대받으셨어요
유엔, 태평양에 관한 논문 전달
정치부 직원들에 대한 정치.
새로운 평화구축과 평화작전
10월 22일 요크 앤 수바","9 월 라디오 호주의 태평양 비트 프로그램에 대한 인터뷰에서 현대 피지 정치의 발전에 대해 논의한 후, 도미니크 오 설리반 교수는 유엔에 의해 정치 및 평화 구축 문제와 평화 부서 직원들에게 태평양 정치에 관한 논문을 전달하도록 초청되었습니다.10 월 22 일 뉴욕과 수바에서의 운영",월 22 일 뉴욕과 수바에서의 운영,17,5
196,3060,오스트레일리아,Charles Sturt University,"On 7 October, as part of the Museum of the
Riverina’s storytelling exhibition ‘Care Factor –
Stories from the home and hospice’ Associate
Professor Maree Bernoth contributed as Master of
Ceremonies and panel member for the Facebook
Live online event",", 박물관의 일부로써
리베리나 스토리텔링 전시회 '케어 팩터 –
가정과 호스피스 관계자의 이야기
Maree Bernoth 교수는 석사로서 공헌했다.
Facebook의 시상식 및 패널 구성원
라이브 온라인 이벤트","10 월 7 일, Riverina의 스토리 텔링 전시회 박물관의 일환으로 'Care Factor - Home and Hospice의 이야기'부교수 Maree Bernoth 교수는 Facebook Live Online 이벤트의 행사 마스터 및 패널 멤버로 기여했습니다.","10 월 7 일, Riverina의 스토리 텔링 전시회 박물관의 일환으로 'Care Factor - Home and Hospice의 이야기'부교수 Maree Bernoth 교수는 Facebook Live Online 이벤트의 행사 마스터 및 패널 멤버로 기여했습니다.",17,5
197,3232,캐나다,McMaster University,"MacChangers pairs multidisciplinary teams with community members to propose innovative solutions
to challenges facing Hamilton, as well as the global community. The non-credit program welcomes
students from all faculties to share their expertise and there is no cost to enroll. In alignment with the
city’s 25-year community vision, past projects include developing a resource hub for housing needs;
closing gaps in the cycling path between the university and the downtown core; and reducing exposure
to open-air secondhand smoke by promoting a smoke-free section along King William, a popular
restaurant row.","MacChangers는 혁신적인 솔루션을 제안하기 위해 커뮤니티 구성원과 여러 학제적 팀을 연결합니다.
지구촌뿐만 아니라 해밀턴이 당면한 도전에 직면하게 될 것입니다. 비신용 프로그램은 환영한다.
모든 학부의 학생들이 그들의 전문 지식을 공유하고 등록하는데 비용이 들지 않는다. 에 맞게 조정
시의 25년 지역사회 비전, 과거 프로젝트에는 주택 수요를 위한 자원 허브 개발이 포함된다.
대학과 시내 중심부 사이의 자전거 도로의 격차를 줄이고 노출을 줄인다.
인기 있는 윌리엄 왕가의 금연 구역을 홍보하여 간접 흡연을 개방하다
식당 행",MacChangers는 지역 사회 구성원과 여러 분야의 팀을 짝을 이루어 해밀턴과 글로벌 커뮤니티가 직면 한 도전에 대한 혁신적인 솔루션을 제안합니다.비 신용 프로그램은 모든 교수진의 학생들이 자신의 전문 지식을 공유하고 등록 비용이 없습니다.시의 25 년간의 커뮤니티 비전과 일치하여 과거 프로젝트에는 주택 요구를위한 자원 허브 개발이 포함됩니다.대학과 다운타운 코어 사이의 자전거 경로에서의 격차;인기있는 레스토랑 행 인 윌리엄 왕을 따라 금연 섹션을 홍보하여 야외 간접 흡연에 대한 노출을 줄입니다.,MacChangers는 지역 사회 구성원과 여러 분야의 팀을 짝을 이루어 해밀턴과 글로벌 커뮤니티가 직면 한 도전에 대한 혁신적인 솔루션을 제안합니다,17,5
198,3233,캐나다,McMaster University,"Now in its 12th year, the McMaster Health Forum is designated
as the WHO Collaborating Centre for Evidence-Informed Policy. The
Forum’s goal is to generate action on the pressing health-system
issues of our time. It strengthens health systems — locally, nationally
and internationally — and gets the right programs, services and drugs
to the people who need them.","이제 12년째인 맥마스터 헬스 포럼은
WHO 증거 정보 정책 협력 센터로 선정되었습니다. 그
Forum의 목표는 급박한 의료 시스템에 대한 조치를 생성하는 것입니다.
우리 시대의 문제 지역적, 국가적으로 의료 시스템을 강화합니다.
그리고 국제적으로 적절한 프로그램, 서비스 및 약물을 공급받습니다.
필요한 사람들에게요","이제 12 년째 McMaster Health Forum은 WHO Collaborating Center for Evidence Informed Policy로 지정되었습니다.포럼의 목표는 우리 시대의 긴급 건강 시스템 문제에 대한 조치를 창출하는 것입니다.그것은 지역, 국내 및 국제적으로 건강 시스템을 강화하고 필요한 사람들에게 올바른 프로그램, 서비스 및 약물을 얻습니다.", 목표는 우리 시대의 긴급 건강 시스템 문제에 대한 조치를 창출하는 것입니다,17,5
199,3234,캐나다,McMaster University,"The university has more than 1,900 partnerships with faculty,
institutions and communities in 247 countries and regions. The Global
Health Office works with many of these partners to find new and
innovative solutions to critical global health problems. As a result of
its efforts, McMaster has advanced the education of women health
professionals in Pakistan, improved the health of vulnerable people
in Indonesia, and, most recently, worked to improve access to higher
education in underserved communities in the Far North of Canada and
Norway. The university’s School of Nursing is designated a PAHO/
WHO Collaborating Centre, which focuses on global priorities in
primary health care.","그 대학은 1,900개 이상의 교수진과 파트너십을 맺고 있다.
247개국과 지역의 기관들과 공동체들. 글로벌
Health Office는 이러한 많은 파트너와 협력하여 새로운 파트너와
중대한 글로벌 건강 문제에 대한 혁신적인 해결책 의 결과로
그것의 노력, McMaster는 여성 건강에 대한 교육을 발전시켰다.
파키스탄의 전문가들, 취약한 사람들의 건강을 개선했습니다.
인도네시아에서, 그리고, 가장 최근에, 더 높은 곳에 대한 접근성을 향상시키기 위해 일했습니다.
캐나다 극북지역의 서비스가 부족한 지역사회에서의 교육 그리고
노르웨이. 이 대학의 간호대학은 PAHO/로 지정되어 있다.
WHO 협력 센터, WHO의 글로벌 우선 순위에 초점을 맞춥니다.
일차 의료","이 대학은 247 개국 및 지역의 교수진, 기관 및 지역 사회와 1,900 개 이상의 파트너십을 보유하고 있습니다.Global Health Office는 이러한 많은 파트너들과 협력하여 중요한 글로벌 건강 문제에 대한 새롭고 혁신적인 솔루션을 찾습니다.노력의 결과로 McMaster는 파키스탄의 여성 건강 전문가의 교육을 발전 시켰으며 인도네시아의 취약한 사람들의 건강을 향상 시켰으며 가장 최근에는 캐나다와 북쪽의 북쪽에있는 지역 사회에서 고등 교육에 대한 접근성을 향상시키기 위해 노력했습니다.노르웨이.대학의 간호 학교는 PAHO/ WHO 협력 센터로 지정되며, 이는 1 차 의료의 세계 우선 순위에 중점을 둡니다.", 결과로 McMaster는 파키스탄의 여성 건강 전문가의 교육을 발전 시켰으며 인도네시아의 취약한 사람들의 건강을 향상 시켰으며 가장 최근에는 캐나다와 북쪽의 북쪽에있는 지역 사회에서 고등 교육에 대한 접근성을 향상시키기 위해 노력했습니다,17,5
200,3235,캐나다,McMaster University,"McMaster is the only university in Canada to serve as host and
partner to a United Nations University through the Institute for Water,
Environment and Health (UNU-INWEH) which acts as the UN think
tank on water. Researchers at McMaster play a key role in Global
Water Futures, a collaboration driven by four major institutions to
transform the way communities, governments and industries in
Canada and other cold regions of the world prepare for and manage
increasing water-related threats. GWF is the largest university-led
freshwater research program ever funded worldwide, in part with a
$77.8-million grant from the Canada First Research Excellence Fund.
In 2020, GWF extended funding for two McMaster projects and
awarded three new projects funding from a total $2.4 million.
The UNU-INWEH recently received a $10-million funding extension
from the Canadian government","맥마스터는 캐나다에서 호스트 역할을 하는 유일한 대학이다.
물 연구소를 통해 유엔 대학교와 협력한다.
유엔의 생각 역할을 하는 환경과 건강(UNU-INWEH)
수조에 물을 채우다 McMaster의 연구원들이 Global에서 핵심적인 역할을 수행함
Water Futures, 4개의 주요 기관이 추진하는 협업
지역 사회, 정부 및 산업의 방식을 변화시킨다.
캐나다와 세계의 다른 추운 지역들은 준비하고 관리한다.
물과 관련된 위협이 증가하고 있습니다. GWF는 가장 큰 대학 주도이다.
전 세계적으로 자금을 지원받은 담수 연구 프로그램, 부분적으로는
캐나다 퍼스트 리서치 엑설런스 기금으로부터 7,780만 달러의 조성금.
2020년, GWF는 두 개의 맥마스터 프로젝트에 대한 자금을 확장했다.
총 240만 달러에서 3개의 새로운 프로젝트에 자금을 지원했다.
UNU-INWEH는 최근 천만 달러의 자금 지원을 받았다.
캐나다 정부로부터","McMaster는 캐나다에서 유엔 싱크 탱크 역할을하는 물, 환경 및 건강 연구소 (UNU-Inweh)를 통해 유엔 대학의 호스트 및 파트너로 일하는 유일한 대학입니다.McMaster의 연구원들은 Global Water Futures에서 핵심적인 역할을 수행하는데, 캐나다 및 기타 차가운 지역의 지역 사회, 정부 및 산업이 물 관련 위협을 준비하고 관리하는 방식을 변화시키기 위해 4 개의 주요 기관이 주도하는 공동 작업을 수행합니다.GWF는 캐나다 최초의 리서치 우수 펀드에서 77.8 백만 달러의 보조금으로 전 세계적으로 자금을 조달 한 최대의 대학 주도의 담수 연구 프로그램입니다.2020 년에 GWF는 2 개의 McMaster 프로젝트에 대한 자금을 확장했으며 총 240 만 달러로 3 개의 새로운 프로젝트 자금을 수여했습니다.Unu-Inweh는 최근 캐나다 정부로부터 1 천만 달러의 자금 확장을 받았습니다.","연구원들은 Global Water Futures에서 핵심적인 역할을 수행하는데, 캐나다 및 기타 차가운 지역의 지역 사회, 정부 및 산업이 물 관련 위협을 준비하고 관리하는 방식을 변화시키기 위해 4 개의 주요 기관이 주도하는 공동 작업을 수행합니다",17,5
201,3236,캐나다,McMaster University,"As a member of Universitas 21 (U21), McMaster University
participates in a leading global network of research-intensive
universities that has helped more than one million students and
200,000 staff. U21 facilitates the delivery of programs, activities and
initiatives that could not be reached through a single university or via
bilateral agreements. RISE (Real Impact on Society and Environment)
is U21’s international showcase of student achievement in
sustainability and social innovation. In 2019, a McMaster student took
one of the four RISE prizes with Guided Hands, a product that helps
those with limited fine motor skills complete everyday tasks, such as
writing, painting and fully participating in school and society.","Universitas 21 (U21)의 멤버로서, McMaster University
연구 집약적인 선도적인 글로벌 네트워크에 참여
백만명 이상의 학생들에게 도움을 준 대학들 그리고
직원 20만 명. U21은 프로그램, 활동, 그리고
단일 대학이나 경유로는 도달할 수 없었던 계획들
쌍무 협정 RISE (사회와 환경에 대한 실제 영향)
U21의 학생 성취에 대한 국제적인 쇼케이스이다.
지속가능성과 사회혁신. 2019년에 맥마스터 학생이
4가지 REIS 상 중 하나인 Guided Hands는 도움을 주는 제품입니다.
제한된 미세 운동 기술을 가진 사람들은 다음과 같은 일상 업무를 완료한다.
글쓰기, 그림 그리고 학교와 사회에 완전히 참여하는 것.","McMaster University는 Universitas 21 (U21)의 회원으로서 백만 명 이상의 학생과 200,000 명의 직원을 도왔던 연구 집약적 인 대학의 주요 글로벌 네트워크에 참여합니다.U21은 단일 대학이나 양자 계약을 통해 도달 할 수없는 프로그램, 활동 및 이니셔티브의 전달을 촉진합니다.Rise (사회와 환경에 대한 실제 영향)는 U21의 지속 가능성과 사회 혁신 분야의 학생 성취도의 국제 쇼케이스입니다.2019 년에 McMaster 학생은 가이드 손으로 4 개의 상승 상 중 하나를 가져 갔는데, 이는 제한된 운동 기술을 가진 사람들이 학교 및 사회에 글쓰기, 그림 및 완전히 참여하는 것과 같은 일상적인 작업을 완성하는 데 도움이되는 제품입니다.","년에 McMaster 학생은 가이드 손으로 4 개의 상승 상 중 하나를 가져 갔는데, 이는 제한된 운동 기술을 가진 사람들이 학교 및 사회에 글쓰기, 그림 및 완전히 참여하는 것과 같은 일상적인 작업을 완성하는 데 도움이되는 제품입니다.",17,5
202,3237,캐나다,McMaster University,"McMaster launched the Global Nexus for Pandemics and Biological
Threats to ensure Canada and the world are better able to manage
the human and economic devastation of COVID-19 and avert future
pandemics. Led by McMaster researchers from many disciplines, the
Global Nexus is developing an international network of scientists,
clinical health and medical specialists, engineers, social scientists,
history and policy researchers, economics and business experts
devoted to one goal: preventing future pandemics and mitigating
global health threats like antimicrobial resistance. The innovative
network has already garnered international attention, and government
and philanthropic support for its approach in its first few months.","McMaster는 팬데믹과 생물학을 위한 글로벌 넥서스를 출시했습니다.
캐나다와 세계가 더 잘 관리할 수 있도록 보장하는 위협
COVID-19의 인적, 경제적 황폐화와 미래 회피
유행병 많은 분야의 McMaster 연구원들에 의해 이끌려,
글로벌 넥서스는 과학자들의 국제적인 네트워크를 개발하고 있다.
임상 보건 및 의학 전문가, 엔지니어, 사회 과학자,
역사 및 정책 연구자, 경제 및 비즈니스 전문가
미래의 유행병을 예방하고 완화하는 하나의 목표에 전념한다.
항생제 내성 같은 세계적인 건강 위협 혁신적
네트워크는 이미 국제적인 관심을 얻었고, 정부는
처음 몇 달 동안은 자선 활동을 지원했습니다.","McMaster는 캐나다와 세계가 Covid-19의 인간 및 경제적 파괴를 더 잘 관리하고 미래의 전염병을 피할 수 있도록 전 세계적으로 전 세계적 넥서스를 시작했습니다.많은 분야의 McMaster 연구원들이 이끄는 글로벌 넥서스는 과학자, 임상 건강 및 의료 전문가, 엔지니어, 사회 과학자, 역사 및 정책 연구원, 경제학 및 비즈니스 전문가의 국제 네트워크를 개발하고 있습니다.항균성 저항성과 같은 건강 위협.혁신적인 네트워크는 이미 국제적인 관심을 끌었으며, 처음 몇 개월 만에 정부 및 자선 단체의 접근 방식에 대한 지원을 얻었습니다."," 분야의 McMaster 연구원들이 이끄는 글로벌 넥서스는 과학자, 임상 건강 및 의료 전문가, 엔지니어, 사회 과학자, 역사 및 정책 연구원, 경제학 및 비즈니스 전문가의 국제 네트워크를 개발하고 있습니다",17,5
203,3238,캐나다,McMaster University,"The McMaster Global annual showcase turns the spotlight on the
university’s mission to make global engagement in education and
sparking ideas an integral part of its presence in Canada and the
world. A host of free activities, lectures and workshops are
open to all. McMaster Global is engaged in international
partnerships that involve research collaboration,
faculty exchanges, student exchanges and
mobility agreements and joint supervision
of doctoral students. ","McMaster Global의 연례 쇼케이스가 스포트라이트를 돌립니다.
교육에 대한 세계적인 참여를 만들기 위한 대학의 사명
캐나다와 그 존재의 필수적인 부분을 자극하는 아이디어들.
많은 무료 활동들, 강의들 그리고 워크샵들은
만인에게 개방하다 McMaster Global은 국제적으로 활동하고 있습니다.
연구 협업을 포함하는 파트너십,
교직원 교환, 학생 교환 그리고
이동성 계약 및 공동 감독
박사과정 학생의","McMaster Global Annual Showcase는 대학의 사명에 대한 주목을 받아 캐나다와 세계에서 교육과 아이디어에 대한 세계적 참여를 없애고 있습니다.수많은 무료 활동, 강의 및 워크샵이 모두가 열려 있습니다.McMaster Global은 연구 협력, 교수 교환, 학생 교환 및 이동성 계약 및 박사 과정 학생의 공동 감독과 관련된 국제 파트너십에 종사하고 있습니다."," 무료 활동, 강의 및 워크샵이 모두가 열려 있습니다",17,5
204,3351,말레이시아,Sunway University,"Envisioning a Post COVID-19 World!
was organised as part of a larger
initiative i.e., a competition to
stimulate high school students
to develop research questions
and propose how their ideas can
contribute towards planetary
health. The idea of this forum was
to inspire students in thinking how
they would want to shape the world
they want, teaching the them to
know what they want to achieve
and where to look.","포스트 코로나 19 세계를 상상하다!
더 큰 것의 일부로 조직되었다.
의 주도권, 즉 경쟁.
고등학생을 자극하다
연구 질문을 개발하다
그리고 그들의 아이디어가 어떻게 할 수 있는지 제안합니다.
행성에 공헌하다.
건강. 이 포럼의 아이디어는
학생들이 어떻게 생각하도록 격려하다
그들은 세상을 만들고 싶어할 것이다.
그들이 원해서, 그들을 가르쳤다.
그들이 무엇을 성취하고 싶은지 안다.
그리고 어디를 봐야 할지.","포스트 Covid-19 World를 구상!더 큰 이니셔티브의 일환, 즉 고등학생이 연구 질문을 개발하고 아이디어가 행성 건강에 어떻게 기여할 수 있는지 제안하는 경쟁의 일환으로 조직되었습니다.이 포럼의 아이디어는 학생들이 원하는 세상을 어떻게 형성하고 싶어하는지 생각하고, 그들이 달성하고자하는 것과 어디를보아야하는지 알도록 가르치는 것이 학생들에게 영감을주는 것이 었습니다."," 큰 이니셔티브의 일환, 즉 고등학생이 연구 질문을 개발하고 아이디어가 행성 건강에 어떻게 기여할 수 있는지 제안하는 경쟁의 일환으로 조직되었습니다",17,5
205,3352,말레이시아,Sunway University,"Community Service
At the Department of Psychology
in the School of Medical and Life
Sciences, Community Service
is a compulsory module for
psychology students. Organisations
involved included elderly homes,
orphanages, pet centres, and NGOs
focusing on mental health and the
environment. This activity provides
students a real demonstration
of impacting the community and
an illustration on how they can
contribute in the UN-Sustainable
Development Goals, which includes
quality education, reducing
inequalities, sustainable cities and
communities, and good health
and well-being","커뮤니티 서비스
심리학과에서
의과대학에서.
과학, 사회봉사
의 필수 모듈입니다.
심리학과 학생 조직
노인 주택도 포함됐고
고아원, 애완동물 센터, NGO
정신건강과 정신건강에 집중하기
환경. 이 활동은 다음을 제공합니다.
학생들 진짜 시범.
지역사회에 영향을 미칠 수 있도록
그들이 어떻게 할 수 있는지에 대한 예시
유엔의 지속가능성에 기여하다
다음을 포함하는 개발 목표
양질의 교육, 감소
불평등, 지속가능한 도시 그리고
공동체와 건강
그리고 웰빙","의료 및 생명 과학 학교의 심리학과의 지역 사회 봉사 지역 사회 봉사는 심리학 학생들을위한 강제 모듈입니다.조직에는 정신 건강과 환경에 중점을 둔 노인 가정, 고아원, 애완 동물 센터 및 NGO가 포함되었습니다.이 활동은 학생들에게 커뮤니티에 영향을 미치는 진정한 데모와 품질 교육, 불평등 감소, 지속 가능한 도시 및 지역 사회, 건강과 복지를 포함하여 지속 불가능한 개발 목표에 기여할 수있는 방법에 대한 예시를 제공합니다."," 활동은 학생들에게 커뮤니티에 영향을 미치는 진정한 데모와 품질 교육, 불평등 감소, 지속 가능한 도시 및 지역 사회, 건강과 복지를 포함하여 지속 불가능한 개발 목표에 기여할 수있는 방법에 대한 예시를 제공합니다.",17,5
206,3353,말레이시아,Sunway University,"Advanced Nano Materials for
Clean Energy & Water Technology
The School of Engineering and
Technology is part of the Advanced
Nano Materials for Clean Energy &
Water Technology interdisciplinary
project. This project has a
networking grant of RM45,000 to
create opportunities for academics,
early career researchers, and
students of participating institutions
redundant. This programme
fosters entrepreneurship and
creativity, and supports the
internationalisation of higher
education. This project can
ultimately impact solar, energy
storage and water treatment
industries through knowledge
transfer, technology development,
and innovation.","고급 나노 소재:
청정에너지&워터
공과대학과
기술은 고급 기술의 일부입니다.
청정에너지를 위한 나노소재 &
학제간 물 기술
프로젝트. 이 프로젝트에는
네트워킹 지원금 RM45,000
학문을 위한 기회를 만들고,
초기 경력 연구자, 그리고
참여 기관의 학생들
중복의 이 프로그램
기업가 정신을 육성하고
창의성과 지원
고등교육의 국제화.
교육. 이 프로젝트는 할 수 있다
궁극적으로 태양, 에너지에 영향을 미치다
저장 및 수처리
지식을 통한 산업.
이전, 기술 개발,
그리고 혁신.","청정 에너지 및 물 기술을위한 고급 나노 재료 공학 및 기술 학교는 청정 에너지 및 수자원 기술 간 학제 간 프로젝트를위한 고급 나노 재료의 일부입니다.이 프로젝트에는 RM45,000의 네트워킹 보조금이 있으며 학계, 초기 경력 연구원 및 참여 기관의 학생들을위한 기회를 창출 할 수있는 기회를 창출했습니다.이 프로그램은 기업가 정신과 창의성을 촉진하고 고등 교육의 국제화를 지원합니다.이 프로젝트는 궁극적으로 지식 이전, 기술 개발 및 혁신을 통해 태양 광, 에너지 저장 및 수처리 산업에 영향을 줄 수 있습니다.",청정 에너지 및 물 기술을위한 고급 나노 재료 공학 및 기술 학교는 청정 에너지 및 수자원 기술 간 학제 간 프로젝트를위한 고급 나노 재료의 일부입니다,17,5
