,Unnamed: 0,국가,대학교명,내용,번역,영한_재번역,추출요약,분류,5분류
0,41,영국,Leicester,"Leicester was one of the first UK HE institutions to sign the SDG Accord, the University and College Sector’s Collective Response to the SDGs.",Leicester는 SDGs에 대한 대학 및 대학 부문의 집단적 대응인 SDG Accord에 서명한 최초의 영국 HE 기관 중 하나였습니다.,"레스터는 SDG 협정, 대학 및 대학 부문의 SDG에 대한 집단적 대응에 서명 한 최초의 영국 기관 중 하나였습니다.","레스터는 SDG 협정, 대학 및 대학 부문의 SDG에 대한 집단적 대응에 서명 한 최초의 영국 기관 중 하나였습니다.",17,5
1,42,영국,Leicester,"As one of the first UK institutions to embrace the SDGs strategically and to develop rigorous mapping of our activities, the University has run several webinars and sector workshops to assist other HE institutions in their SDG journeys.",SDGs를 전략적으로 수용하고 우리 활동의 엄격한 매핑을 개발하는 최초의 영국 기관 중 하나인 University는 SDG 여정에서 다른 HE 기관을 지원하기 위해 여러 웨비나와 부문 워크숍을 운영했습니다.,University는 SDG를 전략적으로 수용하고 우리의 활동에 대한 엄격한 매핑을 개발 한 최초의 영국 기관 중 하나 인 SDG 여행에서 다른 HE 기관을 지원하기 위해 여러 웹 세미나 및 부문 워크샵을 운영했습니다.,University는 SDG를 전략적으로 수용하고 우리의 활동에 대한 엄격한 매핑을 개발 한 최초의 영국 기관 중 하나 인 SDG 여행에서 다른 HE 기관을 지원하기 위해 여러 웹 세미나 및 부문 워크샵을 운영했습니다.,17,5
2,43,영국,Leicester,"The University hosted the 14th biennial international Conference on Communication and Environment in 2017 where the theme was ‘Democracy, Borders and Public/Political Engagement: Challenges for Environmental Communication’. This brought together leading environmental communication scholars and practitioners from around the world for four days of presentations and discussions about how best to address the key challenges facing the environment and environmental communication in these times of rapidly shifting political landscapes.","대학은 2017년에 '민주주의, 국경 및 공공/정치적 참여: 환경 커뮤니케이션을 위한 도전'이라는 주제로 2017년 제14회 커뮤니케이션 및 환경 국제 컨퍼런스를 개최했습니다. 이는 급변하는 정치 환경에서 환경 및 환경 커뮤니케이션이 직면한 주요 과제를 해결하는 최선의 방법에 대해 4일 동안 전 세계의 주요 환경 커뮤니케이션 학자와 실무자들이 한자리에 모였습니다.","이 대학은 2017 년에 제 14 차 2 년간의 커뮤니케이션 및 환경 회의를 개최하여‘민주주의, 국경 및 공공/정치 참여 : 환경 커뮤니케이션을위한 도전’이라는 주제가 있습니다.이로 인해 전 세계의 주요 환경 커뮤니케이션 학자와 실무자들은 4 일간의 프레젠테이션을 위해 모여 왔으며,이 시대에 환경과 환경 커뮤니케이션이 직면 한 주요 과제를 해결하는 데 가장 적합한 방법에 대한 토론과 토론은 빠르게 변화하는 정치적 환경을 빠르게 변화 시켰습니다.","인해 전 세계의 주요 환경 커뮤니케이션 학자와 실무자들은 4 일간의 프레젠테이션을 위해 모여 왔으며,이 시대에 환경과 환경 커뮤니케이션이 직면 한 주요 과제를 해결하는 데 가장 적합한 방법에 대한 토론과 토론은 빠르게 변화하는 정치적 환경을 빠르게 변화 시켰습니다.",17,5
3,71,남아프리카공화국,Pretoria,"A systematic approach to partnering To address partnerships between UP and international partners, UP established both an International Cooperation Division (2003) and an office for International Strategic Partnerships (2019). UP’s Division for International Cooperation keeps a database of both current, expiring, and legacy partnerships and their nature. Also noted is the type of agreement (institutional, or by faculty name); the dates of the agreements; and comments about the nature of the agreement in terms of academic exchange, staff and student mobility. Every institution with whom UP would seek to enter an institutional agreement is categorised by country. This allows us to see the concentration of agreements and partnerships more easily. A background report is prepared on every single institution that UP, at any level, would seek to partner with. Types of information that the report contains typically include: • Collaboration by co-authored publications (according to Scival), per: - UP researcher author/s, including number of co-authored publications, citations, citations per publication, and the authors at the partner university; and, - Subject area and number of publications. • A listing of research undertaken at the partner institution is conducted including research entities, key themes and focus areas, as well as lists of centres, institutes, and focus groups. • Each report contains an overview of the partner institution. These reports take the self-awareness of the institution into context, before connecting the dots of all the resources potentially available to address complex challenges. By using a contextual approach, we understand the complex interplays between us, our partners, and the challenges we seek to address through the partnership.","파트너십에 대한 체계적인 접근 UP와 국제 파트너 간의 파트너십을 해결하기 위해 UP은 국제 협력 부서(2003)와 국제 전략적 파트너십 사무소(2019)를 모두 설립했습니다. UP의 국제 협력 부서는 현재, 만료 및 레거시 파트너십과 그 성격에 대한 데이터베이스를 유지합니다. 또한 계약의 유형(기관 또는 교수진 이름으로)이 표시됩니다. 계약 날짜; 학술 교류, 교직원 및 학생 이동 측면에서 협정의 성격에 대한 의견. UP가 기관 계약을 체결하고자 하는 모든 기관은 국가별로 분류됩니다. 이를 통해 계약 및 파트너십의 집중도를 보다 쉽게 ​​확인할 수 있습니다. 모든 수준에서 UP가 파트너 관계를 맺으려는 모든 단일 기관에 대한 배경 보고서가 준비됩니다. 보고서에 포함되는 정보의 유형은 일반적으로 다음과 같습니다. • 공동 저자 간행물(Scival에 따름)별 공동 작업: - 공동 저자 간행물 수, 인용 횟수, 간행물당 인용 횟수 및 저자를 포함한 UP 연구원 저자 파트너 대학; 그리고, - 주제 영역 및 출판물의 수. • 파트너 기관에서 수행한 연구 목록은 연구 기관, 핵심 주제 및 초점 분야를 포함하여 수행되며 센터, 기관 및 초점 그룹 목록입니다. • 각 보고서에는 파트너 기관의 개요가 포함되어 있습니다. 이 보고서는 복잡한 문제를 해결하는 데 잠재적으로 사용할 수 있는 모든 리소스의 점을 연결하기 전에 기관의 자기 인식을 맥락에 맞게 만듭니다. 상황에 맞는 접근 방식을 사용하여 우리와 파트너 간의 복잡한 상호 작용과 파트너십을 통해 해결하고자 하는 문제를 이해합니다.","UP는 UP와 국제 파트너 간의 파트너십을 해결하기위한 파트너 관계에 대한 체계적인 접근 방식으로 국제 협력 부서 (2003)와 국제 전략 파트너십 사무소 (2019)를 설립했습니다. UP의 국제 협력 부서는 현재, 만료 및 레거시 파트너십과 그 성격의 데이터베이스를 유지합니다. 또한 계약 유형 (기관 또는 교수 이름)도 언급합니다. 계약의 날짜; 학업 교환, 교직원 및 학생 이동성 측면에서 계약의 성격에 대한 의견. UP가 제도적 협정에 들어가려고하는 모든 기관은 국가별로 분류됩니다. 이를 통해 계약과 파트너십의 집중력을 더 쉽게 볼 수 있습니다. 배경 보고서는 모든 단일 기관에서 어느 수준에서나 파트너 관계를 맺고 자하는 모든 기관에 준비됩니다. 보고서에 일반적으로 포함하는 정보 유형 : • 공동 저술 간행물 (Scival에 따르면), PER :-UP 연구원 저자, 공동 저술가, 인용 당 인용, 출판 당 인용 및 저자를 포함하여 UP 연구원 저자/s 파트너 대학; 및, - 주제 영역 및 출판물 수. • 파트너 기관에서 수행 된 연구 목록은 연구 기관, 주요 주제 및 포커스 영역, 센터, 기관 및 포커스 그룹을 포함하여 수행됩니다. • 각 보고서에는 파트너 기관의 개요가 포함되어 있습니다. 이 보고서는 복잡한 문제를 해결하기 위해 잠재적으로 이용할 수있는 모든 자원의 점을 연결하기 전에 기관의 자기 인식을 맥락으로 간주합니다. 상황에 맞는 접근 방식을 사용함으로써, 우리는 파트너십을 통해 해결하고자하는 우리의 복잡한 상호 작용을 이해합니다.","UP는 UP와 국제 파트너 간의 파트너십을 해결하기위한 파트너 관계에 대한 체계적인 접근 방식으로 국제 협력 부서 (2003)와 국제 전략 파트너십 사무소 (2019)를 설립했습니다. UP의 국제 협력 부서는 현재, 만료 및 레거시 파트너십과 그 성격의 데이터베이스를 유지합니다. 또한 계약 유형 (기관 또는 교수 이름)도 언급합니다. 계약의 날짜; 학업 교환, 교직원 및 학생 이동성 측면에서 계약의 성격에 대한 의견. UP가 제도적 협정에 들어가려고하는 모든 기관은 국가별로 분류됩니다. 이를 통해 계약과 파트너십의 집중력을 더 쉽게 볼 수 있습니다. 배경 보고서는 모든 단일 기관에서 어느 수준에서나 파트너 관계를 맺고 자하는 모든 기관에 준비됩니다. 보고서에 일반적으로 포함하는 정보 유형 : • 공동 저술 간행물 (Scival에 따르면), PER :-UP 연구원 저자, 공동 저술가, 인용 당 인용, 출판 당 인용 및 저자를 포함하여 UP 연구원 저자/s 파트너 대학; 및, - 주제 영역 및 출판물 수. • 파트너 기관에서 수행 된 연구 목록은 연구 기관, 주요 주제 및 포커스 영역, 센터, 기관 및 포커스 그룹을 포함하여 수행됩니다. • 각 보고서에는 파트너 기관의 개요가 포함되어 있습니다. 이 보고서는 복잡한 문제를 해결하기 위해 잠재적으로 이용할 수있는 모든 자원의 점을 연결하기 전에 기관의 자기 인식을 맥락으로 간주합니다. 상황에 맞는 접근 방식을 사용함으로써, 우리는 파트너십을 통해 해결하고자하는 우리의 복잡한 상호 작용을 이해합니다.",17,5
4,72,남아프리카공화국,Pretoria,"Taking partnering to the next level The Office for International Strategic Partnerships (ISP) aims to engage partners who would provide mutual benefit in attaining UP’s vision —“to be the leading African global university”—and goals, as set out in UP’s Strategic Plan—2025. The process that ISP follows is encapsulated in the Africa-Global University Project (AGUP) strategy, a nested strategy for the achievement of UP’s Strategic Plan—2025. This was approved by the University’s Executive in November 2020. AGUP is a transformative initiative that seeks to reimagine UP’s approach to collective partnerships, and prioritises building an institution that is firmly focused on internationally recognised and high-quality scholarship while contributing to thoughtful development in South Africa, Africa and globally. This approach to inclusive partnerships with multiple stakeholders and networks within and beyond universities, and across continents, is critical because the multiplicity of current local and global challenges is complicated, intersectoral, and require transdisciplinary co-production of knowledge and co-innovation of solutions. In this way we can be relevant and truly responsive to the current and future challenges facing society. In 2020, the University signed 35 new agreements between universities from Brazil, Japan, Russia, Canada, Norway, Germany, Sweden, Austria, Italy, Switzerland, Belgium, Tanzania, USA, Australia, Ecuador, and the Netherlands. This was at both institutional and faculty level, and various agreements were addended with student and staff exchanges or for joint supervision.","협력을 한 차원 더 높은 수준으로 끌어올리기 ISP(Office for International Strategic Partnerships)는 UP의 전략 계획에 명시된 대로 UP의 비전(""선도적인 아프리카 글로벌 대학이 되는 것"")과 목표를 달성하는 데 상호 이익을 제공할 파트너를 참여시키는 것을 목표로 합니다. 2025. ISP가 따르는 프로세스는 UP의 전략 계획(2025) 달성을 위한 중첩 전략인 아프리카-글로벌 대학 프로젝트(AGUP) 전략에 요약되어 있습니다. 이것은 2020년 11월에 대학 집행부에 의해 승인되었습니다. AGUP은 집단 파트너십에 대한 UP의 접근 방식을 재창조하고, 남반구의 사려 깊은 발전에 기여하면서 국제적으로 인정받는 고품질 장학금에 확고하게 초점을 맞춘 기관을 구축하는 것을 우선시하는 변혁적 이니셔티브입니다. 아프리카, 아프리카 및 전 세계적으로. 여러 이해 관계자 및 대학 내외, 대륙 전반에 걸친 네트워크와의 포괄적인 파트너십에 대한 이러한 접근 방식은 현재 지역 및 글로벌 과제의 복잡성이 복잡하고 부문 간이며 지식의 학제 간 공동 생산 및 솔루션의 공동 혁신이 필요하기 때문에 중요합니다. 이러한 방식으로 우리는 사회가 직면한 현재와 미래의 도전에 적절하고 진정으로 대응할 수 있습니다. 2020년에 본교는 브라질, 일본, 러시아, 캐나다, 노르웨이, 독일, 스웨덴, 오스트리아, 이탈리아, 스위스, 벨기에, 탄자니아, 미국, 호주, 에콰도르 및 네덜란드의 대학 간에 35개의 새로운 계약을 체결했습니다. 이는 기관 및 교수 수준에서 이루어졌으며 학생 및 직원 교환 또는 공동 감독을 위해 다양한 계약이 추가되었습니다.","국제 전략적 파트너십 (ISP) 사무실은 다음 단계로 파트너십을 맺고 UP의 전략 계획에 명시된 바와 같이 UP의 비전 (“아프리카 세계 대학이되기위한”비전과 목표를 달성하는 데 상호 혜택을 제공 할 파트너를 참여시키는 것을 목표로합니다. 2025. ISP가 따르는 프로세스는 UP의 전략 계획 달성을위한 중첩 전략 인 AGUP (Africa-Global University Project) 전략에 캡슐화됩니다. 이는 2020 년 11 월 대학의 임원의 승인을 받았습니다. AGUP 아프리카, 아프리카 및 전 세계. 대학 내외의 여러 이해 관계자 및 네트워크와 대륙 전체에 대한 포괄적 인 파트너십에 대한 이러한 접근 방식은 현재 지역 및 글로벌 과제의 다중성이 복잡하고, 교차관적이며, 지식의 지식을 공동으로 제작하고 솔루션의 공동 소개가 필요하기 때문에 중요합니다. 이런 식으로 우리는 사회가 직면 한 현재와 미래의 도전과 관련이 있고 진정으로 반응 할 수 있습니다. 2020 년 에이 대학은 브라질, 일본, 러시아, 캐나다, 노르웨이, 독일, 스웨덴, 오스트리아, 이탈리아, 스위스, 벨기에, 탄자니아, 미국, 호주, 에콰도르 및 네덜란드에서 35 개의 새로운 계약을 체결했습니다. 이것은 기관 및 교수 수준 모두에 있었고, 학생 및 교직원 교환 또는 공동 감독과 함께 다양한 계약이 추가되었습니다.","국제 전략적 파트너십 (ISP) 사무실은 다음 단계로 파트너십을 맺고 UP의 전략 계획에 명시된 바와 같이 UP의 비전 (“아프리카 세계 대학이되기위한”비전과 목표를 달성하는 데 상호 혜택을 제공 할 파트너를 참여시키는 것을 목표로합니다. 2025. ISP가 따르는 프로세스는 UP의 전략 계획 달성을위한 중첩 전략 인 AGUP (Africa-Global University Project) 전략에 캡슐화됩니다. 이는 2020 년 11 월 대학의 임원의 승인을 받았습니다. AGUP 아프리카, 아프리카 및 전 세계. 대학 내외의 여러 이해 관계자 및 네트워크와 대륙 전체에 대한 포괄적 인 파트너십에 대한 이러한 접근 방식은 현재 지역 및 글로벌 과제의 다중성이 복잡하고, 교차관적이며, 지식의 지식을 공동으로 제작하고 솔루션의 공동 소개가 필요하기 때문에 중요합니다. 이런 식으로 우리는 사회가 직면 한 현재와 미래의 도전과 관련이 있고 진정으로 반응 할 수 있습니다. 2020 년 에이 대학은 브라질, 일본, 러시아, 캐나다, 노르웨이, 독일, 스웨덴, 오스트리아, 이탈리아, 스위스, 벨기에, 탄자니아, 미국, 호주, 에콰도르 및 네덜란드에서 35 개의 새로운 계약을 체결했습니다. 이것은 기관 및 교수 수준 모두에 있었고, 학생 및 교직원 교환 또는 공동 감독과 함께 다양한 계약이 추가되었습니다.",17,5
5,73,남아프리카공화국,Pretoria,"Partnering to leverage knowledge Beyond the AGUP strategy, the Albert Luthuli Leadership Institute (ALLI) hosts the SDG Hub, funded in part by the Department of Science and Innovation and the German International Cooperation Agency. It is also part of the UN’s Sustainable Development Solutions Network and the Global Partnership for Effective Development Co-operation Global Partnership Initiative. Hosted within ALLI, the South African SDG Hub aggregates the best and most relevant South African research related to the SDGs. The strategic objectives of the hub include enabling access to relevant, useful, and reliable knowledge resources; providing policy advice; promoting dialogue; and building capacity. Its machinelearning-based classification tool automatically classifies research in terms of one or more SDGs, equipping leaders with the most relevant knowledge. This enables working with multilateral institutions, governments, and companies to accelerate the implementation of SDGs.","AGUP 전략을 넘어 지식을 활용하기 위해 협력하는 Albert Luthuli 리더십 연구소(ALLI)는 과학 및 혁신부와 독일 국제 협력 기관이 부분적으로 자금을 지원하는 SDG 허브를 주최합니다. 또한 UN의 지속 가능한 개발 솔루션 네트워크 및 효과적인 개발 협력을 위한 글로벌 파트너십 글로벌 파트너십 이니셔티브의 일부입니다. ALLI 내에서 호스팅되는 남아프리카 SDG 허브는 SDG와 관련된 가장 관련성이 높은 남아프리카 연구를 집계합니다. 허브의 전략적 목표에는 관련성 있고 유용하며 신뢰할 수 있는 지식 자원에 대한 액세스를 가능하게 하는 것이 포함됩니다. 정책 조언 제공; 대화 촉진; 및 건물 용량. 머신러닝 기반 분류 도구는 연구를 하나 이상의 SDG에 따라 자동으로 분류하여 리더에게 가장 관련성이 높은 지식을 제공합니다. 이를 통해 다자간 기관, 정부 및 기업과 협력하여 SDGs의 이행을 가속화할 수 있습니다.","Albert Luthuli Leadership Institute (ALLI)는 AGUP 전략을 넘어 지식을 활용하기 위해 파트너십을 맺고 과학 및 혁신 부와 독일 국제 협력청이 부분적으로 자금을 지원하는 SDG 허브를 주최합니다.또한 유엔의 지속 가능한 개발 솔루션 네트워크의 일부이며 효과적인 개발 협력을위한 글로벌 파트너십 글로벌 파트너십 이니셔티브입니다.Alli 내에서 주최 된 남아프리카 SDG 허브는 SDG와 관련된 최고의 남아프리카 연구를 집계합니다.허브의 전략적 목표에는 관련성 있고 유용하며 신뢰할 수있는 지식 자원에 대한 액세스를 가능하게하는 것이 포함됩니다.정책 조언 제공;대화 촉진;그리고 건물 용량.MachineLearning 기반 분류 도구는 하나 이상의 SDG의 관점에서 연구를 자동으로 분류하여 리더에게 가장 관련성이 높은 지식을 장착합니다.이를 통해 다자 기관, 정부 및 회사와 협력하여 SDG의 이행을 가속화 할 수 있습니다.", 기반 분류 도구는 하나 이상의 SDG의 관점에서 연구를 자동으로 분류하여 리더에게 가장 관련성이 높은 지식을 장착합니다,17,5
