,Unnamed: 0,국가,대학교명,내용,번역,영한_재번역,추출요약,분류,5분류
91,1254,오스트레일리아,RMIT University,"7. Engaging for Impact research
event inspires collaboration
RMIT’s fourth ‘Engaging for Impact’ event was held in
February 2020 and brought together top academics, innovators
and industry partners to showcase the best in research and
innovative thinking. The themes covered included future energy,
waste and materials, integrated health care, living in cities and
digital inclusion. Many of the 86 researchers, innovators and
industry partners, presenting to more than 1,000 guests at the
three-day event, spoke of how they were joining forces across
sectors and disciplines to find solutions to some of the world’s
most intractable and complex problems. During the event,
visionary keynote speakers, panel discussions, master classes,
industry spotlight and priority workshops focused on emerging
and current trends and potential solutions to address the
challenges faced by our society.
Engaging for Impact is RMIT’s flagship research and innovation
event, showcasing the University’s leading academics, strong
industry connections, and life-changing student experiences.
It also provided an opportunity for attendees to network and
have collaborative discussions about effective action. It fostered
partnerships and provided participants with the opportunity to
share insights, global trends, industry needs, and best practices
to ensure research and innovation is relevant and creating
value and impact for Australia and the world.","7. 영향 연구 참여_x000D_
이벤트는 협업을 고무한다._x000D_
RMIT의 네 번째 'Engaging for Impact' 행사가 열렸다._x000D_
2020년 2월, 최고의 학계, 혁신가들을 모았습니다._x000D_
그리고 업계 파트너들이 최고의 연구 성과를 보여주고,_x000D_
혁신적인 사고 주제에는 미래 에너지,_x000D_
폐기물 및 자재, 통합 의료, 도시 생활 및_x000D_
디지털 포섭 86명의 연구원, 혁신가, 그리고_x000D_
산업 파트너들, 1,000명 이상의 손님들에게 발표_x000D_
그들이 어떻게 힘을 합쳤는지에 대해 이야기한 3일간의 행사_x000D_
세계 일부의 문제에 대한 해결책을 찾기 위한 부문과 규율_x000D_
가장 다루기 어렵고 복잡한 문제들 행사 기간 동안._x000D_
비전 있는 기조 연설자, 패널 토론, 마스터 클래스,_x000D_
새롭게 부상하는 것에 초점을 맞춘 업계의 스포트라이트 및 우선 순위 워크샵_x000D_
그리고 현재 추세 및 잠재적 솔루션을 통해_x000D_
우리 사회가 직면한 도전_x000D_
임팩트를 위한 참여는 RMIT의 주력 연구 및 혁신입니다._x000D_
그 대학의 일류 학자들을 보여주는 행사, 강렬함_x000D_
업계 관계, 그리고 삶을 변화시키는 학생 경험._x000D_
그것은 또한 참석자들이 네트워크를 형성하고_x000D_
효과적인 행동에 대해 협력적인 토론을 하다. 키웠다._x000D_
파트너쉽과 참가자들에게 다음과 같은 기회를 제공하였습니다._x000D_
통찰력, 글로벌 동향, 업계 요구 및 모범 사례 공유_x000D_
연구와 혁신이 적절하고 창조적인지 확인한다._x000D_
호주와 세계를 위한 가치와 영향이라고 말했다.","7. Impact Research 이벤트에 대한 참여는 2020 년 2 월에 RMIT의 네 번째 'Impact for Impact'이벤트가 열렸으며 최고의 학자, 혁신가 및 업계 파트너를 모아서 연구 및 혁신적인 사고를 선보였습니다. 다루는 주제에는 미래의 에너지, 폐기물 및 재료, 통합 건강 관리, 도시에 거주하고 디지털 포함이 포함되었습니다. 3 일간의 행사에서 1,000 명 이상의 손님에게 선고하는 86 명의 연구원, 혁신가 및 업계 파트너 중 다수는 세계에서 가장 다루기 어려우고 복잡한 문제에 대한 해결책을 찾기 위해 부문과 분야의 힘에 합류하는 방법에 대해 이야기했습니다. 행사 기간 동안 비전 기조 연설자, 패널 토론, 마스터 클래스, 업계 스포트라이트 및 우선 순위 워크샵은 신흥 및 현재 트렌드 및 잠재적 솔루션에 중점을 둔 우리 사회가 직면 한 문제를 해결했습니다. Impact의 참여는 RMIT의 주력 연구 및 혁신 이벤트로, 대학의 주요 학자, 강력한 산업 연결 및 삶을 변화시키는 학생 경험을 보여줍니다. 또한 참석자들이 네트워크를위한 기회를 제공하고 효과적인 행동에 대한 협력 토론을했습니다. 그것은 파트너십을 촉진하고 참가자들에게 연구와 혁신이 호주와 세계에 대한 가치와 영향을 창출 할 수 있도록 통찰력, 글로벌 트렌드, 산업 요구 및 모범 사례를 공유 할 수있는 기회를 제공했습니다.","7. Impact Research 이벤트에 대한 참여는 2020 년 2 월에 RMIT의 네 번째 'Impact for Impact'이벤트가 열렸으며 최고의 학자, 혁신가 및 업계 파트너를 모아서 연구 및 혁신적인 사고를 선보였습니다. 다루는 주제에는 미래의 에너지, 폐기물 및 재료, 통합 건강 관리, 도시에 거주하고 디지털 포함이 포함되었습니다. 3 일간의 행사에서 1,000 명 이상의 손님에게 선고하는 86 명의 연구원, 혁신가 및 업계 파트너 중 다수는 세계에서 가장 다루기 어려우고 복잡한 문제에 대한 해결책을 찾기 위해 부문과 분야의 힘에 합류하는 방법에 대해 이야기했습니다. 행사 기간 동안 비전 기조 연설자, 패널 토론, 마스터 클래스, 업계 스포트라이트 및 우선 순위 워크샵은 신흥 및 현재 트렌드 및 잠재적 솔루션에 중점을 둔 우리 사회가 직면 한 문제를 해결했습니다. Impact의 참여는 RMIT의 주력 연구 및 혁신 이벤트로, 대학의 주요 학자, 강력한 산업 연결 및 삶을 변화시키는 학생 경험을 보여줍니다. 또한 참석자들이 네트워크를위한 기회를 제공하고 효과적인 행동에 대한 협력 토론을했습니다. 그것은 파트너십을 촉진하고 참가자들에게 연구와 혁신이 호주와 세계에 대한 가치와 영향을 창출 할 수 있도록 통찰력, 글로벌 트렌드, 산업 요구 및 모범 사례를 공유 할 수있는 기회를 제공했습니다.",17,5
92,1347,오스트레일리아,Charles Sturt University,"Translating fish passage research
outcomes into policy and legislation
across South East Asia (2020–2023)
A two-day Motivation and Ability (MOTA) framework
development workshop was held at Charles Sturt’s
Albury-Wodonga campus, 20–21 February 2020 to “kick start”
the project.
Left to Right, Chann Aun Tob (Ministry of Agriculture, Forestry
and Fisheries, Cambodia), Professor Ho Long Phi (Centre
for Water Management and Climate Change, Vietnam
National University), Rezki Antoni (Southeast Asia Fisheries
Development Centre, Inland Fisheries Resources Development
and Management Department, Indonesia), and Dr John
Conallin (Charles Sturt – ILWS). Pic K. Doyle.
The recent increase in water development projects
throughout Southeast Asia threatens the long-term
sustainability of productive inland capture fisheries.
Capture fisheries are important as they are often
the main source of protein and cash income for
river communities, often the most vulnerable to
climate change and nutrient deprivation.
This project, being implemented in three South East
Asian countries (Laos, Myanmar, and Indonesia),
aims to:
• understand the motivations of donors
and irrigation agencies for choosing
whether to include fish passage within
development projects
• define institutional capacity needs to enable
design and implementation of future fish
passage programs
• fill critical knowledge gaps needed
to demonstrate proof of concept to
donor agencies
• understand and define policy needs of the
partner countries and donors.","""어류 통로 연구 번역 중""
정책 및 입법에 대한 결과
동남아시아 전역 (2020-2023)
2일간의 동기부여 및 능력(MOTA) 프레임워크
개발 워크숍은 Charles Sturt's에서 열렸다.
2020년 2월 20-21일 ""킥스타트""로 알부리-워동아 캠퍼스
계획
왼쪽에서 오른쪽으로 Chann Aun Tob (농림부)
캄보디아, 수산, Ho Long Phi 교수(센터)
물 관리와 기후 변화를 위한 베트남
국립대학교, 레즈키 안토니 (동남아 수산)
내륙어업자원개발센터
인도네시아 관리부) 및 존 박사
코날린(Charles Sturt – ILWS) 골라봐 도일.
최근 물 개발 프로젝트의 증가
동남아시아 전역에 걸쳐서 장기간에 걸친 위협이 있다.
생산적인 내륙 포획 어업의 지속 가능성
어획량은 종종 중요하기 때문에 중요하다.
단백질과 현금 수입의 주요 원천
종종 에 가장 취약한 하천 공동체
기후 변화와 영양 결핍
이 프로젝트는 세 개의 남동부에서 시행되고 있다.
아시아 국가(라오스, 미얀마, 인도네시아),
목적:
• 기부자의 동기를 이해하다
선택하기 위한 관개 기관
안에 물고기 통로를 포함할지 여부
개발 계획
• 다음을 가능하게 하는 제도적 역량 정의
미래 물고기의 설계 및 구현
통과 프로그램
• 필요한 중요한 지식 격차를 메우다
개념 증명을 보여주다
기증자 기관
• 의 정책 요구를 이해하고 정의한다.
파트너 국가와 기증자""라고 말했다.","물고기 통과 연구 결과를 동남아시아 전역의 정책 및 법으로 번역 한 (2020–2023) 2020 년 2 월 20 일부터 21 일까지 Charles Sturt의 Albury-Wodonga 캠퍼스에서 이틀간의 동기 부여 및 능력 (MOTA) 프레임 워크 개발 워크숍이 열렸습니다. "" 프로젝트. 왼쪽에서 오른쪽으로, Chann Aun Tob (캄보디아의 산림 및 어업부), Ho Long Phi 교수 (베트남 국립 대학교의 물 관리 및 기후 변화 센터), Rezki Antoni (동남아시아 어업 개발 센터, 내륙 어업 자원 개발 센터 및 관리 부서, 인도네시아) 및 John Conallin 박사 (Charles Sturt - ILWS). PIC K. DOYLE. 동남아시아 전역의 물 개발 프로젝트의 최근 증가는 생산적인 내륙 캡처 어업의 장기적인 지속 가능성을 위협합니다. 포획 어업은 종종 강 지역 사회의 단백질과 현금 소득의 주요 원천이므로 기후 변화와 영양소 박탈에 가장 취약한 경우가 많기 때문에 중요합니다. 이 프로젝트는 동남아시아 3 개국 (LAOS, 미얀마 및 인도네시아)에서 시행되는이 프로젝트는 다음과 같이 목표 미래의 어류 통과 프로그램의 구현 • 기부자 기관에 개념 증명을 보여주는 데 필요한 중요한 지식 격차를 메 웁니다. • 파트너 국가 및 기부자의 정책 요구를 이해하고 정의합니다.","물고기 통과 연구 결과를 동남아시아 전역의 정책 및 법으로 번역 한 (2020–2023) 2020 년 2 월 20 일부터 21 일까지 Charles Sturt의 Albury-Wodonga 캠퍼스에서 이틀간의 동기 부여 및 능력 (MOTA) 프레임 워크 개발 워크숍이 열렸습니다. "" 프로젝트. 왼쪽에서 오른쪽으로, Chann Aun Tob (캄보디아의 산림 및 어업부), Ho Long Phi 교수 (베트남 국립 대학교의 물 관리 및 기후 변화 센터), Rezki Antoni (동남아시아 어업 개발 센터, 내륙 어업 자원 개발 센터 및 관리 부서, 인도네시아) 및 John Conallin 박사 (Charles Sturt - ILWS). PIC K. DOYLE. 동남아시아 전역의 물 개발 프로젝트의 최근 증가는 생산적인 내륙 캡처 어업의 장기적인 지속 가능성을 위협합니다. 포획 어업은 종종 강 지역 사회의 단백질과 현금 소득의 주요 원천이므로 기후 변화와 영양소 박탈에 가장 취약한 경우가 많기 때문에 중요합니다. 이 프로젝트는 동남아시아 3 개국 (LAOS, 미얀마 및 인도네시아)에서 시행되는이 프로젝트는 다음과 같이 목표 미래의 어류 통과 프로그램의 구현 • 기부자 기관에 개념 증명을 보여주는 데 필요한 중요한 지식 격차를 메 웁니다. • 파트너 국가 및 기부자의 정책 요구를 이해하고 정의합니다.",17,5
93,1348,오스트레일리아,Charles Sturt University,"Assessing fisheries mitigation measures at
Xayaburi Dam in Lao PDR
Training workshops in Laos (Image: J. McPherson).
From 25 February to 3 March 2020, Charles Sturt
researchers Professor Lee Baumgartner and
Jarrod McPherson, along with Karl Pomorin from
KarlTek Pty Ltd, were in Laos at the Xayaburi River
hydropower project, to undertake their first major
field trip, which involved running intensive training
44 Sustainable Development Goals Report
workshops. While there, they were joined by Dr Alan
Temple from the US Fish and Wildlife Service.
“It was very much about upskilling our project
partners so that they can run things when we are
not on site,” says Lee.
Between the four, they ran training workshops on
electrofishing and PIT tagging, they tagged and
released some fish into the Mekong River, and
began tag retention trials at a fish research centre
that has been constructed at the site.
“We were over there with 20 people – a
combination of Xayaburi employees and Lao
government officials,” says Lee. “It was a very
intensive week. It was all about giving them the
practical skills they need for this project.”
In November, the outreach of this work was
extended even further when the Charles Sturt
project team partnered with the Crawford Fund
and converted the training into a series of publicly
available online instructional videos accessible
via the Crawford Fund YouTube site. There are
further plans to have these translated into multiple
languages to improve their accessibility.
Fish management
instructional video series","""어업 완화 조치의 평가
라오스 PDR의 자야부리 댐
라오스 교육 워크샵(이미지: J. McPherson).
2020년 2월 25일부터 3월 3일까지 찰스 스터트
연구원 Lee Baumgartner 교수와
Jarrod McPherson과 Karl Pomorin이 함께했다.
Karl Tek Pty Ltd는 Laus에서 Xayaburi 강에 있었다.
첫 번째 전공을 맡다
집중 훈련의 실행을 수반한 현장 학습
44 지속 가능한 개발 목표 보고서
작업장 그곳에 있는 동안, 그들은 앨런 박사와 함께 있었다.
미국 어류 및 야생동물국의 사원입니다.
""그것은 우리 프로젝트의 기술 향상에 관한 것이었습니다.
파트너들은 우리가 할 수 있는 일을 할 수 있습니다.
현장에는 없습니다.""라고 Lee는 말합니다.
4명 사이에, 그들은 교육 워크샵을 운영했다.
전기 낚시와 PIT 태그 부착, 그리고
메콩강으로 물고기를 방류했다.
어류 연구소에서 꼬리표 보유 실험을 시작했다.
현장에서 시공된 것입니다.
""우리는 20명의 사람들과 함께 저쪽에 있었습니다 –
사야부리 직원과 라오 조합
정부 관료들""이라고 이씨는 말한다. ""그것은 매우 힘들었다.
집중적인 일주일 그 모든 것은 그들에게 돈을 주는 것 뿐이었다.
이 프로젝트를 위해 필요한 실용적인 기술""이라고 말했습니다.
11월에, 이 작업의 아웃리치는
찰스 스터트 사건 때 더 멀리까지
프로젝트 팀은 크로포드 기금과 제휴했다.
그리고 훈련을 공개적인 일련의 훈련으로 전환했다.
이용할 수 있는 온라인 교육 비디오
크로퍼드 펀드 유튜브 사이트를 통해. 있다
이것들을 여러 개로 번역할 추가 계획
접근성을 향상시키기 위한 언어들.
어류관리
교육용 비디오 시리즈""","Laos의 Lao Pdr Training Workshop의 Xayaburi Dam에서 어업 완화 조치 평가 (이미지 : J. McPherson). 2020 년 2 월 25 일부터 3 월 3 일까지 Charles Sturt 연구원 Lee Baumgartner 교수와 Jarrod McPherson은 Karltek Pty Ltd의 Karl Pomorin과 함께 Xayaburi River Hydropower Project에서 라오스에 있었으며, 첫 번째 주요 견학을 수행하여 강력한 훈련을 실시했습니다. 44 지속 가능한 개발 목표보고 워크샵. 그곳에있는 동안 그들은 미국 어류 및 야생 동물 서비스에서 Alan Temple 박사와 합류했습니다. Lee는“프로젝트 파트너가 우리가 현장에 없을 때 물건을 운영 할 수 있도록 프로젝트 파트너를 업무를 수행하는 것이 매우 많았습니다. 4 명 사이에 그들은 전기 조정 및 피트 태깅에 관한 훈련 워크샵을 진행했으며, 메콩 강으로 일부 물고기를 태그하고 풀어 주었고, 현장에서 건설 된 어류 연구 센터에서 태그 보유 시험을 시작했습니다. Lee는“우리는 Xayaburi 직원과 Lao 정부 관리들의 조합 인 20 명의 사람들과 함께 거기에있었습니다. “매우 집중적 인 주였습니다. 이 프로젝트에 필요한 실용적인 기술을 제공하는 것이 전부였습니다.” 11 월, Charles Sturt Project 팀이 Crawford Fund와 파트너 관계를 맺고 Crawford Fund YouTube 사이트를 통해 액세스 할 수있는 일련의 공개 온라인 교육용 비디오로 교육을 전환했을 때이 작업의 봉사 활동이 더욱 확장되었습니다. 접근성을 향상시키기 위해 여러 언어로 번역 할 계획이 있습니다. 어류 관리 교육 비디오 시리즈","11 월, Charles Sturt Project 팀이 Crawford Fund와 파트너 관계를 맺고 Crawford Fund YouTube 사이트를 통해 액세스 할 수있는 일련의 공개 온라인 교육용 비디오로 교육을 전환했을 때이 작업의 봉사 활동이 더욱 확장되었습니다. 접근성을 향상시키기 위해 여러 언어로 번역 할 계획이 있습니다. 어류 관리 교육 비디오 시리즈",17,5
94,1349,오스트레일리아,Charles Sturt University,"ENM308 – Challenges of Global
Sustainable Development
In session one of 2020, 33 of the 36 students who
studied Environmental Sciences subject ENM308 –
Challenges of Global Sustainable Development,
completed successfully.
This subject covers the following topics:
• Introduction to global sustainable development
• United Nations Sustainable Development Goals
(SDG)
• Challenges of global sustainable development
• Environmental degradation
• Population growth
• Consumption, wealth and poverty
• The Anthropocene
• Indigenous land management: a
historical perspective
• Indigenous understandings of the relationship
between humans and their surroundings
• Achieving global sustainable development:
lessons from Indigenous practices
• Frameworks and indicators for global
sustainable development.
Green Gown Award
In partnership with:
The International Green Gown Awards are administered by EAUC.
Charles Sturt
University
Sustainability Institution of the Year/
Établissement Responsable de l’Année
Highly Commended/
Avec les Félicitations du Jury
2020
In 2020, Charles Sturt actively partnered with
organisations working towards a better, more
sustainable future for all. Charles Sturt is committed
to continuous self-assessment and improvement
of how we operate as an organisation. Recognition
was provided via receiving a Highly Commended
status for the Sustainability Institution of the
Year under the International Green Gown Awards,
which was presented as part of the United
Nations High-level Political Forum on Sustainable
Development. Congratulations to all the winners of
the 2020 Green Gown Awards.","""ENM308 – 글로벌 과제
지속 가능한 개발
2020년 세션 1에서, 36명의 학생 중 33명이
연구된 환경 과학 주제 ENM308 -
글로벌 지속가능개발의 과제,
성공적으로 완료되었습니다.
이 항목에서는 다음 항목을 다룹니다.
• 글로벌 지속가능발전소개요
• 유엔 지속가능개발목표
(SDG)
• 글로벌 지속가능개발 과제
• 환경 악화
• 인구 증가
• 소비, 부, 빈곤
• 인류세
• 토착 토지 관리: a
역사적 관점
• 관계에 대한 원주민의 이해
인간과 그 주변 환경 사이에
• 글로벌 지속 가능한 개발 달성:
원주민의 습관에서 얻은 교훈
• 글로벌 프레임워크 및 지표
지속 가능한 발전
그린 가운상
다음 업체와 제휴:
국제 그린 가운 상은 EAUC가 주관한다.
찰스 스터트
대학.
올해의 지속가능성 기관/
에트블리제이션 책임 드 아네
높이 평가됨/
아베스 여성회원단 쥬리
2020
2020년, 찰스 스터트는 다음과 같이 적극적으로 협력했다.
더 나은, 더 나은, 더 많은 것을 위해 노력하는 조직들
모두를 위한 지속 가능한 미래 찰스 스터트는 헌신적이다.
지속적인 자기 평가와 개선을 위해
우리가 조직으로서 어떻게 운영하는지 알 수 있습니다. 인식
높은 평가를 받아 제공되었습니다.
지속가능성 기관의 지위
'국제 그린 가운상' 시상식에서
그것은 미국의 일부로 제시되었다.
지속가능성에 관한 국가 고위급 정치 포럼
발전. 수상자 여러분 축하드립니다.
2020년 그린 가운 어워즈""를 수상했습니다.","ENM308 - 환경 과학 주제 ENM308을 연구 한 36 명의 학생들 중 33 명 중 33 명 중 33 명 중 33 명 중 33 명 중 33 명 중 33 명 중 33 명이 성공적으로 완료되었습니다. 이 주제는 다음과 같은 주제를 다룹니다. • 글로벌 지속 가능한 개발 소개 • 유엔 지속 가능한 개발 목표 (SDG) • 글로벌 지속 가능한 개발의 도전 • 환경 저하 • 인구 성장 • 소비, 부 및 빈곤 • Anthropocene • 토착 토지 관리 : 역사적 토지 관리 : 역사적 토지 관리 관점 • 인간과 주변 환경 간의 관계에 대한 토착 이해 • 글로벌 지속 가능한 개발 달성 : 원주민 관행의 교훈 • 글로벌 지속 가능한 개발을위한 프레임 워크 및 지표. 파트너십으로 Green Gown Award : International Green Gown Awards는 EAUC가 관리합니다. Charles Sturt University Sustainability Institution of the Year/ établissement De L 'Année 고도로 칭찬 된/ avec les félicitations du jury 2020 2020 년에 Charles Sturt는 더 나은 지속 가능한 미래를 향해 노력하는 조직과 활발히 파트너 관계를 맺었습니다. Charles Sturt는 지속적인 자체 평가와 조직으로서의 운영 방식을 개선하기 위해 노력하고 있습니다. 인정은 국제 그린 가운 어워드 (International Green Gown Awards)에 따라 올해의 지속 가능성 기관에 대해 높은 지위를 받음으로써 제공되었으며, 이는 지속 가능한 개발에 관한 유엔 고위급 정치 포럼의 일환으로 발표되었습니다. 2020 Green Gown Awards의 모든 수상자에게 축하드립니다.","ENM308 - 환경 과학 주제 ENM308을 연구 한 36 명의 학생들 중 33 명 중 33 명 중 33 명 중 33 명 중 33 명 중 33 명 중 33 명 중 33 명이 성공적으로 완료되었습니다. 이 주제는 다음과 같은 주제를 다룹니다. • 글로벌 지속 가능한 개발 소개 • 유엔 지속 가능한 개발 목표 (SDG) • 글로벌 지속 가능한 개발의 도전 • 환경 저하 • 인구 성장 • 소비, 부 및 빈곤 • Anthropocene • 토착 토지 관리 : 역사적 토지 관리 : 역사적 토지 관리 관점 • 인간과 주변 환경 간의 관계에 대한 토착 이해 • 글로벌 지속 가능한 개발 달성 : 원주민 관행의 교훈 • 글로벌 지속 가능한 개발을위한 프레임 워크 및 지표. 파트너십으로 Green Gown Award : International Green Gown Awards는 EAUC가 관리합니다. Charles Sturt University Sustainability Institution of the Year/ établissement De L 'Année 고도로 칭찬 된/ avec les félicitations du jury 2020 2020 년에 Charles Sturt는 더 나은 지속 가능한 미래를 향해 노력하는 조직과 활발히 파트너 관계를 맺었습니다. Charles Sturt는 지속적인 자체 평가와 조직으로서의 운영 방식을 개선하기 위해 노력하고 있습니다. 인정은 국제 그린 가운 어워드 (International Green Gown Awards)에 따라 올해의 지속 가능성 기관에 대해 높은 지위를 받음으로써 제공되었으며, 이는 지속 가능한 개발에 관한 유엔 고위급 정치 포럼의 일환으로 발표되었습니다. 2020 Green Gown Awards의 모든 수상자에게 축하드립니다.",17,5
