,국가,대학교명,번역,분류,번역_전처리,5분류,요약
41,한국,Kangwon,"중독과 트라우마 회복을 위해 예방과 개입에 필요한 실천 방향 제시, 전문가 양성, 학문적 기틀 마련",3,"중독과 트라우마 회복을 위해 예방과 개입에 필요한 실천방향 제시, 전문가 양성, 학문적 기틀 마련",1,"중독과 트라우마 회복을 위해 예방과 개입에 필요한 실천방향 제시, 전문가 양성, 학문적 기틀 마련"
19,한국,Kangwon,어학능력 향상 의지 제고 및 학업 격차 해소를 위한 저소득층 학생 대상 외국어 강좌 수강지원,1,어학능력 향상의 지 제고 및 학업격차 해소를 위한 저소득층 학생 대상 외국어 강좌 수강 지원,1,어학능력 향상의 지 제고 및 학업격차 해소를 위한 저소득층 학생 대상 외국어 강좌 수강 지원
28,한국,Kangwon,"지역주민 대상 커피나무 재배, 수확, 건조 등의 체험과정 운영",2,"지역주민 대상 커피나무 재배, 수확, 건조 등의 체험과정 운영",1,"지역주민 대상 커피나무 재배, 수확, 건조 등의 체험과정 운영"
99,한국,Kyungpook,경북대학교병원은 5년 동안 독립국가연합(CIS)에 후원의 손길을 내밀었습니다. 경북대학교병원 해외의료봉사단은 카자흐스탄 산부인과 소아심장외과센터에서 선천성 심장병 환아 8명을 치료했다. 의료봉사단의 마스터클래스는 봉사기간 내내 연수에 참가한 타지키스탄 의사들에게도 큰 영향을 미쳤다.,1,경북대학교병원은 5년 동안 독립국가연합 CIS에 후원의 손길을 내밀었습니다. 경북대학교병원 해외의료봉사단은 카자흐스탄 산부인과 소아심장외과 센터에서 선천성 심장병 환아 8명을 치료했다.의료봉사단의 마스터 클래스는 봉사기간 내내 연수에 참가한 타지키스탄의사들에게도 큰 영향을 미쳤다.,1, 마스터 클래스는 봉사기간 내내 연수에 참가한 타지키스탄의사들에게도 큰 영향을 미쳤다.
85,한국,Kyungpook,경북대학교병원은 5년 동안 독립국가연합(CIS)에 후원의 손길을 내밀었습니다. 경북대학교병원 해외의료봉사단은 카자흐스탄 산부인과 소아심장외과센터에서 선천성 심장병 환아 8명을 치료했다. 의료봉사단의 마스터클래스는 봉사기간 내내 연수에 참가한 타지키스탄 의사들에게도 큰 영향을 미쳤다.,1,경북대학교병원은 5년 동안 독립국가연합 CIS에 후원의 손길을 내밀었습니다. 경북대학교병원 해외의료봉사단은 카자흐스탄 산부인과 소아심장외과 센터에서 선천성 심장병 환아 8명을 치료했다.의료봉사단의 마스터 클래스는 봉사기간 내내 연수에 참가한 타지키스탄의사들에게도 큰 영향을 미쳤다.,1, 마스터 클래스는 봉사기간 내내 연수에 참가한 타지키스탄의사들에게도 큰 영향을 미쳤다.
111,한국,Kyungpook,"대구여성가족재단은 1차 교류사업으로 경북대학교와 사범대학 재학생 양성평등 교육을 위한 상호교류협약을 체결했다. 양 기관은 대학생 및 교직원 양성평등 교육 확대를 위해 노력하고, 지역사회 양성평등 문화 확산을 위해 공동 연구 및 학술세미나를 개최한다.",5,"대구여성가족재단은 1차 교류사업으로 경북대학교와 사범대학 재학생 양성평등교육을 위한 상호교류협약을 체결했다. 양 기관은 대학생 및 교직원 양성평등교육 확대를 위해 노력하고, 지역사회 양성평등 문화 확산을 위해 공동연구 및 학술세미나를 개최한다.",1,"대구여성가족재단은 1차 교류사업으로 경북대학교와 사범대학 재학생 양성평등교육을 위한 상호교류협약을 체결했다. 양 기관은 대학생 및 교직원 양성평등교육 확대를 위해 노력하고, 지역사회 양성평등 문화 확산을 위해 공동연구 및 학술세미나를 개최한다."
97,한국,Kyungpook,"대구여성가족재단은 1차 교류사업으로 경북대학교와 사범대학 재학생 양성평등 교육을 위한 상호교류협약을 체결했다. 양 기관은 대학생 및 교직원 양성평등 교육 확대를 위해 노력하고, 지역사회 양성평등 문화 확산을 위해 공동 연구 및 학술세미나를 개최한다.",5,"대구여성가족재단은 1차 교류사업으로 경북대학교와 사범대학 재학생 양성평등교육을 위한 상호교류협약을 체결했다. 양 기관은 대학생 및 교직원 양성평등교육 확대를 위해 노력하고, 지역사회 양성평등 문화 확산을 위해 공동연구 및 학술세미나를 개최한다.",1,"대구여성가족재단은 1차 교류사업으로 경북대학교와 사범대학 재학생 양성평등교육을 위한 상호교류협약을 체결했다. 양 기관은 대학생 및 교직원 양성평등교육 확대를 위해 노력하고, 지역사회 양성평등 문화 확산을 위해 공동연구 및 학술세미나를 개최한다."
32,한국,Kangwon,녹색제품 구매를 통한 지속적인 환경 보호와 오염 발생 최소화 노력,2,녹색제품 구매를 통한 지속적인 환경보호와 오염 발생 최소화 노력,1,녹색제품 구매를 통한 지속적인 환경보호와 오염 발생 최소화 노력
42,한국,Kangwon,"우울, 불안 해소 및 대인관계 향상 등 학생들의 건강한 대학생활을 위한 심리 상담 운영",3,"우울, 불안 해소 및 대인관계 향상 등 학생들의 건강한 대학생활을 위한 심리상담 운영",1,"우울, 불안 해소 및 대인관계 향상 등 학생들의 건강한 대학생활을 위한 심리상담 운영"
7,한국,Seoul,"지역사회에 교육 프로그램과 교육 자원 제공
∙중앙도서관, 평생교육원, 규장각, 인권센터를 중심으로 지역사회 구성원에게 교육 프로그램을 제공합니다.
∙SNUON 공개 강좌 및 세계적인 대규모 온라인 공개수업 플랫폼 에덱스(edX)에 서울대학교 강좌를 개설하여 운영하고 있습니다.
∙K-MOOC (Korea-Massive Open Online Course)에 45개 강좌를 운영하여 대중들에게 교육자원 접근성을 높이고 있습니다.",4,"지역사회에 교육 프로그램과 교육자원 제공중앙도서관, 평생교육원, 규장각, 인권센터를 중심으로 지역사회 구성원에게 교육 프로그램을 제공합니다. SNUON 공개강좌 및 세계적인 대규모 온라인 공개수업 플랫폼에 덱스edX에 서울대학교 강좌를 개설하여 운영하고 있습니다. KMOOCKoreaMassiveOpenO nlineCourse에 45개 강좌를 운영하여 대중들에게 교육자원 접근성을 높이고 있습니다.",1,"지역사회에 교육 프로그램과 교육자원 제공중앙도서관, 평생교육원, 규장각, 인권센터를 중심으로 지역사회 구성원에게 교육 프로그램을 제공합니다. SNUON 공개강좌 및 세계적인 대규모 온라인 공개수업 플랫폼에 덱스edX에 서울대학교 강좌를 개설하여 운영하고 있습니다. KMOOCKoreaMassiveOpenO nlineCourse에 45개 강좌를 운영하여 대중들에게 교육자원 접근성을 높이고 있습니다."
54,한국,Kangwon,"지역주민 대상 수영, 수상구조, 스노쿨링 등 해양스포츠 종목 순환 체험",3,"지역주민 대상 수영, 수상구조, 스노쿨링 등 해양스포츠 종목 순환체험",1,"지역주민 대상 수영, 수상구조, 스노쿨링 등 해양스포츠 종목 순환체험"
36,한국,Kangwon,농가 일손 돕기 및 농업생명과학대학 학생들의 교육 현장 농가 일손 돕기 및 농업생명과학대학 학생들의 교육 현장 농가 일손 돕기 및 농업생명과학대학 학생들의 교육 현장 경험 습득,2,농가 일손돕기 및 농업생명과학대학 학생들의 교육 현장 농가 일손돕기 및 농업생명과학대학 학생들의 교육현장 농가 일손돕기 및 농업생명과학대학 학생들의 교육현장 경험 습득,1,농가 일손돕기 및 농업생명과학대학 학생들의 교육 현장 농가 일손돕기 및 농업생명과학대학 학생들의 교육현장 농가 일손돕기 및 농업생명과학대학 학생들의 교육현장 경험 습득
53,한국,Kangwon,"지역주민 대상 실내체육관, 수영장, 피트니스실 등 개방",3,"지역주민 대상 실내체육관, 수영장, 피트니스실 등 개방",1,"지역주민 대상 실내체육관, 수영장, 피트니스실 등 개방"
90,한국,Kyungpook,"경북대학교 현장농기계개발연구센터가 군위군 농업기술원 주관으로 농업에 자원을 순차적으로 기부한다고 밝혔다. 경북대학교도 2016년 2월 농림축산식품부가 주최한 '현장농기계개발연구센터' 공모에 선정되어 밭농기계 실용화 기술 개발 및 육성을 위한 연구개발사업을 추진하고 있습니다. 경상북도, 군위군, 경북대학교, 산업계의 협력을 통해 우수한 현장기반 전문가를 양성합니다. 경북대학교병원 재인증 획득
농촌진흥청 주관 농촌진흥 사회공헌
농림축산식품부와 국민운동
농촌사랑, 농촌사회공헌 선도적 역할 인정
도시와 농촌 교류를 통한 활동.
대구경북국제개발협력센터
국내외를 지원하는 글로벌 NGO World Agri-Vision 출범
지속가능한 농업과 농촌, 경북 와성홀
국립대학교. World Agricultural Vision의 목표는
빈곤을 효과적으로 지원하기 위한 다양한 이해관계자와의 파트너십
개발 도상국의 완화 및 농업 및 농촌 개발.
에 의한 협동조합 결성
대구경북국제
지원하는 개발협력센터
민간 부문의 참여 능력
국제개발협력과
지속 가능한 발전에 기여하고
개발 도상국의 빈곤 완화.",2,"경북대학교 현장농기계 개발연구센터가 군위군 농업기술원 주관으로 농업에 자원을 순차적으로 기부한다고 밝혔다. 경북대학교도 2016년 2월 농림축산식품부가 주최한 현장 농기계 개발연구센터 공모에 선정되어 밭농기계 실용화 기술개발 및 육성을 위한 연구개발사업을 추진하고 있습니다. 경상북도, 군위군, 경북대학교, 산업계의 협력을 통해 우수한 현장기반 전문가를 양성합니다. 경북대학교병원 재인증 획득 농촌진흥청 주관 농촌진흥사회공헌 농림축산식품 부와 국민운동 농촌사랑, 농촌사회공헌선도적 역할인 정도시와 농촌교류를 통한 활동.대구경북 국제개발협력센터 국내외를 지원하는 글로벌 NGOWorldAgriVis ion 출범 지속가능한 농업과 농촌, 경북와 성홀 국립대학교.WorldAgriculturalVis ion의 목표는 빈곤을 효과적으로 지원하기 위한 다양한 이해관계자와의 파트너십 개발도상국의 완화 및 농업 및 농촌개발.에 의한 협동조합 결성 대구경북 국제지원하는 개발협력센 터 민간부문의 참여 능력 국제개발협력과 지속가능한 발전에 기여하고 개발도상국의 빈곤 완화.",1, ion의 목표는 빈곤을 효과적으로 지원하기 위한 다양한 이해관계자와의 파트너십 개발도상국의 완화 및 농업 및 농촌개발
104,한국,Kyungpook,"경북대학교 현장농기계개발연구센터가 군위군 농업기술원 주관으로 농업에 자원을 순차적으로 기부한다고 밝혔다. 경북대학교도 2016년 2월 농림축산식품부가 주최한 '현장농기계개발연구센터' 공모에 선정되어 밭농기계 실용화 기술 개발 및 육성을 위한 연구개발사업을 추진하고 있습니다. 경상북도, 군위군, 경북대학교, 산업계의 협력을 통해 우수한 현장기반 전문가를 양성합니다. 경북대학교병원 재인증 획득
농촌진흥청 주관 농촌진흥 사회공헌
농림축산식품부와 국민운동
농촌사랑, 농촌사회공헌 선도적 역할 인정
도시와 농촌 교류를 통한 활동.
대구경북국제개발협력센터
국내외를 지원하는 글로벌 NGO World Agri-Vision 출범
지속가능한 농업과 농촌, 경북 와성홀
국립대학교. World Agricultural Vision의 목표는
빈곤을 효과적으로 지원하기 위한 다양한 이해관계자와의 파트너십
개발 도상국의 완화 및 농업 및 농촌 개발.
에 의한 협동조합 결성
대구경북국제
지원하는 개발협력센터
민간 부문의 참여 능력
국제개발협력과
지속 가능한 발전에 기여하고
개발 도상국의 빈곤 완화.",2,"경북대학교 현장농기계 개발연구센터가 군위군 농업기술원 주관으로 농업에 자원을 순차적으로 기부한다고 밝혔다. 경북대학교도 2016년 2월 농림축산식품부가 주최한 현장 농기계 개발연구센터 공모에 선정되어 밭농기계 실용화 기술개발 및 육성을 위한 연구개발사업을 추진하고 있습니다. 경상북도, 군위군, 경북대학교, 산업계의 협력을 통해 우수한 현장기반 전문가를 양성합니다. 경북대학교병원 재인증 획득 농촌진흥청 주관 농촌진흥사회공헌 농림축산식품 부와 국민운동 농촌사랑, 농촌사회공헌선도적 역할인 정도시와 농촌교류를 통한 활동.대구경북 국제개발협력센터 국내외를 지원하는 글로벌 NGOWorldAgriVis ion 출범 지속가능한 농업과 농촌, 경북와 성홀 국립대학교.WorldAgriculturalVis ion의 목표는 빈곤을 효과적으로 지원하기 위한 다양한 이해관계자와의 파트너십 개발도상국의 완화 및 농업 및 농촌개발.에 의한 협동조합 결성 대구경북 국제지원하는 개발협력센 터 민간부문의 참여 능력 국제개발협력과 지속가능한 발전에 기여하고 개발도상국의 빈곤 완화.",1, ion의 목표는 빈곤을 효과적으로 지원하기 위한 다양한 이해관계자와의 파트너십 개발도상국의 완화 및 농업 및 농촌개발
4,한국,Seoul,"세계 보건기관과의 협력 서울대학교 병원 공공보건 의료사업단은 세계보건기구
(WHO) 감염병 관리부서와 양해각서(MOU)를 체결하
고 자문과 협력을 하고 있습니다. 서울대학교는 WHO와
협력 하에 각국 의료보험제도를 확대하기 위해 기술적
으로 지원하고 컨설팅하고 있습니다.",3,세계보건기관과의 협력서울대학교병원 공공보건의료사업단은 세계보건기구 WHO 감염병 관리부서와 양해각서 MOU를 체결하고 자문과 협력을 하고 있습니다. 서울대학교는 WHO와 협력 하에 각국 의료보험제도를 확대하기 위해 기술적으로 지원하고 컨설팅하고 있습니다.,1,세계보건기관과의 협력서울대학교병원 공공보건의료사업단은 세계보건기구 WHO 감염병 관리부서와 양해각서 MOU를 체결하고 자문과 협력을 하고 있습니다. 서울대학교는 WHO와 협력 하에 각국 의료보험제도를 확대하기 위해 기술적으로 지원하고 컨설팅하고 있습니다.
101,한국,Kyungpook,"경북대학교 창업지원단은 공개채용을 통해 유망한 5개 스타트업을 선발해 홍콩 아시아월드엑스포에서 열린 2019 글로벌소스 스타트업 런치패드 참가를 지원했다. 5개 기업은 아시아, 미국, 유럽 바이어들과 69차례의 비즈니스 미팅을 통해 138만 달러 규모의 수출 및 투자 컨설팅을 달성했다",1,"경북대학교 창업지원단은 공개채용을 통해 유망한 5개 스타트업을 선발해 홍콩 아시아 월드 엑스포에서 열린 2019 글로벌 소스 스타트업 런치패드 참가를 지원했다.5개 기업은 아시아, 미국, 유럽 바이어들과 69차례의 비즈니스 미팅을 통해 138만 달러 규모의 수출 및 투자컨설팅을 달성했다",1," 기업은 아시아, 미국, 유럽 바이어들과 69차례의 비즈니스 미팅을 통해 138만 달러 규모의 수출 및 투자컨설팅을 달성했다"
87,한국,Kyungpook,"경북대학교 창업지원단은 공개채용을 통해 유망한 5개 스타트업을 선발해 홍콩 아시아월드엑스포에서 열린 2019 글로벌소스 스타트업 런치패드 참가를 지원했다. 5개 기업은 아시아, 미국, 유럽 바이어들과 69차례의 비즈니스 미팅을 통해 138만 달러 규모의 수출 및 투자 컨설팅을 달성했다",1,"경북대학교 창업지원단은 공개채용을 통해 유망한 5개 스타트업을 선발해 홍콩 아시아 월드 엑스포에서 열린 2019 글로벌 소스 스타트업 런치패드 참가를 지원했다.5개 기업은 아시아, 미국, 유럽 바이어들과 69차례의 비즈니스 미팅을 통해 138만 달러 규모의 수출 및 투자컨설팅을 달성했다",1," 기업은 아시아, 미국, 유럽 바이어들과 69차례의 비즈니스 미팅을 통해 138만 달러 규모의 수출 및 투자컨설팅을 달성했다"
