,국가,대학교명,번역,분류,번역_전처리,5분류,요약
9,한국,Seoul,"지역사회 교육 봉사
∙ 서울대학교 글로벌사회공헌단을 중심으로 지역사회와
국제사회에 도움이 되는 사회공헌 활동과 봉사활동을
수행하며, 사회공헌형 교과는 캠퍼스 중심 교육을 탈피
하여 취약계층을 위한 활동에 전공이론을 접목하여 사
회공헌을 실천하고 있습니다. 
∙ ‘골뱅이 어울림 학교’는 지역사회 발달장애아동을 대상
으로 요리, 음악, 체육 등 주말학교 프로그램 운영으로
사회적 약자를 이해하고 어울림을 추구합니다. 
∙ ‘프로네시스 나눔 실천단’은 교육소외지역의 고등학생들
에게 양질의 교육 프로그램을 무상으로 제공합니다. 
∙ ‘샤눔 다문화 공헌단‘은 다양한 국적과 다문화적 배경
을 가진 학생들이 다문화 관련 지역사회 나눔을 실천
합니다.",4,"지역사회교육봉사 서울대학교 글로벌사회공헌단을 중심으로 지역사회와 국제사회에 도움이 되는 사회공헌활동과 봉사활동을 수행하며, 사회공헌형 교과는 캠퍼스 중심 교육을 탈피하여 취약계층을 위한 활동에 전공이론을 접목하여 사회공헌을 실천하고 있습니다. 골뱅이어울림학교는 지역사회 발달장애아동을 대상으로 요리, 음악, 체육 등 주말학교 프로그램 운영으로 사회적 약자를 이해하고 어울림을 추구합니다. 프로네시스나눔 실천단은 교육 소외지역의 고등학생 들에게 양질의 교육 프로그램을 무상으로 제공합니다.샤눔다문화 공헌단은 다양한 국적과 다문화적 배경을 가진 학생들이 다문화 관련 지역사회 나눔을 실천합니다.",1, 공헌단은 다양한 국적과 다문화적 배경을 가진 학생들이 다문화 관련 지역사회 나눔을 실천합니다.
63,한국,Kangwon,지역의 우수한 영재를 발굴하여 전문 교육 제공을 통한 진로탐색 지원,4,지역의 우수한 영재를 발굴하여 전문교육 제공을 통한 진로탐색 지원,1,지역의 우수한 영재를 발굴하여 전문교육 제공을 통한 진로탐색 지원
45,한국,Kangwon,흡연과 성매개감염에 대한 전문 의료진의 교육 제공,3,흡연과 성매개 감염에 대한 전문 의료진의 교육 제공,1,흡연과 성매개 감염에 대한 전문 의료진의 교육 제공
44,한국,Kangwon,성범죄 관련 예방방법 안내를 통한 교내 성범죄 발생 감소 노력,3,성범죄 관련 예방 방법 안내를 통한 교내 성범죄 발생 감소 노력,1,성범죄 관련 예방 방법 안내를 통한 교내 성범죄 발생 감소 노력
93,한국,Kyungpook,"군위군과 경북대학교 칠곡병원은 2017년 국민건강증진을 위한 협약을 체결하고 지역주민 100여명이 가정의학과, 방사선과, 재활의학과, 검사의학과 등 의료서비스를 받았다. 경북대학교 칠곡병원 직원들도 군위군을 방문해 지역 주민들에게 무료 의료 서비스를 제공했다. 군위군민에게 양질의 보건의료 서비스를 제공하기 위해 협력적 진료 분위기에서 지식과 자원, 경험을 적극적으로 공유하고 있습니다.",3,"군위군과 경북대학교 칠곡병원은 2017년 국민건강증진을 위한 협약을 체결하고 지역주민 100여명이 가정의학과, 방사선과, 재활의학과, 검사의학과 등 의료서비스를 받았다. 경북대학교 칠곡병원 직원들도 군위군을 방문해 지역주민들에게 무료 의료서비스를 제공했다.군위군민에게 양질의 보건의료서비스를 제공하기 위해 협력적 진료 분위기에서 지식과 자원, 경험을 적극적으로 공유하고 있습니다.",1," 양질의 보건의료서비스를 제공하기 위해 협력적 진료 분위기에서 지식과 자원, 경험을 적극적으로 공유하고 있습니다."
107,한국,Kyungpook,"군위군과 경북대학교 칠곡병원은 2017년 국민건강증진을 위한 협약을 체결하고 지역주민 100여명이 가정의학과, 방사선과, 재활의학과, 검사의학과 등 의료서비스를 받았다. 경북대학교 칠곡병원 직원들도 군위군을 방문해 지역 주민들에게 무료 의료 서비스를 제공했다. 군위군민에게 양질의 보건의료 서비스를 제공하기 위해 협력적 진료 분위기에서 지식과 자원, 경험을 적극적으로 공유하고 있습니다.",3,"군위군과 경북대학교 칠곡병원은 2017년 국민건강증진을 위한 협약을 체결하고 지역주민 100여명이 가정의학과, 방사선과, 재활의학과, 검사의학과 등 의료서비스를 받았다. 경북대학교 칠곡병원 직원들도 군위군을 방문해 지역주민들에게 무료 의료서비스를 제공했다.군위군민에게 양질의 보건의료서비스를 제공하기 위해 협력적 진료 분위기에서 지식과 자원, 경험을 적극적으로 공유하고 있습니다.",1," 양질의 보건의료서비스를 제공하기 위해 협력적 진료 분위기에서 지식과 자원, 경험을 적극적으로 공유하고 있습니다."
57,한국,Kangwon,"지역의 경력단절 및 미취업자, 청년 대상 강사 양성과정 운영",4,"지역의 경력단절 및 미취업자, 청년대상 강사 양성과정 운영",1,"지역의 경력단절 및 미취업자, 청년대상 강사 양성과정 운영"
23,한국,Kangwon,"기초생활수급자, 차상위 계층 학생 및 장애학생 주거문제 해소를 위한 생활관 우선 선발",1,"기초생활수급자, 차상위계층 학생 및 장애학생 주거문제 해소를 위한 생활관 우선 선발",1,"기초생활수급자, 차상위계층 학생 및 장애학생 주거문제 해소를 위한 생활관 우선 선발"
105,한국,Kyungpook,"치과의사를 지정하여 어린이들의 치과검진을 실시하고, 치과대학 동문회는 어린이들에게 정기적인 구강관리 교육과 치과사업 활성화를 위해 치아건강증진을 위한 기금을 조성한다. 케어.",3,"치과의사를 지정하여 어린이들의 치과 검진을 실시하고, 치과대학 동문회는 어린이들에게 정기적인 구강관리 교육과 치과사업 활성화를 위해 치아 건강증진을 위한 기금을 조성한다.케어.",1,"치과의사를 지정하여 어린이들의 치과 검진을 실시하고, 치과대학 동문회는 어린이들에게 정기적인 구강관리 교육과 치과사업 활성화를 위해 치아 건강증진을 위한 기금을 조성한다"
91,한국,Kyungpook,"치과의사를 지정하여 어린이들의 치과검진을 실시하고, 치과대학 동문회는 어린이들에게 정기적인 구강관리 교육과 치과사업 활성화를 위해 치아건강증진을 위한 기금을 조성한다. 케어.",3,"치과의사를 지정하여 어린이들의 치과 검진을 실시하고, 치과대학 동문회는 어린이들에게 정기적인 구강관리 교육과 치과사업 활성화를 위해 치아 건강증진을 위한 기금을 조성한다.케어.",1,"치과의사를 지정하여 어린이들의 치과 검진을 실시하고, 치과대학 동문회는 어린이들에게 정기적인 구강관리 교육과 치과사업 활성화를 위해 치아 건강증진을 위한 기금을 조성한다"
50,한국,Kangwon,건물 및 휴게공간에 금연 구역 표지판 부착,3,건물 및 휴게공간에 금연구역 표지판 부착,1,건물 및 휴게공간에 금연구역 표지판 부착
69,한국,Kangwon,"여성교원 대표성과 위상도, 양성평등 구현노력을 평가 받아 우수대학 선정",5,"여성교원 대표성과 위상도, 양성평등 구현 노력을 평가받아 우수 대학 선정",1,"여성교원 대표성과 위상도, 양성평등 구현 노력을 평가받아 우수 대학 선정"
110,한국,Kyungpook,"경북대학교 다양성위원회는 대학의 다양성을 보호·증진하고 사회 화합과 발전에 기여하는 대학 문화를 조성하기 위해 설립된 대통령 자문기구입니다. 총 15명의 교수, 학생, 직원, 외부 전문가로 구성되어 있습니다. 경북대학교 다양성위원회는 양성평등 증진, 다양성 가치 확산을 위한 교육 프로그램 개발, 관련 정책 자문 및 제안 등 다양성 보호에 관한 의견을 수렴하는 역할을 합니다.",5,"경북대학교 다양성위원회는 대학의 다양성을 보호증진하고 사회화합과 발전에 기여하는 대학문화를 조성하기 위해 설립된 대통령 자문기구입니다. 총 15명의 교수, 학생, 직원, 외부 전문가로 구성되어 있습니다. 경북대학교 다양성위원회는 양성평등 증진, 다양성가치 확산을 위한 교육 프로그램 개발, 관련 정책자문 및 제안 등 다양성 보호에 관한 의견을 수렴하는 역할을 합니다.",1,"경북대학교 다양성위원회는 대학의 다양성을 보호증진하고 사회화합과 발전에 기여하는 대학문화를 조성하기 위해 설립된 대통령 자문기구입니다. 총 15명의 교수, 학생, 직원, 외부 전문가로 구성되어 있습니다. 경북대학교 다양성위원회는 양성평등 증진, 다양성가치 확산을 위한 교육 프로그램 개발, 관련 정책자문 및 제안 등 다양성 보호에 관한 의견을 수렴하는 역할을 합니다."
96,한국,Kyungpook,"경북대학교 다양성위원회는 대학의 다양성을 보호·증진하고 사회 화합과 발전에 기여하는 대학 문화를 조성하기 위해 설립된 대통령 자문기구입니다. 총 15명의 교수, 학생, 직원, 외부 전문가로 구성되어 있습니다. 경북대학교 다양성위원회는 양성평등 증진, 다양성 가치 확산을 위한 교육 프로그램 개발, 관련 정책 자문 및 제안 등 다양성 보호에 관한 의견을 수렴하는 역할을 합니다.",5,"경북대학교 다양성위원회는 대학의 다양성을 보호증진하고 사회화합과 발전에 기여하는 대학문화를 조성하기 위해 설립된 대통령 자문기구입니다. 총 15명의 교수, 학생, 직원, 외부 전문가로 구성되어 있습니다. 경북대학교 다양성위원회는 양성평등 증진, 다양성가치 확산을 위한 교육 프로그램 개발, 관련 정책자문 및 제안 등 다양성 보호에 관한 의견을 수렴하는 역할을 합니다.",1,"경북대학교 다양성위원회는 대학의 다양성을 보호증진하고 사회화합과 발전에 기여하는 대학문화를 조성하기 위해 설립된 대통령 자문기구입니다. 총 15명의 교수, 학생, 직원, 외부 전문가로 구성되어 있습니다. 경북대학교 다양성위원회는 양성평등 증진, 다양성가치 확산을 위한 교육 프로그램 개발, 관련 정책자문 및 제안 등 다양성 보호에 관한 의견을 수렴하는 역할을 합니다."
51,한국,Kangwon,자살예방 메시지 전달 및 생명존중 의식 고취,3,자살예방 메시지 전달 및 생명존중의식 고취,1,자살예방 메시지 전달 및 생명존중의식 고취
2,한국,Seoul,"지속가능한 농업 지식/기술 제공 ∙농업생명과학대학에서는 지속가능농업 분야 관련 정규 교과목을 개설하고 연간 546명의 졸업생을 배출하고 있으며, 지속가능 분야의 전문가 초청 강연을 진행하고 있습니다. 식물병원에서는 ‘나무의사 양성과정’, ‘수목치료사 양성과정’ 프로그램을 통해 수목의 보호, 관리에 대한 교육과 연구, 병해충 진단 컨설팅을 하고 있으며, 농산업･식품 생산자들에게는 지속가능한 농업 지식을 제공하고 있습니다.",2,"지속가능한 농업지식기술 제공농업생명과학대학에서는 지속가능농업 분야 관련 정규교과목을 개설하고 연간 546명의 졸업생을 배출하고 있으며, 지속가능 분야의 전문가 초청 강연을 진행하고 있습니다. 식물병원에서는 나무의 사양성과정, 수목치료 사 양성과 정 프로그램을 통해 수목의 보호, 관리에 대한 교육과 연구, 병해충 진단 컨설팅을 하고 있으며, 농산업 식품생산자들에게는 지속가능한 농업지식을 제공하고 있습니다.",1,"지속가능한 농업지식기술 제공농업생명과학대학에서는 지속가능농업 분야 관련 정규교과목을 개설하고 연간 546명의 졸업생을 배출하고 있으며, 지속가능 분야의 전문가 초청 강연을 진행하고 있습니다. 식물병원에서는 나무의 사양성과정, 수목치료 사 양성과 정 프로그램을 통해 수목의 보호, 관리에 대한 교육과 연구, 병해충 진단 컨설팅을 하고 있으며, 농산업 식품생산자들에게는 지속가능한 농업지식을 제공하고 있습니다."
49,한국,Kangwon,간접 흡연 피해 방지 및 캠퍼스 이미지 제고,3,간접흡연 피해 방지 및 캠퍼스 이미지 제고,1,간접흡연 피해 방지 및 캠퍼스 이미지 제고
61,한국,Kangwon,지역주민을 대상으로 공개강좌 지속 운영,4,지역주민을 대상으로 공개강좌 지속운영,1,지역주민을 대상으로 공개강좌 지속운영
56,한국,Kangwon,남북교류협력 사업추진 전문가 육성을 위한 아카데미 운영,4,남북교류협력사업 추진 전문가 육성을 위한 아카데미 운영,1,남북교류협력사업 추진 전문가 육성을 위한 아카데미 운영
20,한국,Kangwon,"저소득층 학생 대상 전공 관련 도서, 자격증 수험서 등 도서비용 지원",1,"저소득층 학생 대상 전 공 관련 도서, 자격증 수험서 등 도 서 비용 지원",1,"저소득층 학생 대상 전 공 관련 도서, 자격증 수험서 등 도 서 비용 지원"
6,한국,Seoul,"학생과 교직원의 건강 관리 
∙서울대학교에서는 보건진료소를 운영하여 학생과 교직원의 신체적･정신적 건강 증진을 위해 노력하고 있습니다.
∙대학생활문화원은 심리적 도움이 필요한 학생들을 위한 집단 및 개인 상담, 24시간 심리상담 전화인 SNU call 운영, ‘생명 지킴이 교육’ 프로그램을 운영합니다.
∙보건진료소는 금연 프로그램 운영, 금연상담과 진료를 하고 금연 보조제와 검사 일체를 무상으로 제공하고 있습니다",3,"학생과 교직원의 건강관리 서울대학교에서는 보건진료소를 운영하여 학생과 교직원의 신체적 정신적 건강증진을 위해 노력하고 있습니다. 대학생활문화원은 심리적 도움이 필요한 학생들을 위한 집단 및 개인상담, 24시간 심리상담 전화인 SNUcall 운영, 생명지킴이 교육 프로그램을 운영합니다. 보건진료소는 금연 프로그램 운영, 금연상담과 진료를 하고 금연보조제와 검사 일체를 무상으로 제공하고 있습니다",1,"학생과 교직원의 건강관리 서울대학교에서는 보건진료소를 운영하여 학생과 교직원의 신체적 정신적 건강증진을 위해 노력하고 있습니다. 대학생활문화원은 심리적 도움이 필요한 학생들을 위한 집단 및 개인상담, 24시간 심리상담 전화인 SNUcall 운영, 생명지킴이 교육 프로그램을 운영합니다. 보건진료소는 금연 프로그램 운영, 금연상담과 진료를 하고 금연보조제와 검사 일체를 무상으로 제공하고 있습니다"
33,한국,Kangwon,"지역의 중소기업, 여성기업, 장애인기업 등의 안정적 성장 도모를 위한 제품 우선구매",2,"지역의 중소기업, 여성기업, 장애인기업 등의 안정적 성장도모를 위한 제품 우선구매",1,"지역의 중소기업, 여성기업, 장애인기업 등의 안정적 성장도모를 위한 제품 우선구매"
55,한국,Kangwon,자료분석 및 해석 강의를 진행하는 아카데미 운영,4,자료 분석 및 해석강의를 진행하는 아카데미 운영,1,자료 분석 및 해석강의를 진행하는 아카데미 운영
29,한국,Kangwon,재직자 대상 입학 전형으로 농업 관련 학습 기회 제공,2,재직자 대상 입학전형으로 농업 관련 학습기회 제공,1,재직자 대상 입학전형으로 농업 관련 학습기회 제공
79,한국,Kangwon,현직 여성 멘토를 초청한 토크 콘서트를 개최하여 여대생의 취업 역량 강화,5,현직 여성 멘토를 초청한 토크 콘서트를 개최하여 여대생의 취업역량 강화,1,현직 여성 멘토를 초청한 토크 콘서트를 개최하여 여대생의 취업역량 강화
68,한국,Kangwon,도서관 회원제에 등록한 지역주민 대상 도서관 교육자료 개방,4,도서관 회원제에 등록한 지역주민 대상 도서관 교육자료 개방,1,도서관 회원제에 등록한 지역주민 대상 도서관 교육자료 개방
80,한국,Kangwon,교직원 및 학생 자녀 대상 어린이집 운영을 통한 구성원 복지 증진,5,교직원 및 학생 자녀 대상 어린이집 운영을 통한 구성원 복지증진,1,교직원 및 학생 자녀 대상 어린이집 운영을 통한 구성원 복지증진
40,한국,Kangwon,자살행동에 대한 이해와 자기돌봄 교육을 통한 학생들의 건강한 대학생활 지원,3,자살행동에 대한 이해와 자기 돌봄 교육을 통한 학생들의 건강한 대학생활지원,1,자살행동에 대한 이해와 자기 돌봄 교육을 통한 학생들의 건강한 대학생활지원
3,한국,Seoul,"지역사회 건강과 복지 향상에 기여
∙ 지역사회 공공 보건활동, 의과대학의 지역사회학 실습,
지역사회 건강조사 사업, 정신건강 지원 사업, 지역 보
건기관 운영 및 자문 참여, 자원봉사 프로그램 등을
진행하여 지역사회의 건강과 복지 향상에 기여하고 있
습니다. ∙ 장애아동 체육교실 ‘SNU FUN & KICK’, 유아와 아동
을 위한 ‘운동발달교실’, 주민들을 위한 ‘5060 골든웰
빙 운동 프로그램’ 등 지역사회 주민들을 대상으로 한
스포츠 프로그램을 개설하고 스포츠 시설을 개방합니다.",3,"지역사회 건강과 복지 향상에 기여 지역사회 공공보건활동, 의과대학의 지역사회학 실습, 지역사회 건강조사사업, 정신건강지원사업, 지역보건기관운영 및 자문참여, 자원봉사 프로그램 등을 진행하여 지역사회의 건강과 복지 향상에 기여하고 있습니다. 장애아동체육교실 SNUFUNKICK, 유아와 아동을 위한 운동발달 교실, 주민들을 위한 5060골든 웰빙운동 프로그램 등 지역사회 주민들을 대상으로 한 스포츠 프로그램을 개설하고 스포츠시설을 개방합니 다.",1,"지역사회 건강과 복지 향상에 기여 지역사회 공공보건활동, 의과대학의 지역사회학 실습, 지역사회 건강조사사업, 정신건강지원사업, 지역보건기관운영 및 자문참여, 자원봉사 프로그램 등을 진행하여 지역사회의 건강과 복지 향상에 기여하고 있습니다. 장애아동체육교실 SNUFUNKICK, 유아와 아동을 위한 운동발달 교실, 주민들을 위한 5060골든 웰빙운동 프로그램 등 지역사회 주민들을 대상으로 한 스포츠 프로그램을 개설하고 스포츠시설을 개방합니 다."
5,한국,Seoul,"개발도상국 의료 지원 ∙서울대학교 의과대학은 ‘이종욱-서울 프로젝트’를 통해 라오스에 보건의료 개혁을 지원하는 등, 열악한 의료기술과 환경에 놓여있는 개발도상국에 의료 지원을 하고 있습니다. ∙서울대학교 치과대학은 ‘미얀마 치과대학 역량강화와 우수인재 양성을 통한 구강 보건 향상’ 사업을 진행했습니다.",3,"개발도상국 의료지원 서울대학교 의과대학은 이종욱 서울 프로젝트를 통해 라오스에 보건의료 개혁을 지원하는 등, 열악한 의료기술과 환경에 놓여 있는 개발도상국에 의료지원을 하고 있습니다. 서울대학교 치과대학은 미얀마 치과대학 역량 강화와 우수 인재 양성을 통한 구강보건 향상 사업을 진행했습니다.",1,"개발도상국 의료지원 서울대학교 의과대학은 이종욱 서울 프로젝트를 통해 라오스에 보건의료 개혁을 지원하는 등, 열악한 의료기술과 환경에 놓여 있는 개발도상국에 의료지원을 하고 있습니다. 서울대학교 치과대학은 미얀마 치과대학 역량 강화와 우수 인재 양성을 통한 구강보건 향상 사업을 진행했습니다."
43,한국,Kangwon,학내 인권 및 성평등 의식 향상을 목적으로 하는 대학생 서포터즈 활동,3,학내 인권 및 성평등의식 향상을 목적으로 하는 대학생 서포터즈 활동,1,학내 인권 및 성평등의식 향상을 목적으로 하는 대학생 서포터즈 활동
58,한국,Kangwon,"지역주민 대상 문학, 철학, 사학, 인문학 프로그램 운영",4,"지역주민 대상 문학, 철학, 사학, 인문학 프로그램 운영",1,"지역주민 대상 문학, 철학, 사학, 인문학 프로그램 운영"
95,한국,Kyungpook,경북대학교 지구시스템과학부 천문대기학과는 대학생은 물론 일반인을 대상으로 관측 및 강의를 조직하여 천문학을 재미있고 유익한 천문학으로 만들기 위해 노력하고 있습니다. 천문대기학과 지구시스템과학부에서는 경북대학교 과학관에서 매년 상반기와 하반기에 일반 대중을 대상으로 봄여름 밤하늘 이야기를 8회 개최하고 있습니다. 공개 강연은 공개 관찰과 함께 개최됩니다.,4,경북대학교 지구시스템과 학부 천문대기학과는 대학생은 물론 일반인을 대상으로 관측 및 강의를 조직하여 천문학을 재미있고 유익한 천문학으로 만들기 위해 노력하고 있습니다. 천문대기학과지구 시스템과 학부에서는 경북대학교 과학관에서 매년 상반기와 하반기에 일반 대중을 대상으로 봄여름 밤하늘이야기를 8회 개최하고 있습니다. 공개 강연은 공개 관찰과 함께 개최됩니다.,1,경북대학교 지구시스템과 학부 천문대기학과는 대학생은 물론 일반인을 대상으로 관측 및 강의를 조직하여 천문학을 재미있고 유익한 천문학으로 만들기 위해 노력하고 있습니다. 천문대기학과지구 시스템과 학부에서는 경북대학교 과학관에서 매년 상반기와 하반기에 일반 대중을 대상으로 봄여름 밤하늘이야기를 8회 개최하고 있습니다. 공개 강연은 공개 관찰과 함께 개최됩니다.
109,한국,Kyungpook,경북대학교 지구시스템과학부 천문대기학과는 대학생은 물론 일반인을 대상으로 관측 및 강의를 조직하여 천문학을 재미있고 유익한 천문학으로 만들기 위해 노력하고 있습니다. 천문대기학과 지구시스템과학부에서는 경북대학교 과학관에서 매년 상반기와 하반기에 일반 대중을 대상으로 봄여름 밤하늘 이야기를 8회 개최하고 있습니다. 공개 강연은 공개 관찰과 함께 개최됩니다.,4,경북대학교 지구시스템과 학부 천문대기학과는 대학생은 물론 일반인을 대상으로 관측 및 강의를 조직하여 천문학을 재미있고 유익한 천문학으로 만들기 위해 노력하고 있습니다. 천문대기학과지구 시스템과 학부에서는 경북대학교 과학관에서 매년 상반기와 하반기에 일반 대중을 대상으로 봄여름 밤하늘이야기를 8회 개최하고 있습니다. 공개 강연은 공개 관찰과 함께 개최됩니다.,1,경북대학교 지구시스템과 학부 천문대기학과는 대학생은 물론 일반인을 대상으로 관측 및 강의를 조직하여 천문학을 재미있고 유익한 천문학으로 만들기 위해 노력하고 있습니다. 천문대기학과지구 시스템과 학부에서는 경북대학교 과학관에서 매년 상반기와 하반기에 일반 대중을 대상으로 봄여름 밤하늘이야기를 8회 개최하고 있습니다. 공개 강연은 공개 관찰과 함께 개최됩니다.
82,한국,Kangwon,육아와 학업을 병행하는 여성 석‧박사생 대상 장학금을 지급하여 양성평등교육 기여,5,육아와 학업을 병행하는 여성석 박사 생대상 장학금을 지급하여 양성평등교육기여,1,육아와 학업을 병행하는 여성석 박사 생대상 장학금을 지급하여 양성평등교육기여
77,한국,Kangwon,관련 정책 수립 및 추진실적 점검 등 교내 양성평등 실현을 위한 위원회 운영,5,관련 정책 수립 및 추진실적 점검 등 교내 양성평등 실현을 위한 위원회 운영,1,관련 정책 수립 및 추진실적 점검 등 교내 양성평등 실현을 위한 위원회 운영
59,한국,Kangwon,"중독과 트라우마 회복을 위해 예방과 개입에 필요한 실천 방향 제시, 전문가 양성, 학문적 기틀 마련",4,"중독과 트라우마 회복을 위해 예방과 개입에 필요한 실천방향 제시, 전문가 양성, 학문적 기틀 마련",1,"중독과 트라우마 회복을 위해 예방과 개입에 필요한 실천방향 제시, 전문가 양성, 학문적 기틀 마련"
