,국가,대학교명,번역,분류,번역_전처리,5분류,요약
37,한국,Kangwon,시험기간 학생들의 건강을 위한 저렴한 아침식사 제공,2,시험기간 학생들의 건강을 위한 저렴한 아침식사 제공,1,시험기간 학생들의 건강을 위한 저렴한 아침식사 제공
76,한국,Kangwon,청렴한 근무환경 조성을 위한 공익신고자 보호제도 활성화,5,청렴한 근무환경 조성을 위한 공익신고자 보호제도 활성화,1,청렴한 근무환경 조성을 위한 공익신고자 보호제도 활성화
103,한국,Kyungpook,"경북대학교는 스마트 농업 연구를 육성하기 위해 경북대학교 스마트 농업 혁신 센터를 설립했습니다. 센터는 기아 제로라는 지속 가능한 개발 목표를 위해 일하기 위해 비즈니스 거래 및 계약을 통해 중요한 연결과 협력을 만들어 왔습니다. 이노베이션센터, 대구테크노파크 바이오헬스 MOU 체결
기업 간 협력과 협업을 촉진하는 융합센터
스마트팜 관련 산업. 협력자는 약속을 적용할 것입니다
스마트팜 관련 핵심 원천기술 및 지원
산업화를 통한 기술의 상용화,
학술, 관련 및 정부 네트워킹. 센터도 진출
강력한 비즈니스 계약
두 개의 핵심 조직과 함께
인공지능 연구
연구소와 경상
국립대학교 스마트
농장 연구 센터,
사업을 강화하다
간의 협력
스마트 농업의 다양한 단계.
스마트 R&D 단계부터
확보 단계까지의 농장
원천기술, 이
촉진을 목적으로 하는 협정
기술의 활성화
유통 및 상업화
스마트팜 산업.또 하나의 중요한 합의
센터가 맡았던 사업
국민식품과의 협약
산업을 연결하는 클러스터 지원
식품산업을 발전시킨다. 을 통해
이번 협약으로 두 기관은
인재육성을 위해 함께 노력하겠습니다.
식품 산업의 자원과
클러스터 기술 개발
임차인의 능력을 활용하여
그리고 가능한 한 많은 인프라.",2,"경북대학교는 스마트농업연구를 육성하기 위해 경북대학교 스마트농업혁신센터를 설립했습니다. 센터는 기아제로라는 지속가능한 개발목표를 위해 일하기 위해 비즈니스거래 및 계약을 통해 중요한 연결과 협력을 만들어 왔습니다.이노베이션 센터, 대구테크노파크 바이오헬스 MOU 체결기업 간 협력과 협업을 촉진하는 융합센터 스마트팜 관련 산업. 협력자는 약속을 적용할 것입니다스마트팜 관련 핵심 원천기술 및 지원산업화를 통한 기술의 상용화, 학술, 관련 및 정부 네트워킹. 센터도 진출 강력한 비즈니스 계약 두 개의 핵심 조직과 함께 인공지능 연구연구소와 경상국립대학교 스마트농장연구센터, 사업을 강화하다간의 협력 스마트 농업의 다양한 단계. 스마트 RD 단계부터 확보 단계까지의 농장 원천기술, 이 촉진을 목적으로 하는 협정 기술의 활성화 유통 및 상업화 스마트팜 산업. 또 하나의 중요한 합의센터가 맡았던 사업 국민식품과의 협약산업을 연결하는 클러스터 지원식품 산업을 발전시킨다.을 통해 이번 협약으로 두 기관은 인재육 성을 위해 함께 노력하겠습니다. 식품산업의 자원과 클러스터 기술 개발 임차인의 능력을 활용하여 그리고 가능한 한 많은 인프라.",1, 통해 이번 협약으로 두 기관은 인재육 성을 위해 함께 노력하겠습니다. 식품산업의 자원과 클러스터 기술 개발 임차인의 능력을 활용하여 그리고 가능한 한 많은 인프라.
89,한국,Kyungpook,"경북대학교는 스마트 농업 연구를 육성하기 위해 경북대학교 스마트 농업 혁신 센터를 설립했습니다. 센터는 기아 제로라는 지속 가능한 개발 목표를 위해 일하기 위해 비즈니스 거래 및 계약을 통해 중요한 연결과 협력을 만들어 왔습니다. 이노베이션센터, 대구테크노파크 바이오헬스 MOU 체결
기업 간 협력과 협업을 촉진하는 융합센터
스마트팜 관련 산업. 협력자는 약속을 적용할 것입니다
스마트팜 관련 핵심 원천기술 및 지원
산업화를 통한 기술의 상용화,
학술, 관련 및 정부 네트워킹. 센터도 진출
강력한 비즈니스 계약
두 개의 핵심 조직과 함께
인공지능 연구
연구소와 경상
국립대학교 스마트
농장 연구 센터,
사업을 강화하다
간의 협력
스마트 농업의 다양한 단계.
스마트 R&D 단계부터
확보 단계까지의 농장
원천기술, 이
촉진을 목적으로 하는 협정
기술의 활성화
유통 및 상업화
스마트팜 산업.또 하나의 중요한 합의
센터가 맡았던 사업
국민식품과의 협약
산업을 연결하는 클러스터 지원
식품산업을 발전시킨다. 을 통해
이번 협약으로 두 기관은
인재육성을 위해 함께 노력하겠습니다.
식품 산업의 자원과
클러스터 기술 개발
임차인의 능력을 활용하여
그리고 가능한 한 많은 인프라.",2,"경북대학교는 스마트농업연구를 육성하기 위해 경북대학교 스마트농업혁신센터를 설립했습니다. 센터는 기아제로라는 지속가능한 개발목표를 위해 일하기 위해 비즈니스거래 및 계약을 통해 중요한 연결과 협력을 만들어 왔습니다.이노베이션 센터, 대구테크노파크 바이오헬스 MOU 체결기업 간 협력과 협업을 촉진하는 융합센터 스마트팜 관련 산업. 협력자는 약속을 적용할 것입니다스마트팜 관련 핵심 원천기술 및 지원산업화를 통한 기술의 상용화, 학술, 관련 및 정부 네트워킹. 센터도 진출 강력한 비즈니스 계약 두 개의 핵심 조직과 함께 인공지능 연구연구소와 경상국립대학교 스마트농장연구센터, 사업을 강화하다간의 협력 스마트 농업의 다양한 단계. 스마트 RD 단계부터 확보 단계까지의 농장 원천기술, 이 촉진을 목적으로 하는 협정 기술의 활성화 유통 및 상업화 스마트팜 산업. 또 하나의 중요한 합의센터가 맡았던 사업 국민식품과의 협약산업을 연결하는 클러스터 지원식품 산업을 발전시킨다.을 통해 이번 협약으로 두 기관은 인재육 성을 위해 함께 노력하겠습니다. 식품산업의 자원과 클러스터 기술 개발 임차인의 능력을 활용하여 그리고 가능한 한 많은 인프라.",1, 통해 이번 협약으로 두 기관은 인재육 성을 위해 함께 노력하겠습니다. 식품산업의 자원과 클러스터 기술 개발 임차인의 능력을 활용하여 그리고 가능한 한 많은 인프라.
39,한국,Kangwon,학생들에게 저렴한 아침 식사 제공 후원 캠페인 진행,2,학생들에게 저렴한 아침식사 제공 후원 캠페인 진행,1,학생들에게 저렴한 아침식사 제공 후원 캠페인 진행
60,한국,Kangwon,강원도 내 군 장병 대상 취‧창업 교육 기회 제공,4,강원도 내 군 장병대상 취 창업교육기회 제공,1,강원도 내 군 장병대상 취 창업교육기회 제공
16,한국,Kangwon,강원도 내 군 장병 대상 취‧창업 교육 기회 제공,1,강원도 내 군 장병대상 취 창업교육기회 제공,1,강원도 내 군 장병대상 취 창업교육기회 제공
38,한국,Kangwon,동문 인근 학생회관 개관을 통해 학내 구성원들에게 식사 제공,2,동문 인근 학생회관 개관을 통해 학내 구성원들에게 식사 제공,1,동문 인근 학생회관 개관을 통해 학내 구성원들에게 식사 제공
47,한국,Kangwon,과학적 체력관리 프로그램을 제공하여 지역주민 건강 증진,3,과학적 체력관리 프로그램을 제공하여 지역주민 건강증진,1,과학적 체력관리 프로그램을 제공하여 지역주민 건강증진
24,한국,Kangwon,법률문제 해결의 사각지대에 놓인 사회적 취약계층에게 법률서비스 제공,1,법률문제 해결 의 사각지대에 놓인 사회적 취약계층에게 법률 서비스 제공,1,법률문제 해결 의 사각지대에 놓인 사회적 취약계층에게 법률 서비스 제공
62,한국,Kangwon,"교수 학습자료, 학습콘텐츠 등에 관한 정보를 무료로 지역 주민과 학생들에게 제공",4,"교수학습 자료, 학습 콘텐츠 등에 관한 정보를 무료로 지역주민과 학생들에게 제공",1,"교수학습 자료, 학습 콘텐츠 등에 관한 정보를 무료로 지역주민과 학생들에게 제공"
92,한국,Kyungpook,보건대학원이 대구중구치매구호센터로부터 '치매예방대학'으로 선정됐다. 보건복지부와 경북대학교 보건대학원이 주관하는 대구 8개 치매구호센터 중 첫 번째,3,보건대학원이 대구 중구 치매 구호센터로부터 치매 예방대학으로 선정됐다. 보건복지부와 경북대학교 보건대학원이 주관하는 대구 8개 치매 구호센터 중 첫 번째,1,보건대학원이 대구 중구 치매 구호센터로부터 치매 예방대학으로 선정됐다. 보건복지부와 경북대학교 보건대학원이 주관하는 대구 8개 치매 구호센터 중 첫 번째
106,한국,Kyungpook,보건대학원이 대구중구치매구호센터로부터 '치매예방대학'으로 선정됐다. 보건복지부와 경북대학교 보건대학원이 주관하는 대구 8개 치매구호센터 중 첫 번째,3,보건대학원이 대구 중구 치매 구호센터로부터 치매 예방대학으로 선정됐다. 보건복지부와 경북대학교 보건대학원이 주관하는 대구 8개 치매 구호센터 중 첫 번째,1,보건대학원이 대구 중구 치매 구호센터로부터 치매 예방대학으로 선정됐다. 보건복지부와 경북대학교 보건대학원이 주관하는 대구 8개 치매 구호센터 중 첫 번째
15,한국,Kangwon,대학 구성원 및 지역사회 대상 취‧창업을 위한 대학 공간 제공,1,대학 구성원 및 지역사회 대상 취창업을 위한 대학 공간 제공,1,대학 구성원 및 지역사회 대상 취창업을 위한 대학 공간 제공
94,한국,Kyungpook,"경북대학교 도서관이 '대구/경북 거점도서관 비전선포식'으로 거듭났다. 기념식은 대학 교육 및 연구 지원의 핵심 기관이 되겠다는 경북대학교 도서관의 의지를 보여주었다. 현재 도서관은 지식기반사회에서 교육문화시설이자 커뮤니티 지식정보센터의 역할도 겸하고 있다. 경북대학교 도서관은 1982년에 건립되어 2000년과 2017년에 증축되었습니다. 장서 330만 권, 이용자 수 150만 명으로 전국에서 세 번째로 큰 대학입니다.",4,"경북대학교 도서관이 대구경북 거점도서관 비전 선포식으로 거듭났다. 기념식은 대학교육 및 연구지원의 핵심기관이 되겠다는 경북대학교 도서관의 의지를 보여주었다.현재도서관은 지식기반사회에서 교육문화시설이자 커뮤니티 지식정보센터의 역할도 겸하고 있다. 경북대학교 도서관은 1982년에 건립되어 2000년과 2017년에 증축되었습니다.장서 330만권, 이용자 수 150만명으로 전국에서 세 번째로 큰 대학입니다.",1, 지식기반사회에서 교육문화시설이자 커뮤니티 지식정보센터의 역할도 겸하고 있다. 경북대학교 도서관은 1982년에 건립되어 2000년과 2017년에 증축되었습니다
108,한국,Kyungpook,"경북대학교 도서관이 '대구/경북 거점도서관 비전선포식'으로 거듭났다. 기념식은 대학 교육 및 연구 지원의 핵심 기관이 되겠다는 경북대학교 도서관의 의지를 보여주었다. 현재 도서관은 지식기반사회에서 교육문화시설이자 커뮤니티 지식정보센터의 역할도 겸하고 있다. 경북대학교 도서관은 1982년에 건립되어 2000년과 2017년에 증축되었습니다. 장서 330만 권, 이용자 수 150만 명으로 전국에서 세 번째로 큰 대학입니다.",4,"경북대학교 도서관이 대구경북 거점도서관 비전 선포식으로 거듭났다. 기념식은 대학교육 및 연구지원의 핵심기관이 되겠다는 경북대학교 도서관의 의지를 보여주었다.현재도서관은 지식기반사회에서 교육문화시설이자 커뮤니티 지식정보센터의 역할도 겸하고 있다. 경북대학교 도서관은 1982년에 건립되어 2000년과 2017년에 증축되었습니다.장서 330만권, 이용자 수 150만명으로 전국에서 세 번째로 큰 대학입니다.",1, 지식기반사회에서 교육문화시설이자 커뮤니티 지식정보센터의 역할도 겸하고 있다. 경북대학교 도서관은 1982년에 건립되어 2000년과 2017년에 증축되었습니다
65,한국,Kangwon,"학내 구성원 및 지역주민 대상 미술, 음악, 스포츠 등 다양한 분야의 교육과정 제공",4,"학내 구성원 및 지역주민 대상 미술, 음악, 스포츠 등 다양한 분야의 교육과정 제공",1,"학내 구성원 및 지역주민 대상 미술, 음악, 스포츠 등 다양한 분야의 교육과정 제공"
34,한국,Kangwon,지역주민 대상 교육‧체험시설 제공,2,지역주민 대상 교육체험시설 제공,1,지역주민 대상 교육체험시설 제공
26,한국,Kangwon,캠퍼스와 도계 시내 간 통학을 돕기 위해 학생들에게 매월 통학권 배부,1,캠퍼스와도계시내 간 통학을 돕기 위해 학생들에게 매월 통학권 배부,1,캠퍼스와도계시내 간 통학을 돕기 위해 학생들에게 매월 통학권 배부
25,한국,Kangwon,캠퍼스와 시내 간 통학버스 운행을 통한 이동 편의 제공,1,캠퍼스와 시내 간 통학버스 운행을 통한 이동 편의 제공,1,캠퍼스와 시내 간 통학버스 운행을 통한 이동 편의 제공
13,한국,Kangwon,빈곤‧국제기구‧개발정책 교육을 통한 국제개발협력 분야 전문 인력 양성,1,빈곤국제기구 개발정책 교육을 통한 국제개발협력 분야 전문인력 양성,1,빈곤국제기구 개발정책 교육을 통한 국제개발협력 분야 전문인력 양성
83,한국,Kangwon,각 학과별 여성 지원자와 입학자 수 수록,5,각 학과별 여성 지원자와 입학자 수수록,1,각 학과별 여성 지원자와 입학자 수수록
66,한국,Kangwon,"학내 구성원 및 지역주민 대상 영어, 프랑스어, 중국어 등의 외국어 강좌 제공",4,"학내 구성원 및 지역주민 대상 영어, 프랑스어, 중국어 등의 외국어 강좌 제공",1,"학내 구성원 및 지역주민 대상 영어, 프랑스어, 중국어 등의 외국어 강좌 제공"
30,한국,Kangwon,경제적 부담 완화를 위한 저소득층 학생 대상 기숙사비（관리비+식비） 지원,2,경제적 부담 완화를 위한 저소득층 학생 대상 기숙사비 관리비식비 지원,1,경제적 부담 완화를 위한 저소득층 학생 대상 기숙사비 관리비식비 지원
22,한국,Kangwon,경제적 부담 완화를 위한 저소득층 학생 대상 기숙사비（관리비+식비） 지원,1,경제적 부담 완화를 위한 저소득층 학생 대상 기숙사비 관리비식비 지원,1,경제적 부담 완화를 위한 저소득층 학생 대상 기숙사비 관리비식비 지원
27,한국,Kangwon,식당마다 전문 영양사를 배치하여 양질의 건강한 식단 구성,2,식당마다 전문 영양사를 배치하여 양질의 건강한 식단 구성,1,식당마다 전문 영양사를 배치하여 양질의 건강한 식단 구성
64,한국,Kangwon,농업분야의 경쟁력을 갖춘 전문인력 양성을 위한 교육 제공,4,농업분야의 경쟁력을 갖춘 전문인력 양성을 위한 교육제공,1,농업분야의 경쟁력을 갖춘 전문인력 양성을 위한 교육제공
31,한국,Kangwon,농업분야의 경쟁력을 갖춘 전문인력 양성을 위한 교육 제공,2,농업분야의 경쟁력을 갖춘 전문인력 양성을 위한 교육제공,1,농업분야의 경쟁력을 갖춘 전문인력 양성을 위한 교육제공
67,한국,Kangwon,온라인 교양 및 전공 강좌를 제공하여 모든 수요자의 교육 접근성 제고,4,온라인 교양 및 전공 강좌를 제공하여 모든 수요자의 교육 접근성 제고,1,온라인 교양 및 전공 강좌를 제공하여 모든 수요자의 교육 접근성 제고
14,한국,Kangwon,빈곤과 개발협력 관련 사례 연구를 통한 국제개발에 대한 이해와 관심 제고,1,빈곤과 개발협력 관련 사례연구를 통한 국제개발에 대한 이해와 관심 제고,1,빈곤과 개발협력 관련 사례연구를 통한 국제개발에 대한 이해와 관심 제고
72,한국,Kangwon,전임교원 신규임용지침에 근거하여 여성교원의 우선 채용 보장,5,전임교원 신규 임용지침에 근거하여 여성교원의 우선 채용보장,1,전임교원 신규 임용지침에 근거하여 여성교원의 우선 채용보장
81,한국,Kangwon,여직원 및 여학생이 사용가능한 휴게실을 마련하여 편의 제공,5,여직원 및 여학생이 사용 가능한 휴게실을 마련하여 편의 제공,1,여직원 및 여학생이 사용 가능한 휴게실을 마련하여 편의 제공
35,한국,Kangwon,"지역주민 대상 숲 해설, 학술림 탐방, 목공체험 제공",2,"지역주민 대상 숲해설, 학술림 탐방, 목공체험 제공",1,"지역주민 대상 숲해설, 학술림 탐방, 목공체험 제공"
71,한국,Kangwon,교수회 규정에 근거하여 부회장 임원에 대한 참여 보장,5,교수회 규정에 근거하여 부회장 임원에 대한 참여 보장,1,교수회 규정에 근거하여 부회장 임원에 대한 참여 보장
21,한국,Kangwon,경제적 부담 완화를 위한 저소득층 학생 대상 학업장려금 지원,1,경제적 부담 완화를 위한 저소득층 학생 대상 학업장려금 지원,1,경제적 부담 완화를 위한 저소득층 학생 대상 학업장려금 지원
75,한국,Kangwon,여후보생 선발 시범대학으로 선정되어 지속적인 여후보생 선발 진행,5,여 후보생 선발 시범대학으로 선정되어 지속적인 여 후보생 선발 진행,1,여 후보생 선발 시범대학으로 선정되어 지속적인 여 후보생 선발 진행
46,한국,Kangwon,심폐소생술 실습 등으로 지역주민에게 응급처치 방법 전달,3,심폐소생술 실습 등으로 지역주민에게 응급처치 방법 전달,1,심폐소생술 실습 등으로 지역주민에게 응급처치 방법 전달
1,한국,Seoul,구성원의 식사/기아 문제 해결 - “천원의 식사” ∙서울대학교에서는 재학생 대상으로 ‘천원의 식사’ 코너를 운영하여 저소득층 학생들의 식비 부담을 줄이고 건강 향상에 기여하고 있습니다. ‘천원의 식사’는 가격에 비해 양질의 식사를 제공하여 구성원에게 인기가 높습니다. 학교 생협 직영 식당 6개소에서는 건강하고 저렴한 음식을 제공하기 위해 구성원들에게 식비 가격을 기준 가격보다 할인해 주고 있습니다.,2,구성원의 식사기아 문제 해결 천원의 식사서울대학교에서는 재학생 대상으로 천원의 식사코너를 운영하여 저소득층 학생들의 식비 부담을 줄이고 건강 향상에 기여하고 있습니다. 천 원의 식사는 가격에 비해 양질의 식사를 제공하여 구성원에게 인기가 높습니다. 학교생협 직영식당 6개소에서는 건강하고 저렴한 음식을 제공하기 위해 구성원들에게 식비가격을 기준가격보다 할인해주고 있습니다.,1,구성원의 식사기아 문제 해결 천원의 식사서울대학교에서는 재학생 대상으로 천원의 식사코너를 운영하여 저소득층 학생들의 식비 부담을 줄이고 건강 향상에 기여하고 있습니다. 천 원의 식사는 가격에 비해 양질의 식사를 제공하여 구성원에게 인기가 높습니다. 학교생협 직영식당 6개소에서는 건강하고 저렴한 음식을 제공하기 위해 구성원들에게 식비가격을 기준가격보다 할인해주고 있습니다.
52,한국,Kangwon,전문 상담을 통한 학교생활 어려움 및 심리문제 해소,3,전문상담을 통한 학교생활 어려움 및 심리 문제 해소,1,전문상담을 통한 학교생활 어려움 및 심리 문제 해소
74,한국,Kangwon,학칙에 근거하여 휴학사유를 증빙할 경우 학생의 임신‧출산‧육아에 따른 휴학 허가,5,학칙에 근거하여 휴학사유를 증빙할 경우 학생의 임신 출산 육아에 따른 휴학허가,1,학칙에 근거하여 휴학사유를 증빙할 경우 학생의 임신 출산 육아에 따른 휴학허가
78,한국,Kangwon,여성 교원의 권익 보호 및 양성평등 실현 도모를 위한 여교수회 운영,5,여성교원의 권익보호 및 양성평등 실현도모를 위한 여교수회 운영,1,여성교원의 권익보호 및 양성평등 실현도모를 위한 여교수회 운영
17,한국,Kangwon,외국인 학생의 언어소통능력 향상을 위한 한국어 학습 봉사활동 진행,1,외국인 학생의 언어 소통 능력 향상을 위한 한국어 학습 봉사활동 진행,1,외국인 학생의 언어 소통 능력 향상을 위한 한국어 학습 봉사활동 진행
48,한국,Kangwon,"의료봉사, 결핵검사 등의 지역주민 대상 봉사활동 진행",3,"의료봉사, 결핵검사 등의 지역주민 대상 봉사활동 진행",1,"의료봉사, 결핵검사 등의 지역주민 대상 봉사활동 진행"
8,한국,Seoul,"지역사회 교육 프로그램
∙ 중앙도서관과 규장각, 평생교육원을 중심으로 대중에게 개방되는 공개 강의와 지역사회를 위한 교육 행사가 정기적으로 진행되고 있습니다. 
∙ ‘문화가 함께하는 도서관’ 프로그램을 통해 미술전시회, 북콘서트, 음악회, 명사초청 강연, 별빛 영화제 등 복합문화 공간으로서의 도서관 역할을 강화하고 있습니다. 
규장각 금요 시민강좌를 통해 일반시민들이 한국학에
관한 전문 강의를 접할 기회를 제공합니다. 지역사회
고교생 체험 캠프는 휴먼 라이브러리, 고문헌 전시자
료와 도서관 투어, 명사특강 등으로 구성한 프로그램으
로 매년 100명 정도의 고등학생들이 참여하고 있습니
다. 인권센터는 주제를 달리한 인권강좌를 주최해 학
내 외 전문가들에게 심도 있는 강의를 제공합니다.",4,"지역사회교육 프로그램 중앙도서관과 규장각, 평생교육원을 중심으로 대중에게 개방되는 공개강의와 지역사회를 위한 교육행사가 정기적으로 진행되고 있습니다.문화가 함께하는 도서관 프로그램을 통해 미술 전시회, 북콘서트, 음악회, 명사 초청 강연, 별빛영화제 등 복합문화공간으로서의 도서관 역할을 강화하고 있습니다. 규장각 금요시민 강좌를 통해 일반 시민들이 한국학에 관한 전문 강의를 접할 기회를 제공합니다.지역사회 고교생 체험캠프는 휴먼 라이브러리 , 고문헌 전시 자료와 도서관 투어, 명사특강 등으로 구성한 프로그램으로 매년 100명 정도의 고등학생들이 참여하고 있습니다. 인권센터는 주제를 달리한 인권 강좌를 주최해 학내외 전문가들에게 심도 있는 강의를 제공합니다.",1," 함께하는 도서관 프로그램을 통해 미술 전시회, 북콘서트, 음악회, 명사 초청 강연, 별빛영화제 등 복합문화공간으로서의 도서관 역할을 강화하고 있습니다. 규장각 금요시민 강좌를 통해 일반 시민들이 한국학에 관한 전문 강의를 접할 기회를 제공합니다"
