,국가,대학교명,번역,분류,번역_전처리,5분류,요약
82,한국,Kyungpook,"작은 말 껍데기 보존 말 갑각은 민물 생물을 보존하는 데 매우 중요한 종입니다. 민물고기의 알을 보호하는 은신처 역할을 합니다. 작은 말 껍데기는 한국이 원산지이며 가치가 높습니다. 그들의 보존이 필요합니다. 경북대학교 생물학교육과 황의욱 교수팀이 한반도 주변에 서식하는 말 껍데기가 중국 황하 지역에서 유래했다는 사실을 새롭게 발견했다. 황 교수팀은 8개의 국내 수계(북한강, 남한강, 금강, 만경강, 영산강, 침진강, 섬진강, 낙동강)에 서식하는 86개의 말껍질과 83개의 작은 말껍질의 미토콘드리아 DNA 염기서열을 분석했다. 그리고 그들의 기원을 추적했습니다. 연구 결과 황 교수팀은 다음과 같이 예측했다.말 조개류는 고대 황색에 널리 분포되어 있었습니다.
중국에서 한반도로 흐르는 하수도 약 1억 6천만 년 전 한국의 서해가 존재하지 않았던 때 그리고 한반도의 동부와 서부는 하나의 대륙으로 연결됩니다.
또한, 세계 유일의 토종 한국에만 서식하는 종, 작은 말 껍데기, 조선인 주변에 살았던 말 껍데기에서 나타났다.
약 2,800만 년 전 말 반도
신생대 팔레. 그 이후로 말 조개류는
정착하면서 고유종으로 분화
신생대 초기 동아시아 각 지역에서
1200만년 전 시대.
의 지원을 받아 수행한 연구
환경부 낙동강
국립 생물 자원 연구소,
Scientific Reports에서 10월 6일에 발표되었습니다.
이 외에도 교수가 수행한 연구
환경과 김웅
경북대학교 공학과
사우디아라비아의 King Saud University는
유색의 98% 이상을 분해할 수 있는 광촉매
폐수에 염색. 연구 결과는
유해 물질 저널",14,"작은 말껍데기 보존 말갑각은 민물생물을 보존하는 데 매우 중요한 종입니다. 민물고기의 알을 보호하는 은신처 역할을 합니다.작은 말껍데기는 한국이 원산지이며 가치가 높습니다. 그들의 보존이 필요합니다. 경북대학교 생물학 교육과 황의욱 교수팀이 한반도 주변에서식하는 말껍데기가 중국 황하지역에서 유래했다는 사실을 새롭게 발견했다. 황 교수팀은 8개의 국내 수계 북한강, 남한강, 금강, 만경강, 영산강, 침진강, 섬진강, 낙동강에 서식하는 86개의 말껍 질과 83개의 작은 말껍질의 미토콘드리아 DNA 염기서열을 분석했다. 그리고 그들의 기원을 추적했습니다. 연구 결과 황 교수팀은 다음과 같이 예측했다.말조개류는 고대 황색에 널리 분포되어 있었습니다. 중국에서 한반도로 흐르는 하수도 약 1억6천만 년 전 한국의 서해가 존재하지 않았던 때 그리고 한반도의 동부와 서부는 하나의 대륙으로 연결됩니다. 또한, 세계 유일의 토종 한국에만 서식하는 종, 작은 말껍데기, 조선인 주변에 살았던 말껍데기에서 나타났다.약 2,800만년 전 말반도 신생대 팔레.그 이후로 말조개류는 정착하면서 고유종으로 분화 신생 대 초기 동아시아 각 지역에서 1200만년 전 시대.의 지원을 받아 수행한 연구환경부 낙동강 국립생물자원연구소, ScientificReports에서 10월 6일에 발표되었습니다. 이외에도 교수가 수행한 연구환경과 김웅경북대학교 공학과 사우디아라비아의 KingSaudU niversity는 유색의 98 이상을 분해할 수 있는 광촉매 폐수에 염색.연 구 결과는 유해물질 저널",2," 고대 황색에 널리 분포되어 있었습니다. 중국에서 한반도로 흐르는 하수도 약 1억6천만 년 전 한국의 서해가 존재하지 않았던 때 그리고 한반도의 동부와 서부는 하나의 대륙으로 연결됩니다. 또한, 세계 유일의 토종 한국에만 서식하는 종, 작은 말껍데기, 조선인 주변에 살았던 말껍데기에서 나타났다"
19,한국,Ajou,"아주대학교 중앙도서관이 온/오프라인 북 큐레이션으로 기후변화 테마 도서를 선정하여 제공하였다. 해당 북 큐레이션은 폭염과 한파, 잦은 태풍, 산불 등 기후 위기의 시대 속에 탄소중립, 기후변화, 제로웨이스트, 플라스틱 저감 등 기후변화 관련 도서를 읽고 건강한 지구를 만들어 가는 한 걸음을 함께 내디뎌 보자는 취지에서 진행되었다. 이에 추천 도서로 , , , , , , , , , 를 선정하여 학생들의 관심을 끌었다.",13,"아주대학교 중앙도서관이온오프라인 북큐레이션으로 기후변화 테마도서를 선정하여 제공하였다. 해당 북큐레이션은 폭염과 한파, 잦은 태풍, 산불 등 기후위기의 시대 속에 탄소중립, 기후변화, 제로웨이스트, 플라스틱 저감 등 기후변화 관련 도서를 읽고 건강한 지구를 만들어가는 한 걸음을 함께 내디뎌 보자는 취지에서 진행되었다.이에 추천도서로,,,,,,,,, 를 선정하여 학생들의 관심을 끌었다.",2," 추천도서로,,,,,,,,, 를 선정하여 학생들의 관심을 끌었다."
90,한국,Kyungpook,전 세계의 연간 염료 생산량은 약 100만 톤으로 막대한 양의 유색 폐수를 발생시킵니다. 김웅 경북대 환경공학부 교수는 사우디 킹사우드대 등 국제공동연구를 통해 1시간 이내에 착색된 폐수를 98% 이상 분해할 수 있는 광촉매를 개발했다. 책임 있는 소비와 생산 지구 환경을 위협하는 폐수를 처리할 수 있는 촉매 기술의 개발은 매우 고무적입니다. 촉매는 유기염료 뿐만 아니라 폐수 내 유기물에도 적용될 것으로 기대된다. - 경북대학교 환경공학과 교수 책임소비 및 생산 이 광촉매는 이황화몰리브덴이 도핑된 철-유기 하이브리드 복합재료입니다. 이중 광촉매 기술이라는 지속 가능한 기술을 구동하여 자외선과 가시광선 조건 모두에서 기능할 수 있다는 점에서 특별합니다. 연구 결과는 Journal of Hazardous Materials에 게재되었습니다.,12,전 세계의 연간 염료 생산량은 약 100만톤으로 막대한 양의 유색 폐수를 발생 시킵니다. 김웅 경북대 환경공학부 교수는 사우디 킹 사우드대 등 국제공동연구를 통해 1시간 이내에 착색된 폐수를 98 이상 분해할 수 있는 광촉매를 개발했다. 책임 있는 소비와 생산지구 환경을 위협하는 폐수를 처리할 수 있는 촉매기술의 개발은 매우 고무적입니다. 촉매는 유기염료뿐만 아니라 폐수 내 유기물에도 적용될 것으로 기대된다. 경북대학교 환경공학과 교수 책임 소비 및 생산이 광촉매는  이황화 몰리브덴이 도핑된 철유기하이브리드 복합재료입니다.이 중 광촉매 기술이라는 지속가능한 기술을 구동하여 자외선과 가시광선 조건 모두에서 기능할 수 있다는 점에서 특별합니다. 연구 결과는 Jou rnalofHaz ardousMaterials에 게재되었습니다.,2, 중 광촉매 기술이라는 지속가능한 기술을 구동하여 자외선과 가시광선 조건 모두에서 기능할 수 있다는 점에서 특별합니다. 연구 결과는 Jou rnalofHaz ardousMaterials에 게재되었습니다.
78,한국,Kyungpook,전 세계의 연간 염료 생산량은 약 100만 톤으로 막대한 양의 유색 폐수를 발생시킵니다. 김웅 경북대 환경공학부 교수는 사우디 킹사우드대 등 국제공동연구를 통해 1시간 이내에 착색된 폐수를 98% 이상 분해할 수 있는 광촉매를 개발했다. 책임 있는 소비와 생산 지구 환경을 위협하는 폐수를 처리할 수 있는 촉매 기술의 개발은 매우 고무적입니다. 촉매는 유기염료 뿐만 아니라 폐수 내 유기물에도 적용될 것으로 기대된다. - 경북대학교 환경공학과 교수 책임소비 및 생산 이 광촉매는 이황화몰리브덴이 도핑된 철-유기 하이브리드 복합재료입니다. 이중 광촉매 기술이라는 지속 가능한 기술을 구동하여 자외선과 가시광선 조건 모두에서 기능할 수 있다는 점에서 특별합니다. 연구 결과는 Journal of Hazardous Materials에 게재되었습니다.,12,전 세계의 연간 염료 생산량은 약 100만톤으로 막대한 양의 유색 폐수를 발생 시킵니다. 김웅 경북대 환경공학부 교수는 사우디 킹 사우드대 등 국제공동연구를 통해 1시간 이내에 착색된 폐수를 98 이상 분해할 수 있는 광촉매를 개발했다. 책임 있는 소비와 생산지구 환경을 위협하는 폐수를 처리할 수 있는 촉매기술의 개발은 매우 고무적입니다. 촉매는 유기염료뿐만 아니라 폐수 내 유기물에도 적용될 것으로 기대된다. 경북대학교 환경공학과 교수 책임 소비 및 생산이 광촉매는  이황화 몰리브덴이 도핑된 철유기하이브리드 복합재료입니다.이 중 광촉매 기술이라는 지속가능한 기술을 구동하여 자외선과 가시광선 조건 모두에서 기능할 수 있다는 점에서 특별합니다. 연구 결과는 Jou rnalofHaz ardousMaterials에 게재되었습니다.,2, 중 광촉매 기술이라는 지속가능한 기술을 구동하여 자외선과 가시광선 조건 모두에서 기능할 수 있다는 점에서 특별합니다. 연구 결과는 Jou rnalofHaz ardousMaterials에 게재되었습니다.
54,한국,Kangwon,"산, 강, 섬에 서식하는 동식물의 생태계 조사 및 모니터링",14,"산, 강, 섬에서식하는 동식물의 생태계 조사 및 모니터링",2,"산, 강, 섬에서식하는 동식물의 생태계 조사 및 모니터링"
27,한국,Kangwon,"절수식 소변기 설치로 지속적, 의식적 물 절약 실천",6,"절수식소변기 설치로 지속적, 의식적 물 절약 실천",2,"절수식소변기 설치로 지속적, 의식적 물 절약 실천"
64,한국,Kangwon,동물자원공동연구소 운영. 전염병 질병 및 대책 마련 연구 수행,15,동물자원 공동연구소 운영.전염병질병 및 대책 마련 연구수행,2, 및 대책 마련 연구수행
43,한국,Kangwon,재난안전 문제해결 기술개발 지원 사업＇ 주관 연구기관 선정. 도시산불방재 기술개발에 관한 연구과제 수행,13,재난안전 문제 해결기술 개발 지원사업 주관 연구기관 선정. 도 시 산불방재기술개발에 관한 연구과제 수행,2,재난안전 문제 해결기술 개발 지원사업 주관 연구기관 선정. 도 시 산불방재기술개발에 관한 연구과제 수행
76,한국,Kyungpook,연구팀이 나프록센을 분해할 수 있는 첨단 수처리 시스템을 개발했다. 기존의 고급 산화 공정은 높은 처리 비용과 에너지가 필요하며 나프록센과 같은 잔류 약물의 불완전한 방출로 인해 종종 낮은 효율로 토양 및 수계에 남아 있습니다. 박창민 경북대 환경공학과 교수와 윤여민 사우스캐롤라이나대 교수는 1시간 안에 나프록센을 99.9% 분해할 수 있는 기술을 개발했다.,6,연구팀이나 프록센을 분해할 수 있는 첨단 수처리시스템을 개발했다. 기존의 고급 산화공정은 높은 처리비용과 에너지가 필요하며 나프록센과 같은 잔류약물의 불완전한 방출로 인해 종종 낮은 효율로 토양 및 수계에 남아있습니다. 박창민 경북대 환경공학과 교수와 윤여민 사우스캐롤라이나대 교수는 1시간 안에 나프록센을 99.9분해할 수 있는 기술을 개발했다.,2, 수 있는 기술을 개발했다.
88,한국,Kyungpook,연구팀이 나프록센을 분해할 수 있는 첨단 수처리 시스템을 개발했다. 기존의 고급 산화 공정은 높은 처리 비용과 에너지가 필요하며 나프록센과 같은 잔류 약물의 불완전한 방출로 인해 종종 낮은 효율로 토양 및 수계에 남아 있습니다. 박창민 경북대 환경공학과 교수와 윤여민 사우스캐롤라이나대 교수는 1시간 안에 나프록센을 99.9% 분해할 수 있는 기술을 개발했다.,6,연구팀이나 프록센을 분해할 수 있는 첨단 수처리시스템을 개발했다. 기존의 고급 산화공정은 높은 처리비용과 에너지가 필요하며 나프록센과 같은 잔류약물의 불완전한 방출로 인해 종종 낮은 효율로 토양 및 수계에 남아있습니다. 박창민 경북대 환경공학과 교수와 윤여민 사우스캐롤라이나대 교수는 1시간 안에 나프록센을 99.9분해할 수 있는 기술을 개발했다.,2, 수 있는 기술을 개발했다.
7,한국,Seoul,"신재생 에너지 사용 확대 계획
∙관악캠퍼스 약 35개 건물에 태양광, 태양열, 지열 등의 신재생 에너지 설비를 보유하고 있습니다. 2020년부터 법률에 의거하여 신축되는 건물 에너지 수요의 30%까지 신재생 에너지를 설치할 예정이며, 향후 태양광 중심의 신재생 에너지 보급을 확대할 계획입니다.",13,"신재생에너지 사용 확대 계획 관악캠퍼스 약 35개 건물에 태양광, 태양열, 지열 등의 신재생에너지 설비를 보유하고 있습니다.2020년부터 법률에 의거하여 신축되는 건물 에너지 수요의 30까지 신재생에너지를 설치할 예정이며, 향후 태양광 중심의 신재생에너지 보급을 확대할 계획입니다.",2," 법률에 의거하여 신축되는 건물 에너지 수요의 30까지 신재생에너지를 설치할 예정이며, 향후 태양광 중심의 신재생에너지 보급을 확대할 계획입니다."
12,한국,Seoul,"지역사회 기후변화/SDGs 교육 제공
∙ 관악시민환경대학은 서울대학교와 관악구의 협력으로 지
역주민들에게 양질의 환경교육 서비스를 제공하며, 환
경대학원 교수들과 환경전문가들이 환경문제의 원인과
대응방안을 강의합니다. 환경 전반의 이슈를 서울대학
교 환경대학원 교수들이 지역 주민에게 총 12차례 강
연하는 프로그램입니다.",13,"지역사회 기후변화SDGs 교육 제공 관악시민환경대학은 서울대학교와 관악구의 협력으로 지역주민들에게 양질의 환경교육 서비스를 제공하며, 환경대학원 교수들과 환경전문가들이 환경문제의 원인과 대응방안을 강의합니다. 환경 전반의 이슈를 서울대학교 환경대학원 교수들이 지역주민에게 총 12차례 강연하는 프로그램입니다.",2,"지역사회 기후변화SDGs 교육 제공 관악시민환경대학은 서울대학교와 관악구의 협력으로 지역주민들에게 양질의 환경교육 서비스를 제공하며, 환경대학원 교수들과 환경전문가들이 환경문제의 원인과 대응방안을 강의합니다. 환경 전반의 이슈를 서울대학교 환경대학원 교수들이 지역주민에게 총 12차례 강연하는 프로그램입니다."
21,한국,Ajou,"우리 대학을 비롯한 5개 대학이 공동 주최·주관한 ‘2021 대학연합창업캠프-B대면 창업 데이트’가 한 달의 여정을 성황리에 마쳤다. 아주대 LINC+사업단·성균관대 LINC+사업단·한양대 ERICA LINC+사업단과 부산대 창업지원단, 포항공대 산학협력단이 함께 마련한 ‘2021 대학연합창업캠프-B대면 창업 데이트’는 지난 7월 특강을 시작으로 개막, 8월 모의투자 데모데이로 마무리됐다. 총 75명의 대학생들이 를 주제로 ▲식량과 농업 ▲물 ▲에너지 ▲도시 ▲순환경제와 관련한 사회 문제 해결책 개발에 나섰다. 5개 대학의 학생들이 골고루 섞인 15개팀이 구성되어, 창업 전문가들의 특강과 멘토링을 기반으로 팀 빌딩부터 아이디어 발굴, 비즈니스 모델 발표, 사업계획서 작성, 모의투자 데모데이까지 예비 창업팀이 경험해볼 수 있는 다양한 실전 프로그램에 참여했다. 행사는 온라인으로 진행됐다. 한달 간 발전시킨 창업 아이디어를 심사한 결과, 15개 연합팀 가운데 Ampere(암페어)팀이 최우수상을 받았다. 이 팀은 ‘폐휴대폰 업사이클링을 통한 개발용 보드 제작’이라는 아이디어를 냈다. 우수상은 ‘캠퍼 들의 친환경 에너지 자급자족을 위해 전동 킥보드 폐배터리를 활용한 다용도 에너지 저장장치’로 뫼비우스의 띵팀이, 장려상은 ‘도심 속 유휴공간을 활용한 텃밭 대여 시스템과 스마일 팜’으로 시티져스팀이 받았다. ‘유해종으로 폐기되는 갯끈풀을 활용한 나노셀룰로오스 공기청정기 필터개발’의 VC9팀도 장려상을 받았다. 이번 대학연합창업캠프에서 배출된 예비 창업 우수팀들에게는 아주대 창업지원단과 창업교육센터가 협업 하여 지식재산권 출원 및 창업컨설팅, 시제품 제작 등 다각적인 후속 사업을 지원할 계획이다. 더불어 참여 대학 간 긴밀한 협업을 통해 이번 창업팀들이 실제 창업으로까지 이어갈 수 있도록 인큐베이팅 프로그램을 공동으로 진행하는 등 후속 사업을 모색할 예정이다.",15,"우리 대학을 비롯한 5개 대학이 공동 주최 주관한 2021대학연합 창업캠프 B대면 창업 데이트가 한 달의 여정을 성황리에 마쳤다. 아주대 LINC 사업단 성균관대 LINC사업단 한양대 ERICALINC 사업단과 부산대 창업지원단, 포항공대 산학협력단이 함께 마련한 2021대학연합 창업캠프 B대면 창업 데이트는 지난 7월 특강을 시작으로 개막, 8월 모의투자 데모데이로 마무리됐다. 총 75명의 대학생들이를 주제로 식량과 농업물 에너지도시 순환경제와 관련한 사회문제 해결책 개발에 나섰다.5개 대학의 학생들이 골고루 섞인 15개 팀이 구성되어, 창업 전문가들의 특강과 멘토링을 기반으로 팀 빌딩부터 아이디어 발굴, 비즈니스 모델 발표, 사업계획서 작성, 모의투자 데모데이까지 예비창업팀이 경험해 볼 수 있는 다양한 실전 프로그램에 참여했다. 행사는 온라인으로 진행됐다. 한 달간 발전시킨 창업 아이디어를 심사한 결과, 15개 연합팀 가운데 Ampere암페어팀이 최우수상을 받았다. 이 팀은 폐휴대폰 업사이 클링을 통한 개발용 보드 제작이라는 아이디어를 냈다. 우수상은 캠퍼들의 친환경 에너지 자급자족을 위해 전동킥 보드 폐 배터리를 활용한 다용도 에너지저장장치로 뫼비우스의 띵팀이, 장려상은 도심 속 유휴공간을 활용한 텃밭 대여 시스템과 스마일팜으로 시티져스팀이 받았다. 유해종으로 폐기되는 갯끈 풀을 활용한 나노 셀룰로오스 공기청정기 필터개발의 VC9팀 도장려상을 받았다. 이번 대학연합 창업캠프에서 배출된 예비창업 우수팀들에게는 아주대 창업지원단과 창 업 교육센터가 협업하여 지식재산권 출원 및 창업 컨설팅, 시제품 제작 등 다각적인 후속 사업을 지원할 계획이다. 더불어 참여 대학 간 긴밀한 협업을 통해 이번 창업팀들이 실제 창업으로까지 이어갈 수 있도록 인큐베이팅 프로그램을 공동으로 진행하는 등 후속 사업을 모색할 예정이다.",2," 대학의 학생들이 골고루 섞인 15개 팀이 구성되어, 창업 전문가들의 특강과 멘토링을 기반으로 팀 빌딩부터 아이디어 발굴, 비즈니스 모델 발표, 사업계획서 작성, 모의투자 데모데이까지 예비창업팀이 경험해 볼 수 있는 다양한 실전 프로그램에 참여했다. 행사는 온라인으로 진행됐다. 한 달간 발전시킨 창업 아이디어를 심사한 결과, 15개 연합팀 가운데 Ampere암페어팀이 최우수상을 받았다. 이 팀은 폐휴대폰 업사이 클링을 통한 개발용 보드 제작이라는 아이디어를 냈다. 우수상은 캠퍼들의 친환경 에너지 자급자족을 위해 전동킥 보드 폐 배터리를 활용한 다용도 에너지저장장치로 뫼비우스의 띵팀이, 장려상은 도심 속 유휴공간을 활용한 텃밭 대여 시스템과 스마일팜으로 시티져스팀이 받았다. 유해종으로 폐기되는 갯끈 풀을 활용한 나노 셀룰로오스 공기청정기 필터개발의 VC9팀 도장려상을 받았다. 이번 대학연합 창업캠프에서 배출된 예비창업 우수팀들에게는 아주대 창업지원단과 창 업 교육센터가 협업하여 지식재산권 출원 및 창업 컨설팅, 시제품 제작 등 다각적인 후속 사업을 지원할 계획이다. 더불어 참여 대학 간 긴밀한 협업을 통해 이번 창업팀들이 실제 창업으로까지 이어갈 수 있도록 인큐베이팅 프로그램을 공동으로 진행하는 등 후속 사업을 모색할 예정이다."
5,한국,Seoul,"서울대학교 1인당 폐기물 발생량 
∙재활용이 가능한 일반폐기물을 대상으로 1인당 폐기물 발생량을 산정한 결과 2019년 기준으로 1인당 약 93 kg의 폐기물을 발생시키고 있으며 재활용량을 고려한 순 배출량은 13 kg인 것으로 나타났습니다. 1인당 연간 폐기물 발생량은 95 Kg 내외를 기록하고 있지만 재활용률의 꾸준한 증가에 의하여 순 배출량은 꾸준히 감소하고 있는 추세입니다.",12,서울대학교 1인당 폐기물 발생량 재활용이 가능한 일반폐기물을 대상으로 1인당 폐기물 발생량을 산정한 결과 2019년 기준으로 1인당 약 93kg의 폐기물을 발생시키고 있으며 재활용량을 고려한 순배출량은 13kg인 것으로 나타났습니다.1인당 연간 폐기물 발생량은 95Kg 내외를 기록하고 있지만 재활용률의 꾸준한 증가에 의하여 순배출량은 꾸준히 감소하고 있는 추세입니다.,2, 연간 폐기물 발생량은 95Kg 내외를 기록하고 있지만 재활용률의 꾸준한 증가에 의하여 순배출량은 꾸준히 감소하고 있는 추세입니다.
14,한국,Ajou,"아주대학교 아주지속가능발전센터는 본교 플라스틱 및 일회용품 감축, 물 절약을 촉진하는 AJOU 친환경 캠페인을 진행했다. 최근 UN 보고서 내용 중 긴급한 자금 투입 없이는 2030년까지 전 세계적으로 수십억 명이 안전한 식수, 위생 서비스에 접근할 수 없는 위험에 처해 있다는 점은 플라스틱 폐기물과 물 절약의 필요성을 시사하고 있다. 이에 센터는 본교 구성원의 환경 인식을 개선하고, 물의 가치를 제고하기 위하여 AJOU 친환경 캠페인을 실시하였다",6,"아주대학교 아주 지속가능발전센터는 본교 플라스틱 및 일회용품 감축, 물 절약을 촉진하는 AJOU 친환경 캠페인을 진행했다. 최근 UN 보고서 내용 중 긴급한 자금 투입 없이는 2030년까지 전 세계적으로 수십억 명이 안전한 식수, 위생서비스에 접근할 수 없는 위험에 처해 있다는 점은 플라스틱 폐기물과 물 절약의 필요성을 시사하고 있다.이 에 센터는 본교 구성원의 환경인식을 개선하고, 물의 가치를 제고하기 위하여 AJOU 친환경 캠페인을 실시하였다",2," 에 센터는 본교 구성원의 환경인식을 개선하고, 물의 가치를 제고하기 위하여 AJOU 친환경 캠페인을 실시하였다"
3,한국,Seoul,"폐기물 발생량
∙ 폐기물 총량은 일반폐기물, 지정폐기물, 건설폐기물을
모두 포함하여 산정되었으며 총량 기준으로 2017년에
감소했다가 2018년부터 등락을 보이고 있으며 건설 폐
기물이 차지하는 비율이 약 45%로 상당합니다. 
∙ 건설폐기물을 제외한 일반폐기물과 지정폐기물의 발생
량을 분석해보면 2017년과 2018년에는 전년대비 각각
2.1%, 1.7%로 증가하였으나 2019년에 전년대비 약
7.4% 감소했습니다. 또한 일반폐기물이 지정 폐기물보
다 더 큰 감소량을 보였습니다.",12,"폐기물 발생량 폐기물 총량은 일반 폐기물, 지정폐기물, 건설폐기물을 모두 포함하여 산정되었으며 총량기준으로 2017년에 감소했다가 2018년부터 등락을 보이고 있으며 건설폐기물이 차지하는 비율이 약 45로 상당합니다.건설폐기물을 제외한 일반폐기물과 지정폐기물의 발생량을 분석해보면 2017년과 2018년에는 전년 대비 각각 2.1, 1.7로 증가하였으나 2019년에 전년 대비 약 7.4 감소했습니다. 또한 일반폐기물이 지정폐기물보다 더 큰 감소량을 보였습니다.",2, 증가하였으나 2019년에 전년 대비 약 7
