,제목,내용
213,"이상운 물리학과 교수, 경기도 젊은 과학자상 수상","우리 학교 물리학과 이상운 교수가 ‘제1회 경기도 과학기술인상’ 수상자로 선정됐다. 이상운 교수는 ‘경기도 젊은 과학자상’ 부문에서 수상했다.  경기도는 올해 처음으로 ‘경기도 과학기술인상’을 신설, 지난 10월29일 성남 경기창초경제혁신센터에서 개최된 ‘경기도 과학기술 통합 페스티벌’에서 시상식을 열었다.우리 학교 이상운 교수를 비롯해 총 6명의 과학기술인이 수상자 명단에 이름을 올렸다. 이상운 교수는 도내 반도체 기업들과의 연구 협력을 통해 지역경제와 반도체 산업의 활성화에 큰 역할을 한 점을 인정받아 ‘젊은 과학기술인상’을 수상했다.   '제1회 경기도 과학기술인상'은 총 6개 부문에서 각 1명의 수상자를 배출했다. 우리 대학 이상운 교수 이외의 수상자는 다음과 같다. 경기도 과학기술인상(대학부문) 한양대학교 방진호 교수 경기도 과학기술인상(연구기관부문) 경기도경제과학진흥원 최용문 팀장 경기도 과학기술인상(기업부문) 아모레퍼시픽 김주원 수석연구원 경기도 여성과학기술인상 차세대융합기술연구원 윤은영 연구실장 경기도 과학기술 공로상 한국원자력안전재단 김성욱 팀장이다. 수상자는 경기도지사 명의의 상패를 받았다. 1차와 2차 심사를 거쳐 최종 수상자를 선정했다. 경기도 내에서 과학기술 연구활동을 하는 연구자 중 우수한 과학연구 개발과 과학진흥 풍토 조성 등 지역과학기술발전에 기여한 공이 큰 대학, 연구기관, 기업체 소속원 또는 개인이 대상이다. 경기도는 이번 경기도 과학기술인상 신설을 통해, 경기도 내 우수한 과학기술 연구자를 발굴해 과학기술인의 사기진작을 도모하고, 연구 의욕을 고취하는 데 기여할 것으로 기대한다고 밝혔다."
214,,"약학대학에서 이틀에 걸쳐 전문가 초청 세미나와 약사가운 수여식를 진행한다.  오는 11월4일 열리는 약사가운 수여식은 실무실습을 앞둔 5학년 예비 약사들이 약사 가운을 착용하고 디오스코리데스 선서를 하는 행사이다. 디오스코리데스 선서는 약학대학 학생들이 전문 약사로서 살아가기 위한 책임감과 의무를 다지는 의미를 담고 있다.  이번 수여식에는 경기도약사회 박영달 회장 수원시약사회 한희용 회장, 한국병원약사회 이영희 회장(아주대병원 약제팀장)과 우리 학교 정이숙 글로벌제약임상대학원장이 참석해 축사를 전할 예정이다.  한편, 수여식에 앞선 11월3일 오후 1시에는 아주대 약과학연구소 Ajou-BEST센터가 주관하고 아주대 AP연구사업단과 식약처 의약품 규제과학인재양성사업이 후원하는 세미나가 진행된다.   ‘신약개발과정의 이해–생체장벽조절 환자 맞춤형 의약품 개발’이라는 주제로 열리는 이번 세미나는 약학 및 제약분야에 관심이 있는 대학원 진학 희망자 및 대학원생들을 대상으로 온·오프라인 동시 진행될 예정이다.  등록기간은 10월15일부터 11월1일까지이며 등록비는 무료이다. 오프라인 행사 장소는 다산관 지하 B-121호이며 선착순 25명을 모집한다. 오프라인 행사 참석자에 한해 현장에서 교재를 제공한다. 온라인은 선착순 250명까지 참여할 수 있다.  * 참가 신청 및 기타 문의: csa99@naver.com* 사진 출처: 아주대학교 약학대학 페이스북"
215,"하은진∙남훈 기부자, 기부금 전달식 열려","하은진 ㈜제이엠코퍼레이션 대표와 남훈 ㈜현민아이디 대표의 기부금 전달식이 진행됐다.28일 율곡관 총장실에서 열린 기부금 전달식에는 하은진 ㈜제이엠코퍼레이션 대표와 남훈 ㈜현민아이디 대표가 참석했다. 학교에서는 박형주 총장을 비롯한 주요 관계자들이 자리해 기부자 예우품을 전달하고 감사의 뜻을 전했다. 하은진 ㈜제이엠코퍼레이션 대표는 전자공학과 장학기금으로 지난 2016년부터 2021년까지 매달 50만원을 기부, 총 3000만원을 쾌척했다. 하 대표는 전자공학과 15학번 김지승 동문의 모친으로, ㈜제이엠코퍼레이션은 정밀기기 및 과학기기 도매업을 영위하는 기업이다. 남훈 ㈜현민아이디 대표는 우리 학교 경영대학원 재학생으로서, 경영대학 발전기금으로 1000만원을 기부했다. 남훈 대표가 운영하는 ㈜현민아이디는 섬유제품 제조 기업이다.박형주 총장은 “우리 대학은 동문, 기부자들과 함께 50년 가까운 시간을 걸어왔다”며 “앞으로도 아주가족의 인연으로 동행할 수 있기를 기원한다”고 전했다. * 사진 왼쪽부터 허준석 전자공학과 부학과장, 하은진 기부자, 박형주 총장, 남훈 기부자, 강주영 경영대학장* 이번 행사는 코로나19 방역지침을 준수한 가운데 진행되었습니다."
216,,"우리 학교 대학원 환경공학과 석사과정 손규원 학생과 공과대학 환경안전공학과 3학년 정성은 학생이 한국대기환경학회가 주최한 '제1회 대학(원)생 미세먼지 연구논문 공모전'에서 각각 우수상과 장려상을 수상했다. 이는 전국 약 100여명의 대학(원)생 및 박사과정 연구원들이 발표자로 참여한 가운데 거둔 성과다.  이번 공모전 시상식은 지난 10월20일부터 22일까지 온·오프라인으로 개최된 한국대환경학회 학술대회에서 이뤄졌다. 공모전 주제는 미세먼지와 관련한 대기환경 대기환경관리 기후환경 분야 연구로, 우리 학교에서는 대학원 환경공학과 손규원 학생과 학부 환경안전공학과 정성은 학생이 참여했다. 발표 지도는 김순태 교수(환경안전공학과)가 맡았다.  손규원 학생은 인체 발암성이 높은 물질로 알려진 '원소탄소(EC)'의 지역별, 오염원별 기여도를 분석하고,향후 관리가 우선되어야 할 배출원을 선별하여 제시했다. 원소탄소는 노후된 자동차 및 연소과정에서 발생하는 초미세먼지 성분 중 하나로, 지구온난화를 가속하고 인체에 악영향을 끼치는 물질로 알려져 있다.   정성은 학생은 국내 복잡 지형이 초미세먼지 농도와 구성 성분에 미치는 영향을 분석했다. 분지가 많고, 복잡한 해안선으로 이루어진 우리나라의 지형을 살펴보고 대기오염물질 배출원의 입지 선택의 중요성에 대해 설명했다.두 학생의 지도를 맡은 환경안전공학과 김순태 교수는 ""많은 박사과정 및 대학원생이 참여한 이번 공모전에서 3학년 학부생의 장려상 수상은 연구를 얼마나 열심히 했는지의 성과를 보여준 것""이라며 ""많은 학생들이 전공 관련 학업과 연구에 더 많은 관심을 가져주길 바란다""고 전했다.  한편, 1983년 창립된 한국대기환경학회는 대기환경 분야의 학술 및 기술 진흥과 발전을 위해 기술 및 지식 교류 학술연구 발표회 학술 및 기술적 연구조사 전문가 양성 등의 사업을 진행하고 있다.* 사진 설명: 김순태 교수와 손규원 학생(좌) / 김순태 교수와 정성은 학생(우)"
217,,"우리 학교 건축학과 학생들이 <LH 대학생 주택건축대전>에서 대상과 동상, 장려상을 수상했다. <LH 대학생 주택건축대전>은 1995년부터 시작된 공동주책 분야 공모전으로 올해에는 ‘공감하는 주거 : 공생, 공감하는 새로운 주거 문화’를 주제로 열렸다. 전국 68개 대학에서 196개팀이 참가, 대상과 금상을 비롯해 총 20개팀이 수상의 영광을 안았다.우리 학교 김유은·박성전 학생(건축 16)이 보호 종료 아동을 위한 주거 공간 ‘Room in Room’으로 대상을 차지했다(맨 위 사진). 대상 팀은 보호 종료 아동을 위한 주거 공간을 제시하면서, 주변 교육 공간을 활용한 학습 지원과 인근 대학생 공동 거주를 통한 멘토링 연계를 함께 제안했다.이혜준·손은지 학생(건축 16)은 로컬 크리에이터들이 정체성을 찾아가는 ‘미로’가 담긴 공동 주택을 제안해 동상을 수상했다. 장려상을 받은 어윤범·이형민 학생(건축 16)은 첨단 산업에 종사하는 메이커들을 위한 주거 공간을 제안, 대학생부터 업계 종사자까지 함께 교류하고 성장할 수 있는 환경을 기획했다.이번 대회 동상 이상 수상팀에는 포상과 LH 입사 지원 시 서류 면제 등 가산점이 부여된다. 수상작은 10월27일부터 11월1일까지 LH 본사 1층에 전시되며, 홈페이지를 통한 온라인 전시도 병행된다.  <동상 수상작, 로컬 크리에이터들을 위한 '미로' 공동 주택><장려상 수상작, 첨단 산업 종사자들을 위한 교류와 성장의 공동 주택 제안>"
218,콘티넨탈코리아 오희근 대표 방문... 해외 인턴 및 교류 확대 논의,"콘티넨탈코리아의 오희근 대표와 관계자들이 우리 학교를 방문했다. 양 기관의 해외 인턴 및 교류 확대에 관련해 의견을 나누고 협력하기 위해서다.  지난 26일 콘티넨탈코리아 오희근 대표와 조성훈 이사는 율곡관 총장실에서 박형주 총장과 환담했다. 이어 제1회의실로 자리를 옮겨 손정훈 국제협력처장, 권용진 산학협력단장, 김은하 학생처장 등 교내 관계자들 및 지난 2021학년도 1학기 파란학기 우승팀 ‘Lazy Monday’팀과 함께했다.  이 자리에서 손정훈 국제협력처장과 권용진 산학협력단장이 우리 학교의 국제 교류 등의 교육 현황 및 산학 협력 활동에 대해 소개했으며, 지난 학기 파란학기 우승팀인 Lazy Monday팀은 파란학기 참여를 통한 음악 엔터테인먼트 도전 사례를 발표했다. 창업 동아리 ‘지니컵’팀의 창업 우수사례도 소개되었다.  오희근 대표는 “학생들이 파란학기를 통해 직접 기획부터 제품 제작, 유통 등 창업으로 이어가는 모습이 인상 깊었다”며 “학생들의 다양한 아이디어 및 커리어 개발을 위한 인턴쉽 확대와 연구·개발 교류 활성화 방안을 모색해보겠다”고 전했다.  콘티넨탈은 독일 하노버에 본사를 둔 글로벌 자동차 부품제조사로 타이어 브레이크 시스템 전자장치 안전장치 파워트레인 및 섀시 구성요소 등을 제조하고 있다."
219,,"우리 학교 경제학과 김임겸 학생이 ‘2021년도 제3회 대학생기자단 통일기자 경진대회’에서 우수상을 수상했다.  통일교육협의회가 주최한 이번 ‘전국 대학생기자단 통일기사 경진대회’는 지난 8월21일부터 9월13일까지 기사 작성 교육과 ‘아프가니스탄 사태가 북한에 미치는 영향’을 주제로 기사 작성 공모전 방식으로 진행됐다.  김임겸 학생은 ‘혼돈의 아프간, 북한은 웃고 있다’라는 제목의 기사를 작성했다. 기사는 올해 8월 발생한 탈레반의 아프가니스탄 재집권 사태의 원인을 밝히고 북미간 지속적 외교적 갈등에 기초한 북한의 대미 외교 우위 확보 전략으로 해석했다. 이어 급변하는 한반도 정세에 따른 유연한 외교 전략의 필요성을 강조했다.  이번에 우수상을 수상한 김임겸 학생은 “25살이라는 나이에 신입생이 되어 불안한 마음이 있었지만 한편으로 세상에 더 많이 부딪히고 경험해 보고자 한 게 수상까지 이어진 것 같다”고 전했다.  한편, 2019년 시작한 ‘전국 대학생기자단 통일기사 경진대회’는 대학생들의 통일공감 형성과 그에 따른 홍보 및 기사작성 능력 배양을 목표로 개최되고 있다.  #김임겸 학생 기사 보러 가기 "
220,2021 아주 바이오·헬스 사이언스 리서치 페어 개최,"우리 학교 바이오·헬스 사이언스 연구자들이 한 자리에 모이는 ‘2021 아주 바이오·헬스 사이언스 리서치 페어’가 오는 11월1일부터 5일까지 온·오프라인으로 개최된다.  올해로 3회째를 맞이하는 이번 행사에는 우리 학교 의과대학과 간호대학뿐만 아니라 정보통신대학, 약학대학과 외부 기업 등의 다양한 분야와 기관의 연구자들이 참여한다. 행사는 5일 간 각 분야별 연구 성과를 공유하는 리서치포럼 KMU/AUSOM International Conference 의약학 공통심포지엄 등으로 구성된다.   행사 첫날에는 서울대 의과대학 묵인희 교수와 우리 학교 의과대학 주일로 교수의 기조강연이 진행된다. 또한 젊은 연구자들을 위한 Ajou Young Investigator Forum이 진행된다.   이외에 의과대학 학생과 대학원생을 위한 리서치 페어와 ‘바이오/헬스케어 창업기업 연구자를 위한 전략과 지원’을 주제로 한 산학협력특강도 마련되어 있다. 산학협력특강에서는 개방형실험실과 바이오코어 퍼실리티를 중심으로 한 바이오창업기업 지원 사례와 창업을 준비하는 연구자를 위한 전략 등이 소개된다.  온·오프라인으로 진행되는 이번 ‘2021 아주 바이오·헬스 사이언스 리서치 페어’는 Zoom 실시간 중계를 통해 온라인으로 참여가 가능하다. 오프라인 행사는 아주대학교의료원 별관 대강당에서 진행된다.   # 온라인 참여 방법은 첨부의 행사 브로셔에서 확인하실 수 있습니다. "
221,"中 북경석유화공대와 MOU, 인공지능 연구센터 설립키로","우리 학교와 중국 북경석유화공대학이 연구‧교육 협력을 위한 MOU를 체결했다. 협약식은 지난 20일 온라인 개최됐다.두 대학은 이번 협약을 계기로 국제인공지능 공동연구센터를 설립하기로 하고 인공지능 컴퓨터 공학 제어공학 분야를 중심으로 상호 긴밀한 협력관계를 맺기로 협의했다. 또한 두 대학 간 교원 교류를 통해 연구 부문에서 활발히 교류하고, 석‧박사급 고급 인재 양성을 위해 긴밀히 협력하기로 했다. 온라인으로 열린 이번 협약식 행사에는 우리 학교 손정훈 국제협력처장, 윤천석 국제협력부처장, 정태선 소프트웨어학과장, 이동렬 국제교육센터장, 김재은 국제교류팀장과 북경석유화공대학의 DING Fuchen 국제협력 처장, LIU Qiang 교수, WANG Xuezhong 교수, XU Feng 교수, ZHAO Yixing 교수를 비롯한 두 대학 관계자들이 참석했다. 중국 북경석유화공대학은 지난 1978년 설립되었으며, 에너지와 화학공학을 중점적으로 연구하고 있다. 이 대학은 최근 로보틱스 컴퓨터 비전 인지 컴퓨팅 자연언어 처리 등 최신 IT 분야에 중점을 두고 연구와 교육 활동을 이어가고 있다. "
222,,"우리 학교 쩐 지에우 링(Tran Dieu Linh) 연구원이 2021년도 한국생체재료학회 추계총회 및 학술대회에서 우수논문발표상을 수상했다.   이번 추계 한국생체재료학회는 지난 9월30일부터 10월1일까지 온라인과 오프라인 병행으로 진행되었으며 생체고분자 생명공학 고분자공학 의공학 등 생체소재 관련 분야 논문들이 발표되었다.  링 연구원의 논문 제목은 ‘Promoting the endothelialization and anti-inflammation by nitric oxide releasing hydrogel for chronic wound treatment’으로, 향상된 혈관내피세포 증식 및 항염증 특성 등 다양한 생의학적 응용력을 지닌 주입형 하이드로젤 개발 내용을 담고 있다. 논문 지도는 박기동 교수 (응용화학생명공학과·대학원 분자과학기술학과)가 맡았다.  하이드로젤은 다량의 수분 함유 및 쉽게 분해되지 않는 특성을 지니고 있어 체내 약물 전달, 임플란트 및 생체접착제로의 개발이 진행되고 있다. 특히, 겨자무과산화수소(HRP) 및 과산화수소(H2O2) 촉매 하이드로젤화 시스템은 취급이 용이하고 조절이 가능한 특성으로 많은 관심을 받고 있다. 그러나 하이드로젤을 이용한 조직재생 과정에서 혈관내피세포의 증식 유도와 체내 임플란트에 따른 염증 억제에 대한 어려움이 있었다.이번 연구에서는 황산구리(CuSO4)를 활용해 효과적인 조직재생을 위한 혈관내피세포의 증식과 염증을 억제할 수 있는 산화질소(NO) 방출형 재료를 개발했다. 황산구리를 통해 항염증 및 세포증식 효능을 지닌 산화질소를 하이드로젤에 고정하고, 체내 물질과 상호작용하여 산화질소 가스를 방출하는 재료를 개발한 것. 하이드로젤에서 생성되는 산화질소 가스는 혈관내피세포의 증식과 항염증 특성을 나타내며 동물실험에서도 조직내 혈관 형성을 이루는데 성공했다.이번 연구 성과를 적용하면 산화질소 방출형 하이드로젤이 내피세포화 증진 및 항염증과 같은 조직재생을 넘어, 보다 광범위한 의료용 생체재료로 사용될 수 있을 것으로 전망된다."
223,"도구박물관, ‘2021년 올해의 대학박물관상’ 수상","우리 대학 도구박물관이 (사)한국대학박물관협회가 수여하는 ‘2021년 올해의 대학박물관상’을 수상했다.  도구박물관은 지난 10월14일 한양대학교 박물관에서 개최된 ‘(사)한국대학박물관협회 창립 60주년 기념 제70차 정기총회’에서 ‘2021년 올해의 대학박물관상’을 수상했다.  지난 1990년 11월 개관한 도구박물관은 전시 매장문화재 학술발굴조사 학술지 『科技考古硏究』 발행 지역사회 학술대회 개최 등 다양한 사업을 이어오고 있다.  특히, ‘길 위의 인문학’ 및 ‘지역문화예술 플랫폼 육성사업’에 선정되어 2018년부터 중·고등학생들을 대상으로 한 특별전시 ‘툴툴씨네 가족이야기’, ‘찾아라 툴툴씨의 의·식·주’ 등 다양한 교육 및 프로그램을 성공적으로 운영해 오고 있다. 또한, VR을 이용한 온라인 전시 ‘집에서 만나는 생활 속 전통 이야기’를 개최하는 등 지역사회의 문화 발전과 교육 사업에 기여한 공을 인정받아 상을 받았다.  한편, 올해의 대학박물관상은 전국 대학박물관이 회원으로 구성된 (사)한국대학박물관협회에서 대학박물관의 발전과 다양한 활동을 통해 지역 사회에 기여한 공로가 큰 대학박물관을 한 곳을 선정해 수여하는 상이다."
224,"분자과학기술연구센터 연구원, 한국여성과학기술단체총연합회 젊은 과학자상 수상","우리 학교 분자과학기술연구센터 르 타이 푸엉(Le Thi Phuong) 연구원이 2021년도 한국생체재료학회 추계총회 및 학술대회에서 ‘한국여성과학기술단체총연합회 젊은 과학자상’을 수상했다.  이번 추계 한국생체재료학회는 지난 9월30일부터 10월1일까지 온라인과 오프라인 병행으로 진행되었으며 생체고분자 생명공학 고분자공학 의공학 등 생체소재 관련 분야 논문들이 발표되었다.  푸엉 연구원은 ‘Enhanced Osteogenic and Antibacterial Effects of O2/H2O2 Dual Releasing Injectable Hydrogels’ 이라는 논문으로 한국여성과총 젊은과학자상을 수상했다. 논문 지도는 박기동 교수(응용화학생명공학과·대학원 분자과학기술학과)가 맡았다.  논문은 향상된 줄기세포의 기능 조절과 항균 특성으로 다양한 생의학적 응용력을 지닌 주입형 하이드로젤의 개발 내용을 담고 있다.하이드로젤은 물과 젤리의 합성어로, 외부 자극 없이 쉽게 분해되지 않는 특성을 지니고 있어 체내 약물전달이나 임플란트 및 생체접착제로 개발이 진행되고 있다. 특히, 주입형 하이드로젤은 다양한 질병의 치료 및 조직재생을 위한 치료 수단으로 주목받고 있으며 겨자무과산화효소(HRP) 및 과산화수소(H2O2) 촉매 하이드로젤화 시스템은 취급이 용이하고 조절이 가능한 특성으로 많은 관심을 받고 있다. 그러나 과산화수소의 직접적인 첨가는 하이드로젤 내 세포에 독성 및 부작용을 유발할 수 있다는 문제점이 있었다.이에 이번 연구에서는 동일한 촉매 반응을 이용하여 세포 사멸과 부작용을 유발하지 않으면서 하이드로젤을 제조하여 적용하는 치료법을 개발했다.과산화칼슘(CaO2)은 칼슘(Ca2+), 산소(O2), 관산화수소(H2O2)를 생성하는 물질로서, HRP와 CaO2의 농도를 조절하여 HRP/H2O2 촉매 반응을 통해 하이드로젤의 물리 화학적 특성을 쉽게 제어할 수 있다. 또한, 하이드로젤에서 Ca2+, O2, H2O2의 지속적인 방출은 박테리아 성장을 억제하면서 인간 간엽 줄기 세포의 부착, 이동 및 분화를 유도할 수 있다. 이번 연구 성과를 활용하면 HRP/CaO2에 의해 형성된 하이드로젤이 조직·뼈 재생 및 감염 치료와 같은 광범위한 생의학적 응용을 위한 유망한 생체재료로 사용될 수 있을 것으로 전망된다."
225,,"우리 학교 정보통신대학이 산업통상자원부 R&D전략기획단의 신산업MD그룹과 긴밀한 협조체제 구축을 위한 업무협약(MOU)를 체결했다.  지난 8일 팔달관에서 열린 이번 행사에는 정보통신대학 김상인 학장, 손태식 사이버보안학과 학과장, 곽진 사이버보안학과 교수와 산업통상자원부 R&D전략기획단 신산업MD그룹 이규택 MD, 이헌구 그룹장을 비롯한 양 기관 관계자들이 참석했다.  양 측은 이번 협약을 계기로 신산업 사이버보안 및 SW융합분야 산업핵심과제 4차 산업혁명 신기술 기반 신산업R&D전략 연구 대학 인적자원 활용 및 육성 등에 대해 긴밀히 협력하기로 했다.  산업통상자원부 R&D전략기획단은 산업기술혁신촉진법에 의거하여 설립된 기관으로 산업기술 정책발굴 산업R&D투자 전략수립 사업R&D기획 역량 고도화 등이 업무를 수행하고 있다. 이 중 신산업MD그룹은 바이오 지식서비스 및 엔지니어링 스마트제조 스마트전자 디자인 의료기기 이차전지 분야의 사업기획과 지원을 담당하고 있다. "
