,제목,내용
708,"아주대-KB국민은행, 주거래은행 업무제휴 협약"," 우리 학교가 KB국민은행과 주거래은행 업무제휴 협약을 체결했다.협약식은 10일 율곡관에서 박형주 총장과 허인 KB국민은행장, 관계자들이 참석한 가운데 열렸다. 이번 협약 체결에 따라 KB국민은행은 우리 학교의 운영자금 관리를 비롯해 교직원 대상 금융편의 제공, 아주대 영업점 입점, ATM기 운영, WM자산관리서비스 등을 지원하게 된다.박형주 아주대 총장은 ""KB국민은행과의 업무제휴 협약 체결을 환영한다""며 ""교류와 협력을 통해 양 기관이 한 단계 더 발전하고 도약하는 동반자가 되기를 기대한다""고 말했다.이어 허인 KB국민은행장은 ""KB국민은행은 21세기 아시아를 리드하는 최고의 대학 아주대학교에 최상의 금융 서비스를 제공하겠다""며 ""양 기관 모두 국민에게 더욱 사랑 받는 기관이 되도록 상생 발전에 노력하겠다""고 전했다."
709,," 아주대학교가 누구나 참여할 수 있는 학교 콘텐츠 경연대회를 개최한다.우리 학교는 이달 2일부터 31일까지 '아주 크리에이티브 콘테스트'를 개최한다. 학부생과 대학원생, 교직원 등 아주대를 사랑하는 사람이라면 누구나 참가할 수 있다. '아주 크리에이티브 콘테스트'의 주제는 <아주의 아이덴티티가 반영된 비주얼 콘텐츠 발굴>이다.모집분야는 이미지·일러스트 부분(에코백 프린트 디자인, 캐릭터·일러스트 디자인 등) 프로모션 부분(기념품 아이템 제안 및 기획, PPT 템플릿 디자인) 영상콘텐츠 부분(아주대 관련 영상제작물) 등 세 개 분야로 구분된다. 참가작품 가운데 우수 콘텐츠에 대해서는 대상(1명, 아이패드 미니) 최우수상(2명, 에어팟) 우수상(3명, 문화상품권 10만원) 장려상(5명, 문화상품권 5만원) 등의 시상이 진행될 예정이다. 참가자 전원에게는 아주대 중앙도서관 카페 음료이용권이 제공된다. 참가를 원하는 사람은 아주대학교 대외협력실(hongbo@ajou.ac.kr)로 이메일 접수하면 된다. 자세한 내용은 학교 홈페이지를 통해 확인할 수 있다."
710,"황순영 학생, 2019년도 한국분자세포학회 '젊은 연구자상' 수상"," 우리 학교 황순영 학생(대학원, 생명과학과)이 한국분자세포학회에서 주최한 2019년도 국제학술대회(International Conference of Korean Society for Molecular and Cellular Biology <이하 ICKSMCB 2019>)에서 올해 젊은 연구자상(Young Investigator Research Award)을 수상했다. ICKSMCB는 지난달 30일부터 이달 2일까지 코엑스에서 열린 국제 컨퍼런스로, 1만 4,000여명의 연구자로 구성된 한국분자세포학회 (KSMCB)가 매년 가을 개최하고 있다. 노벨상수상자를 포함해 2,000여명의 세계적인 연구자들이 참여하는 국내 최고 학술대회이다.황순영 학생이 수상한 'Young Investigator Award'는 생명과학 분야 대학원생 또는 석박사 학위자로서 학계, 산업체 또는 공공기관에서 우수한 연구활동을 하고 있는 젊은 연구자에게 수여되는 상이다.ICKSMCB 조직 위원회와 학회 학술분과에서 심사 절차를 거쳐 대상자를 선정하고, 선정자에게는 소정의 상금이 부상으로 제공된다. 또 ICKSMCB에서 발표 기회를 얻게 된다. 황순영 학생의 발표 제목은 <절단된 DNA에서의 CTCF의 역할> (A role of CTCF at broken DNAs)로, 유전체 손상 중 가장 위험한 DNA 이중가닥이 끊어졌을 때 이를 정확하게 복구할 수 있는 'CTCF' 단백질 작용에 대한 연구이다. 해당 연구는 이종수 교수(생명과학과)의 지도하에 진행된 <생체 내 유전체의 손상을 정확하게 복구하는 조절 시스템 연구>의 성과이다.황순영 학생(생명과학과, 석박사통합과정)은 암을 대상으로 한 연구 분야 중 유전체 손상 반응 연구를 통해 인용지수 11이상인 학술지를 포함한 SCI 저널에 제1저자로 3편의 논문을 발표한 바 있다."
711,"김도희·주소영 학생, 국민은행 'AI 챌린지 공모전' 수상"," 우리 학교 김도희, 주소영 학생(e-비즈니스학과 4학년, 빌리네어팀)이 KB국민은행이 주최한 <2019 Future Finance A.I Challenge> 대회에서 AWS상을 수상했다.KB국민은행은 지난 7월부터 인공지능 금융 서비스 아이디어 발굴을 위해 공모전을 개최했다. 본선은 지난달 3일 이화여자대학교 캠퍼스복합단지에서 진행됐다.이번 대회는 참가팀의 정보는 공개하지 않는 블라인드 식으로 진행됐다. 참가자들은 금융상품과 금융서비스, 고객편의 등 분야의 제한없이 아이디어를 겨뤘다. 이 가운데 '빌리네어'팀이 'OCR기술을 활용한 여행 지출 기반 금융상품 제안'을 주제로 아이디어의 우수성을 인정받아 AWS상을 수상했다. 김도희 학생은 ""아주대학교 E비즈니스학과 학생으로서 전공 지식을 활용할 수 있는 좋은 계기가 됐다""고 말했다. 주소영 학생은 ""앞으로도 미래금융에 기여할 수 있는 인재가 되고 싶다""고 말했다.한편, 이번 대회는 마이크로소프트와 AWS, Pivotal, Megazone Cloud, TDG, Metanet Global이 후원했다."
712,,"우리 학교 재학생으로 구성된 '청사진 협동조합(이사장 김태산, 미디어학과 4학년)'이 수원시지속가능도시재단 물환경센터와 물순환도시 구현을 위한 네트워크 구축에 나선다.청사진 협동조합은 지난달 30일 수원시 지속가능도시재단과 물순환도시를 실현시키기 위한 업무협약을 체결했다. 협약식은 수원시지속가능도시재단 안상욱 이사장과 오현재 물환경센터장, 우리 학교 강경란 LINC+교육혁신부단장, 청사진 협동조합 김태산 이사장 및 기관 관계자들이 참석한 가운데 진행됐다.앞서 청사진 협동조합은 지난 7월 수원시지속가능도시재단 산하 물환경센터를 방문해 물환경센터에서 진행한 '하천입양제'사업에 참여했다. 하천입양제란 수원시민들에게 수원시에 위치한 하천을 입양해 시민들 스스로 하천을 가꾸고 보살피는 사업이다.이번 협약 체결로 청사진 협동조합은 수원시지속가능도시재단의 물순환도시 구현 및 시민인식증진을 위한 활동에 적극적으로 참여할 계획이다. 이를 통해 하천입양제를 통한 하천활동의 활성화에 기여 환경 보전 및 복원을 위한 정보 공유․활용을 통한 협업사업 추진 물환경네트워크 주체에 대한 정책·학습·사업·홍보의 교류 협업사업을 통한 수원시민의 환경인식증진 상호협력 등 수원시 지역 내 물환경 관련 문제들을 해결할 것으로 기대된다.김태산 청사진 협동조합 이사장은 ""앞으로 수원 지역의 물환경과 도시재생 등 다양한 사회적문제 해결 기반을 다져주는 계기가 이번 업무협약식을 통해 마련됐다""며 ""청년들의 추진력과 의지를 긍정적으로 바라봐 주시고 지원해주신 모든 분들께 감사드린다""고 말했다.한편, 협약식에 참석한 강경란 LINC+교육혁신부단장은 ""청사진 협동조합은 지난 6월 '아주대 파란학기제'를 통해 장애인 문제 해결을 위한 전국 청년 아이디어톤 대회를 성공적으로 개최하고, 최근에는 ‘LINC+창업동아리’ 및 ‘다학제 캡스톤디자인’을 통해 콘텐츠 중심의 지역사회 문제 해결에 앞장서고 있다""며 “이번 업무 협약 이후 물환경과 관련된 콘텐츠를 지속적으로 개발하고 시민들이 살기 좋은 쾌적한 마을을 만들어 수원시 도시재생사업에 기여 할 수 있도록 적극 지원하겠다""고 전했다."
713,'2019 Study Abroad Fair' 개최,"가을 학술제 기간동안 재학생을 대상으로 '2019 Study Abroad Fair'가 개최됐다.우리 학교는 지난달 24일부터 3일간 학생들에게 해외 경험과 파견학교의 생활 정보를 공유할 수 있는 장을 마련했다. 이번 '2019 Study Abroad Fair'는 대학혁신지원 사업의 일환으로 국제교류팀이 해외 프로그램을 홍보하기 위해 열렸다. 행사에는 해외 파견학생과 외국인 교환학생 60명을 비롯해 3일동안 1,200여명의 학생들이 참여했다.부스를 방문한 학생들에게는 교환학생 및 단기파견, 글로벌 인턴십 프로그램 등이 소개됐다. 그 외 11월 말에 모집 예정인 교환학생 프로그램, 현재 모집 중인 동계 단기파견 프로그램과 하반기 해외 인턴십 파견에 관심 학생을 대상으로 현장 상담이 이뤄졌다."
714,," 우리 학교 재학생들이 우수 중소·중견기업 '히든 챔피언'을 소개하는 자리를 마련한다.아주대학교 재학생들로 구성된 ‘아주 히든챔피언 학생발굴단’은 오는 2일 16시 다산관 강당에서 '2019 아주 히든챔피언 학생발굴단 선정기업 발표회'를 개최한다고 밝혔다.학생발굴단 12개팀은 지난 여름방학 동안 IT 서비스 및 개발 분야 전자·반도체·화학 제조업 등 다양한 기업 가운데 재학생들에게 소개해주고 싶은 우수 중소·중견기업 44개사를 발굴했다. 이날 학생발굴단에 의해 선정된 히든챔피언 12개 기업이 발표된다. 이번 발표회는 재학생들에게 우수한 중소·중견기업을 알리고, 다양한 시각을 가지고 취업을 준비할 수 있는 계기를 제공하고자 마련됐다. 학생발굴단은 해당 기업의 우수성을 중심으로 선정이유를 발표할 예정이다. 행사는 활동 경과보고 격려사 학생발굴단 발표 평가위원·기업관계자 발표참관 소감 시상 간담회 등의 순으로 진행된다. 우수팀에게는 대상(1개팀) 150만원 최우수상(2개팀) 100만원 우수상(2개팀) 50만원 인기상(3개팀) 15만원 등이 제공된다.아주 히든챔피언 학생발굴단은 올해 6년째 진행중인 프로젝트로, 대기업중심의 취업관을 탈피하고자 아주대학교 대학일자리센터와 LINC+사업단이 주최하고 있다. 아주 히든챔피언 학생발굴단 6기는 5인이 한 팀을 이뤄, 12개팀 총 60명이 참여했다.아주 히든챔피언 학생발굴단 6기는 기업선정 및 조사 방문을 위한 기업연락 인터뷰 보고서 작성 등 학생들이 직접 '히든챔피언' 기업들에 대한 정보들을 수집했다. 팀별로는 담당 컨설턴트들이 배치돼 기업분석방법과 프레젠테이션 발표기술, 컨설팅 등 다양한 형태의 특강이 제공됐다.□ 2019 아주 히든챔피언 학생발굴단 선정기업은 다음과 같다.굿모닝아이텍 와이즈넛 슈피겐코리아 인피니트 헬스케어 동운아나텍 라온 시큐어 나노브릭 이오테크닉스 아크릴 KINX 피타소프트 모아소프트 등 이상 12개사"
715,"나재민 학생, '제29회 신호처리합동학술대회' 우수 논문상 수상","    우리 학교 나재민 학생(대학원, 컴퓨터공학과)이 '제 29회 신호처리합동학술대회'에서 우수 논문상을 수상했다.나재민 학생의 논문 제목은 <특징 분리를 위한 표현학습>으로, 영상 기반 딥러닝 특징 추출 방법에서 복잡하게 얽혀 있는 특징을 가시적으로 분리하는 알고리즘에 대한 연구이다. 해당 논문은 황원준 교수(소프트웨어학과)의 지도하에 진행된 딥러닝 기반 영상 인식 연구'의 성과이다.이번 신호처리합동합술대회에서는 인공지능 기술을 포함한 신호처리 연구 결과와 이론 등에 대한 논문이 발표됐다. 총 4편의 우수논문 가운데 하나로 나재민 학생의 논문이 선정됐다.한편, 신호처리합동학술대회는 신호처리 분야의 다양한 연구결과를 발표하고 토론하는 대회로, 대한전자공학회, 한국음향학회, 한국통신학회, 한국방송공학회 등 4개 학회가 합동으로 주최하는 학술 행사이다.   "
716,'김수정 장학' 10기 장학증서 수여식 열려,"'김수정 장학' 10기 장학생 장학증서 수여식이 지난 17일 율곡관에서 열렸다. '김수정 장학'은 우리 학교 졸업생인 김중권 동문 부부가 지난 2014년 11월 림프암으로 세상을 떠난 딸 김수정 양의 뜻을 기리고자 2015년 기부 약정한 3억원으로 만들어진 장학이다.장학증서 수여식에는 박형주 총장과 각 대학 학장, 학과장들이 함께 자리했다. 김중권(전자73)·서호영 부부는 지난 2015년부터 매 학기 10명의 학생에게 150만원씩 장학금을 지원하고 있다. 올해도 1, 2학기 각각 장학생 10명이 혜택을 받게 됐다. 어려운 환경 속에 학업에 최선을 다하고 있는 학생들이 장학생으로 뽑혔다.김중권 기부자가 학생들에게 장학증서를 직접 전달하며 격려했고, 차지민 학생(경영학과4, 학군단)이 대표로 감사의 편지를 낭독했다.김중권 기부자는 ""아주대 1회 졸업생으로서 학교에 대한 애정과 자부심이 무척 크기에 작은 나눔의 씨를 뿌린다는 생각으로 이를 실천하고 있다""며 ""이렇게 맺은 인연을 소중히 생각하고 김수정 장학에 대한 좋은 기억을 가져주길 바란다""고 말했다.김중권 기부자의 아내인 서호영씨는 ""매학기 장학생을 통해 딸 수정이의 모습을 볼 수 있어 뿌듯하고 감사하다""며 “다른 얘기를 매번 똑같이 알아듣는 사람은 퇴보하며, 다른 대안을 통해 성장할 수 있는 인재가 됐으면 한다""고 장학생들에게 당부했다.이에 박형주 총장은 ""오늘 장학금을 받은 우리 학생들이 기부자님의 뜻을 잘 기억했으면 좋겠다""며 ""어려울 때 손을 내밀어 주신 분들게 감사할 줄 알고, 또 받은 것을 우리 사회에 돌려줄 수 있는 사람들로 성장하길 바란다""고 전했다."
717,,"우리 학교 율곡관 영상회의실에서 사회과학대학 재학생을 대상으로  '제 20회 에세이 경진대회'가 개최됐다.사회과학대학은 지난 23일 율곡관 영상회의실에서 열린 에세이 경진대회에 연구논문 및 보고서, 독서서평, 체험수기 3개 부문에 총 16개의 팀 또는 개인이 에세이 작품이 출품됐다고 밝혔다. 이 가운데 예선을 통과한 9작에 대해 공개발표와 시상이 이뤄졌다.연구논문 및 보고서 부문의 무기명 포스터 심사는 율곡관 1층 로비에서 3일간 공개적으로 실시됐다. 포스터 심사에는 200여명의 학우들이 관심을 가지고 심사에 참여했다.수상자는 연구논문 및 보고서부문(한채연(최우수, 사회학과), 한진주(우수, 행정학과), 구본길(장려, 행정학과), 전하은(장려, 행정학과) 독서서평 부문(노인산(최우수, 정치외교학과), 안주형(우수, 사회학과) 체험수기 부문(윤진원(최우수, 심리학과), 강석훈(장려, 정치외교학과). 최현정(장려, 정치외교학과), 엄경석(장려, 정치외교학과) 등 9개 팀 또는 개인이다. 체험수기 장려상 수상자 3인은 '2019 KOICA 대학교 국제개발협력 이해증진사업'의 일환으로 실시된 베트남 해외 현장활동 참여자로, 지난 8월 현지 교육봉사와 문화 교류 활동에 대한 체험수기를 제출해 호평 받았다."
718,'파란사다리 2기 해외연수' 성과발표회 열려," 2019년도 2기 파란사다리 참가자 학생들의 성과발표회가 지난 18일 저녁 우리 학교 도서관 북카페에서 열렸다.행사에는 올 여름 중국과 미국 명문대학 3곳으로 연수를 다녀온 파란사다리 참가자를 비롯해 박형주 총장과 파란사다리 1기 참가자, 교수 및 직원들이 참석했다.참가자들은 연수 기간 쌓은 경험과 성휘한 개별 도전 및 팀 프로젝트 결과를 공유하고, 그 외 박형주 총장과의 Q&A 시상 경품 추첨 및 다과회 등의 프로그램이 진행됐다.정창재 학생(경제학과 16, 미국 미시건대 파견)은 ""막상 가서 새로운 환경에 부딪혀보고 해보지 못했던 도전을 해보니 스스로를 한 단계 더 발전시키는 경험이었다""고 말했다. 이효진 학생(국방디지털융합학과 18, 워싱턴대 파견)은 ""워싱턴 대학에서 4주간의 생활을 통해 실제 미국 대학생이 된 것 같아 너무 좋았고 좀 더 공부를 열심히 하여 세계에서 영향을 끼칠 수 있는 사람이 되고 싶다""고 소감을 전했다. 이에 박형주 총장은 ""인생은 살다 보면 시행착오도 생기고 계획한 대로 안되는 것도 생기고 좌절의 순간도 있지만 그래도 꿈은 크게 꿔야한다""고 참가학생들을 격려했다.파란사다리 프로그램은 취약 계층 대학생들을 위한 해외 연수 프로그램으로, 우리 학교가 지난 2015년 시작한 'AFTER YOU 프로그램'이 모태가 됐다. 파란사다리 사업은 사회·경제적으로 어려운 여건 속에서도 자기 계발과 진로 개척을 위해 노력하는 대학생에게 해외 연수를 지원하는 사업이다. 교육부와 한국장학재단은 올 한해 총 대학생 1,200명을 선발해 연수 경비를 지원하고, 선발된 학생들은 이번 여름 해외 대학에서의 4주간 어학연수 및 문화체험에 참여했다.올해 우리 학교는 파란사다리 사업의 주관대학으로 선정돼 100명의 학생(아주대 80명, 타대학 20명)을 선발하고 해외 연수를 진행했다. 학생들은 올여름 방학 4주 동안 미국 미시건대학교와 워싱턴대학교와 중국 상해교통대학교에 다녀왔다.참가 학생 선발은 기존의 우리 학교 'AFTER YOU 프로그램”과 같이 학점·어학 등이 아닌 자기 계발과 미래에 대한 잠재력과 의지 등을 기준으로 이뤄졌다. 학생들의 교육 비용은 한국장학재단의 지원(70%)과 우리 학교 유쾌한 반란 기금(30%)으로 마련됐다. 유쾌한 반란 기금은 이 프로그램의 취지에 동참한 교내외 인사들의 기부금으로 조성된다.한편, 2019년도 파란사다리 프로그램에는 우리 학교를 포함해 15개 대학이 파란사다리 사업에 참여했다. 수도권에서 우리 학교와 건국대, 삼육대, 한경대, 인천대가 참여하고 충청·강원권 - 강원대, 충남대, 선문대  호남·제주권- 전북대, 조선대  대구·경북권 - 대구가톨릭대, 대구대, 계명문화대  부산·울산·경남권- 동의대, 신라대가 포함됐다. 주관 대학은 대학별로 연수 프로그램을 운영하고 참여 학생들의 진로 멘토링을 비롯해 프로그램 전후 학생 관리를 맡는다.* 유투브 영상1. 미시간대학교편 :  https://www.youtube.com/watch?v=v1exXk6WmGs&t=5s2. 상해교통대학교편 : https://www.youtube.com/watch?v=AvOUkEXtUik"
719,"서형탁 교수 연구팀, 정부주관 인력양성프로그램 연이어 선정"," 우리 학교 서형탁교수 연구팀 소속 연구원들이 과학기술정보통신부가 주관하는 인력양성프로그램인 '해외 우수신진연구자 유치사업‘과 ’한국 이공계 대학원생 캐나다 연수프로그램‘에 연이어 선정됐다. 연구팀은 이번 사업 수행을 통해 우리 학교 국제공동연구 활성화를 도모할 예정이다. 우리 학교 서형탁 교수(에너지시스템학과·신소재공학과) 연구팀 소속 박사후연구원으로 최근 임용된 란비어 싱 (Ranveer Singh) 박사는 2019년 해외 우수신진연구자 유치사업 공모에 ’전자구조 제어 기반 핫 캐리어 에너지 전환 소재 및 소자 개발‘이라는 연구주제를 제안해 선정됐다. 지도교수는 서형탁 교수가 맡았다. 이번 사업에 선정됨에 따라 4년 4개월간 총 3억여원의 신진연구원 인건비, 체재비, 연구활동비 등을 지원받게 된다.과기정통부와 한국연구재단은 잠재력과 역량있는 해외 신진연구자가 국내에 장기체류해 우수성과를 창출하고 우리나라 연구역량을 강화할 수 있게 성장지원 체계 구축하고자 매년 '해외 우수신진연구자 유치사업‘을 공모하고 있다.란비어 싱박사는 인도 정부의 원자력국(Department of Atomic Energy) 산하 자율 연구 기관인 부바네스와르 물리학 연구소((Bhubaneswar Institute of Physics)에서 물리학 박사학위를 취득해 주사탐침원자현미경을 이용한 다중접합 태양전지의 전자구조 분석에 대한 연구를 수행해왔다.또 같은 연구팀 유일한 학생(박사과정)은 2019년 한국 이공계 대학원생 캐나다 연수프로그램 공모에서 선정된 ’저차원 나노스케일 금속 및 금속산화물을 이용한 이산화탄소 환원연구‘ 연구를 내년 상반기부터 6개월간 캐나다 파견 공동연구를 수행하게 된다. 유일한 학생은 이번 연구를 서형탁 교수를 한국측 지도교수로 하여 캐나다의 맥매스터 대학 (Mc Master Univ, 캐나다 랭킹 4위) 화학공학과의 드류 히긴스 (Drew Higgins) 교수와 공동연구를 위해 제안한 바 있다.  과기정통부와 한국연구재단은 한국과 캐나다 양국 간 인력교류 활동을 추진해 신진연구자들의 연구 활동을 촉진하고 양국의 대학 간 R&D 프로젝트 참여를 통해 연구역량 증진 및 해외연구 경험을 제공하기 위해 '한국 이공계 대학원생 캐나다 연수프로그램'을 매년 공모하고 있다. 해당 연수사업에 선정되기 위해서는 한국연구재단과 캐나다의 Mitacs Globalink Research Award에서 동시에 심사를 통과해야 한다.유일한 학생은 서형탁 교수 연구팀에서 태양광 촉매 분야에서 최근 우수한 논문 결과를 발표하는 등 활발한 연구 활동을 진행하고 있다.서형탁 교수는 ""이번 인력양성사업 선정으로 인도 및 캐나다의 우수 연구 그룹과 자연스럽게 공동연구를 기획·진행하는 구심점이 되고 있으며 아주대의 국제적 위상 재고와 대학원 국제 공동연구 활성화에 기여할 것으로 기대된다“고 말했다.이어 서 교수는 ”지난 8월에 연구실에서 박사학위를 취득한 이상연 박사도 싱가포르 난양이공대에 (세계QS랭킹 12위, 아시아QS랭킹 1위, Best Young Univ.랭킹 세계 1위) 박사후연구원 펠로우쉽에 선정되는 성과을 얻었고, 우리학교 대학원생 들의 우수 해외연구기관 진출과 우수 해외연구자유치에 지속적인 노력을 기울일 예정""이라고 덧붙였다."
720,개교 초기 재직 프랑스 교원 아주대 방문," 개교 초기에 재직한 프랑스인 교수 4명이 부부동반으로 지난 20일 우리 학교를 다시 찾았다.프랑스인 교수 4명은 지난 1975년부터 1980년 사이에 우리 학교 교수로 재직했다. 이들의 방문은 우리 학교 전자공학과 74학번 동문인 권영빈 교수(중앙대 소프트웨어학부)를 통해 성사됐다.이날 프랑스 교수단은 박형주 총장을 접견하고, 불어권협력센터와 전자공학과, 기계공학과를 방문하고 1970년대 초반 우리 학교 초기시절 사진 자료 60점을 중앙도서관 대학사료실에 기증했다. 기증자료는 2023년 개교 50주년을 앞두고 기념사업을 준비 중인 중앙도서관 대학사료실에서 보관 될 예정이다.Michel Joubert 교수(1975년~1977년, 아주대 전자공학과 재직)는 ""지난 40년 동안 발전한 아주대학교의 모습에 감명을 받았으며, 프랑스와의 협력을 시작으로 아주대학교가 성장한 것에 대하여 매우 보람을 느낀다""고 말했다."
