,제목,내용
0,"아주대-LG전자, 모빌리티 및 자동차 분야 교육·연구 협력","우리 학교와 LG전자 VS사업본부가 모빌리티 및 자동차 분야에서의 교육·연구 협력을 위해 업무협약을 체결했다. LG전자 VS(vehicle component solutions) 사업본부는 차량용 인포테인먼트(infotainment), 지능형 운전(connectivity and intelligent driving), 친환경 차량 부품 등의 개발을 맡고 있다.협약 체결식은 지난 10일 우리 학교 율곡관에서 진행됐다. 박장호 아주대 공과대학 학장과 임종락 LG전자 VS연구소장이 협약서에 서명하고 이를 교환했다. 이번 협약을 계기로 양측은 인공지능(AI)을 자동차를 포함하는 모빌리티 분야에 접목, 모빌리티 및 자동차 분야의 연구 협력체계를 구축하기로 했다. 이를 통해 모빌리티 산업의 발전과 AI 융합인재 양성에 함께 힘을 모은다는 계획이다. 특히 학교는 첨단분야 학과로 신설한 AI모빌리티공학과와 자율주행 모빌리티 연구센터(AMRC)를 주축으로 LG전자의 기술 경쟁력 확보를 위한 산학협력 과제 제안 AI융합인재 양성을 위한 교육 협력 연구 인력과 교육 자원의 공동 활용 등에 있어 상호 협력할 계획이다.LG전자 VS사업본부는 모빌리티 및 자동차와 연관된 자동차 부품의 개발을 맡고 있으며, 전기차 부품과 자율주행 센서뿐 아니라 자동차 소프트웨어, 차량용 인포테인먼트 제품에 이르는 전 영역에서 글로벌 유수 자동차 제조사와 지속적으로 사업을 펼쳐가고 있다. VS사업본부는 앞으로 우리 학교 AI모빌리티공학과와 긴밀한 협력을 이어가면서 산업계 니즈를 반영한 교육과정의 개발과 운영을 지원하고, 관련 산학협력 프로젝트도 확대하기로 했다. 박장호 학장은 “아주대는 4차 산업으로 최근 주목받고 있는 모빌리티 분야의 융합 인재 육성을 위해 AI모빌리티공학과를 새롭게 신설, 오는 9월부터 신입생 모집을 시작한다”며 “LG전자를 비롯한 관련 분야 글로벌 기업들과의 긴밀한 산학연 협력으로 학생들의 역량 개발과 진로 설계에 실질적 도움을 줄 수 있을 것”이라고 전했다.임종락 LG전자 VS연구소장은 “LG전자는 자동차 산업의 기술 경쟁력을 키우기 위해 정부의 미래형 자동차 인력양성 사업에 적극 참여하고 있다”며 “모빌리티 분야에서 선도적인 연구력과 교육 커리큘럼을 보유한 아주대와의 협력을 통해 산·학·연 상생 모델을 만들도록 노력하겠다“고 말했다.우리 학교는 올해 공과대학 내에 AI모빌리티공학과를 신설했다. 2023학년도에 첫 신입생을 받는 이 학과는 40명 정원으로, 전통적인 자동차 및 교통 분야 지식과 인공지능·빅데이터·통신과 같은 ICT 학문을 함께 공부할 수 있는 기회를 제공한다. 이후 이를 병합하여 자율주행자동차, 이동 로봇, 스마트 모빌리티 서비스 등의 시스템적 응용 분야로 확대하는 교육과정을 구성하고 있다. 학과는 관련 기업과의 밀접한 산학 네트워크를 기반으로 현장 실습 인턴십 산학 장학생 지원을 활발히 추진하고, 해외 유수 대학과의 학생 교류 프로그램도 진행할 예정이다. 한편  공과대학은 앞서 지난 7월 현대자동차그룹에서 기술 경쟁력 확보 지원 및 인재 육성을 담당하고 있는 현대엔지비(주)와 모빌리티 및 자동차 분야에서의 교육·연구 협력을 위해 업무협약을 체결했다. 양측은 교육과정의 개발 및 운영과 산학협력 프로젝트 확대에 힘을 모으기로 했다. "
1,"e-비즈니스학과 학생팀, 'KB Pay 아이디어 공모전' 최우수상 수상","우리 학교 e-비즈니스학과 학생팀이 KB국민카드가 주관한 'KB Pay 아이디어 공모전'에서 최우수상을 받았다.이번 공모전은 KB국민카드의 간편결제 플랫폼 KB Pay의 이용 활성화 신규 서비스 제안 기능/서비스 개선에 관한 다양한 아이디어 수렴을 위해 열렸으며 총 181개 팀이 참가했다.우리 학교 e-비즈니스학과 김천하·박지원·박성우·주다은 학생이 팀(KB beneFIT)을 구성해 참여, 최우수상 수상의 영광을 안았다. 부상으로 상금 500만원이 주어졌다.e-비즈니스학과 학생팀은 게임적 요소를 적용한 KB Pay 이용 활성화 아이디어를 제안했다. KB Pay 이용 실적에 따라 사용자의 캐릭터를 레벨업 할 수 있고, 일정 레벨 이상이 되면 아이템을 장착할 수 있다. 각 아이템들은 사용자가 자주 결제하는 분야와 연관된 혜택들로 구성되어 있으며, 이를 통해 맞춤형 혜택을 설계할 수 있는 것. 학생팀의 아이디어는 소비 패턴 기반 맞춤형 혜택 전략을 캐릭터와 접목시켰다는 측면에서 높은 평가를 받았다.팀장을 맡은 박성우 학생은 ""빅테크 기업과 카드사의 간편결제 시장 경쟁 속에서, 소비자 입장에서 그들이 원하는 서비스가 무엇인지 생각해볼 수 있었다""고 말했다. 그는 ""e-비즈니스학과 19학번 동기들이 함께 참여했기에 더 큰 시너지를 낼 수 있었다""고 소감을 전했다.주다은 학생은 ""금융업계가 당면한 문제와 향후 방향에 대해 논의해볼 수 있는 좋은 기회""였으며 ""e-비즈니스학과만의 새로운 시각으로 금융 데이터 활용에 접근했기에 높은 점수를 얻은 것 같다""고 말했다.# 사진 설명 : 왼쪽부터 e-비즈니스학과 김천하 학생, KB국민카드 이창권 사장, e-비즈니스학과 박성우·박지원·주다은 학생"
2,"양승철·임석철·범진환 기부자, 기부금 전달식 열려","양승철·임석철·범진환 기부자의 기부금 전달식이 열렸다.지난 7월28일 율곡관 총장실에서 열린 이 날 행사에는 양승철 오현물류(주) 대표이사, 산업공학과 임석철 교수, 기계공학과 범진환 명예교수가 참석했다. 학교에서는 최기주 총장과 조경숙 대학발전본부장, 박장호 공과대학장이 자리했다. 최기주 총장이 아주 가족을 대표해 감사 인사를 전하고 기부자 예우품을 전달하였으며 자리를 옮겨 기부자들과 오찬을 함께 했다.양승철 오현물류(주) 대표이사는 산업공학과 물류소학회 장학기금으로 1000만원을 쾌척했다. 그는 2010년부터 임석철 교수가 지도하는 산업공학과 물류소학회에 기부를 이어오고 있으며, 현재 누적 기부금이 1억2700만원에 도달했다.임석철 교수는 산업공학과 물류소학회 장학기금 1000만원과 1200만원 상당의 의자를 율곡관 제1회의실에 기부했다. 임 교수는 2022년 8월 정년을 맞아 퇴임 예정이다.범진환 명예교수는 지난 2021년 8월 정년퇴임 후 현재 기계설비업체 ㈜이지로보틱스 대표이사를 맡고 있다. 범진환 명예교수는 2021년부터 10년간 총 2억4000만원 기부를 약정하고, 매년 2400만원을 기부하고 있다. 이번 행사에서는 기계공학과 발전기금 및 장학기금으로 각각 1200만원씩 기부했다.#사진 설명 : 왼쪽부터 조경숙 대학발전본부장, 양승철 오현물류㈜ 대표이사, 기계공학과 범진환 명예교수, 최기주 총장, 산업공학과 임석철 교수, 박장호 공과대학장<사진 왼쪽부터 양승철 오현물류(주) 대표이사, 최기주 총장><산업공학과 임석철 교수와 최기주 총장><기계공학과 범진환 명예교수와 최기주 총장>"
3,"안병민 교수 공동 연구팀, 고엔트로피 합금 이용한 고체 수소저장 기술 관련 리뷰논문 발표","<청정 녹색 에너지를 향한 다양한 수소 저장 매체의 발전 과정>우리 학교 안병민 교수가 참여한 국제 공동 연구팀이 고엔트로피 합금을 이용한 고체 수소저장 기술에 대한 리뷰논문을 발표했다. 논문의 제목은 ""미래 고체 수소저장 소재의 응용 및 현안 문제에 관한 전망 및 고찰(A comprehensive review of the prospects for future hydrogen storage in materials-Application and outstanding issues)""이다. 우리 학교 공학연구소 시탈 쿠마 디완간(Sheetal Kumar Dewangan) 박사후연구원이 제1저자로 참여했고, 안병민(첨단신소재공학과·대학원 에너지시스템학과) 교수와 아슈토쉬 샤르마(Ashutosh Sharma, 첨단신소재공학과) 교수는 공동 교신저자로 함께 참여했다. 인도 룽타 공학기술대학의 맨 모한(Man Mohan) 교수, 인도르 인도공과대학의 비노드 쿠마(Vinod Kumar) 교수는 공동 저자로 참여했다.공동 연구팀의 논문은 <국제 에너지 연구 저널(International Journal of Energy Research, Impact Factor 5.164, JCR 상위 1.47%)> 7월18일자 온라인판에 실렸다. <국제 에너지 연구 저널>은 원자력 과학 및 기술 분야 IF 1순위 저널이다.연구팀은 논문에서 고엔트로피 합금(High-entropy alloys)을 이용한 고효율 수소저장 메커니즘을 기존 금속 수소화물 저장 기술과 비교하고 최신 연구 동향을 소개했다. 수소는 탄소중립에 가장 적합한 에너지원으로, 이를 안전하고 효율적으로 저장하는 기술에 대한 연구가 활발히 이루어지고 있다. 현재 수소를 고압으로 압축한 기체저장 방식이 보편적으로 사용되고 있으나, 저장 효율이 낮고 폭발 위험성이 높아 보관 및 운송이 쉽지 않다. 극저온 상태에서 수소를 냉각한 액체저장 방식은 저장 효율은 높으나, 에너지 소모가 크며 장기간 보관에는 적합하지 않다는 한계가 있다. 반면 금속 합금에 수소를 결합하여 저장하는 고체저장 방식은 저장 효율이 우수하고 폭발의 위험성이 없어 수소를 장기간 안전하게 저장할 수 있다. 이러한 특성 때문에 고체 수소저장 기술이 주목받고 있는 것.고체 수소저장 방식 중 특히 고엔트로피 합금(주된 원소 없이 여러 개의 금속 원소를 동등한 비율로 혼합하는 방식)을 이용한 저장 기술이 최근 많은 관심을 받고 있다. 고엔트로피 합금은 극한 환경에서도 우수한 성능을 보이는 합금으로 극저온 재료, 원자력 재료 등 각종 산업 분야에서 주목하는 고기능성·극한물성 소재이다.고엔트로피 합금은 5개 이상의 금속 원소가 동등한 비율로 구성되어 있어 각기 원자 반경이 다르기 때문에 다양한 격자 틈새가 발생한다. 이와 같은 고유의 결정학적 특성으로 인해 고엔트로피 합금은 기존의 수소저장합금보다 저장 효율이 높은 것으로 밝혀졌다. 수소는 금속 원자들 사이의 격자 틈새에 흡착됨으로써 고체상태로 저장되는데, 틈새가 다양해지면 더 많은 수소가 흡착될 수 있기 때문. 연구팀은 최근 개발된 수소저장용 고엔트로피 합금 조성을 비교 분석하고 향후 전망도 제시했다.안병민 교수는 ""고엔트로피 합금 관련 후속 연구를 통해 수소저장 효율을 높이는 것뿐만 아니라, 국제적으로 자원 무기화되고 있는 희토류 원소를 배제하는 고체 수소저장용 고엔트로피 합금 개발을 목표로 하고 있다""고 전했다.한편 이번 연구는 한국연구재단의 과학기술분야 중견연구 및 기초연구 지원사업의 지원을 받아 수행됐다.<금속 결정과 수소의 화학 흡착/탈착을 통해 수소가 합금 내에 고체 상태로 저장/방출되는 원리># 논문 바로가기 : A comprehensive review of the prospects for future hydrogen storage in materials-application and outstanding issues"
4,"기계 강대식∙고제성∙한승용 교수팀, 삼성전자와 인공근육 구동기 개발","우리 학교 기계공학과 강대식·고제성·한승용 교수 연구팀이 삼성전자와 함께 소형 웨어러블 기기에 적용할 수 있는 ‘초경량∙초박형 인공근육 구동기’를 개발했다. 기존의 모터와 차별화된 특성을 가진 인공근육 구동기는 메타버스 기술뿐만 아니라 다양한 분야에 활용될 전망이다.연구팀은 삼성전자와 함께 형상기억합금 기반의 구동기를 개발하여 몰입감 높은 쌍방 소통 촉각기기와 안경형 다중 초점 광학 기기 구현에 성공했다고 밝혔다. 우리 학교 기계공학과의 강대식, 고제성, 한승용 교수와 박사과정에 재학 중인 김동진 연구원, 김백겸 연구원이 참여했다. 삼성전자에서는 신봉수 연구원이 함께 참여했다. 이번 연구 성과는 저명 학술지인 <네이처 커뮤니케이션즈(Nature Communications)> 7월18일 자에 온라인 게재됐다. 논문의 제목은 ‘다기능 인공근육을 이용한 소형 웨어러블 증강현실 기기 구동(Actuating compact wearable augmented reality devices by multifunctional artificial muscle)’이다. 구동기란 압력을 가해 물체를 움직이게 하거나, 인공 근육의 압력을 측정할 수 있는 시스템을 말한다. 최근 메타버스(metaverse)가 주목을 받으면서 이와 함께 증강현실(augmented reality, AR)이나 가상현실(virtual reality, VR)과 관련한 웨어러블 기기에 대한 연구가 활발히 진행되고 있다. 그러나 기존의 기기는 현실과 동떨어진 자극과 높은 시각적 피로도로 인해 몰입감이 낮고 장시간 사용에 는 큰 불편이 따른다. 광학 기기 측면에서 안경형 근안 디스플레이 기기는 고정된 초점으로 인해 시각적 피로도와 어지러움을 유발한다. 촉각 기기 측면에서, 글러브형 촉각 기기는 진동 기반의 현실과 다른 자극을 전달하거나, 무겁고 큰 구조로 인해 착용 편의성이 낮다. 또 몰입감 높은 자극을 전달하는 데는 한계를 보인다. 이에 몰입감을 높이기 위한 AR ∙ VR 구동기와 센서는 작고 가벼우면서도 복잡한 시각과 촉각 기능을 구현해야 한다. 연구팀은 기존 전자기 모터 기반의 구동기가 가진 한계를 해결하기 위해 모터보다 훨씬 큰 출력을 낼 수 있는 인공근육인 형상기억합금 기반 구동기를 개발했다. 형상기억합금 기반 구동기는 0.2g 정도의 가벼운 무게에도 불구하고 10g의 추를 공중으로 던져 올릴 만큼 높은 출력 밀도를 가지고 있다.가벼운 무게와 더불어 구동기의 높이 또한 5mm 이하로 설계할 수 있어, 얇은 소형 웨어러블 기기에도 적용 가능하다. 이번에 개발된 구동기는 압력을 부가할 뿐만 아니라, 전기적 저항이 변화하는 특성을 이용하여 별도의 센서 없이 외부 압력 측정이 가능하기 때문이다.고제성 교수는 “독보적인 특성의 인공근육 구동기를 적용하여 안경형 근안 디스플레이의 초점을 30cm부터 5m까지 조절하며 시각적 어지러움을 해소할 수 있음을 보여주었다”며 “새 기술이 적용된 촉각 글로브는 피부를 변형시켜 실제 손으로 누르는 것과 유사한 느낌을 전달할 수 있음 역시 확인했다”고 밝혔다. 뿐만 아니라 압력을 감지할 수 있는 기능을 이용하여 시∙청각 장애인이 원하는 단어를 점자의 형태로 받아들이고 보낼 수 있는 텔레햅틱(telehaptics) 기술의 가능성도 선보였다. 텔레햅틱이란 촉각을 원격으로 재현하는 기술을 말한다. 한편 이번 연구는 과기정통부 개인기초연구(신진연구) 사업과 삼성전자 산학연구 지원을 받아 수행되었다.<인공근육 구동기를 통한 광학∙촉각 웨어러블 기기># 제일 위 사진 - 왼쪽부터 기계공학과 강대식 교수, 고제성 교수, 한승용 교수, 김동진 연구원, 김백겸 연구원"
5,"아주대·서울대 공동으로, 암·퇴행성 질환 치료에 새 희망 제시","아주대·서울대 공동 연구팀이 암·퇴행성 질환을 치료하고 노화를 억제할 수 있는 세포 자가 포식 작용(오토파지, Autophagy)의 새로운 유전자 조절 메커니즘을 밝혀냈다.박대찬 교수(생명과학과·대학원 분자과학기술학과, 사진 오른쪽)는 공동 연구팀이 포도당 결핍 상황에서 일어나는 오토파지 유전자들의 발현을 조절하는 새로운 후성유전학적 조절 메커니즘을 밝혀냈다고 발표했다. 해당 연구는 ‘인핸서 활성화를 통해 포도당 결핍 유도 오토파지의 후성유전적 조절에 핵심적 기능을 하는 PHF20(PHF20 Is Crucial for Epigenetic Control of Starvation-Induced Autophagy through Enhancer Activation)’라는 논문으로 옥스퍼드대학에서 발간하는 세계적 저널 <핵산 연구(Nucleic Acids Research)> 7월13일자에 온라인 게재됐다. 박대찬 아주대 교수(생명과학과·대학원 분자과학기술학과)와 백성희 서울대 교수(생명과학부)가 공동 교신저자로 참여했다. 제1저자로 아주대 김재훈 연구원(대학원 분자과학기술학과, 사진 왼쪽)과 서울대 박세원·오성룡 연구원(생명과학부)이 함께 참여했다. 오토파지(Autophagy)는 세포의 항상성 유지와 외부 스트레스로 인한 세포 손상을 막기 위해 필수적인 과정으로, 세포 내의 필요 없거나 손상된 단백질과 세포 소기관을 분해하는 과정을 말한다. 이 과정에서 오토파지를 일으키는 데 필요한 오토파지 단백질들도 함께 분해된다. 때문에 일정한 수준의 오토파지가 유지되기 위해서는 오토파지 유전자가 활성화되어 오토파지 단백질들을 만들고, 세포 내 오토파지 단백질의 양이 충분히 유지되어야 한다. 오토파지가 제대로 조절되지 못하면 암과 퇴행성 뇌신경 질환을 비롯한 질병이 발생하며, 노화를 촉진하기도 한다. 이에 전 세계적으로 오토파지 조절을 통해 이러한 질병들을 치료하기 위한 연구가 활발히 진행되고 있다. 그러나 포도당 결핍 같은 실제 세포 스트레스 상황에서 세포 내의 유전정보가 어떻게 오토파지 단백질의 생성으로 이어지는지에 대해서는 아직 잘 알려져 있지 않아 더 심도 깊은 연구가 필요한 분야였다.  공동 연구팀은 세포 스트레스 상황에서 PHF20 단백질(히스톤 메틸화 인지 도메인을 가지고 있는 단백질로, 다른 전사조절 인자들과 함께 특정 상황에서 유전자 발현을 조절하는 데 중요한 기능을 수행)이 오토파지 관련 유전자 발현을 증가시킨다는 점을 새롭게 밝혀내는 데 성공했다. PHF20 단백질은 다른 전사조절 인자들과 함께 특정 상황에서 유전자의 발현을 조절하는 데 중요한 기능을 수행한다. PHF20 단백질 같은 히스톤 변형 인지 인자 히스톤 변형 인지 인자(DNA가 감긴 히스톤 단백질에 메틸화, 아세틸화 등 화학적 변형이 일어났을 때 그 구조를 인지하는 단백질)들은 최근 주목받는 생물학적 현상 중 하나인 후성유전학적 전사 조절 과정을 일으키는 핵심 인자로 알려져 있다. 후성유전학적 전사 조절이란 DNA 서열과 무관하게 유전자 발현이 조절되는 과정을 의미하며, 발생 과정이 마무리된 성체에서 나타나는 유전자 발현 변화와 관련되어 있다. 이에 암·퇴행성 질환, 노화 같은 질병과 관련해 연구되고 있지만 정확한 메커니즘에 대해서는 아직 완전히 밝혀지지 않은 부분이 많다. 연구팀은 PHF20 단백질이 결손된 실험용 쥐가 오토파지가 일어나지 못하는 돌연변이 실험용 쥐와 유사한 표현형을 나타낸다는 점에 착안, PHF20이 오토파지 유도 과정에 중요한 역할을 수행할 것이라는 가설을 세웠다. 그리고 실험을 통해 오토파지를 유도하는 세포 스트레스 중의 하나인 포도당 결핍 신호를 처리했을 때, 정상적인 오토파지의 유도가 일어나지 못한다는 점을 확인했다. 이후 연구팀은 대용량 전사체 전사체 데이터와 후성유전학적 정보를 이용해 PHF20 단백질이 조절하는 유전자군을 밝혀냈다. 또 기계학습(machine learning) 분석을 통해 해당 유전자가 위치한 크로마틴 특성을 규명했다. 그 결과 PHF20 단백질이 히스톤 메틸화된 인핸서(enhancer) 부위의 활성화를 통해 오토파지 관련 유전자들의 전사를 촉진 시키는 후성유전학적 전사 조절 메커니즘을 발굴해냈다. 오토파지 유도 신호에 의해 PHF20은 유전자상의 후성유전학적 변형을 인지하여 단백질 복합체를 이루고, 이를 통해 원거리 조절인자인 인핸서를 활성화시켜 오토파지 유전자 발현을 촉진함을 밝힌 것이다.박대찬 교수는 “이번 연구는 오토파지 유전자 발현이 조절되는 후성유전학적 전사 조절 메커니즘을 규명, 오토파지 활성 조절의 근본적 이해를 제공했다는 데 의미가 있다”며 “오토파지 관련 질병 치료제 개발에 새로운 가능성을 제시한 셈”이라고 전했다. 박 교수는 이어 “최근 주목받는 차세대 DNA 염기서열 분석(sequencing) 기술과 기계학습을 적극적으로 도입해, 방대하고 다양한 종류의 데이터를 통합적으로 해석할 수 있었다”며 “최신 생물 정보학과 전통적 생화학적 실험 방법의 융합 사례를 보여줌으로써, 앞으로 생물학 연구에 더 폭넓게 적용할 수 있을 것으로 기대한다”고 전했다. 이번 연구는 우수신진연구자지원사업, 대학중점연구소지원사업, 리더연구자지원사업 지원으로 수행되었다. 포도당 결핍에 의한 세포 자가포식(오토파지,  Autophagy) 유도 과정에서 PHF20 단백질의 기능"
6,"총장이 뛴다! 최기주 총장, 동문기업 두두인터내셔널 방문","우리 학교 최기주 총장이 ‘총장, 동문·유력인사와의 만남’의 일환으로 동문기업인 두두인터내셔널을 방문했다. 두두인터내셔널은 건설장비인 타워크레인의 설계, 엔지니어링 업체로 우리 학교 채교석 동문(기계공학과 84학번, 위 사진 가운데)이 대표를 맡고 있는 기업이다. 지난 21일 최기주 총장과 조경숙 대학발전본부장을 비롯한 우리 학교 관계자들은 충청북도 진천군에 위치한 두두인터내셔널을 방문했다. 이 날 채교석 동문은 '개교 50주년 기념사업기금'으로 1000만원을 기부했다. 채 동문은 이번 기부를 포함하여 그동안 '대우학원 설립자 추모사업', '불어불문학과 장학기금' 등에 총 6000만원을 쾌척했다. 총장은 채 동문에게 ‘아주 리더스 클럽’ 임명패와 예우품을 전달하고, 방문 기념 식수에 참여했다. 채교석 대표는 ""'모든 것을 해낼 수 있다'라는 자신감으로 회사를 이끌어왔다""며 ""새로운 길을 개척해 나가는 모교에 앞으로 힘을 보태고 싶다”고 전했다.이후 총장은 진천군청을 방문, 송기섭 진천군수(아주대 대학원 건설교통공학과 박사)를 만났다. 두 사람은 대학과 지역 사회와의 협력, 교류 방안에 대하여 심도있는 논의를 나눴다. 최기주 총장은 앞으로도 동문 기업과 유력인사를 직접 방문해 교류하고, ‘개교 50주년’을 비롯한 우리 학교의 여러 현안과 교육 철학·목표 등을 알릴 예정이다.<두두인터내셔널 회사 내부를 둘러 보고 있는 최기주 총장과 일행><방문 기념 식수를 하는 최기주 총장과 채교석 동문><우리 학교 동문 송기섭 진천군수(왼쪽)와 최기주 총장(오른쪽)>"
