,제목,내용
508,"강기주 교수(기계공학부), 우수학술연구자 선정","전남대 강기주 교수 2020년 우수학술연구자 선정   전남대학교가 강기주 교수를 우수학술연구자로 선정하고, 표창했다.    정병석 전남대 총장은 2006년 국가지정연구실에 선정된 이래 규칙적인 미세구조를 가진 기계적 메타재료를 개발해 온 강기주 교수(기계공학부. 사진)를 우수학술연구자로 선정하고, 지난 6월 8일 개교기념식에서 연구비 1억원을 지급했다.    강 교수는 최근 금속 와이어로 구성돼 강도가 매우 높고 대량생산에 유리한 팽창성(auxetic) 재료를 개발했다. 이는 보통의 재료가 종 방향으로 압축될 때 횡 방향으로는 팽창하는데 반해 수축하는 특이한 특성을 가지기 때문에 충격흡수 능력이 탁월하다.     또 부드러운 곡면을 가진 박막으로 구성된 재료(일명 Shellular)를 개발하기도 했다. 물의 1/100 이하일 정도로 가벼우면서도 강도가 높아 생체이식용 세포집, 열교환기, 압력용기, 연료전지 등 다양한 용도로 활용될 것으로 기대된다.        이에 대한 논문이 2019년 국제저널 Materials Today(영향력지수 25)에 두 차례 연달아 게재된 바 있다.    지금까지 강 교수는 90여편의 국제저널 논문과 60여건의 국내외 발명특허를 등록하는 등 왕성한 연구활동을 보여주고 있다.    강 교수는 전남대를 졸업하고, KAIST에서 석, 박사를 받은 뒤 지난 1989년부터 전남대 교수로 재직 중이다. 영국 캠브리지대학 포스트닥터, 미국 프린스턴 대학 방문교수를 역임했다."
509,"전남대, 대학 창의적 자산 실용화 2단계 대학 최종 선정","대학 창의적 자산 실용화(BRIDGE+) 전남대 2단계 대학 최종 선정      전남대학교가 ‘대학 창의적 자산 실용화 지원사업’(이하, BRIDGE+사업)의 단계평가 결과 2단계 진입 대학으로 최종 선정됐다.    교육부와 한국연구재단이 지원하는 BRIDGE+사업은 기업이 원하는 제품이나 공정에 필요한 최종수요를 파악해 대학의 유망기술을 이전하거나 대학 간 자율적인 협업을 통해 융·복합 기술사업화를 촉진한다.    전남대는 우수자산 발굴, 기업멤버십(CNU 100 Club) 운영을 통한 파트너십 구축, 기업 최종수요 발굴과 BRIDGE+ 프로그램(R&BD 기획, BM설계, 실용화개발 등) 연계를 통한 기술사업화 성과 우수 등 1단계 사업이 전반적으로 잘 운영됐다는 평가를 받아, 올해 11억여 원의 사업비를 지원받게 됐다.    전남대는 지난 18년 1단계 사업에 선정된 이후 2단계 사업(’20. 3.~’23. 2.)까지 이어 수행하게 됨에 따라, 앞으로 기업의 최종수요와 소·부·장 및 3대 신산업과 연계한 유망기술 사업화와, 기술사업화 재투자 등을 통한 수익 창출을 극대화함으로써 대학 기술사업화의 선도적 역할을 수행할 계획이다.    정병석 총장은 “BRIDGE+사업은 대학 기술사업화의 선순환 모델을 한 차원 더 높일 수 있는 중요한 사업”이라며 “이번 사업 선정을 계기로 기업의 최종수요와 대학의 고부가가치 기술을 연계한 신산업 창출 기반을 확대하고 상생적인 산학협력을 통해 일자리 창출에 기여함으로써 대학의 사회적 기여를 촉진할 것”이라고 말했다.    *문의: 062-530-5151(전남대학교산학협력단 기술경영부)"
510,"2020년도 용봉학술상 이상준, 함유근 교수 선정","2020년도 용봉학술상 이상준·함유근 교수 선정      전남대학교가 교원의 연구의욕 고취와 대학 연구역량 강화를 위해 지난 1997년 제정한 용봉학술상 제23회 수상자로 이상준 교수와 함유근 교수를 선정했다.    이상준 교수(경영학부)는 정보시스템을 조직과 경영업무에 도입하기 위한 사회과학적 접근법과 정보기술 향상을 위한 공학적 접근법을 함께 고려해, 정보기술과 타 산업분야와의 디지털 융합에 관한 연구를 수행했다. 최근 5년간 SCI급 논문 10편을 포함해 KCI 등재지 이상 저널에 주저자로서 60여 편의 논문을 게재했다.    10여개 국내학회에서 종신회원과 부회장 등으로 활동 중이며, 국제학회에서는 매년 우수논문상을 수상했다. 정보기술의 긍정적 역할을 위해 e-비즈니스 기반의 공짜 경제에 관한 연구에 이어서, 최신 정보기술을 이용한 사회문제해결 연구로 지역사회와 실질적으로 교류하고 있다.    함유근 교수(해양학과)는 현재까지 상위 10% 저널에 총 70여편의 SCI 논문을 발표했다.    딥-러닝을 활용한 엘니뇨 예측과 기후 변화 진행시 엘니뇨 강도 변화를 주제로 각각 2019년과 2018년에 Nature 지 제1저자 논문을 게재했다. 그 외에도 해당분야 최상위 저널인 Nature Climate Change, Nature Geosciences 지에 제1저자로 논문을 게재하는 등 탁월한 연구 성과를 다수 이룬 바 있다.    해당 연구는 학계의 큰 주목을 받았으며, 최근의 활발한 연구 업적을 인정받아 2019년 이달의 전남대인, 2019년 차세대과학기술한림원 회원으로 선출됐다.    전남대는 개교 68주년 기념식이 열린 지난 6월 8일 이들에 대해 시상했다."
511,전남대 2년 연속 기초과학연구역량강화사업 대상 선정,"전남대 2년 연속 기초과학연구역량강화사업 대상 선정 여수캠퍼스, 6년간 30억 지원 핵심장비 개선·신규장비 도입      전남대학교가 교육부의 ‘기초과학연구역량강화사업’ 대상기관으로 선정됐다.    전남대 여수캠퍼스 ‘스마트 플랜트 신뢰성 핵심연구지원센터’(센터장 김이곤)는 교육부와 한국연구재단, 한국기초과학지원연구원이 선정한 올해의 ‘기초과학연구역량강화사업’ 대상자로 선정해 지난 8일 발표했다.    교육부의 ‘기초과학 연구역량강화사업’은 대학 R&D 역량을 향상시키고 연구 생태계를 조성하기 위해 연구 분야별로 전문화된 핵심연구지원센터(Core-Facility) 조성·운영을 지원하는 사업이다. 전국 52개 센터 가운데 전남대 등 13개가 최종 선정됐다.    김이곤 센터장은 “교육부로부터 매년 3~6억원씩 최대 6년간 총 30억원을 지원받아, 플랜트 신뢰성 분야 핵심장비의 성능 개선은 물론 신규 장비 도입으로 공동활용을 촉진하며 기초과학연구을 뒷받침하게 된다.”며, “앞으로 연구 장비를 분야별로 집적화한 후 유관 연구분야 거점 조성과 인력양성 등 장기적인 연구기반을 마련해 나가겠다.”고 말했다.    한편 전남대는 지난해 ‘에너지 융·복합전문 핵심연구지원센터’가 기초과학연구역량강화사업에 선정된 이후 2년 연속 이 사업에 선정됐다.    *문의: 061-659-6754(전남대학교 스마트 플랜트 신뢰성 핵심연구지원센터)"
512,"전남대, 대학혁신지원사업 최우수 A등급","대학혁신지원사업 전남대, 최우수 ‘A등급’    미래융합형 인재양성 혁신 등 평가 전년비 증액된 사업비 80억원 확보      전남대학교가 교육부 주관 2019년 대학혁신지원사업연차평가 Ⅰ유형(자율협약형)에서 최고 등급에 해당하는 A등급을 받았다.    이로써 전남대는 지난해 보다 12억원이 증액된 80억 원을 지원받게 됐다.    대학혁신지원사업은 대학의 자율혁신을 통해 국가성장의 토대가 되는 미래형 창의인재양성체제 구축을 지원하는 사업이다. 5개 권역별 연차평가를 통해 A등급(30%), B등급(50%), C등급(20%)으로 구분되며, 사업비가 차등 지급된다.    전남대는 이번 평가에서 사업추진 실적, 사업비 집행의 적절성, 사업환류, 지역사회 혁신성장 기여도 등 사업평가 지표 전반에 걸쳐 높은 점수를 받았다. 특히 대학의 중장기발전계획인 인재양성, 지식연구, 상생발전을 사업전략과 연계해 차별화된 교육혁신 체제를 구축했다는 점에서 우수한 평가를 받았다.    앞서 전남대는 지난 1차년도 사업을 통해 ▲이-러닝 콘텐츠 개발을 통한 원격수업 활성화 ▲통합 스마트 교육시스템 구축 ▲자기주도적 진로 설계 지원 ▲몰입형 학습공간의 재구조화 ▲SNS 기반 창의융합 LMS 구축 등 교육혁신의 기반을 마련했다.    또 학생중심의 교과·비교과 연계활동을 다양한 차원에서 지원하며 급변하는 교육환경에 부응할 수 있는 대학 경쟁력 강화에 힘써왔다.    정병석 전남대 총장은 “지역거점 국립대학으로서 지역혁신의 중심이 돼야 한다소명의식을 갖고 일하고 있다.”며 “대학이 가진 인적자원, 기술자원, 연구자원을 적극 활용해 국가 균형발전을 선도하는 우수인재 육성에 최선을 다하겠다.”고 말했다.    *문의 : 062-530-5136 (전남대학교 기획조정과)"
513,"전국 국공립대학교총장협의회, '코로나 위기 극복' 한 목소리","전국 국공립대학교총장협의회 ‘코로나 위기 극복’ 한 목소리   유은혜 장관 “포스트 코로나 시대 거점 육성” 예산지원, 규정개정, 인프라 구축방안 등 협의       전국 국공립대학교 총장협의회(회장 정병석 전남대 총장)가 6월 11일 유은혜 사회부총리 겸 교육부장관을 비롯한 교육부 관계자와 39개 회원대학 총장들이 참석한 가운데 전남대학교에서 개최됐다.     이날 유은혜 장관은 인사말을 통해 “‘코로나 19’로 인해 한 번도 가보지 않고 아무도 가보지 않은 길을 가고 있다.”면서 “전국 국공립대학들이 방역과 교직원, 학생들의 안전관리에 만전을 기해준 덕분에 조금은 안정적인 새 국면이 시작되고 있다.”고 감사를 표했다.     유 장관은 이와함께 국공립대학들을 위해 ▲대학혁신사업비의 집행기준을 완화해 재정문제를 해소하고 ▲각종 규제에 대한 근본적인 개선책을 마련하겠다고 밝혔다. 특히 포스트 코로나시대에 대비해 대학을 교육혁신의 거점으로 육성해 나가겠다고 강조했다.       이에 정병석 회장(전남대 총장)은 “방역과 학생안전관리에 눈코 뜰 새 없는 유 장관께서 대학재정문제 등 현장상황을 정확하게 파악하고 있어서 기대가 크다.”며, 교육부와 협력해 코로나 위기 극복에 적극 나서겠다고 말했다.     앞서 국공립대학총장들은 ‘코로나 19’로 인한 ▲대학내 수입대체기관들의 세입결손에 대한 지원 ▲자체수입금의 예산편성 및 집행 자율성 보장 ▲공공기관 지역인재 채용할당제 개선 ▲연구실 안전관리 체계 개선 등에 대해 열띤 토론을 벌였다.     특히, 포스트 코로나 시대에 대비한 ▲교수 책임시수 개선 ▲원격강의 요건 완화 ▲온라인교육 인프라 구축 예산 지원 등에 대해서도 깊이 있는 논의가 이어졌다.     총장협의회 참석자들은 12일 국립 5.18민주묘지를 참배한다.    "
514,개교 68주년 기념 축하행사 '풍성'(화보),"전남대학교 개교 기념 축하행사 '풍성'     전남대학교가 개교 68주년을 기념하는 축하행사와 용봉인의 밤 행사를 성대하게 가졌다.    전남대는 지난 6월8일 오후 5시 민주마루 앞 잔디광장에 대형 야외무대를 마련하고, 후광학술상을 비롯해 자랑스러운 전남대인상, 용봉인 영예대상, 용봉학술상, 우수학술연구자상 등을 수여했다. 우수교직원과 장기재직 교직원에 대해서도 표창했다.    정병석 총장은 기념사를 통해 “전남대학교는 미래형대학이자, 연구형 대학이며, 글로벌대학, 지역친화대학, 일등동문대학”이라고 소개한 뒤, “내일의 대한민국을 위해, 인류의 평화를 위해, 어린 느티나무를 든든한 동량으로 키우는데 힘을 모아 나가자.”고 강조했다.       기념사   전남대학교가 개교 68주년을 맞습니다. 숱한 고난과 극복의 역사를 자축하며, 새롭게 도전해나가는 모든 대학 가족과 지역민 여러분의 행복한 미래를 기원합니다.   존경하는 전남대학교 가족 여러분!   우리 대학은 1952년 전쟁의 소용돌이 속에서 문을 열었습니다. 국립대학이지만, 민간의 성금만으로 기틀을 닦았습니다. 도민들은 분배받았던 일제 적산기업의 주식을 내놓았습니다. 유림은 향교재단의 농지증권을 흔쾌히 출연하였습니다. 전라남도는 도의회의 만장일치 결의로 도립대학들의 재산을 국유로 이전하였습니다. 식민지 시대에 억눌렸던 이 지역의 고등교육이, 국립대학이, 오롯이 도민들의 손으로 싹튼 것입니다.   오늘의 전남대학교는 자부심 넘치는 대학 역사를 미래를 향한 희망으로 가꾸어내는 미래형 대학입니다. 17번째 단과대학인 AI융합대학을 지난해 출범시켰고, 내년에는 인공지능과 헬스케어메디컬, 빅데이터, 지능형모빌리티, 석유화학소재공학, 스마트수산자원관리 등 이름만으로도 최첨단인 6개의 학과, 학부를 신설하고, 310명의 신입생을 받습니다.   전남대학교는 연구형 대학입니다. 연구비 금액과 연구과제 수에서 해를 거듭하며 국립대 최상위 수준을 유지하고 있고, 이달 들어서도 460억 원 규모의 면역치료플랫폼 사업을 유치하는데 성공하였습니다. 우리는 글로벌 대학입니다. 62개국 557개 대학과 교류하고, 코로나19 위기 속에서도 2,000명에 이르는 외국인학생들이 재학하고 있습니다.   우리는 지역친화 대학입니다. 대학의 캠퍼스와 체육시설은 인근 주민들의 소중한 힐링 공간으로 가꾸어지고 있습니다. 우리가 만들어낸 캠퍼스타운형 도시재생사업도 제 궤도에 올라 본격적으로 추진되고 있습니다. 최근에 마무리한 민주길은 대학을 찾는 분들이 대한민국의 민주주의 여정을 생활 속에서 느껴보는 문화산책로가 될 것입니다.   우리는 일등동문 대학입니다. 금번 제21대 국회의원 총선거에서 동문들이 거둔 성과는 참으로 눈부십니다. 18명의 걸출한 동문들이 국민들의 선택을 받았습니다. 올해 우리는 100여 년을 거슬러 올라가는 전신학교들에 몸담았던 분들에게 명예졸업장을 드립니다. 510명의 1차 수여자 중에 일제강점기 독립운동을 하다 투옥되어 졸업하지 못한 선배께 드리는 졸업장은 새로운 역사 찾기의 시작이 될 듯합니다.   사랑하는 전남대인 여러분!   우리는 제4차 산업혁명의 물결 속에서 신사회의 도래를 예감하고 있습니다. 더구나 최근의 감염병 위기는 이제는 과거로 돌아갈 수 없다는 포스트 코로나 시대를 예고하고 있습니다. 대학의 연구와 강의도 지속가능성을 확보하려면 끊임없이 새로운 가치를 창출해내야만 합니다. 예상했지만 갑자기 닥쳐온 새로운 시대, 다시없는 기회입니다. 전남대학교는 충실히 준비해왔고, 이제 누구보다 앞서 혁신을 실천해 나갈 것입니다.   우리 대학을 지키는 용봉탑에 새 봉황이 둥지를 틀었습니다. 날아오르는 모습이 웅비하는 전남대인의 기상을 활짝 펼쳐 보이고 있습니다. 우리는 진리를 탐구하고, 과학기술의 발전을 추구하며, 함께 행복한 세상을 밝혀갑니다. 眞理를 밝히는 바른 사람, 創造하며 도전하는 사람, 奉仕하며 더불어 사는 사람 – 교목(校木)인 느티나무 같은 인재들로 가득한 전남대학교. 우리의 느티나무 숲은 나날이 무성해갈 것입니다.   존경하는 대학 가족 여러분!   전남대학교는 줄곧 진리, 창조, 봉사의 교시를 좇아 민주·인권·정의를 지키고 자유와 평화를 위해 헌신하였습니다. 전남대학교의 역사와 전통이 더욱 찬란하게 빛날 수 있도록 우리는 사랑과 정성을 다할 것입니다. 내일의 대한민국을 위해, 인류의 평화를 위해, 어린 느티나무를 든든한 동량으로 키우는데 힘을 모읍시다. 지역에 사랑받고, 국가에 떳떳하며, 세계에 당당한 전남대학교로 함께 나아갑시다.   2020년 6월 8일전남대학교 총장 정병석"
515,전국 국·공립대학교 총장협의회 개최,"전국 국·공립대학교 총장협의회 개최   6월 11일 오후 전남대 본관 대회의실서 전국 41개 회원 대학교 총장 등 참석 유은혜 교육부장관도 ‘교육부와 대화’에      전국 국.공립대학교 총장협의회(회장 정병석 전남대 총장)가 6월 11일 오후 전남대학교에서 개최된다.    이날 협의회는 전국 41개 회원대학 총장들이 모여 국립대학 위상강화, 지역인재 채용할당제 연구실 안전관리체계 등에 대한 개선방안 등을 협의한다. 특히 이들은 ‘코로나19’와 관련해 대학생 현장실습, 온라인 교육 규정 및 인프라 구축 예산 지원, 2학기 학사운영 등에 대해서도 의논한다.    협의회에 이어 진행되는 ‘교육부와의 대화’에는 유은혜 사회부총리겸 교육부장관이 참석해 전국 국.공립대학들의 애로사항을 듣고 고등교육정책에 대해 설명할 예정이다.    협의회는 다음날인 12일 국립 5.18 민주묘지를 찾아 참배한다.    전국 국·공립대학교 총장협의회는 전국 41개 국.공립대학들이 회원교로 참여해, 각 대학간 정책에 대해 논의하고, 교육부에 관련사항을 건의하는 협의체이다. 지난해 12월 선출된 정병석 전남대 총장이 제27대 회장을 맡고 있다.  "
516,"국책연구과제 2건 수임, AI기반 미래형 자동차핵심기술 개발","전남대, 국책연구과제 2건 수행 AI기반 미래형 자동차핵심기술 개발      전남대학교가 인공지능(AI)에 기반한 미래형 자율주행 자동차의 핵심기술 개발에 나선다.    전남대는 과학기술정보통신부(정보통신산업진흥원)가 공모한 자동차 AI융합연구개발 과제 공모에 강현욱 교수 연구팀의 ‘전기자동차 기반 미래차량의 AI 적용 사람중심 지능화 기술개발’ 과제가, 한승회 교수 연구팀의 ‘열악한 자연환경 변화에서 자율주행 차량의 객체인식 제고와 고장 진단을 위한 AI 기반 차량 내·외부 융합 센서 활용 기술 개발’ 과제가 각각 선정됐다.    두 연구팀은 앞으로 5년간 56억원 규모의 사업비를 지원받게 된다.강 교수(기계공학부. 왼쪽 위 사진)팀은 이번 연구과제에서 운전자 생체 및 영상정보, 자동차 안전상태, 자동차 실내환경 정보를 연계한 운전자 맞춤형 인공지능 통합 알고리즘 개발에 나선다. 이는 운전자와 자동차가 실시간으로 상호작용하는 인공지능 플랫폼 기술로, 완전자율주행에 꼭 필요한 선행기술 가운데 하나이다.    이 기술은 운전자의 영상정보와 생체신호에 기반한 운전자의 상태를 실시간으로 AI알고리즘을 통해 1차 판단하고, 차량의 자율주행 수준을 고려해 자동차의 상태진단 및 실내환경 정보를 운전자에게 적합한 형태로 제공해줌으로써, 운전자의 안전과 편의를 증대시키는 AI기반 사람중심 지능화 서비스(Vehicle to human service, VHS)이다.    이 연구에는 전기자동차 전장부품 개발업체인 모트랩㈜(대표이사 김남종)과 ㈜성암에너지(대표이사 염정호)가 함께 참여한다. 또 통합 AI알고리즘을 탑재시킨 VHS 플랫폼 단말기 및 휴먼 인터랙션 모듈을 2024년도까지 개발하고, 한국자동차연구원(미래전장연구센터 센터장 임현택 박사)에서 실차검증을 거쳐 상용화될 예정이다.    이와함께 한승회 교수(기계공학부. 왼쪽 아래 사진)팀은 ㈜인포웍스(대표이사 박현주)와 함께 열악한 환경에서도 자율주행차량의 객체 인식 수준을 높이고, 차량고장 진단을 위한 센서를 활용해 차량 내·외부 융합센서를 활용하는 기술을 개발하고 이를 데이터베이스화하는 핵심 연구를 수행한다.    이 기술은 수요기업인 현대자동차에서도 적용 여부를 적극 검토할 만큼 높은 관심을 표명하고 있는데, 연구팀은 이 과제를 통한 차세대 라이다 기술개발로 관련분야의 세계 시장에서 기술적 우위를 확보할 것으로 내다봤다.    정병석 총장은 “무엇보다도 전남대학교가 광주의 주력산업인 자동차와 인공지능 융합 연구개발을 통해 AI집적단지 활성화에 기여할 수 있게 돼 더 반가운 소식”이라며 “앞으로도 광주지역의 인공지능 산업 생태계 활성화와 주력산업의 혁신기술 확보에 더욱 힘써 나가겠다.”고 말했다."
517,’2020 자랑스러운 전남대인,"’2020 자랑스러운 전남대인          전남대학교가 ‘2020 자랑스러운 전남대인으로 8명의 동문을 선정했다.     전남대는 개교 68주년을 맞아 (묶음사진 위 왼쪽부터) 류혜경, 정석우, 오운열, 김현철, (묶음사진 아래 왼쪽부터) 오병석, 김승남, 송경희, 송갑석 등 모두 8명의 동문을 올해의 자랑스러운 전남대인으로 선정하고, 6월 8일 열리는 개교기념식에서 시상한다.    류혜경 총동창회 상임부회장은 의학과를 졸업한 뒤 38년 동안 지역민은 물론 북한이탈주민 무료검진, 생활보호대상자 무료수술 등 의료봉사를 펼쳐왔다. 광주 아너소사이어티 65호 회원으로, 모교에 발전기금 1억원을 기부했다.    정석우 한국주택건설 대표는 기계공학과 출신으로, 공대 동창회장직을 수행하며 모교발전과 동창회 활성화에 헌신했고, 많은 발전기금을 기부하는 등 후학들의 장학과 교수연구력 증진을 후원해 왔다.    오운열 해양수산부 해양정책실장은 영문학과를 졸업한 뒤, 행정고시를 거쳐 해양수산부의 주요 보직을 두루 거치면서 모교의 명예를 빛냈다. 특히 2012여수세계박람회 지원총괄 업무를 성공적으로 수행해 홍조근정훈장을 수상하기도 했다.    김현철 금호고속 대표이사는 화학공학과 출신으로, 금호그룹의 핵심요직을 두루 거치면서, 광주종합버스터미널 리뉴얼, 문화관 신설, 유-스퀘어라는 새 브랜드를 명명하는 등 참신한 경영능력을 발휘하며, 모교의 위상을 높였다.    오병석 농림식품기술기획평가원장은 농학과를 졸업하고, 기술고등고시에 합격한 뒤 국립종자원장, 농림축산식품부 농촌정책국장, 식품산업정책실장, 차관보 등 주요 보직을 역임하며 국가농업발전에 기여하며, 모교의 이름을 드높였다.    김승남 국회의원은 국문학과생이자 1987년 6월 항쟁 당시 전남대 총학생회장으로, 전대협 부의장, 남대협 초대의장 등을 거치며 민주화운동에 앞장섰고, 제19대에 이어, 21대 국회의원에 당선됐다.    송경희 과학기술정보통신부 소프트웨어정책관은 영문학과 출신으로, 부처내 첫 여성국장으로서 국내외 인터넷 정책분야 대국민보호와 다양한 산업지원 정책으로 국민편익 증진과 국가위상 제고에 기여했다. 특히 나노산업발전에 기여한 공로를 높이 평가받고 있다.    송갑석 국회의원은 무역학과 출신으로, 전남대 총학생회장, 전대협 4대 의장 등을 역임하며 민주화운동에 앞장섰다. 제20대 국회에서 예결위원으로 활약했고, 제21대 국회의원에 당선됐다. "
