,제목,내용
259,전남대 여수캠퍼스 활성화 워크숍,"전남대 여수캠퍼스 활성화 워크숍 전남대학교가 여수캠퍼스 활성화를 위한 합동 워크숍을 갖고 대학비전를 이룰 수 있는 밑그림 그리기에 나섰다.정성택 전남대 총장은 지난 6월 30일 여수캠퍼스에서 총장 자문기구인 혁신위원회, 미래위원회간 합동 워크숍을 주관하고, ▲여수캠퍼스 활성화를 위한 학사구조 미래화 ▲대학-지자체-산업체간 대외협력 체계구축 필요성 ▲입시ㆍ취업ㆍ시설 개선방안 등에 대해 집중 논의했다.정성택 총장은 “혁신위에서 심도 깊게 연구해 준 내용을 대학 정책에 적극 반영되도록 하겠다.”고 말했다.올 초 출범한 혁신위원회는 여수캠퍼스의 공동 현안에 대해 논의하는 공식 기구로, 여수캠퍼스 활성화 방안에 대한 다양한 연구를 하고 있다.지난 2017년 12월 출범한 미래위원회는 대학혁신의 기조와 방향을 유지하고, 대외 환경변화는 물론 수시로 바뀌는 고등교육정책에 대해 선제적인 대응방안을 마련하고 있다.*문의: 061-659-6231(전남대학교 교학기획과)"
260,전남대LINC+ 등 전국 31개 대학 사회적경제산학협력학회 창립,"전남대LINC+ 등 전국 31개 대학 사회적경제산학협력학회 창립 전남대학교를 비롯한 전국 31개 대학이 사회적경제산학협력학회를 창립한다.전남대 등 사회적경제대학협의회 참여대학이 중심을 이룬 이 학회는 7월 2일 김대중컨벤션센터에서 열린 사회적경제박람회장에서 창립총회를 가졌다. 또 초대 학회장에 김재국 전남대 LINC+사업단장(신소재공학부 교수)을 선임했다.(사)사회적경제산학협력학회는 산학협력으로 경제적 이익뿐만 아니라 사회적 이익도 추구하기 위해 산학협력 전문 교수들이 주축이 돼 설립된 연구단체이다. 앞으로 전통적인 자본주의 기업이 가진 경제 효율성의 원리와 사회적경제 조직에서 가장 발전된 형태로 나타나는 호혜의 원리가 양립할 수 있음을 실천적으로 증명해 나갈 계획이다.또 이를 위해 학회는 호혜의 원칙에 기반을 둔 협동의 경제제도 촉진 및 확장, 이와 관련한 연구, 교육, 재창조를 위해 민, 관, 학 관계자들에게 문호를 개방할 방침이다. 김재국 신임 회장은 “우리 학회는 한국경제 발전의 원동력인 산학협력 활동을 통해 얻은 확신을 실천하기 위한 다양한 접근을 시도할 것”이라며, “협동을 근간으로 하는 산학협력협동조합을 만들어 사회적경제 대학협의회와 함께 경제현실과 사회현실을 조화시켜 나가겠다.”고 밝혔다.이와함께 회원대학들은 7월 2일부터 4일까지 광주광역시 김대중컨벤션센터에서 열리는 제3회 대한민국 사회적경제박람회에 참가해, 사회적경제 인재양성, 사회적경제조직의 경쟁력 강화 기여, 산학협력협동조합 설립 등 각 대학별로 수행해 온 활동내역을 전시했고, 앞선 7월 1일에는 전남대에서 사회적경제대학협의회 업무협약식과 함께 회원대학 간 상견례 및 특강도 진행했다.*문의: 062-530-0331 (전남대학교 LINC+사업단)"
261,전남대-해양경찰교육원 해양전문인력 양성 ‘힘 모은다’,"전남대-해양경찰교육원 해양전문인력 양성 ‘힘 모은다’6월 28일 업무협약 체결 실습선 교차활용 등 협력 전남대학교가 해양경찰교육원과 업무협약을 맺고 해양전문인력 양성에 협력하기로 했다.전남대는 6월 28일 여수시 해양경찰교육원(원장 김성종)과 업무협약을 맺고 ▲공동 세미나 개최 및 연구활동 추진 ▲상호 교차 강의 ▲양 교육기관의 교육시설 및 프로그램 이용 등 학문적·실천적 협력체계를 구축해 나가기로 했다.두 기관은 이번 협약으로 교육분야 상호 협력관계를 고도화 하고, 실습선 간 교차실습 등 더욱 다양한 분야에서 교류를 강화할 계획이다.정성택 총장은 “우수한 해양 전문가를 양성하는 두 기관이 가지고 있는 다양한 시설과 노하우를 잘 활용해 미래 해양을 책임질 수 있는 전문인력을 양성해 내자”고 말했다.전남대학교와 해양경찰교육원은 지난 2014년 업무협약을 체결한 이래 3년마다 갱신하고 있다.*문의: 061-659-6231(전남대 교학기획과)"
262,전남대학교 입학설명회,"전남대학교 입학설명회7월3일 오후 1시 대강당 농축수산계열 학과 소개 부산대 등 4개 대학 합동 전남대학교 입학설명회가 오는 7월 3일 오후 1시 전남대 민주마루(옛 대강당)에서 열린다.전남대를 비롯해 경상국립대, 경북대, 부산대가 공동주관하는 이번 입학설명회에서는 각 대학의 농축수산계열 학과가 소개되고 2022학년도 대학입학 전형의 주요사항이 안내된다.이날 설명회에는 지역 거점 국립대 또는 해당 계열 입학에 관심있는 학생과 학부모, 교사는 누구나 참석이 가능하다. 단 방역 수칙 준수를 위해 각 대학 홈페이지에 사전 신청을 해야 참여가 가능한데, 이미 250여명이 참가 신청한 것으로 집계됐다.이에따라 전남대는 합동설명회와 별도로 대입전형 안내를 위한 부스를 마련해 수험생과 학부모들의 입학과 진학 상담에도 나설 예정이다.합동입학설명회는 지난 6월 26일 부산에 이어 대구(7월 10일), 진주(8월 21일)에서 계속 진행될 예정이다. *문의: 062) 530-1041 (전남대학교 입학과)"
263,전남대학교 개교 70주년 기념 표어 공모,"전남대학교 개교 70주년 기념 표어 공모20자 내외 간결·독창적 표현 최우수·우수·장려상 등 포상전남대학교가 개교 70주년을 앞두고 표어를 공모한다.전남대는 내년으로 다가온 개교 70주년을 기념하기 위해 6월 28일부터 오는 7월 23일까지 4주 동안 표어공모에 나선다.공모 주제는 ▲개교 70주년의 의미와 가치를 핵심적이고 함축적으로 나타내거나 ▲전남대학교의 역사와 미래교육 100년의 비전을 반영할 수 있는 내용 ▲지역사회 및 세계와 소통을 담아낼 수 있는 내용 ▲기타 전남대학교를 상징할 수 있는 참신한 내용이어야 하고, 20자 이내의 간결하면서도 독창적인 문장으로 표현하면 된다.응모작은 주제적합성, 작품성, 창의성 등을 감안한 두 차례의 심사 끝에 최우수상, 우수상, 장려상이 가려지고, 상금도 주어진다.응모는 전남대학교 홈페이지(https://www.jnu.ac.kr/Catchphrase70)를 통해 가능하며, 표어(국.영문 모두 가능)와 그에 대한 부가설명을 A4용지 1매 이내로 기술해 접수하면 된다. 1인당 응모는 1점으로 제한된다.앞서 지난 2012년 개교 60주년에는 ‘60년의 두드림, 세계와의 어울림, 미래로의 큰울림’이 당선됐다.전남대 관계자는 “주요한 단어로 ▲진리와 정의의 빛 ▲당당하고 자유로운 전남대人 ▲자긍심과 품격 ▲학술·봉사·문화적 역량 ▲지역·시민·동문을 향한 개방과 소통 ▲세계적 비전 등을 참고하면 더 좋은 작품이 가능할 것”이라고 밝혔다. *문의: 062)530-1133 (전남대학교 대외협력과)"
264,호남권 국.사립 10개교 국립대학 육성사업 프로그램 참여키로,"전남대 등 호남권 대학협력 네트워크 국립대학 육성사업 프로그램 참여키로 전남대학교를 비롯한 「대학 협력 네트워크 활성화 협의체」 회원 대학들이 ‘광주전남이 읽고 톡하다’ 사업 등 국립대학육성사업 네트워크 프로그램에 참여하기로 했다.6월 23일 호남권 국.사립 대학 10개교가 참여한 가운데 열린 「대학 협력 네트워크 활성화 협의체」 회의에서 참여대학들은 기존 국립대학 육성사업 네트워크 프로그램인 ▲‘광주·전남이 읽고 톡 하다’(전남대) ▲‘충무공 발자취를 따라서’(목포해양대) ▲‘지역 인접대학 해양체험 문화 네트워크 교류 사업’(군산대) 등에 회원대학들이 함께 참여하기로 했다. 이날 참석자들은 또 ‘광주·전남이 읽고 톡하다’ 프로그램이 시행되고 있는 전남대 디지털도서관을 방문해 프로그램 운영 성과를 공유하기도 했다.「대학 협력 네트워크 활성화 협의체」는 대학 간 유형, 지역, 기능별 네트워크를 확대하고, 네트워크 사업 신규 프로그램 소개 등 참여대학 간 정보공유와 협력 활성화를 이끌고 있는 회의체이다.이준웅 전남대 기획조정처장은 “앞으로도 호남권역 국·사립대학간의 협력과 교류로 상호 발전해 나갈 수 있도록 협의체가 마중물 역할을 충실히 하겠다.”고 말했다.*문의 : 062)530-5139 (전남대학교 기획조정과)"
265,‘올해의 한 책’ 「관계에도 연습이 필요합니다」 선포,"전남대 ‘올해의 한 책’ 「관계에도 연습이 필요합니다」 선포 전남대학교가 「관계에도 연습이 필요합니다」를 올해의 한 책으로 선포했다.전남대는 ‘광주전남이 읽고 톡하다’ 사업의 일환으로 매년 선정하는 ‘2021년 올해의 한 책’으로 박상미 작가의 「관계에도 연습이 필요합니다」를 선정해 발표했다.이 책은 타인과의 관계에서 의연하게 대처하는 기술 뿐 아니라 새로운 시대에 건강한 관계를 유지하는 법을 알려주는 안내서이다. 박상미 작가는 현재 심리상담연구소 ‘더공감 마음학교’대표이자 한국의미치료학회 부회장이며, 경찰대학에서 강의하고 있는 심리상담 전문가이다.‘올해의 한 책’은 지난 3월 교수, 언론인, 협력기관, 광주전남지역중견관리자 등으로 구성된 17명의 한책선정위원회가 후보도서 5권을 선정했고, 이를 대상으로 지난 4월 21일부터 5월 20일까지 온오프라인 시도민 투표를 통해 선정됐다.동반 추천도서는 모지현 작가의 「꿈꾸는 사과」, 우종영 작가의 「나는 나무에게 인생을 배웠다」, 이응교 작가의 「서른세 번의 만남, 백석과 동주」, 정재찬 작가의 「우리가 인생이라 부르는 것들」 등 4권이다.전남대 도서관(관장 장우권)은 앞으로 한 책 도서교환전(6월 말)을 비롯, 테마도서전시회(9월), 작가 초청 한책 톡 콘서트(9~10월), 한책 문학기행(10월), 독서후기 공모전(11월), 한책 독서퀴즈(12월) 등 다양한 독서문화 프로그램을 진행할 계획이다.전남대가 지난 2013년부터 시작해 현재는 광주.전남지역 대학도서관이 공동주관하는 ‘광주전남이 읽고 톡하다’ 사업은 매년 한 권의 책을 선정해 지역민이 함께 읽고 토론하는 범시민 독서문화프로그램이다.※문의: 062)530-3533, http://gjtalk.jnu.ac.kr (전남대학교 도서관)"
266,여수캠퍼스 ‘전동킥보드’ 안전수칙 준수 강력 시행,"전남대 여수캠퍼스 ‘전동킥보드’ 안전수칙 준수 강력 시행안전모 미착용, 2인 탑승 등 강력 제재 2~3회 위반시 안전교육, 교내봉사활동 부여전남대학교 여수캠퍼스가 최근 이용이 늘고 있는 킥보드 등 개인형 이동장치(PM) 사용자들에 대해 안전수칙 위반시 교내 출입을 막는 등 대안 마련에 나섰다.전남대 여수캠퍼스는 오는 7월 1일부터 PM 이용시 안전모 미착용, 2인 탑승, 음주운행, 역주행 등 탑승자 안전의무를 위반할 경우 교내 진입을 막는 등 강화된 안전수칙을 시행한다.특히 2회 이상 안전수칙 위반자에게 대해서는 안전교육 및 면담을 실시하고, 3회 이상 위반시에는 교내봉사활동(3시간) 부여하는 등 강력한 조치를 취할 계획이다.  앞서 여수캠퍼스는 지난 6월 17일 오전 학생들의 출입이 많은 학교 정문과 생활관 입구에서 이 같은 내용을 담은 전단지를 제작해 배부하는 등 홍보활동을 전개했다.*문의: 061-659-6031~5 (전남대학교 행정지원과)"
267,전남대 국제여름학교 24일 온라인 개강,"전남대 온라인 국제여름학교 개강14개국 23개 외국인대학생 참가 전남대생 150여 명도 함께 수강 전 과목 영어 진행, 계절학기 학점 인정 전남대학교 국제여름학교가 오는 24일 온라인으로 개강한다.전남대는 세계 각국의 교수들을 초청해 외국인 학생과 전남대 재학생들에게 수준 높은 강의를 제공하는 국제여름학교(International Summer Session 2021)를 6월 24일 온라인으로 개강해 4주일 동안 계속된다.올해는 IoT인공지능, 경제학, 교육학 등 10과목이 모두 영어로 진행되는데, ▲미국 네바다-라스베가스대학 Venki Muthukumar 교수가 ‘IoT 데이터분석(사물인터넷)’을 맡고, ▲뉴질랜드 링컨대학의 Christopher Gan 교수가 ‘경제학 개론’을, ▲미국 사우스플로리대학 Sanghoon Park 교수가 ‘사용자 인터페이스 설계 및 교육 공학’을 각각 강의한다.또 예비교육 과정에서는 미국 탈튼주립대학의 Marcy Tanter 교수가 소설가 한강의 ‘소년이 온다’ 특강과 함께 한국의 민주주의와 광주에 대해 소개할 예정이다.수강생은 전 세계 14개국 23개 대학에서 45명의 외국인 학생들이 온라인으로 참가하고, 전남대생 150여명도 함께 수강한다. 특히 전남대 재학생 가운데 20여명은 외국인 학생들의 언어소통 등 학습과 문화체험활동을 돕는 ‘버디’(buddy)로 참가한다.국내.외 학생들은 수강 교과목에 대해 자국에서 계절학기 학점으로 인정받게 된다.전남대는 온라인의 특성을 최대한 활용하면서 실감나는 문화 교류가 이뤄질 수 있도록 5.18 소개 책자, 각종 기념품, 호떡만들기 세트 등을 담은 ‘문화체험 패키지’를 각국의 참여 학생들에게 미리 배송하고, 버디들과도 교류할 수 있도록 했다.전남대 국제여름학교는 지난 2009년 시작된 이래 11년 동안 국립대 최대 규모로 성장해 왔으나, 지난해에는 ‘코로나 19 팬데믹’으로 인해 취소됐다가 올해 온라인으로 재개됐다. * 문의: 062-530-1273(전남대학교 국제협력과) * 별첨: 사진은 2021년 전남대 온라인 국제여름학교 홍보 영상 사진 유튜브 영상 바로가기"
268,미디어 아티스트 이이남 작가 초대형 작품 기부,"미디어 아티스트 이이남 작가 전남대에 초대형 작품 기부2억 8천만 원 상당 ‘지식의 폭포’ 디지털 도서관 ‘정보마루’에 설치 세계적인 미디어 아티스트로 불리는 이이남 작가가 전남대학교에 2억 8천만 원 상당의 작품 ‘지식의 폭포’를 기부했다.이이남 작가는 지난 6월 18일 전남대학교 디지털도서관 정보마루에서 열린 발전기금 전달식에서 정성택 총장에게 작품을 전달했다.‘지식의 폭포’는 우리나라를 대표하는 고전회화의 소재인 폭포에 고대부터 현대까지 이르는 다양한 텍스트들을 디지털로 재해석해 시각화한 작품이다. 배경이 되는 박연폭포는 진경산수의 대가 겸재 정선의 작품으로 가장 한국적이란 평가를 받고 있는데, 이 작품에서는 디지털을 통해 수직으로 연장해 폭포의 장엄함을 극대화시켰다.이 작품은 10m가 넘는 초대형작으로, 오는 8월 중에 정보마루 1층 벽면에 설치될 예정이다. 이이남 작가는 “학술과 IT가 융복합된 최첨단 도서관에 작품을 기증할 수 있게 돼 영광이다.”며, “학생들이 일상 속에서 손쉽게 미디어아트 작품을 감상할 수 있길 바란다.”고 말했다.정성택 총장은 “기부해주신 작품으로 인해 ‘정보마루’가 더욱 빛날 것”이라며, “많은 사람들이 작품의 의미를 되새길 수 있도록 최적의 위치에 설치하겠다.”고 말했다.전남 담양 출신인 이이남 작가는 동서양의 고전 회화에 디지털 기술을 더해 움직이는 미디어 아트를 선보여 호평을 받고 있다. 10여 차례의 국내.외 개인전을 가졌으며, 아트코리아방송 2020 올해의 작가 비디오부문 등 다수의 수상경력을 가지고 있다. "
269,전남대-전남테크노파크 지역현안 사업 해결 ‘맞손’,"전남대-전남테크노파크 지역현안 사업 해결 ‘맞손’15일 여수캠퍼스서 정책간담회 인적 네트워크, 신규과제 발굴도전남대학교가 전남테크노파크와 지역현안사업에 적극 협력키로 했다.전남대는 지난 15일 여수캠퍼스에서 (재)전남테크노파크(원장 유동국)와 정책간담회를 갖고 두 기관 간 정책과제 발굴과 지역 현안사업 해결을 위해 협력체제를 구축키로 했다.또 교내 연구자와 전남테크노파크 간 인적 네트워크를 구성해 신규과제 발굴과 공동사업도 추진키로 했다.이날 간담회에서 전남대 여수캠퍼스는 ▲광양만권 R&D센터 구축 ▲수소출하센터 건립 ▲실버헬스케어의료기기 지원센터 구축사업 ▲광양만권 간단종사자 건강모니터링 실증센터 ▲기후변화 대응 수산생물 질병제어 기반기술 개발사업을 제시했다.또 ▲녹차 사포닌을 이용한 알츠하이머 질환예방 및 치유제의 상품화 ▲참조기의 정자은행구축을 통한 인공종자생산 ▲석유화학 폐유기용매의 재이용기술 개발 ▲환경성 질환 개선을 위한 수산생물자원 유래 소재기반기술 개발 사업 ▲해양특화 MICE 및 웰니스 관광 클러스터 구축 사업 등 10가지 사업에 대해 심도 깊은 논의가 이어졌다.전남테크노파크는 산학연관 협력체계를 기반으로 지역기업 육성, 산업기술 고도화, 지역경제 활성화를 추구하는 기관으로, 전남형 뉴딜사업, 전남 그린수소 메가클러스터 10년 수립 계획, 전남 주력산업 탄소중립 대응계획 수립, 여수국가산단 스마트그린산단사업 등을 추진하고 있다.*문의: 061-659-7901 (전남대학교 여수산학협력본부)"
270,2021 자랑스러운 전남대인 선정,"2021 자랑스러운 전남대인전남대학교가 개교 69주년을 맞아 모교의 명예와 위상을 높이고 대학발전에 공헌한 동문 12명을 ‘자랑스러운 전남대인’으로 선정했다. 또 용봉리더스포럼 김해곤 회장을 특별공로상 수상자로 선정했다.정성택 총장은 6월 15일 보직교수들과 조성희 총동창회장 등 동창회 관계자들이 참석한 가운데 대학본부 대회의실에서 '특별공로상 및 자랑스러운 전남대인 포상 전수식'을 갖고 상패와 부상을 전달했다. 당초 시상은 개교기념식에 맞춰 진행될 예정이었으나, 코로나 19 상황으로 인해 언택트 기념식으로 대체되면서 시상식도 함께 취소된 바 있다. 정 총장은 이 자리에서 “자랑스러운 전남대인 여러분 덕분에 전남대학교가 교육과 연구에서 발군의 역량을 발휘하며 성장을 거듭해 나가고 있다.”며 “앞으로도 진리, 창조, 봉사의 이념아래 동문 여러분과 함께 당당하고 자유로운 모교를 만들어 나가겠다.”고 말했다. 수상자는 다음과 같다. (출신학과 및 졸업연도)□ 특별공로상 ▲김해곤 용봉리더스포럼 회장(섬유공학과 1959)□ 자랑스러운 전남대인 ▲김영 영진산업(주) 대표(화학공학과 1976) ▲장석웅 전라남도교육감(역사교육과 1979) ▲민형배 국회의원(사회학과 1984) ▲문정현 법무법인 바른길 대표변호사(공법학과 1987) ▲전동평 영암군수(산업공학과 1989) ▲공진항 한화제약 부사장(제약학과 1986) ▲김용집 광주광역시의회 의장(행정학과 1989) ▲형민우 형치과의원장(치의학과 1988) ▲강용 학사농장 대표(낙농학과 1992) ▲김성준 국방부 인사복지실장(행정학과 1991) ▲조오섭 국회의원(신문방송학과 2003) ▲이병훈 국회의원(행정대학원 2005)"
271,"전남대 우수학술연구자 김진혁, 송선주 교수 선정","전남대 우수학술연구자 김진혁, 송선주 교수 선정 전남대학교가 개교 69주년을 맞아 국제적으로 우수한 논문을 발표하는 등 뛰어난 연구활동을 펼쳐 온 우수학술연구자로 김진혁, 송선주 교수를 선정했다.정성택 총장은 6월 14일 이들을 표창하고 격려했다.김진혁 교수(신소재공학부)는 산업통상자원부 에너지인력양성사업인 ‘저가-화합물 박막태양전지 GET-Future 연구실 사업’에서 화학물박막태양전지 관련 연구를 수행해서 박막양전지의 효율을 개선하는 결과를 『advanced energy materials』에 게재했다. 이 저널은 JCR 상위 10% 안에 드는 세계적으로 저명한 국제학술지로 꼽힌다.송선주 교수(신소재공학부)는 결함화학 기반 에너지소재 분야에서 160여 편의 학술논문을 발표하는 등 교육과 연구에 활발한 활동을 수행하고 있다. 특히 최근 고체산화물 연료전지 양극 신소재를 개발해 『Energy & Environmental Science』에 발표했고, 산업체와의 공동연구를 통해 기업 애로기술 해결을 위해 노력해왔다."
272,"전남대 용봉학술상 이수진, 송선주, 정지훈 교수","전남대 용봉학술상 이수진, 송선주, 정지훈 교수 전남대학교 제25회 용봉학술상 수상자로 이수진, 송선주, 정지훈 교수가 선정됐다. 또 용봉학술 특별상에는 김재국, 신해진 교수가 뽑혔다.전남대는 개교 69주년(6.9)을 맞아 교원의 연구의욕 고취와 대학 연구역량 강화를 위해 제정한 용봉학술상과 특별상 수상자로 이들을 선정했다.정성택 총장은 6월 14일 차담회를 갖고 이들을 표창, 격려했다.  이수진 교수(경영학부)는 경영학 인사조직 분야에서 리더십과 조직 구성원의 동기부여 향상을 위한 다각적 접근을 통해 많은 연구를 수행하고 있다. 최근 5년간 SSCI급 논문 15편을 포함해 KCI 등재지에 10여 편의 논문을 게재했으며, 이 중 두 편은 JCR 상위 10%에 해당하는 저널에 게재되는 등 탁월한 연구 성과를 이루고 있다. 또 자율전공학부 책임지도교수와 다수의 저널 편집위원을 맡아왔다. 송선주 교수(신소재공학부)는 결함화학 기반 에너지소재 분야에서 160여 편의 학술논문을 발표하는 등 왕성한 교육연구 활동을 해오고 있다. 특히 최근 고체산화물 연료전지 양극 신소재를 개발해 『Energy & Environmental Science』에 발표했고, 산업체와의 공동연구를 통해 기업 애로기술 해결을 위한 노력을 경주해왔다. 정지훈 교수(해양학과)는 최근 급격한 기후변화에 의한 동아시아 내륙지역의 폭염-가뭄 동시 발생증가 메커니즘을 규명한 연구결과를 『사이언스』지에 발표하는 등 기후역학 및 기후예측 분야에서 60여 편의 학술 논문을 발표했다. 현재 기상청-전남대 가뭄특이기상센터를 이끌고 있으며, 기상청-환경부와 함께 기후환경변화예측에 대한 연구들을 수행하고 있다. 용봉학술특별상 수상자인 김재국 교수(신소재공학부)는 차세대 이차전지 전극소재 및 전지시스템 연구·개발을 수행하며, 『네이처』지를 포함해 국제전문학술지에 220여 편의 논문을 게재하는 등 이차전지분야에서 학술적, 기술적 국가경쟁력을 높였다.신해진 교수(국문학과)는 한국 고전 번역과 연구로 인문학적 소통과 문화 발전에 크게 기여했으며, 인문학 분야에서 학술적 업적 및 공적이 매우 탁월한 학자로, 고금의 소통에 큰 관심을 가지고 82권의 학술저서를 내고, 38편의 논문을 유수 학술지에 게재한 바 있다. "
