,제목,내용
762,여수캠퍼스 창업보육센터 최우수기관 선정,"여수캠퍼스 창업보육센터 최우수기관 선정      전남대학교 여수캠퍼스가 ‘2019년도 창업보육센터 경영평가’ 결과, 최우수기관으로 선정됐다.    전남대 여수창업보육센터(센터장 박복재 교수. 물류통상전공)는 최근 중소벤처기업부가 전국 261개 창업보육센터를 대상으로 실시한 경영평가 결과, 입주기업 성과와 자체운영 실적 부문에서 높은 점수를 받아 최우수기관으로 선정됐다. 또 부상으로 운영지원사업비와 보육역량강화사업비 등 모두 7천4백만원을 지원받게 됐다.    여수창업보육센터는 매년 중소벤처기업부, 전남도, 여수시 등 3개 기관으로부터 운영보조금을 지원받아, 경영교육, R&D, 기업기술인증, 지식재산권, 판로개척, 각종인허가 등 다양한 지원프로그램과 산학협력 인프라를 제공하는 성장단계별 지원을 하고 있다. 또 여수캠퍼스 교수와 학생, 창업동아리의 창업활동도 지원하고 있다. 현재 14개 기업이 입주해 있다.    박복재 센터장은 “지역의 창업기업이 경쟁력 있는 기업으로 성장할 수 있도록 최선의 지원을 다하고 있다.”며, “앞으로도 더 많은 창업기업들을 발굴·성장시켜 지역경제 활성화와 일자리 창출은 물론 학생들의 취업과 창업 활성화에 기여하도록 노력하겠다.”고 말했다.    * 문의: 061-659-6977 (전남대학교 여수창업보육센터)"
763,"‘3월의 전남대인’, 박원철 소위","‘3월의 전남대인’, 박원철 소위      3월의 전남대인으로 학군단(여수) 출신 박원철 소위가 선정됐다. 전남대학교 ‘이달의 전남대인’ 선정위원회(위원장 한은미 부총장)는 전남대학교의 명예를 빛낸 3월의 전남대인으로 학군단 출신 박원철 소위를 선정하고, 지난 4월 27일 표창했다.  박원철 소위는 학군단(여수)57기로 2019 대한민국 ROTC 임관식에서 전남대 학군단 역사상 최초로 영예의 대통령상을 수상해 전남대의 위상을 높인 공로를 인정받았다.    박 소위는 학군단 재학 중 중대장 및 대대장 후보생을 차례로 맡는 등 최우수 후보생으로 활약했으며, 현재 소위로 임관해 육군보병학교 학생장교로 교육업무를 담당하고 있다.    이날 시상은 박 소위가 부대 내 사격훈련우수자로 포상휴가를 받아 대학을 방문하면서 이뤄졌다.    박상규 부총장은 ""이달의 전남대인으로 선정된 것을 축하하며, 모범적인 군생활을 통해 후배 학군사관후보생의 자부심 고취와 학군단 활성화에 힘써 달라.""고 당부했다.    * 문의: (061)659-6232 (전남대학교 교학기획과)  "
764,"전남대, 윤상원 기념홀 개관","전남대, 윤상원 기념홀 개관        윤상원 열사 기념홀 개관식이 2일 오전 전남대학교 사회과학대학 별관 1층에서 열렸다.    이날 행사에는 윤상원 열사의 유가족과 윤상원기념사업회, 5.18기념재단, 전남대 민청학련동지회, 전남대 민주동우회 등 민주인사들과 정병석 전남대 총장과 박승현 전남대 총동창회장을 비롯한 교수, 직원, 학생 등 100여명이 참석해 기념홀 개관을 축하했다.    참석자들은 윤상원 열사의 생전의 모습과 그의 삶을 되돌아보고, 살아남은 자로서 해야 할 역할을 다짐했다.    정병석 총장은 “전남대는 인류보편의 가치인 민주, 인권, 정의, 자유와 평화를 지키는데 앞장 서 왔고, 윤상원 열사도 그 중 한 분이었다.”며 “오늘 모교에 그의 숭고한 정신을 기리기 위해 마련된 기념홀이 개인과 역사의 기록을 담아두는 공간에 그치지 않고, 그의 배려와 나눔의 정신을 온 세상에 들불처럼 번져나가게 하는 불꽃이 되길 바란다.”고 말했다.  "
765,"전남대, 송영길 국회의원 초청 용봉포럼","전남대, 송영길 국회의원 초청 용봉포럼    2일 용봉홀서 학생 등 300여명 참석 ‘문재인 정부와 북방 경제협력’ 특강       전남대학교는 5월 2일(목) 오후 1시30분 교내 대학본부 용봉홀에서 송영길 국회의원을 초청, ‘용봉포럼’을 개최했다.    송영길 의원은 이날 ‘문재인정부와 북방경제협력’을 주제로 한 강연을 통해, 역대 정부의 북방정책과 문재인 정부의 정책간 차이를 비교한 뒤, 문재인정부의 한반도 신경제구상의 주요내용을 소개했다.  송 의원은 특히 대통령 직속 북방경제협력위원회 위원장 등의 자격으로 중국과 러시아 지도자들을 직접 면담하고, 유력 외신들과의 인터뷰 등을 통해 외교활동을 전개한 내용도 함께 소개했다. 송 의원은 강연 내내 해박한 역사지식과 날카로운 세계정세 분석, 그리고 남북협력과 평화에 대한 절박함을 드러내 참석자들로부터 박수갈채를 받았다.    송 의원은 전남 고흥 출신으로 광주 대동고, 연세대 재학시절 초대 직선 총학생회장을 역임하기도 했다. 그는 제36회 사법고시에 합격, 변호사로 활동하다 민선 5기 인천광역시장을 역임한 4선(인천 계양구 을) 국회의원이다.    현재 한-러의원외교협의회 부회장, 한-인도의원친선협회 회장을 맡고 있고, 전 대통령 직속 북방경제협력위원회 위원장을 역임한 바 있다.    한편, 전남대학교는 대학 교직원과 지역민을 위해 다양한 주제를 갖고 각계 저명인사를 초청, 용봉포럼을 개최하고 있다.   *문의: 062-530-1135(전남대학교 대외협력과) "
766,전남대학교 2020학년도 수시모집요강 발표,"전남대학교 2020학년도 수시모집요강 발표   전체 모집 인원의 73% 선발 학생부교과(일반전형) 학생부 100%로 변경 자기소개서 전면 폐지…수험생 부담 경감 복수지원 기회도 3회로 늘려        전남대학교가 2일 2020학년도 수시모집 모집요강 및 2021학년도 입학전형 기본계획을 발표했다.    모집요강에 따르면 전남대는 2020학년도 수시모집 3,076명(73.6%), 정시모집 1,103명(26.3%)을 선발한다. 여기에는 조기취업형계약학과 모집인원은 제외된다.  정시모집 인원은 2019학년도 1,036명(24.8%)에 비해 67명 증가했다. 전년도에 비해 학생부교과(일반전형)은 다소 축소된 1,728명을 선발하고 학생부종합(지역인재전형)은 545명, 학생부종합(고교생활우수자전형) 471명으로 전년도에 비해 선발인원이 증가했다.    2020학년도 수시모집에서 달라진 점은 학생부교과(일반전형) 전형방법이 학생부 80%, 교과서류평가 20%에서 학생부 100%로 변경되었고, 학생부교과(예능우수자전형)이 신설되었다. 학생부종합일반전형은 학생부종합(고교생활우수자전형)으로 전형명이 변경되었으며, 학생부종합전형에 있었던 농어촌학생전형과 특성화고교졸업자전형은 올해부터 학생부교과전형으로 선발한다.    자기소개서는 전면 폐지되어 수험생의 부담을 덜도록 했고, 수시모집 복수지원 횟수는 2회에서 3회로 지원기회가 늘었다. 또 전남대 수시모집의 모든 전형은 지원자의 나이 및 졸업년도 제한이 없다.    모집단위의 변화로 문화사회과학대학 문화관광경영학과가 신설되었으나, 경영대학 경제학부 지역개발학전공은 폐지됐다. 여수캠퍼스에 있던 사범대학 특수교육학부는 광주캠퍼스 교육융합관으로 이전됐다.    전남대는 1-Click Service (http://ao.chonnam.ac.kr/) 홈페이지를 통해 전년도 입시결과 및 모의진단 서비스, 면접 안내영상 등도 제공하고 있다.    * 문의: 062-530-4731~4734 / http://admission.jnu.ac.kr (전남대학교 입학과)"
767,전남대 교육융합관 개관,"전남대 교육융합관 개관    강의동·연구동, 지하 1층 지상 10층 국회의원, 교육감 등 200여명 참석 강기정 정무수석 등에 감사패 수여       미래사회가 필요로 하는 창의융합 인재 양성의 보금자리가 될 전남대학교 교육융합관이 개관했다.    전남대학교는 4월 30일 정병석 총장을 비롯해 김경진 국회의원, 장석웅 전남도교육감, 박승현 총동창회장과 이근배 전남대평의원회 의장, 이상권 사범대학장 등 내외귀빈과 교직원, 학생 등 200여명이 참석한 가운데 전남대 교육융합관 개관식을 가졌다.    특히 이날 개관식에는 전남대 동문이면서 국회의원 시절 교육융합관 사업에 기여한 강기정 현 청와대 정무수석과 이개호 현 농림축산식품부 장관이 보내온 축전과 영상메시지가 소개되기도 했다.    교육융합관은 지하 1층, 지상 10층으로 강의·실습동과 연구·행정동으로 구분돼 구성되고, 34개의 강의실과 8개 세미나실, 40개 실험실습실 등을 갖춰 사범대학 16학과(부) 가운데 11개가 입주한다.    또 1층 중앙과 5층 옥상에 휴게공간을 겸한 실내조경이 조성되고, 천장을 통한 자연채광이 가능토록 하는 등 쾌적한 분위기 속에 연구와 교육이 진행될 수 있도록 했다.    정병석 총장은 “교사임용시험 거점국립대 1위, 교육문제연구소의 한국연구재단 중점연구소 지정 등 사범대학이 대한민국 교육이 나아갈 방향을 제시하는데 앞장서고 있다.”며 “교육융합관은 우수 중등교사 양성의 요람이자, 교육의 이론과 실제를 연구하는 터전이 될 것”이라고 말했다.    * 문의: 062-530-2320(전남대학교 사범대학)  "
768,"전남대-전남교육청, 우수교사양성 위해 손 잡아","전남대-전남교육청 우수교사 양성위해 손 잡아   예비교사 현장 적응력 향상 전남교육에 대학인프라 활용 4월30일 전남대서 업무협약       전남대학교와 전남도교육청이 4월 30일 전남대 총장 접견실에서 교원 및 예비교사의 교육혁신 역량 강화를 위한 교류협약을 체결했다.    두 기관은 이날 협약을 통해 전남대학교 대학원 특별연수 대상자 지원, 유치원 및 초.중등학교-대학 연계 프로그램 운영 지원, 전남교육청 산하 혁신학교 현장실습 지원 등 상호 협력사업을 펼쳐나가기로 했다.    특히 전남교육청은 소속 교원 1명을 전남대학교에 교육협력관으로 파견하기로 했다. 이 교원은 전남대학교에서 근무하면서 사범대학의 교육과정 편성 및 운영 지원, 교직 소양 및 실무강의 지원, 현장실습 업무 지원 등에 나서게 된다.    정병석 전남대 총장은 “전남교육청에서 교육협력관을 파견하고, 대학과 교육청이 상호 교류하는 상설협의체를 운영하게 돼 마음 든든하다.”며 “앞으로도 사범대학 교육에 많은 관심을 보여주길 부탁한다.”고 말했다.    장석웅 전남도교육감은 “대학의 교육역량 인프라를 활용하게 돼 전남교육이 한 단계 더 올라설 것으로 기대한다.”며 “오늘 협약이 교육청과 대학을 연결하는 연결고리가 돼 앞으로 더 높은 교육협력을 이뤄갈 것”이라고 화답했다.    * 문의: 062-530-2320(전남대학교 사범대학)  "
769,"윤상원, 김남주 기념홀 개관","‘윤상원’, ‘김남주’ 기념홀 개관  전남대 사회대 본관, 인문대 1호관서 2일, 5.18시민군 대변인 윤상원 열사 3일, 반독재 민주화운동 김남주 시인         5.18 시민군의 대변인 윤상원 열사를 기리는 기념홀과 70~80년대 반독재 민주화운동에 헌신한 김남주시인 기념홀이 5월 2일과 3일에 잇따라 문을 연다.    전남대학교는 오는 5월 2일 오전 10시30분 사회과학대학 본관 1층에서 ‘윤상원 열사 기념홀’ 개관식을 가진다.    윤상원 열사 기념홀은 ‘윤상원의 방’과 ‘윤상원 길’로 구성됐다. 윤상원 방 외관은 윤 열사가 활동한 들불야학의 장소였던 당시 광천동 성당 교리실의 붉은 벽돌건물에 착안해 형상화하고, 방 내부에는 들불야학 활동상과 그의 어록, 박기순 열사와의 영혼결혼식에 쓰였던 ‘님을 위한 행진곡’ 가사, 윤상원 열사의 출생부터 산화하기까지의 삶의 기록을 연보형태로 사진과 함께 게시돼 있다.    ‘윤상원 길’은 그의 평탄치 않은 삶과 장렬한 산화로 민주화와 역사의 빛이 된 인생 여정을 물결문양의 빛으로 형상화하면서, 열사의 연설문과 일기의 일부를 5.18 사진 속에 담아 세상을 향한 그의 따스한 손길과 실천의 발자취를 자연스럽게 느끼도록 했다.    전남대는 이와함께 오는 5월 3일 오후 5시 인문대학 1호관에서 ‘김남주 시인 기념홀’ 개관식을 가진다.    근대문화유산으로 지정된 인문대학 1호관 강의실을 다목적 기념홀과 복층형 기념공간으로 조성한 ‘김남주시인 기념홀’에는 그의 대표적인 시 ‘자유’, ‘조국은 하나다’, 5.18관련 시 ‘학살’ 등과 서정시를 벽에 새겨 넣고, 시집과 산문집, 번역집 등 25권의 저서를 전시한다. 특히 김남주 시인이 감옥에서 화장지에 쓴 ‘바람에 지는 풀잎으로 오월을 노래하지 말아라’ 등 육필원고 6~7편과 편지글 5편 등이 원본으로 전시된다. 또 시인의 연보를 영어, 중국어, 일어 등으로 작성해 게시했다.    또 시인의 육성 시 오디오, 이이남의 미디어 아트, 안치환의 노래, 각종 영상과 관련자 인터뷰, 전자방명록 등이 함께 설치돼, 시인을 기념하면서도 교육적인 기능까지 함께 수행할 수 있도록 꾸며졌다."
770,"전남대, 전국 국공립대 직원테니스대회 단체전 우승","전국 국공립대 직원테니스대회 전남대 단체전 우승    개인전 골드부, 청년부도 준우승 31개 대학 44개팀 5백여명 참가 대학간 교류협력, 생활체육 진흥        전남대학교가 제26회 교육부장관기 전국국공립대학교 직원테니스대회에서 단체전 우승을 차지했다.    전남대학교는 지난 4월 26일부터 27일까지 전국 31개 국공립대학교 44개팀 500여명이 참가한 가운데 부산대에서 열린 이번 대회에서 단체전 우승을 차지했다. 개인전에서도 골드부와 청년부에서 각각 준우승을 차지해 대학의 명예를 드높이는데 기여했다.    전남대는 단체전 최다우승팀인 강원대와 결승에서 박빙의 승부를 펼친 끝에 4년만에 우승컵을 되찾아오는 기쁨을 누렸다.    직원테니스대회는 교육부와 전국 국공립대학교 교육가족들이 서로의 벽과 테두리를 허물고 한 데 어울리는 축제의 장으로 대학 간의 정보교류, 교육협력과 직장 내 생활체육 진흥 도모를 위해 매년 열리고 있다.    위재환 전남대 직원테니스회 회장은 “이번 성과는 회원들의 하나된 마음으로 이룬 값진 성과""라며 ”대회 출전에 아낌없는 지원과 성원을 보내준 대학당국에 감사하다.“고 말했다.    ◇ 단체전 선수명단 ▲김문환(교학기획과) ▲김동문(대외협력과) ▲염현(대외협력과) ▲이상훈(문화사회대) ▲장요순(산학협력과) ▲강민수(선박실습센터 ▲기부원(시설과) ▲오명근(약학대) ▲정용석(입학과) ▲위재환(총무과) ▲강성진(행정지원과 ▲김흥식(행정지원과)  ◇ 개인전 선수명단 <골드부> ▲김문환 ▲이상훈  <청년부> ▲강민수 ▲박춘식(행정지원과)"
771,"박승현 전남대총동창회장, 모교 발전기금 2억 쾌척","박승현 전남대총동창회장   모교 발전기금 2억 쾌척    박승현 전남대학교총동창회장이 대학발전기금 2억 원을 기부했다.    박승현 총동창회장은 4월 25일 오전 모교인 전남대학교를 찾아 정병석 총장에게 대학발전기금 2억 원을 전달하고, 환담했다.    지난 2월 제34대 전남대총동창회장에 취임한 박 회장은 오랫동안 동창회 발전을 위해 앞장서온 건축공학과 출신의 전남대동문으로, 국내 유수의 건설회사를 거쳐 지난 1994년 영진종합건설을 창업, 지역중견기업으로 성장시킨 건설 경영인이다.     박 회장은 “동문회장을 맡으면서 후배들과 모교 발전에 조금이나마 힘을 보태고싶어 발전기금을 기부하게 되었다.”며, “앞으로도 모교를 위해 최선의 노력을 다하고 10억 원까지 기부를 계속 이어나가겠다.”고 말했다.    정병석 총장은 “평소에도 모교에 대해 큰 관심과 사랑을 베풀어주셨는데, 또다시 대학 발전을 위해 많은 기금을 기부해 주셔서 감사하다.”며 “후배를 위하는 박 회장의 뜻을 살려 ‘창의적이고, 감성적이며, 함께하는 인재’를 양성하는데 더욱 힘쓰겠다.”고 말했다.    박 회장은 2002년부터 장학금, 시설기금 등 모교를 위해 꾸준히 4억여 원의 발전기금을 기부하여왔고 오늘 발전기금 2억 원을 전달하며 총 6억여 원의 기금을 조성하였다. 이와 별도로 본인이 나온 공과대학에 1억 원을 기부하기도 하였다.    "
772,“대학역량 모아 지역과 상생해야”(한은미 부총장),"“대학역량 모아 지역과 상생해야”   전남대 한은미 부총장, 전국부총장협 특강 18~20일 봄 정기총회 및 세미나서 강조       전남대 한은미 부총장이 전국 대학 부총장들을 대상으로 한 특강에서 대학과 지역상생의 필요성과 이를 위한 대학간 네트워크의 중요성에 대해 역설했다.   한은미 부총장(전남대 화학공학부 교수)은 18~20일 제주 해비치 호텔에서 열린 2019년 전국대학교 부총장협의회 봄 정기총회 및 세미나에서 ‘제4차 산업혁명시대의 대학: 지역사회와 상생하는 대학’을 주제로 한 특별강연에서 이같이 강조했다.   한 부총장은 “대학이 지역사회 구성원으로서 사회적 책무를 다하기 위해서는 대학간 네트워크 협의체를 구축하고, 상호경쟁에서 벗어나 호혜 환경을 조성하여 그 집결된 에너지로 지역사회와 상생하는 역할을 수행해야 한다.”고 말했다.   한 부총장은 전국 99개 대학으로 구성된 전국대학교부총장협의회 부회장을 맡고 있다. 회장은 국민대 정승렬 교수이다."
773,전남대 여수캠퍼스 ‘국제문화의 날’ 연중 진행,"‘국제문화의 날’ 연중 진행   세계문화 이해 등 글로벌 역량강화 외국인유학생 등 자국 자긍심 고취 18일 ‘우즈베키스탄의 날’ 행사성황     전남대학교가 외국인 유학생들의 나라를 각각 소개하는 ‘2019학년도 국제문화의 날’ 행사를 주기적으로 갖기로 하고, 지난 4월 18일(목) ‘우즈베키스탄의 날’을 지정해 다채로운 행사를 가졌다.   전남대 글로벌교육원(원장 김상구)은 이날 우즈베키스탄 학생들의 전통춤 공연 등 행사 참여자들이 우즈베키스탄을 쉽게 이해할 수 있도록 다채로운 프로그램을 진행했다. 특히, 우즈베키스탄 전통의상 입고 사진 찍기와 유학생 홍보대사가 출제한 퀴즈풀이가 큰 인기를 끌었다. 퀴즈풀이 정답자에게는 기념 티셔츠도 제공됐다.   우즈베키스탄 유학 우마크로브 아사드백 학생(1학년)은 “조국의 춤과 의상 등 전통 문화를 한국은 물론 다른 외국인 유학생 친구들에게 소개하는 자리가 있어 너무나 행복하다.”고 말했다.   글로벌교육원은 대학 구성원들이 세계문화에 대한 폭넓은 이해를 통해 글로벌 역량을 강화하고, 이를 통해 국제화 캠퍼스 도약의 토대를 마련하기 위해 ‘국제문화의 날’(INTERNATIONAL CULTURE DAY)를 계획했다.   김상구 원장은 “최근 전남대에 외국인 유학생은 물론, 외국인 교수와 직원, 연구원들이 크게 늘고 있다.”며 “이들 모두에게 자신의 출신국가에 대한 자긍심을 고취하고, 전남대 구성원으로서의 소속감을 강화하는 등 쌍방향 문화교류를 위해 마련한 자리가 성황을 이뤄 다행이다.”고 말했다.   ‘INTERNATIONAL CULTURE DAY’는 우즈베키스탄의 날을 시작으로 5월에는 핀란드, 베트남, 6월 미국, 인도, 9월 스리랑카, 아프리카, 10월 몽골, 카자흐스탄, 11월 파키스탄, 방글라데시, 12월 일본, 중국, 우크라이나 등 모두 14개국을 선정해 진행할 예정이다.    * 문의: 061-659-6992 (전남대학교 글로벌교육원)  "
774,"정병석 총장, KBC출연 “‘인공지능’에 연구, 교육 집중”","“‘인공지능’에 연구, 교육 집중”    전남대 정병석 총장 ‘임기 후반기에 주력’ 밝혀 ‘새 시대 걸맞은 교육의 내용·방향·환경 마련’도 19일 KBC 아침 생방송 ‘모닝 730’ 출연       정병석 전남대 총장은 “인공지능(AI)산업 활성화를 위해 모든 연구력과 교육역량을 집중하겠다.”고 밝혔다.   정병석 총장은 19일 아침 kbc 생방송 ‘모닝 730’에 출연해 “최근 우리지역에 4,000억원이 넘는 인공지능중심 집적단지가 예비타당성조사 면제사업으로 유치됐다.”고 밝힌 뒤, “지역발전에 커다란 영향을 미칠 인공지능(AI) 분야의 활성화를 위해 전남대학교의 모든 연구력과 교육역량을 집중하겠다.”고 말했다.   정 총장은 또 “인공지능이 사람의 판단을 대신해 주고, 작업은 로봇이 하며, 이동은 무인자동차가, 거래는 블록체인이 하는 새로운 시대가 다가오고 있다.”며, “전남대학교는 미래시대를 위해 학생들을 어떻게 가르치고, 무엇을 가르치며, 어떤 환경을 갖춰줄 것인가에 교육의 초점을 맞추겠다.”고 덧붙였다.   정 총장은 ‘지역상생’과 관련, “전라도민들의 출연에 의지해 출범한 전남대학교로서는 지역발전을 위해 사명을 다하는 것이 지역민에게 빚을 갚는 것이라고 생각해 왔다.”고 말한 뒤, “정부가 지역균형발전을 위해 공공기관을 이전한데 이어, 이제는 지역사회가 역량을 발휘해 자생력을 높이도록 돕고 있으므로, 전남대학교와 지역사회가 상생협력해 지속가능하고 안정적인 지역발전을 도모해 나가야 한다.”고 말했다.   정 총장은 전남대학교의 새로운 인재상과 관련, “진리, 창조, 봉사를 교시로 하는 전남대학교에서 세상의 빛이 되는 바른 사람을 키워내기로 정했다.”며 “이는 전문지식을 바탕으로 도전하는 창의적인 사람, 윤리·문화적으로 감성적인 사람, 공동체와 소통하며 세계로 나아가는 함께하는 사람”이라고 소개했다.   정 총장은 “임기 전반기는 혁신의 기조를 유지하면서 융합전공 개설, 대형국책연구과제 수임, 도시재생사업 전개, 민주길 조성 등 많은 일을 진행했는데, 대학 구성원들의 중간평가를 통해 더 열심히 일할 기운도 얻었다.”며 “앞으로는 산적한 대학내외 사업들을 정비하고, 전남대학교가 나아갈 장기적인 방향의 틀과 기반을 닦는데 노력하겠다.”고 말했다."
