대학교명,내용
한국외국어대학교,"우리대학 서양어대학 노어과는 지난 5월 18일(화), 2021학년도 '노어과 후배사랑 장학금 전달식'을 개최했다. '노어과 후배사랑 장학금'은 신동익 동문(88학번)을 기억하고 기념하고자 제정된 장학금으로, 홍주희(19학번) 학생이 2021학년도 장학생으로 선발되었다.이날 장학금을 받은 홍주희 학생은 ""노어과 학생회의 꿈을 이어가는 '후배사랑 장학금'을 받을 수 있게 되어 영광""이라며, ""앞으로도 많은 학생들이 학생회 안에서 다양한 활동을 하고 뜻깊은 추억을 만들며 노어과를 빛내주길 바란다""고 소감을 밝혔다.이승우 노어과 학생회장은 ""여러 선배들과 학생회에 대해 많은 대화를 나누며 학생사회의 일원으로서 책임감을 느꼈고, 앞으로 나아갈 방향에 대해 더욱 숙고할 수 있었던 뜻깊은 자리였다""고 소감을 밝혔다. 또한 ""앞으로도 학과 발전과 학생들의 권익 옹호를 위해 더욱 힘쓰겠다""고 덧붙였다.수여자로 참석한 정원락 동문은 ""이전의 우리가 간절하게 지켜나가고 싶었던 가치를 후배들이 지켜줄 수 있지 않을까 하는 생각을 했다""며, '후배사랑 장학금'은 학과 발전을 바라는 마음을 담아 후배들에게 보내는 작은 격려라고 장학금 전달의 취지를 밝혔다.한편 노어과 후배사랑 장학금 전달식은 지난해 코로나19 상황의 악화로 인해 개최되지 못했으나 올해 재개됐다."
한국외국어대학교,"우리대학은 5월 20일(목), 백년관 총장실에서 온라인 대담 방식으로 '총장과의 대화'를 진행하였다.이번 '총장과의 대화'는 코로나19로 인해 김인철 총장, 최호성 학생·인재개발처장, 김온유 총학생회장, 윤정현 부총학생회장 등 4명이 대담을 나누는 방식으로 총학생회 공식 유튜브 채널을 통해 생중계되었다.글로벌캠퍼스 총학생회는 유튜브 생중계 방식의 '총장과의 대화'를 준비하며 사전에 학생들을 대상으로 다양한 주제에 걸쳐 질문에 대한 온라인 접수를 진행하였으며, 총 100여 건이 넘는 질문 중 중요도와 영향력을 고려하여 언어계열 유사학과 통폐합, 송도캠퍼스 개발 계획, 2학기 수업 방식 및 평가 방법, 학점 백분위 산출법 변경 등 주요 질문을 선정하였다. 다양한 주제에 대한 질의에 김인철 총장이 주요 정책들의 비전과 효과, 각종 예시와 데이터 등 세세한 내용을 설명하며 소통하는 시간을 가졌다.행사를 주관한 김온유 총학생회장은 ""현재 글로벌캠퍼스가 발전과 도약의 기로에 서 있는 상황에서 학생들의 다양한 질문에 대해 총장님과 직접 소통할 수 있어 좋았고 앞으로도 소통의 자리가 자주 마련될 수 있도록 노력하겠다""고 소감을 밝혔고, 이에 김인철 총장 또한 ""코로나19로 인해 학생들을 직접 만나기 어려운 상황에서 유튜브 생중계라는 새로운 방식으로 학생들과 소통하는 자리를 갖게 되어 기쁘다. 학교 발전을 위한 학생들의 애정 어린 질문과 걱정을 접하게 되어 총장으로서 책임감을 느끼고 학생들을 위해 더 노력하고 더 자주 소통하겠다""고 화답하였다."
한국외국어대학교,"우리대학 글로벌캠퍼스 총학생회는 스승의 날을 맞이하여 5월 13일(목), 백년관 총장실에서 스승의 날을 기념하며 카네이션 증정 행사를 개최하였다.이번 행사는 총학생회가 스승의 은혜를 감사하는 의미를 담아 준비한 행사로, 김인철 총장, 신정환 부총장 및 행사에 참석한 처장단에게 카네이션을 달아드리며, 감사의 인사와 덕담을 나누는 등 사제 간의 돈독한 정을 쌓는 뜻깊은 시간을 가졌다.김온유 총학생회장(영미권통상통번역전공 15)은 ""때론 학생 복지와 권리, 각종 현안을 두고 학교 본부와 치열하게 논쟁하고 부딪히지만, 평소에는 스승과 제자로서 서로를 존경하고 아끼는 마음을 가지고 있다""며 소감을 밝혔다."
한국외국어대학교,"지난 5월 7일(금), 우리대학 서울시캠퍼스타운사업단(이하 '사업단')이 추진하는 독립출판프로젝트를 통해 대학언론을 다룬 책 '라이터'가 출판됐다.'라이터'는 대학 학보사에 대한 관찰기를 담은 도서다. 이준성, 이수빈(이상 미디어커뮤니케이션 19) 두 학생이 공동 집필했다.'라이터'는 '외대학보'를 비롯하여 경희대학교 대학주보, 서강대학교 서강학보, 서울대학교 대학신문, 성균관대학교 성대신문, 연세대학교 연세춘추 등 총 6개 대학 학보사를 직접 만나 인터뷰한 내용을 담았다. 각 대학 학보사를 직접 방문하여 기자들의 활동 모습 등 대학언론에 대한 기록을 사진과 글을 통해 대학생 저자들이 생생하게 직접 담아냈다는 점에서 그 의의를 찾을 수 있다.'라이터' 출판을 추진한 사업단의 독립출판 프로젝트는 서울시캠퍼스사업단이 지원하는 사업으로, 2019년 1기를 시작으로 올해 3기를 맞았다.신간 '라이터'는 현재 이문일공칠에서 구매할 수 있으며, 이후 판매처가 확대될 예정이다."
한국외국어대학교,"정현규(중국어 77) 바이오플러스(주) 회장이 5월 12일(수), 우리대학을 방문하여 마스크 20만 장을 기부하였다.정현규 회장은 ""코로나로 모두가 어려움을 겪는 시대에 학생들과 교내 관계자들이 코로나를 이겨내는 데 조금이나마 도움이 되었으면 한다""고 기부 소회를 밝혔다. 이에 김인철 총장은 ""어려운 시기에 따뜻한 마음을 전해주신 정현규 회장님께 감사드린다""며 ""교내 구성원들의 건강을 위해 유용히 사용하겠다""고 밝혔다.이날 마스크 전달식에는 정현규 회장을 비롯해 승병욱 뷰티풀코리아(주) 대표이사, 김인철 총장, 김학태 재무·대외부총장, 이재원 대외협력처장, 김종호 중국학대학장이 참석하였다.한편 정현규 회장은 독보적 기술로 전 세계에 히알루론산 필러를 수출하는 바이오플러스(주)를 이끌고 있으며, 현재 바이오플러스(주)는 미용 재료 수출뿐만 아니라 중국 하이난 개발 프로젝트에 참여하여 바이오연구개발센터, 종합성형병원 등을 건설하는 등 글로벌 뷰티 시장을 선도하고 있다."
한국외국어대학교,"반병렬(영어 55) 반씨대종회장이 5월 10일(월), 우리대학의 글로벌 인재 양성을 기원하며 학교발전기금 1억 원을 기탁하였다.반병렬 회장은 ""모교의 발전과 미래 인재 양성에 도움이 되었으면 한다. 우리대학이 외국학 연구와 융복합 교육을 선도하는 세계적인 싱크탱크로 발돋움하길 바란다""며, 세계로 뻗어가는 대학생들의 꿈을 이뤄줄 수 있는 학교의 사명과 역할을 다해줄 것을 당부하였다.김인철 총장은 반 회장의 모교와 후배 사랑에 감사의 뜻을 전하며, 4차 산업혁명 시대 지식기반 사회에서 새로운 학문의 영역을 발굴하고 그 성과를 공유하여 사회에 기여할 것을 약속했다.이날 우리대학은 반병렬 회장의 뜻을 기리어 강의실을 헌정했다."
한국외국어대학교,"- 강영훈 전 총리 가족, 고인 뜻 기려 우리대학 총동문회에 장학금 1억원 기탁우리대학 총동문회(회장 민동식)는 5월 3일(월), 서울캠퍼스 총동문회 사무실에서 '청농(靑儂) 강영훈 국무총리-김효수 여사 장학금' 수여식을 개최하였다. 이번 수여식에 앞서 강 전 총리 가족(강성룡, 혜연, 효영)은 올해 강 전 총리 서거 5주년을 맞아 부모의 뜻을 기려 지난 4월 20일(화), 장학금 1억 원을 총동문회에 기탁하기로 하였다.이에 따라 총동문회는 올해부터 향후 10년 동안 매해 두 명(남녀 각 1명)의 학생을 선발하여 각 500만원씩 총 1,000만원의 장학금을 지급할 계획이다. 장학생은 전년도 동문 멘토링에 참여한 학생 중 동문 멘토의 추천을 받아 총동문회가 선발한다.올해 첫 장학생으로 선발된 유중곤(중국어통번역 15), 유승연(국제통상 18) 학생은 어려운 환경 속에서 배움에 힘쓰고, 타인을 위해 나눔과 봉사를 실천해온 점에서 좋은 평가를 받았다.육군사관학교 교장과 주영국 대사를 거쳐 국무총리를 지낸 강 전 총리는 우리대학 대학원장으로 재직한 바 있으며, 부인 김효수 여사는 우리대학 영어과를 졸업한 동문으로 내외가 우리대학과 인연이 깊다.가족을 대표하여 행사에 참석한 강성룡 변호사는 ""대한민국의 미래를 짊어질 인재 육성에 큰 관심을 기울이신 부모님의 뜻을 기려 한국외대에 장학금을 기탁 하게 됐다""고 밝혔다. 민동석 총동문회장은 ""주영국 대사관에서 대사로 모실 때부터 외교관으로 공직생활을 하는 동안 평생 멘토이셨다. 내외분 모두 외대 사랑이 지극한 '외대인'이다""며 총동문회에 장학금을 쾌척한 강 전 총리에게 감사의 뜻을 전했다.이날 장학금 수여식에는 민동석 총동문회장과 강성룡 변호사를 비롯하여 공영익 총동문회 멘토링 이사, 윤경욱 대외협력부처장, 이소영 발전협력팀장 등이 참석하였다."
한국외국어대학교,"-12개 국가 대사 참여, 해당 특수외국어의 중요성 알리는 자리 마련-우리대학 특수외국어교육진흥원(원장 오종진)은 4월 30일(금) 오후 2시, 애경홀에서 특수외국어 사용 12개 국가(브라질, 아제르바이잔, 오만, 우즈베키스탄, 인도, 인도네시아, 카자흐스탄, 케냐, 태국, 터키, 포르투갈, 폴란드)의 대사를 초청하여 각국의 언어를 소개하고, 한국 내 특수외국어 교육 확산의 방안을 모색하기 위한 포럼을 개최하였다. 제1회 CFL AMBASSADOR FORUM은 1세션의 신남방/신북방 지역의 언어와 2세션의 전략지역 언어로 구성되었다. 본 포럼을 통하여 우리대학과 특수외국어 사용 국가들의 국내외 네트워크를 증진하고, 특수외국어 교육을 위한 다양한 논의를 통하여 한국 내 특수외국어 교육 활성화의 계기 및 국내외 협력체계를 구축하는 중요한 토대를 마련하는 장이 될 것이라는 측면에서 그 의미가 크다.김인철 총장은 환영사를 통해 “특수외국어 학과를 포함한 총 45개 언어 교육이 이루어지는 한국외국어대학교에서는 글로벌 네트워크를 바탕으로 전 세계의 언어, 인문, 사회 그리고 과학과 기술을 아우르는 융복합 인재 양성을 목표로 교육이 이루어지고 있다”고 강조하면서, “특수외국어의 저변 확대에 기여하고, 해당 언어권의 사회-문화적 감각과 소양을 갖춘 우수한 외국어 전문 인재를 창출하는 교육 네트워크의 중심에서 한국외국어대학교가 함께 협력해 나갈 것”이라고 밝혔다.또한, 특수외국어교육진흥원 오종진 원장은 기조연설을 통해 “특수외국어교육진흥 사업의 목표는 다양하고 전문적인 교육 기회를 특수외국어에 관심 있는 사람들에게 제공함은 물론, 특수외국어 전문 인재 양성을 통하여 국가 경쟁력 향상에 기여하는 것”이라고 설명하며, “12개국 대사가 참여하는 본 포럼을 통하여 관련 국가들과 함께 국경을 초월한 협력체계를 구축하고, 국내 특수외국어 교육을 더욱 촉진하는 계기가 될 것”이라고 전했다.2016년 특수외국어 교육 진흥에 관한 법률이 제정되면서, 글로벌 시대를 맞아 국내 기업의 신흥시장 진출, 국가 교류 다변화, 해외 취·창업 등으로 인해 증가하는 대내외적 신수요를 반영하여 주요 외국어 외에 국가발전을 위해 전략적으로 필요한 53개 언어가 특수외국어로 지정되었다. 1단계(2017-2021) 특수외국어 교육 진흥 사업은 특수외국어교육법의 취지에 따라 특수외국어 교육을 체계적으로 지원하기 위한 기반 조성 및 전문 인재 양성을 목적으로 교육부-국립국제교육원의 지원을 받아 전문기관별로 다양한 프로그램이 운영되고 있다.사회적 거리 두기로 인한 온라인 교육이 필수가 된 코로나19 상황 속에서 교육계에도 자연스러운 디지털 전환이 이루어지고 있으며, 그간 위축되었던 국제간 교류는 시간과 공간의 물리적 경계가 허물어진 온라인에서 더욱 활발하게 이루어지고 있다. 이러한 측면에서 제1회 CFL AMBASSADOR FORUM 역시 코로나19 상황 속에서 방역 수칙을 지키며 온·오프라인으로 진행되었다.100여 명의 특수외국어 관련 학과 재학생들 뿐 아니라 특수외국어에 관심 있는 일반인들이 온라인으로 참여하여 각국의 대사로부터 언어와 문화에 대한 설명을 직접 듣고, 궁금한 점을 알아볼 수 있는 의미 있는 시간을 가졌다.※ 관련 보도 'Save the languages' - 중앙데일리, 2021.05.04.(화)"
한국외국어대학교,"우리대학은 4월 16일(금) 오후 3시, 서울캠퍼스 스마트도서관에서 공공인재개발원 개원식과 현판제막식을 개최하였다. 공공인재개발원은 이전 진로취업지원센터의 행정지원을 통하여 운영되었던 고시반을 공공분야 인재 양성의 의지를 강화하고자 신설한 조직이다. 공공인재개발원의 산하에는 Pre-Law School, 행정고시 연구실, 국립외교원시험 연구실, CPA시험 연구실, 언론고시 연구실, 임용고시 연구실 총 6개의 연구실을 두고 있다.우리대학 김인철 총장은 축사를 통해 학교 차원에서 고시반의 발전을 위한 기구 신설 및 열람실 이전 등 그간의 변화를 강조하며, 앞으로 공공인재개발원 학생 모두가 배전의 노력을 기울여 줄 것을 당부하였다. 이어진 이기현 공공인재개발원장의 답사에서는 이러한 변화를 지원해 주신 데 대한 감사의 인사를 전하며, 향후 좋은 성과로 이어지기까지 학교의 전략적이고 지속적인 관심과 지원을 요청했다.이날 행사에는 김인철 총장 외에 윤석만 서울캠퍼스 부총장, 김학태 재무·대외부총장, 이성하 도서관장, 이기현 공공인재개발원장, 이태욱 기획조정처장, 제성훈 학생·인재개발처장, 곽선주 행정지원처장, 신지혜, 견진만, 지성욱 연구실 지도교수 등 내빈과 학생 대표가 참석하여 새로운 출발을 축하했다."
한국외국어대학교,"우리대학은 4월 19일(월) 오전 11시, 서울캠퍼스 미네르바 콤플렉스 국제회의실에서 '개교 67주년 기념식'을 개최하였다. 이번 기념식 행사는 코로나19 상황을 고려하여 사회적 거리두기 지침을 준수하며 소규모로 진행되었다.[사진. 개교 67주년 기념식에서 축사를 건네는 김인철 총장]곽선주 행정지원처장의 사회로 진행된 기념식 행사는 이태욱 기획조정처장의 학교연혁 보고를 시작으로 김종철 이사장, 김인철 총장의 기념사, 민동석 총동문회장의 축사가 이어졌다.김종철 이사장은 축사를 통해 ""한국외대의 핵심 역량은 외국어이다. 다양한 외국어 분야 중 특히 번역 분야에서의 우수한 업적을 통하여 우리대학의 학문 발전과 위상 확립에 큰 역할을 해주신 두 분에게 법인에서 새로 마련한 동원번역상을 드릴 수 있게 되어 기쁘게 생각한다""고 말했다.그리고 AI, 빅데이터, 질병의 대유행 등 우리에게 닥친 위기에 대하여 우리대학의 생존과 번영을 위한 대혁신에 모든 구성원이 동참하여 줄 것을 당부하였다.김인철 총장은 개교 67주년을 외대 가족 모두와 함께 축하하며, ""대한민국의 산업화와 세계화를 주도한 17만 동문을 배출한 명문사학, 이공계 중심 선두권 대학과 어깨를 겨룰 수 있는 인문학 전통을 가진 융복합 대학으로서의 자부심과 엄중한 소명감을 여러분들과 함께 나눠가겠다""고 전했다.민동석 총동문회장은 ""코로나19와 함께 다가온 저출산과 4차 산업혁명 시대의 위기를 극복하기 위하여, 총동문회에서 도입한 '동문 멘토링'의 선순환 사례처럼 학교와 재단, 총동문회가 긴밀하게 협력해서 우리대학을 다시 한 번 도약시키기로 다짐하는 개교 67주년이 되기를 바란다""고 하였다.[사진. 개교 67주년 기념식에 참석한 김종철 이사장, 김인철 총장, 민동석 총동문회장]이어진 표창장 수여식에서 우리대학 학교법인 동원육영회는 번역 문화 발전에 공헌하고 학교의 위상을 드높인 공로에 대하여 동원번역상을 박우수 영미문학·문화학과 교수, 최성은 폴란드어과 교수에 수여했다. 다음은 장기근속자, 우수교원 및 우수직원 표창 순으로 진행되었다.[사진. 개교 67주년 기념식에서 동원번역상을 수상한 박우수, 최성은 교수][사진. 개교 67주년 기념식에서 업적평가우수교원상을 수상한 이성하 교수]"
한국외국어대학교,"우리대학 한국어문화교육원(원장 김의수)은 4월 13일(화), 한국어 멘토링 봉사단 위촉장 수여식을 개최하였다.이번 멘토링 봉사단은 한국어문화교육원 연수생과 우리대학 학부생이 서로의 문화 및 언어를 공유하며 이를 통해 학문적 지식은 물론 도덕적 인격을 겸비한 우수 인재로 성장하기 위해 발족 되었다. 멘토 학생들은 한국어문화교육원 멘티 연수생들에게 실생활에서 쓰이는 한국어, 한국 문화 및 대학교 생활, 기타 한국 생활에 필요한 조언 등을 이번 봄학기 동안 제공한다.봉사단 대표 이동엽(LD학부 15) 학생은 ""한국어문화교육원 멘토링 봉사단으로 위촉되어 영광스럽다""고 소감을 밝히며, ""이번 멘토링을 통해 한국어문화교육원 외국인 유학생들이 한국어 학습에 더 많은 관심을 갖고 나아가 우리 한국외대 학부생으로 입학할 수 있는 동기부여가 될 수 있도록 최선을 다하겠다""고 각오를 다짐했다.멘티 대표로 참여한 한국어문화교육원 MUNG HIU YING 학생은 ""이번 기회를 통해 한국외대 멘토와 한국 문화에 대해 좀 더 많이 이야기 나누고 싶다""고 말하며, ""한국어문화교육원에서 준비한 멘토링 프로그램이 앞으로도 계속 지속되어 다른 연수생들도 좋은 경험을 쌓을 수 있기를 바란다""고 기대했다.봉사단으로 선발된 우리 대학 학부생들에게는 한국어문화교육원장 명의 위촉장이 수여되며, 활동 종료 후 결과 보고를 통해 성공적으로 멘토링을 마무리하면 우리대학 사회봉사센터에서 지급하는 소정의 활동지원 장학금을 받게 된다."
한국외국어대학교,"우리대학 특수외국어교육진흥원(원장 오종진)은 교육부와 국립국제교육원의 특수외국어교육진흥 사업 지원을 받아 특수목적고등학교와 업무 협약(고양국제고등학교 3월 30일(화), 대일외국어고등학교 4월 12일(월))을 체결하고 고등학교 학생 대상 특수외국어 알리기에 나섰다.본 특수외국어 교육 지원 사업에서는 우리대학 15개 학과가 참여하여 사업 대상 11개 언어 '말레이·인도네시아어, 몽골어, 스와힐리어, 우즈베크어, 이란어(페르시아어), 태국어, 터키어, 포르투갈어, 폴란드어, 헝가리어, 힌디어'를 소개한다. 평소 접하기 어려운 특수외국어 기초 강좌 및 관련 언어‧문화 특강을 통해 청소년의 세계시민 교육 역량 강화와 특수어 교육 확대를 목표로 한다.지난 3월, 고양국제고등학교와 업무 협약을 체결하고, 고양국제고의 특성화 교육 과정 '자기성장 프로젝트 프로그램'으로 인문학 프로젝트와 세계시민 프로젝트를 기획하여 운영하고 있다. 고등학교 2학년 학생들을 대상으로 세계시민 프로젝트의 일환으로 이란어(페르시아어), 터키어, 포르투갈어 등 3개 언어의 특수외국어 기초 어학 교육을 지원한다. 8주 과정으로 이루어지는 본 기초 강좌를 통하여 특수외국어 저변 확대 및 청소년 글로벌 마인드 함양에 기여할 것으로 기대하고 있으며, 하반기에는 언어를 확대하여 진행할 계획이다.대일외국어고등학교는 상반기에 고등학교 3학년 학생들을 대상으로 '특수외국어를 통한 세계의 언어와 문화' 특강을 진행한다. 4월 중순 진행되는 1차 특강은 스와힐리어, 태국어, 터키어, 포르투갈어 등 4개 언어로 특수외국어 사용국가 소개, 언어 및 문화적 특징, 관련 언어 학습과 연계된 진로 및 취업 안내 등을 다룬다. 이후 순차적으로 진행되는 특강을 통해 해당 언어 전반을 소개할 예정이며, 학생들의 특수외국어를 통한 문화적 다양성 이해도 및 특수외국어 흥미도 향상을 기대하고 있다.오종진 특수외국어교육진흥원장은 ""외국어 교육에 특성화된 특수목적고등학교의 인재 양성 방침에 맞춰 다양하게 기획된 프로그램을 통하여 학생들의 특수외국어 흥미도 향상과 더불어 지속적 학습으로의 연계까지 목표로 하고 있다""며, ""종합적이고 전문적인 특수외국어 교육 지원을 통하여 특수외국어에 대한 이해도 신장 및 청소년 학문 후속세대, 특수외국어 인재 양성 기회의 폭넓은 확대를 위하여 특수목적고등학교를 포함 중·고등학교와 업무 협약을 사업 기간 지속적으로 확장해 나갈 예정이다""라고 향후 계획도 밝혔다."
한국외국어대학교,"우리대학은 고용노동부에서 주관하는 2021학년도 대학일자리플러스센터사업 운영대학(대형)으로 선정되어 지난 3월 19일(금), 고용노동부와의 협약을 체결하였다. 이로써 우리대학은 1년 차 사업비 6억 원과 매년 성과평가를 통하여 최대 5년간 총 30억 원 규모의 사업을 운영하게 된다.대학일자리플러스센터사업은 2016학년도부터 2020학년도까지 고용노동부 주관으로 운영되어온 대학일자리센터사업의 후속 사업으로, 지난해까지 학생·인재개발처 진로취업지원센터를 중심으로 본 사업을 운영해왔고, 기존 사업에 이어 후속 사업에도 참여하게 됨으로써 학생들의 진로 및 취업 지원체계를 지속적으로 발전시킬 수 있는 여건을 마련하게 되었다.제성훈 학생·인재개발처장 겸 대학일자리플러스본부장은 ""지난 5년간 대학일자리센터사업을 통해 쌓아온 경험과 인프라를 기반으로 대학일자리플러스센터사업에서는 취업 지원 시스템 고도화, 전문적인 학생상담 연계체계 운영, 기업 DB 및 잡 매칭 프로그램 강화, 대외 기관 협력 및 지역 청년 취업 지원 프로그램 확대 등을 중점적으로 시행하여 대학생 및 지역 청년들의 사회진출을 지원할 예정이다""라고 밝혔다."
