대학교명,내용
한국외국어대학교,"글로벌캠퍼스 학생상담센터에서는 지난 10월 31일부터 11월 14일 사이, 총 3회에 걸쳐 자신에게 적합한 스트레스 해소법을 찾기 위한 집단상담 프로그램인 '나를 위한 스트레스 해소법'을 진행하였다. 매주 심리학에서 알려주는 건강한 삶의 비결과 스트레스에 대한 현명한 대처를 다루었고, 다양한 활동을 경험하며 자신에게 맞는 스트레스 해소법을 탐색하였다. 참가학생들은 스트레스와 우울을 이해하는 과정과 컬러링 등의 작업이 즐겁고 도움이 되었다고 하였다.글로벌캠퍼스 학생상담센터는 매 학기 다양한 프로그램을 진행하고 있다. 자세한 사항은 학교 홈페이지, 학생상담센터 홈페이지, 페이스북을 통해 확인할 수 있다."
한국외국어대학교,"우리대학 진로취업지원센터는 12월 6일(목) 서울캠퍼스 미네르바콤플렉스 국제회의실에서 10시부터 18시까지 2018 글로벌 해외진출 설명회(Global Career Day)를 개최했다. 이번 설명회는 국제기구 취업전문가, 한국무역협회 무역아카데미, 대우세계경영연구회, aT 한국농수산식품유통공사, 외교부, 글로벌 다국적기업 현직자 등이 참여하여 해외 인턴십, 해외취업, 국제기구 취업전략, 글로벌 커리어 개발전략 등 다양한 해외 진출에 관한 특강을 진행하였다. 설명회장 외부에는 한국외국어대학교 학생들의 해외 현장실습(인턴십) 수기공모 수상작 14점을 전시하여 학생들에게 다양한 해외 인턴십 사례를 공유하였다. 한편, 진로취업지원센터는 대학일자리센터 사업의 일환으로 학생들의 해외취업역량강화를 위한 다양한 프로그램을 지속적으로 운영하고 있다."
한국외국어대학교,"우리대학은 지난 12월 6일(목) 국내 유수의 기업들을 대상으로 인재채용 및 조직 內 리더의 발굴과 육성, 조직진단 등의 서비스를 제공하는 전문 컨설팅기업 ㈜태드솔루션과 글로벌 인재육성을 위한 MOU를 체결하였다.김인철 총장과 이도형 ㈜태드솔루션 대표는 이날 MOU를 통해 국내기업들의 해외진출을 위한 글로벌 인재육성의 기틀 마련에 양 기관이 협력하기로 하였다.이날 MOU 체결식에서 김인철 총장은 “한국외대의 우수한 어학교육 콘텐츠를 통해 국내 여러 기업들의 글로벌 역량강화에 기여해 온 부분에 대해 자부심을 느낀다”며, “이번 MOU 체결을 계기로 기업들에 특화된 글로벌리더 교육프로그램 개발을 위해 지원을 아끼지 않을 것”이라고 말했다. 이에 이도형 ㈜태드솔루션 대표는 “국내에서 독보적인 지위를 가진 한국외대의 글로벌 콘텐츠와 자사가 보유한 리더 역량진단 및 육성 방법론과 컨설팅 경험을 통해 국내 기업들의 글로벌리더 역량강화를 위한 시너지 효과가 클 것”이라고 기대감을 표했다.현재 우리대학은 교내 여러 교육기관을 통해 국내 유수의 기업들에게 글로벌 역량강화 프로그램 서비스를 제공하고 있다. 이번 MOU는 기업들의 심화되는 글로벌 경쟁 속에서, 해외진출을 위해 어학과 이문화교육 외에, 글로벌 경영관리, 리더십, 글로벌 역량진단 등 한층 다변화 된 교육프로그램 개발을 위한 것으로, 다양한 계층의 기업들이 체계적인 인사관리와 임직원 역량강화를 도모할 수 있도록 설계될 예정이다.한편 이날 행사에는 조기성 글로벌 부총장, 박중찬 국제사회교육원장이 배석하였으며, ㈜태드솔루션 이도형 대표, 송제환 전문위원, 이주헌 전무 및 주요 관계자들이 참석하였다."
한국외국어대학교,"우리대학 전략홍보팀 박창호 부장이 지난 12월 5일 서울 장충동 서울클럽 한라산룸에서 진행된 '제10회 한국대학신문 대학직원대상 시상식'에서 최우수 대상인 교욱부 장관상을 수상하였다.'제10회 한국대학신문 대학직원 대상 시상식'에는 우리대학 전략홍보팀 박창호 부장을 비롯하여 총 15명이 수상하였으며, 이인원 한국대학신문 회장, 홍준 한국대학신문 대표이사, 김규태 교육부 고등교육정책관 등 80여명이 참석하였다.그동안의 노고를 인정받아 대상을 수상한 박창호 부장은 수상 소감을 밝히며, ""한국외국어대학교 뿐만 아니라 우리나라 대학이 세계 대학과 경쟁에서 우뚝서서 국가 발전의 초석이 되었으면 한다""고 강조하였다."
한국외국어대학교,"글로벌캠퍼스 학생상담센터에서는 2학기 집단상담 '발표불안감소 프로그램'을 10월 29일, 11월 5일, 12일, 19일, 26일 5회에 걸쳐 실시하였다.이번 집단 상담 프로그램에서는 '발표불안'에 대해 적극적으로 알아보고 발표와 친해지는 시간을 가졌다. 학생들은 불안감에 대한 원인을 살펴본 후 자신의 의견을 자연스럽게 표출하는 방법을 찾아보았다.학생상담센터는 매 학기 집단상담 프로그램으로 '발표불안감소 집단상담프로그램'을 진행하고 있다. 구체적인 프로그램 일정과 내용은 학교 홈페이지와 학생상담센터 홈페이지 그리고 학생상담센터 페이스북을 통해 확인할 수 있다."
한국외국어대학교,"우리대학은 지난달 30일 서울 종로구 AW컨벤션센터에서 열린 여성가족부 ‧한국청소년활동진흥원 주최 “2018 국제청소년 리더교류 지원사업 결과보고회”에서 여성가족부 장관상을 받았다.이날 결과보고회에서, 이번 행사에 참여했던 참가자 가운데 박상희(영어학전공), 상염(국어국문학) 학생은 여성가족부 장관상을, 권현선(철학과), 이월명(외국어로서의 한국어 번역 전공)은 한국청소년활동진흥원 이사장상을 수상하였다.더불어 본교의 “‘공감(共感)’하며 ‘공존(共存)’하는 국제 청소년 리더” 프로그램은 우수 프로그램으로 선정되어 장관상 수상은 물론, 현장에서 우수 사례 발표의 시간을 가졌다.이 자리에는 오종진 국제교류처장, 오세권 국제학생지원팀장이 배석하였으며, 운영을 맡았던 국제학생지원팀 전다록 담당은 “이번 프로그램이 한국외대의 특성을 충분히 살려 ‘국제’ ‧ ‘청소년’ ‧ ‘리더’의 의미를 학생들이 스스로 탐구해가는 기회를 마련했다는 점에서 보람을 느낀다.”는 소감을 밝혔다.한편 우리대학 국제학생지원팀이 주관한 본 행사는 2018년 6월부터 10월까지 약 4개월 간 19개국 본교 내 ‧ 외국인 학생이 참여하여 강릉, 속초, 용인 등 다양한 지역을 함께 탐방하며 깊은 우애를 다지고, 리더십을 함양하는 시간이었다."
한국외국어대학교,"지난 11월 29일(목), 서울시청 다목적홀에서 서울시와 7개 대학(한국외대, 건국대, 명지대, 상명대, 서일대, 성신여대, 숙명여대)이 공동 주최하는 ‘2018 서울시 일자리 해커톤’ 행사가 열렸다.이번 행사는 청년이 주도적으로 새로운 ‘일자리’에 대한 아이디어를 내고, 그것을 실현하는 장을 마련하여 ‘아래로부터의 청년뉴딜일자리’를 실현하고자 실시되었다.이번 행사에는 일자리 아이디어를 공모한 42팀 중 선발된 15팀이 참가하였으며, 심사위원 및 시민평가단의 최종 평가를 통해 수상팀이 결정되었다.우리대학 ‘코워커스(Co-Walkers)’팀은 중소기업과 마케터를 연결해주는 ‘웹 브랜드 마케터’를 제안하여 장려상을 수상하였다. 한국외대 총장상은 반려동물 클리닉을 제안한 ‘아리오빠’팀이 수상했다.수상팀들의 우수 아이디어는 검토를 통해 일자리 사업화가 이루어지게 된다.한편, 우리대학 진로취업지원센터는 고용노동부 대학일자리센터 사업을 운영 중이며, 이와 관련하여 진로상담, 각종 진로 및 취업지원 프로그램, 지역연계 프로그램 실시를 통해 학생 역량 강화를 위해 힘쓰고 있다."
한국외국어대학교,"우리대학 지역특화 청년 무역전문가 양성사업단(이하 GTEP) 지난 7월부터 9월까지 각종 해외 박람회에 참여했다.지난 7월 18~20일 싱가포르에서 개최된 ‘제 19회 Singapore Gifts & Premiums Fair 2018'에는 스페인어통번역학과 김누리 학생이 참여했다. 김누리 학생은 ""싱가포르에서 개최하는 이번 전시회에 참여하게 되어 큰 영광이다"" 라고 하였으며 ""이번 전시회를 통해 한국 중소기업들이 싱가포르 및 다양한 국가에 진출하는 것이 용이해졌으면 좋겠다"" 라고 하였다.지난 8월 24~27일에는 대만에서 개최된 ' 2018 Taiipei Beauty Show K-BEAUTY Expo에 스페인어과 조현우 학생은 글로벌 종합 미용 유통업체인 '인코아'와 참여하였다. 그는 ""계속해서 좋은 마케팅, 영업을 위해, 혹은 회사 상품을 창의적으로 팔 수 있기 위해 실력과 경험을 쌓는 것이 중요하다는 것을 깨달았다. 또한 이를 위해 평소부터 계속해서 새로운 사고를 하고 머리를 쓰는 연습을 해야겠다고 생각했다."" 라고 하였다.마지막으로 지난 9월 28~30일 3일간 스페인 마드리드에서 진행된 'IFEMA 마드리드 미용전시회'에는 스페인어통번역학과 서예은 학생과 김누리 학생이 참여하여 부천 소재 중소기업인 ‘홈케어’의 제품들을 홍보해 스페인 바이어들을 비롯한 많은 유럽 및 중남미 바이어들의 관심을 받았다. 서예은 학생은 ""마드리드 미용전시회는 기존의 국내 및 해외 전시회들과는 다르게 하루 10시간 동안 진행되어 몸은 힘들었지만, 더 많은 실무를 배울 수 있는 뜻깊은 경험이었습니다.""라고 하였다.한편 우리대학 GTEP 사업단은 무역관련 실무지식과 현장교육을 접목하여 기업현장의 요구에 부합하는 맞춤형 인재 양성을 목적으로 하며 한국무역협회 및 산업통상자원부의 지원을 받아 국내외 다양한 전시회에 중소기업의 수출업무를 돕고 있다."
한국외국어대학교,"서울캠퍼스 학생상담센터와 동대문구 정신건강복지센터는 지난 11월 19일(월) 국제학사 및 학생회관 1층 로비에서 ‘빨간 우체통’ 설치식을 진행하였다.빨간 우체통 사업은 학생상담센터와 동대문구 정신건강복지센터 생명존중 자살예방 협력 사업의 일환으로, 정신건강에 어려움을 겪는 학생들이 ‘빨간 우체통’을 이용하여 도움을 요청하는 방식을 활용한다. 주기적으로 우체통에 접수된 편지를 수거하여 도움을 요청한 대상자에게 검사, 상담, 치료기관 연계, 치료비 지원, 복지자원 연계 등의 서비스 등을 제공할 계획이다. 우리대학 빨간 우체통은 국제학사 및 학생회관 1층 로비에 위치해 있으며, 도움을 필요로 하는 교내 재학생은 누구나 24시간 이용가능하다."
한국외국어대학교,"우리대학 지역특화 청년 무역전문가 양성사업단(이하 GTEP) 학생들이 지난 11월 1일~2일 싱가포르에서 개최된 ‘싱가포르 한류 박람회(2018 KBEE)’에 참여했다.산업과문화 융합 수출 마케팅 사업인 ‘싱가포르 한류 박람회 (2018 KBEE)’는 코트라와 산업통상부자원부의 주최 하에 싱가포르의 마리나 베이샌즈 컨벤션 센터에서 개최되었다. 한류 박람회란 한류 스타의 공연이나 팬미팅과 연계에 한국의 소비재와 서비스를 홍보하고 수출 마케팅을 추진하는 행사이다. 이번 전시회에는 화장품, 패션의류, 생활용품, 식품, 교육 콘텐츠 등의 분야에서 121개 기업이 참가해 아세안 전역에서 참가한 260개 바이어와 투자자들과의 비즈니스 상담을 가졌다. 또한 배우 송지효와 한류 아이돌 스누퍼 등 홍보대사의 공연과 팬 사인회, 사회공헌활동(CSR)이 진행되었다.우리대학 GTEP 학생들은 이번 전시회에 ‘핀덴 스킨베베’의 제품들을 홍보해 여러 바이어들의 관심을 받았다. 핀덴 스킨 베베는 한솔교육에서 만든 프리미엄 영유아 스킨케어 브랜드이다. 핀란드 자작나무수액, 센텔라아시아티카, 세라마이드 등으로 구성된 특허 성분 '노르딕 리커버리 콤플렉스'를 개발해 전 제품에 적용했으며, 인공향료·인공색소·미네랄오일을 배제하고 피부 자극테스트를 완료해 아기 피부에도 안심하고 사용할 수 있다.이번 박람회에 참가한 스페인어 통번역학과 김나연 학생(4학년)은 “신남방시장의 중심지 답게 혁신적이고 개방적이었던 싱가포르 한류박람회에선 다채로운 국가의 바이어들을 만나 볼 수 있었다. 그로 인해 각국 소비시장의 특징들을 직접적으로 조사할 수 있었는데, 북미 쪽 바이어는 친환경인증을 요구하는 반면, 중동 쪽 바이어는 할랄 인증을, 동남아 쪽 바이어는 KC인증 여부에 관심을 가지는 특징을 보였다. 또한 전시회에 참가하는 동안 싱가포르 내에서의  한류 여파로 인한 대한민국 중소중견기업의 대외적 긍정적 이미지를 몸소 체험할 수 있었다”라고 참가 소감을 밝혔다.GTEP 사업단은 산업통상자원부가 주관하고 한국무역협회가 교육하는 글로벌 무역전문가 양성 사업이다. 무역관련 실무지식과 현장교육을 접목하여 기업현장의 요구에 부합하는 맞춤형 인재 양성을 목적으로 하며 국내외에서 다양한 전시회에 중소기업의 수출업무를 지원하고 있다."
한국외국어대학교,"우리대학 미디어커뮤니케이션학부는 11월 27일(화), 창립 40주년을 맞이하여 이효성 방송통신위원장을 초청하여 특강을 진행했다.이효성 방송통신위원장은 재학생을 대상으로 '방송언어와 미디어 교육'을 주제로 강연했다. 강연 후에는 김인철 총장과 환담 시간을 가졌다. 그는 ""오래전 한국외대에서 강의한 경험이 있는데 오늘 이렇게 다시 찾게 돼 감회가 새롭다. 그 사이 한국외대가 크게 변화, 발전하였다.""며 ""오늘 학생들과 만나 뜻깊었는데 앞으로도 소통이 원활한 우리 사회를 만들기 위해  더욱 노력하겠다""고 밝혔다. 환담에는 김영찬 미디어커뮤니케이션학부 교수, 임대근 홍보실장이 배석했다."
한국외국어대학교,"우리대학 경영대학이 최근 세계적인 경영교육 프로그램 인증기관인 AACSB(국제 경영대학 발전협의회)로부터 ‘경영학교육 국제인증’을 획득했다. AACSB 경영학교육 국제인증은 전 세계 1만 6천여 개 이상의 경영대학 중 약 5% 만이 획득했다는 점에서 경영교육의 최고 품질 인증으로 평가 받고 있다. 한국외국어대학교는 이번 AACSB 경영학교육 국제인증으로 경영학부 학사과정, 일반대학원 경영학 석사 및 박사과정, 경영대학원(MBA) 과정에 대한 경영학 교육프로그램 품질을 세계적으로 인정받게 됐다.AACSB(Association to Advance Collegiate Schools of Business International: 국제 경영대학 발전협의회)는 경영학 분야의 대표적인 국제 인증 기관으로, 연구와 교육, 예산, 행정 등 총 15가지의 국제적 기준을 설정하고, 각 기준과 주요 필수 지표에 대한 평가 및 심사를 진행한 후 이를 모두 충족시킨 대학에 대하여 인증을 수여하고 있다. AACSB에서 설정한 국제적 기준을 충족하기 위해서는 대학이 비전과 미션을 달성하기 위해 노력하고, 지속적으로 혁신하며, 성과를 창출해야 한다.스테파니 브라이언트(Stephanie M. Bryant) AACSB 인증위원장은 “한국외국어대학교 경영대학이 교육, 연구, 커리큘럼 개발 및 학생 학습의 모든 영역에서 탁월함을 입증했다”고 평가하며 “지원해준 대학 본부와 교수, 행정팀 및 학생 모두에게 축하를 보낸다”고 밝혔다. AACSB 측은 “한국외국어대학교 경영대학은 재학생과 동문 네트워크가 우수하며, 산업계와 대학ㆍ대학원 교육 전반에 공헌하고 있음을 확인했다”며 “이번 인증은 기존 AACSB 인증 경영대학의 네트워크에도 매우 긍정적인 영향을 줄 것”이라고 밝혔다."
한국외국어대학교,"글로벌캠퍼스 학생상담센터에서는 지난 11월 21일 백년관 로비에서 자살 예방 캠페인을 개최하였다.이번 자살 예방 캠페인은 업무협약기관인 용인시 정신건강복지센터와 함께 주최하였다. 학생들을 대상으로 자살위험성 평가하여 고위험군은 상담 프로그램과 연계하였으며, 우울·스트레스에 대한 간이평가를 받을 수 있도록 하여 학생들의 정신건강을 돕고 건강한 삶을 위한 내용을 전했다.기존에 상담소를 찾아오는 학생들에게 서비스를 제공하던 방식과 달리, 직접 현장으로 나가 사은품과 함께 다양한 이벤트를 홍보함으로써 총 130명의 학생들이 참여하였다."
한국외국어대학교,"서울캠퍼스 학생상담센터에서는 지난 11월 9일(금)동대문구 정신건강복지센터와 재학생 자살예방사업 실무 TF회의를 진행하였다. 본 회의는 교내 우울 및 자살 위험군에 대한 지역사회 협력체계를 마련하고, 자살위험성의 문제 해결을 위한 개입방향을 모색하여 20~30대 대학생의 학업증진과 자살예방 도모를 목적으로 하였다.본 회의에서는 지속적이고 정기적인 생명존중교육 및 자살예방지킴이 양성교육 진행, 교내 자살고위험 대상자가‘빨간 우체통’을 이용하여 정신건강복지센터로 도움을 청할 수 있도록 하는 빨간 우체동 사업에 대한 논의가 이루어졌다. 이 외 경제적 취약 대학생 치료비 지원, 치료기관 연계 등 다양한 지역사회 자원 연계 사업을 진행할 계획이다."
한국외국어대학교,"우리대학 서울캠퍼스에서 지난 11월 19일(월) 2018학년도 2학기 동원그룹리더십장학재단 장학금 수여식과 간담회가 진행되었다.김인철 총장을 대신하여 장학금을 수여한 김봉철 학생･인재개발처장은 동원그룹리더십장학재단의 동원장학생과 동원IDS장학생들에게 장학생 선발을 축하하고 재단 장학생으로서 재단 설립 취지에 따라 국가와 사회 발전에 기여할 수 있는 글로벌 리더로서 활동하기 위해 노력해 줄 것을 당부하였다. 재단법인 동원그룹리더십장학재단은 2008년 동원그룹에서 10억원을 기탁하여 한국외국어대학교 학생들이 섬김과 봉사정신, 자아개념, 성취욕이 투철하고 국가와 사회 발전에 기여할 수 있는 우수 인재로 성장할 수 있도록  장학금(생활보조비)을 지원하기 위해 설립하였다. 동원장학생은 선발 이후 졸업 시까지 매학기 250만원의 장학금을 지원하고 있으며, 2018년 2학기에는 동원장학생 5명에게 장학금을 지원하였다.특히, 2018년 2학기에는 동원그룹리더십장학재단에서 동원그룹의 장학금 추가 지원으로 대한민국의 풀브라이트(Fulbright Scholarship) 장학사업인 한국외국어대학교 IDS(International Diplomatic Scholarship) 장학생이 체재비 걱정 없이 교육･ 연구에 매진하여 학위 취득 후 본국에서 글로벌 리더로 활동할 수 있도록 지원하기 위한 ‘IDS장학생’ 5명을 신규 선발하여 매학기 180만원의 장학금을 1년간 지원한다."
한국외국어대학교,"서울캠퍼스 학생상담센터에서는 동대문구 정신건강복지센터와 함께 자살예방지킴이 양성교육 ‘보고, 듣고, 말하기’를 진행하였다. 교내 재학생(학부생, 대학원생)을 대상으로 시행된 본 교육은 11월 14일(수), 11시부터 13시까지  BRICS 문화관 대학원 105호에서 진행되었으며, 74명의 학생들이 참여하였다.이번 교육은 자살에 대한 이해와 현황, 자살 위험군에 대한 개입 방법, 게이트키퍼의 역할 등의 내용으로 구성되었으며, 한국형 표준자살예방교육 프로그램 ‘보고 듣고 말하기’ 전문강사가 진행하였다. 교육에 참여한 학생들은 자살위험 대처 방법에 대해 생각해 볼 수 있는 유익한 강의였으며 인권, 자살예방 관련 교육이 더욱 많아졌으면 좋겠다는 의견을 제시하였다. 학생상담센터는 지역사회 협력체계를 통해 교내 구성원을 위한 다양한 정신건강 프로그램을 계획, 진행할 예정이다."
한국외국어대학교,"우리대학 창업교육센터는 지난 11월 9일(금)~10(토) 1박 2일 동안, 글로벌캠퍼스 국제사회교육원에서 창업교육센터 주관으로 ‘2018 하반기 Start Up Camp(이하 창업캠프)’를 개최하였다.처음으로 숙박형으로 진행된 금번 창업캠프에는 서울캠퍼스 학생 10명, 글로벌캠퍼스 학생 26명, 지역 청년고용거버넌스 구축의 일환으로 용인한국외국어대학교부설고등학교 국제학과 1학년 학생 4명 등 총 40명이 참가하였다.1일차에는 창업 아이디어 빌딩을 위한 아이디어 도출방법 및 사업계획서 작성법 특강을시작으로 팀빌딩 및 멘토링의 순서로 진행되었으며, 2일차에는 멘토링, 아이디어 발표, 시상 등의 순서로 진행되었다.참가 후, ‘좋은 네트워크의 장이었음’, ‘이론과 실습 비율이 잘 구성되었음’, ‘창업에 대한 많은 투자와 기대를 확인할 수 있었던 좋은 행사였음’, ‘멘토 선생님들의 열정과 친절함’, 등의 후기를 써낸 참가 학생들은 밤늦게까지 아이디어 발표를 위해 열정적으로 노력하는 모습을 보여 주었다.우리대학 창업교육센터는 창업을 희망하는 학생들을 위해 지속적으로 창업 프로그램을 진행할 예정이다."
한국외국어대학교,"우리대학 글로벌캠퍼스 HUFS Dorm(학사장 폴란드어과 김용덕 교수)에서 기숙사식당 삼성웰스토리와 함께 2018년 11월 15일(목) 19시 기숙사생 40명이 참가한 김장담그기 행사를 개최하였다.외국인학생들에게는 한국 특유의 문화를 직접 체험할 수 있는 유익한 시간이었고, 한국인학생들에게는 어려운 지역주민에게 전달할 김장김치를 직접 만든 뜻깊은 시간이었다. 이 날 만든 김장김치는 모현읍사무소를 통해 독거노인 등 도움이 필요한 이웃에게 전달할 예정이다."
한국외국어대학교,"2018년 11월 8일(목) 서울캠퍼스에서 2018학년도 학생홍보대사 임명장 수여식이 열렸다.김인철 총장을 대신하여 임명장을 수여한 임대근 홍보실장은 학생홍보대사들에게 학교 홍보를 위해 열심히 노력해준 것에 대해 감사 인사를 전했다.이번 2018학년도 학생홍보대사는 새로미 12명, 훕스온(HUFSon) 19명 총 31명이 임명장을 수여받았다.새로미는 고등학생을 대상으로 하는 캠퍼스 투어 및 교내외 학교 행사의 의전을 담당하고 있으며,훕스온(HUFSon)은 학교 공식 SNS를 운영, 관리하며 학교 홍보를 위한 사진촬영 및 영상 제작을 담당하고 있다.이날 임명식에는 임대근 홍보실장, 박창호 전략홍보팀장을 비롯하여 홍보실 직원들이 배석했다."
