,제목,내용
466,"도계 응급구조학과, 「2021년 한국연구재단 글로벌 교육지원 사업」 선정","보건과학대학 응급구조학과（학과장 이현지）가 ‘2021년 한국연구재단 글로벌 교육지원 사업’에 선정되었다.베트남 다낭지역 대학교의 응급구조학과 설립 기반 구축 및 교양교과목 심폐소생술과 응급처치 이러닝 온라인 교육콘텐츠 공동개발이라는 과제로 정부 공적 개발 원조（ODA）사업 첫 수행이며, 2021년 5월부터 2022년까지 사업을 수행한다. 베트남 다낭지역 대학교에 관련 학과를 신설하여 학부ㆍ대학원 교육을 실행할 수 있도록 할 것이며, 또한 베트남 다낭 현지 학생과 주민들을 위한 ‘지역사회 건강증진개발 및 심혈관계 예방프로그램’도 운영할 계획이다.지난해까지 응급구조학과는 국립 베트남 다낭대학교와 다낭 동아대학교는 2019년~2020년간 상호교류 협정을 체결하고, KOICA 지원사업을 받아 베트남 다낭시에 15명의 봉사단원과 FM 파견하는 등 다양한 자원봉사 및 교류 활동을 하였다.사업책임자인 조병준 교수（보건의료교육 융합연구소장）는 “대학의 우수한 석박사 인프라와 연구팀의 사업 운영 경험을 기반으로 응급구조학 분야의 혁신적 글로벌 교육 및 인재 육성을 위해 노력하겠다”라고 말했으며, “이 사업으로 직업 및 고등교육 분야 보건 의료교육 인적자원개발과도 관련되어 베트남과 새로운 협력관계를 강화해 가는 데도 도움이 될 것으로 기대한다”라고 전했다."
467,"삼척·도계 삼척도서관, 도서관 스탬프투어 실시","삼척도서관（관장 신두호）은 5월 10일（월）부터 6월 4일（금）까지 대학 구성원을 대상으로 「도서관 스탬프투어」를 실시한다.이번 행사는 캠퍼스 독서문화 조성 및 대학 구성원의 독서역량 강화를 위한 취지로 계획됐으며, 코로나19 상황을 고려해 온·오프라인을 병행하여 진행된다.‘도서관 스탬프 투어’는 도서관 홈페이지（http://library.kangown.ac.kr）에 준비된 온라인 폼 형식에 접속 후, 미션을 확인 및 수행하여 스탬프를 받는 방식이다.참가자는 도서관 이용자 교육 수강 희망도서 신청 도서 대출 및 한줄 평 전자잡지 서비스 이용 등 미션을 수행하고 결과 제출자 대상으로 추첨을 통해 에어팟, AI 스피커, 미니 공기청청기, 커피상품권 등의 다양한 경품을 제공한다.신두호 도서관장은 “이번 행사를 통해 캠퍼스 내 독서문화가 확산되고 도서관과 가까워질 수 있는 계기가 되길 바란다”며 “지속적으로 구성원들에게 독서 기회를 제공하기 위한 신규 프로그램 및 컨텐츠 개발에 최선을 다하겠다”고 밝혔다."
468,춘천 「고교교육 기여대학 지원사업」 계속지원대학 선정,"우리대학이 5월 10일（월） 교육부의 「2021년 고교교육 기여대학 지원사업」 중간평가에서 ‘계속지원대학’으로 선정됐다.‘고교교육 기여대학 지원사업’은 대입전형 과정의 공정성과 투명성을 높이고 합리적으로 대입전형을 운영해 교육과정에 충실한 고교교육 여건을 조성하기 위해 마련됐으며, 사업비는 입학사정관 등 인건비와 대입전형 운영비, 전형결과 분석 연구비 등으로 사용할 수 있다.이번 중간평가에서는 2020년 지원사업 선정대학 총 75개교의 2020년 사업 운영 실적과 2021년 사업계획, 2022~2023학년도 대입 전형 시행계획 등을 평가했으며, 총 73개 대학이 ‘계속지원대학’으로 선정돼 올해도 지원을 받는다.우리대학은 2020년 유형Ⅰ 사업에 선정돼 지난 1년간 약 8억 6천만원 규모의 국고 예산을 지원받았으며, 이번 계속지원대학 선정에 따라 고교-대학 연계 프로그램 운영 대입전형 공정성 강화 및 정보공개 확대 사회적 배려대상자·지역균형발전 관련 전형 운영 등의 사업을 수행할 계획이다.이보경 입학본부장은 “이번 사업선정을 계기로 실효성 있는 대입전형 정보를 제공하고, 수험생들이 적성에 맞는 올바른 진로를 찾을 수 있도록 다양한 프로그램을 더욱 확대해 나가겠다”며 “앞으로도 내실있는 입시전형 운영과 공교육 활성화를 위해 노력하겠다”고 밝혔다."
469,춘천 「전동킥보드 안전운행 캠페인」 실시,"우리대학은 춘천경찰서（서장 최승화）와 공동으로 5월 11일（화） 춘천캠퍼스 후문 일대에서 「전동킥보드 등 개인형 이동장치 안전운행 캠페인」을 실시했다.이번 캠페인은 5월 13일부터 시행되는 개정 도로교통법에 따른 개인형 이동장치 관련 운전자의 의무 및 안전수칙 강화, 통행방법 등을 알려 캠퍼스내 안전한 교통문화를 조성하기 위해 마련됐다.개정된 도로교통법 시행령에 따르면, 개인형 이동장치를 이용할 경우 제2종 원동기 장치 자전거 면허를 소지해야 하며, 안전모 의무 착용, 동승자 탑승 금지, 음주운전 금지, 보도 통행 불가, 교내 안전속도 준수 등의 수칙을 지켜야 한다.우리대학은 5월 14일（금）까지 춘천캠퍼스 주요 출입로*에서 전동 킥보드 관련 안전수칙 홍보물을 배부하며, 이후에도 총학생회와 함께 동영상, 카드뉴스, 현수막 등 온·오프라인 채널을 통해 지속적인 교통안전 캠페인을 실시할 예정이다.*정문, 후문, 동문, 공대쪽문, 자연대쪽문 등 5개소또한, 캠퍼스내 개인형 이동장치 안전관리 지침 마련, 전용 주차구역 지정 및 확대 등 공유형 전동킥보드 안전사고 예방 및 주차문화 개선을 위한 사업을 추진할 계획이다.김경수 학생처장은 “캠퍼스내 전동킥보드 이용이 증가하고 있지만, 이용자의 안전사고를 비롯해 무분별한 주차로 인한 보행자 불편, 학습환경 저해 등의 문제가 발생하고 있다”며 “관련 법규 준수와 안전한 전동킥보드 이용 문화를 조기에 정착시킬 수 있도록 지속적으로 안내하도록 하겠다”고 밝혔다."
470,삼척·도계 KNU-Star 교수 선발,"우리대학이 코로나19 속에서 진로교육에 어려움을 겪고 있는 지역 고등학교의 교육 지원을 위해 KNU Star 교수를 선발하여 교육 기부를 제공한다.KNU Star 교수는 ‘김현준 교수（전자정보통신공학부）, 최봉길 교수（에너지공학부）, 박훈 교수（건설융합학부）, 서정희 교수（식품영양학과）, 장종식 교수（작업치료학과）, 김상엽 교수（안경광학과）, 김민정 교수（글로벌인재학부）, 신명진 교수（레저스포츠학과）, 박용숙 교수（자유전공학부）’로 총 9명이 선정됐다.또한 선발된 대표 교원 9명은 우수한 강의와 연구로 교육 및 연구역량 제고에 기여하고 변화하는 교육환경에 맞춰 고교생을 위한 온·오프라인 진로 특강 및 교육 서비스를 무상으로 제공할 예정이다.김헌영 강원대 총장은 “코로나19로 어려워진 지역 내 고등학교의 진로교육의 어려움을 해결하기 위한 교수들의 자발적 동참으로 국가거점 국립대학의 교육 서비스 기반 사회적 책임을 다할 것”이라고 밝혔다."
471,"춘천 산림환경과학대학, 「대한민국의 산림연구」 특강 개최","산림환경과학대학（학장 이승환）은 5월 6일（목） 산림환경과학대학 1호관 교양강의실에서 「제1차 산림환경과학대학 특강-대한민국의 산림연구」를 개최했다.이번 강연은 산림환경과학대학 학부생과 대학원생들의 전공에 대한 관심을 제고하기 위해 마련됐으며, 현장 강의와 ZOOM을 통해 학생 및 대학 관계자 150여명이 참여했다.이날 강의는 박현 국립산림과학원장이 강사로 나서, 대한민국 산림의 역사와 산업적 수요, 지속가능한 숲 경영에 대한 내용에 대해 소개하고, 질의응답 시간을 가졌다."
472,도계 코로나19 속 꾸준한 헌혈 실천 앞장,"우리대학이 코로나19 사태 속에서 혈액 수급난 극복을 위한 생명나눔 단체 헌혈 운동에 앞장서고 있다.코로나19의 지속으로 심화하고 있는 혈액수급 문제를 이겨내는 데 도움이 되고자 지난 6일（목） 도계캠퍼스 도서관 앞에서 교직원과 재학생 40여명이 참여하는 생명나눔 사랑의 헌혈을 실시하였다.삼척캠퍼스 헌혈 행사는 지난해 9월 강원혈액원으로부터 「생명나눔 단체 헌혈릴레이」 참여 요청을 받은 이후 6번째 단체 헌혈에 참여하는 것으로써 코로나19 위기 속에서도 헌혈을 통한 이웃사랑 실천을 위해 꾸준히 노력하고 있다.특히, 삼척시에는 헌혈의 집이 없어 헌혈하기 위해서는 가장 가까운 곳인 강릉센터를 이용해야 하는 불편함을 해소하고자 강원혈액원으로부터 헌혈 버스를 지원받아 이번 행사를 하였다.문태영 교육지원처장은 “코로나19로 더욱 어려워진 헌혈 수급에 작은 힘이나마 보탬이 되고자 헌혈 활동을 지속해서 추진하고 있다”고 말하며, “앞으로도 지역 내 사랑과 온정이 필요한 곳에 함께 함으로써 지역거점 국립대학으로 사회적 책임을 다하겠다”고 밝혔다."
473,춘천 「지역선도대학 육성사업」 1단계 평가‘우수 컨소시엄’ 선정,"우리대학이 주관하는 ‘강원권 지역선도대학육성사업단（단장 송영훈 기획처장）’이 「지역선도대학 육성사업」 1단계 사업 운영 평가에서 ‘우수 컨소시엄’에 선정됐다.‘지역선도대학 육성사업’은 교육부와 한국연구재단이 주관하고, 전국 권역별 12개 컨소시엄이 참여하고 있으며, 지역대학과 지자체, 공공기관, 산업계이 컨소시엄을 구성해, 지역 맞춤형 인재를 양성함으로써 지속가능한 지역발전 여건을 조성하는 사업이다.‘강원권 지역선도대학육성사업’은 선도대학인 우리대학을 비롯해 협력대학인 강릉원주대, 경동대, 연세대 미래캠퍼스, 한림대 등 5개 대학과 지자체, 공공기관, 산업체 등 강원지역 27개 기관이 참여하고 있다.이번 1단계 평가는 총 사업기간 5년（2019~2023, 2+3년） 중 1~2차년도 사업 운영 실적을 평가했으며, 강원권 지역선도대학육성사업단은 우수 컨소시엄 선정에 따라 국고보조금 1억원이 증액되어 총 9억원을 지원받는다.강원권 지역선도대학육성사업단은 ‘강원 초（超）융합 공공인재 양성을 통한 지속가능한 강원 성장 생태계 구축’을 비전으로, 5개 대학 간 공동 융합전공 교육과정（공공인재융합전공·공공건강보험융합전공·디지털헬스케어융합전공）을 운영하고 있다.강원권 지역선도대학육성사업단은 1단계 사업을 통해 우수인재 양성을 위한 컨소시엄 구축 융합 교육과정 개발·운영 수요자 맞춤형 고등교육 지원 지역 상생발전을 위한 평생교육 지원사업 등을 추진해왔으며, 향후 3년간 산업체 맞춤형 인재양성과 지역밀착형 공유 네트워크 구축 등 2단계 사업을 지속적으로 고도화할 계획이다.송영훈 강원권 지역선도대학육성사업단장（기획처장）은 “1단계 사업 운영 실적을 기반으로 2단계에도 우수한 사업 성과를 도출하고자 노력하겠다”며 “앞으로도 공공기관 및 산업체 수요를 중심으로 사업의 내실화를 도모해 학생들의 취업역량 강화와 지역사회와의 활발한 소통을 위해 최선을 다하겠다”고 밝혔다."
474,"춘천 교육연구소 생활과학교실, 「온라인 창의생활과학교실」 참가자 모집","우리대학 교육연구소（소장 김진영）가 운영하는 생활과학교실이 5월 11일（화）부터 「2021년 상반기 온라인 창의생활과학교실」 참가자를 모집한다.모집대상은 춘천시, 원주시, 홍천군, 횡성군, 철원군 5개 시·군에 거주중인 미취학 7세 아동과 초등학생 및 학부모이며, 운영기간은 6월 7일（월）부터 8월 25일（수）까지 12주간이다. 실습 재료비를 제외한 수강료는 무료다.‘춘천시 온라인 창의생활과학교실’은 저학년 기초과학교실（초등 2~3학년） 15명 고학년 SW코딩교실（초등 4~6학년） 15명 학부모와 함께하는 기초과학교실（7세~초등 1학년, 학부모 동반） 15명을 각각 모집한다.‘원주시 온라인 창의생활과학교실’은 저학년 기초과학교실（초등 2~3학년） 15명 학부모와 함께하는 기초과학교실（7세~초등 1학년, 학부모 동반） 15명을 각각 모집한다.홍천군은 저학년 기초과학교실（초등 2~3학년） 15명, 횡성군과 철원군은 고학년 SW코딩교실（초등 4~6학년） 과정을 운영하며 각각 10명과 5명을 모집한다.수강을 원하는 사람은 인터넷 또는 모바일로 신청하면 되고, 자세한 사항은 생활과학교실（（033）250-7224）로 문의하거나 다음 카페 게시판（http://cafe.daum.net/chuncheonlifescience）을 통해 확인할 수 있다.한편, 교육연구소 생활과학교실은 2010년부터 한국과학창의재단과 춘천시, 원주시, 홍천군, 화천군, 횡성군 등 각 지자체의 지역보조금을 지원받아 지역 초·중·고교 학생과 주민들을 대상으로 과학 이해 증진 및 과학교육 격차 해소를 위한 과학체험 프로그램을 펼치고 있으며, 2020년 사업운영 최종평가에서 ‘우수’등급을 받아 2021년 계속운영기관으로 선정된 바 있다."
475,전체 「디지털 신기술 인재양성 혁신공유대학」 2개 분야 선정,"우리대학이 참여한 2개 연합체（컨소시엄）이 ‘한국판 뉴딜’ 신규과제로 추진되는 「디지털 신기술 인재양성 혁신공유대학（이하 ‘디지털 혁신공유대학’」 사업 2개 분야에 각각 선정됐다.교육부와 한국연구재단은 5월 3일（월） 우리대학이 참여한 ‘서울대 연합체（차세대반도체）’와 ‘고려대 연합체（에너지신산업）’를 비롯한 총 8개 연합체*를 사업 지원대상으로 발표했다.*사업 선정분야（총 8개） : 인공지능/빅데이터/차세대반도체/미래자동차/바이오헬스/실감미디어/지능형로봇/에너지신산업‘디지털 혁신공유대학’사업은 여러 대학에 흩어져 있는 신기술분야 교육자원을 공동 활용하고 산업체·연구기관·학회·민간기관 등이 참여해 국가 수준의 핵심인재를 양성하는 협력체계를 구축하는 사업이다.각 대학은 신기술 분야 인재 양성을 위해 표준화된 양질의 교육과정을 공동으로 개발·운영하고, 전공이나 소속에 관계없이 희망하는 학생이 신기술분야 교육과정을 수준별·분야별로 자유롭게 수강할 수 있도록 지원할 계획이다.교육부는 최종 선정된 8개 연합체에 올해 예산 816억원（각 102억원）을 지원하고, 앞으로 6년간（2021~2026년） 국가 수준의 신기술분야 핵심인재 10만명을 양성한다는 방침이다.우리대학은 ‘차세대반도체’인재 양성을 위해 서울대（주관대학）, 포항공대, 대구대, 숭실대, 중앙대, 조선이공대 등과 연계를 통한 소재·설계·회로 분야별 교육과정을 개발하고, 온라인 강좌를 공학교육혁신센터 협의체, 공개강좌（K-MOOC, STAR-MOOC）에 공유할 계획이다.또한, 우리대학은 ‘에너지신산업’분야에서 고려대（주관대학）, 서울대, 한양대, 부산대, 전북대, 경남정보대와 학점교류, 평생교육원, 한국형 온라인 공개강좌（K-MOOC） 등을 통해 교육과정 공동 개발 및 운영에 착수하고, 성인 대상 단기과정（마이크로디그리）을 운영해 사업에 참여하지 않는 대학（공동활용대학） 및 일반인도 혜택을 받을 수 있도록 할 예정이다.김헌영 총장은 “디지털 혁신공유대학 사업은 온라인 교육을 기반으로 사업을 추진하기 때문에 포스트 코로나 시대의 온라인 교육 확대와 글로벌 수준의 연구 경쟁력을 확보하는 계기가 될 것으로 기대한다”며 “대학 간 긴밀한 협력체제를 구축하고 각 기관이 보유한 인적 자원 및 인프라 공유를 활성화해 우수인재 양성과 지역 균형발전에 지속적으로 앞장서겠다”고 밝혔다."
476,"춘천 산림환경과학대학-한솔제지, 「연구교류 협력 업무협약」 체결","산림환경과학대학（학장 이승환）과 한솔제지（대표이사 한철규）는 4월 30일（금） 산림환경과학대학 대회의실에서 「연구 교류 협력을 위한 업무협약」을 체결했다.이번 협약에 따라, 양 기관은 국내 나노셀룰로오스 생산 기술 연구 기능성 소재 개발 연구 나노셀룰로오스의 고도화 응용 방안 연구자 상호 교류 연구성과 및 학술교류 등에 대해 긴밀히 협력하기로 했다.이승환 학장은 2020년 7월 한솔제지와 함께 ‘나노셀룰로오스 산업화 전략 포럼’을 창립하고, 국내 나노셀룰로오스 생산 및 응용기술 개발, 산·학·연 네트워크 체계 구축에 앞장서고 있다.이승환 학장은 “산림과학연구소는 ‘이공분야 중점연구소’로 선정되어 나노셀룰로오스의 고효율적 생산 기술과 다양한 기능성 소재 개발 연구에 주력하고 있다”며 “양 기관의 연구 협력과 우수한 연구성과를 바탕으로 국내 나노셀룰로오스 제조 및 응용기술 개발, 관련 산업 발전에 기여할 수 있도록 적극 노력하겠다”고 밝혔다."
477,"춘천 LINC+사업단, 「스마트 챌린지 시티형 예비사업」 선정","우리대학 사회맞춤형 산학협력 선도대학 육성사업단（LINC+사업단, 단장 최성웅）이 4월 26일（월） 국토교통부가 주관하는 「스마트 챌린지 시티형 예비사업」에 선정됐다.이번 사업은 기업과 시민, 지자체가 협력해 다양한 도시문제 해결을 위한 혁신적인 기술과 창의적인 아이디어를 발굴하고 적용하는 사업으로, 춘천시를 비롯해 대구시·충북도·포항시 등 4개 지역이 사업대상지로 선정됐다.우리대학은 춘천시와 함께 ‘시민참여형 탄소 제로도시 구현’을 골자로 사업을 추진하며, KT, 한국기후변화연구원, 나모, KEVC, 한국엘이디, 가티, 모토밸로 등 정보통신기술（ICT） 기업들이 컨소시엄 파트너로 참여한다.이번 사업 선정에 따라, 우리대학과 춘천시는 올해 국비 15억원을 지원받아 예비사업을 시행하며, 이후 평가를 거쳐 본사업 대상지 2곳에 선정될 경우 2년간 200억원（지방비 50％）을 지원받게 된다.우리대학은 개인이 타고 다니는 자동차에 센서를 달아 운행량이 줄어든 만큼 탄소절감 포인트를 제공하고, 택시 공유승차와 대중교통 이용거리에 대응한 포인트 제공 서비스를 시범 운영하며, 이를 통해 모빌리티 공유서비스를 탄소배출권 수익 구조와 연계한 지자체 최초의 실증모델을 구현할 계획이다.또한, 춘천캠퍼스 정문 앞에 조성되는 탄소카페를 ‘탄소 제로도시’ 홍보관으로 활용해 시민과 학생들에게 탄소배출권 플랫폼의 중요성을 알리는 다양한 홍보사업을 펼칠 예정이다.향후 본사업 단계에서는 춘천시의 스마트 도시계획 수립을 위한 연구용역을 진행하고, ‘스마트 에코시티 및 스마트 PM-Road（Personal Mobility）’를 설계하는 등 춘천시 탄소배출권 플랫폼 구축에 중추적 역할을 수행하게 된다.박동환 LINC+사업단 산학협력중점교수는 “이번 사업을 통해 춘천시의 교통 수요현황 빅데이터 알고리즘 개발, 역세권과 우리대학 캠퍼스를 연결하는 스마트 PM-Road 조성 등 혁신적인 열린 캠퍼스를 만들어 나가겠다”고 밝혔다."
478,춘천 강원디자인진흥원과 「강원권역 디자인분야 발전 협력 업무협약」 체결,"우리대학과 강원디자인진흥원（원장 최인숙）은 4월 27일（화） 대학본부 3층 교무회의실에서 「강원권역 디자인분야 발전 협력을 위한 업무협약」을 체결했다.이번 협약식에는 김헌영 총장과 최인숙 원장 등 양 기관 관계자 10여명이 참석했으며, 앞으로 양 기관은 지역 디자인분야 발전과 융합형 디자인 창의인재 양성을 위한 다양한 협력사업을 펼쳐나갈 계획이다.이번 협약의 주요 내용은 디자인사업 발굴과 활성화를 위한 연구 및 인적·물적 교류 융합형 창의인재 양성을 위한 디자인 교육분야 협력 디자인문화 조성 및 확산을 위한 교육·행사 등 정보·자원 교류 등이다.김헌영 총장은 “이번 협약을 통해 강원도 디자인산업 활성화를 위한 협력체계를 공고히 하고, 지역경제와 기업들의 경쟁력을 갖추는 계기가 될 것으로 기대한다”며 “앞으로도 디자인사업 발굴 및 연구협력 등 지역의 핵심적인 디자인 혁신거점으로서 특화된 역할과 기능을 수행해 나가겠다”고 밝혔다."
479,춘천 「2021년도 춘천캠퍼스 교수회의 임시회의」 개최,"우리대학은 4월 27일（화） 온라인 비대면 방식으로 「2021년도 춘천캠퍼스 교수회의 임시회의」를 개최했다.이날 회의에는 김헌영 총장과 이한수 교수회장을 비롯해 주요 보직자와 교직원 등이 유튜브 실시간 중계를 통해 참석했으며, 국민의례 교수회장 인사말 총장 인사말 부서별 주요업무 보고 질의응답 순으로 진행됐다.김헌영 총장은 “학령인구 감소와 코로나19를 비롯한 위기를 슬기롭게 극복할 수 있도록 대학 구성원들의 협조가 절실히 필요한 시점”이라며 “구성원과의 소통을 통해 교육의 질적 향상과 연구력 제고, 지역발전 기여를 위한 발전계획을 실행해 나가겠다”고 밝혔다."
480,"춘천 법학전문대학원, 「제10회 변호사시험」 34명 합격","법학전문대학원（원장 정진근）이 4월 21일（수） 발표된 「제10회 변호사시험」에서 34명이 합격하는 성과를 거뒀다.우리대학은 올해 변호사시험에서 2021년 2월 졸업생 33명 중 20명이 합격해 60.6％의 합격률을 기록했으며, 이는 지난해 졸업자 33명 중 15명이 합격한 제9회 변호사시험 대비 약 15％ 상승한 결과다.특히, 연간 졸업생 인원 33명 대비 합격자 비율은 103％에 해당하며, 전제 합격자 수는 제8회 변호사시험 25명, 제9회 변호사시험 26명에 비해 약 30％ 증가했다.정진근 법학전문대학원장은 “변호사시험 합격률 제고를 위해 학력 분석도구를 개발하는 등 각고의 노력을 기울였다”며 “강원도민의 염원을 담아 설립된 강원대 로스쿨이 한걸음 한걸음 앞으로 나아갈 수 있도록 지역사회의 따뜻한 관심과 응원을 부탁드린다”고 밝혔다.한편, 법학전문대학원은 2009년에 설립된 이래 2020년 이준영 판사（4기）, 김명섭 검사（10기）, 손형택 재판연구원（10기）이 임명된 것을 비롯해 판사 1명, 검사 4명, 재판연구원 10명, 변호사 281명을 배출했다."
481,"춘천 장애학생 인권증진 동아리 ‘인지해（人之諧）’, 「강원도장애인종합복지관 성금」 전달","우리대학 장애학생 인권증진 동아리 ‘인지해（人之諧, 회장 전경탁）’는 4월 20일（화） 장애인의 날을 맞아 「강원도장애인복지관 후원을 위한 성금 77만원」을 전달했다.이번 성금은 ‘인지해’ 회원들과 학생, 일반시민을 대상으로 진행한 SNS 이벤트를 통해 마련했으며, 이날 강원도장애인종합복지관에서 열린 성금 전달식에는 전경탁 ‘인지해’ 회장과 김남영 고문이 참석했다.‘인지해（人之諧）’는 ‘사람 사이의 어울림’이라는 뜻으로, 2017년 설립됐으며, 장애인 인권증진을 위한 ‘울림제’ 개최, 지역 장애 중·고교생 대상 진로탐색과 전공체험 등 장애인권 교육 및 장애인식 개선을 위한 다양한 활동을 펼치고 있다.전경탁 회장과 김남영 고문은 “강원도의 장애인 복지 및 인권 강화를 위해 조금이나마 도움이 되기를 바란다”며 “우리 ‘인지해’ 동아리도 장애학생들이 자신의 권리를 스스로 찾아 누리고 주어진 역할에 책임을 다하는 사회구성원으로 성장해 나갈 수 있도록 다양한 활동을 펼쳐 나가겠다”고 밝혔다."
