,제목,내용
717,"춘천 강원대기술지주회사, 「2020년 기술지주회사 자회사 R&BD 지원사업」 주관기관 선정","강원대기술지주회사（대표이사 윤경구）가 5월 6일（수） 중소벤처기업부와 한국산업기술진흥원에서 시행하는 「2020년 기술지주회사 자회사 R&BD 지원사업」 주관기관으로 선정됐다.‘기술지주회사 자회사 R&BD 지원사업’은 대학과 지역 유관기관의 인적·물적 인프라를 활용해 신규 자회사 발굴 및 신산업 분야 기술개발·성장지원 등을 지원하는 사업으로, 전국 10개 기관에 3년간 총 216억원의 사업비가 투입된다.강원대기술지주회사는 지난 2014년 7월에 설립돼 현재 총 10개의 자회사를 운영하고 있으며, 이번 사업에는 강원대기술지주회사와 4개의 자회사가 참여해 3년간 약 39억원을 지원받게 된다.앞으로, 강원대기술지주회사는 ‘펫 라이프케어（반려동물 토탈 관리 서비스）’플랫폼 기반 바이오마커 및 모니터링 솔루션·모바일앱·시스템 최적화 기술（U-blockchain） 연구개발과 제품화에 나설 계획이다.또한,‘강원권 지역 기술지주회사 자회사 지원 활성화’와‘기술기반 우수 자회사 설립’을 위한 강원권 기술사업화 지원 네트워크 구축 비즈니스 모델 고도화 기술 벤처기업 창출 및 인큐베스트 자회사 벤처투자 연계사업을 추진한다.아울러, 대학이 보유하고 있는 기술, 특허 등 연구성과와 연계한 기술 이전 및 기술 창업을 통해 적극적인 기술사업화（자회사 설립·편입）를 추진하고 직·간접적 일자리 창출, R&D 성과 제고 등을 도모해 나갈 방침이다.윤경구 대표이사는 “이번 사업 선정을 계기로 강원대학교가 가진 우수한 기술과 인프라를 바탕으로 자회사가 기술사업화를 성공적으로 이끌 수 있도록 지원을 확대할 계획”이라며 “강원대기술지주회사 고유의 자회사 발굴·육성 프로그램 및 산학협력 네트워크를 적극 활용해 강원권 지역 기술사업화 플랫폼을 구축하고 지역경제 활성화에 이바지할 수 있도록 노력하겠다”고 밝혔다."
718,"춘천 의학전문대학원, 국립 인도네시아대학교 의과대학에 「한국산 방호용품」 지원","의학전문대학원（원장 조성준）과 강원대학교병원（원장 이승준）은 5월 5일（화） 국립 인도네시아대학교（Universitas Indonesia） 의과대학（학장 Ari Fahrial Syam）에 현지 의료인력 150여명이 사용할 수 있는 「한국산 방호용품」을 지원했다.5월 4일 현재, 인도네시아는 Covid-19 확진자 11,587명과 사망자 864명을 기록하고 있으며, 이에 의학전문대학원은 현지 의료진 안전을 위해 방호복, 보안경 및 안면 보호대 등 개인 방호용품을 전달했다.이날 국립 인도네시아대학교 의과대학 본관에서 열린 전달식에는 의학전문대학원 이희제 교수를 비롯해 국립 인도네시아대학교 의과대학 Dwiana Ocviyant 부학장, Frans Suyatna 교수, 대한무역투자진흥공사（KOTRA） 자카르타 무역관 이종윤 관장 등 주요 관계자가 참석했다.우리대학과 국립 인도네시아대학교는 지난 2018년 상호교류협정을 체결하고, 의학전문대학원 교수를 인도네시아대학교 의과대학 연구교수로 파견하는 등 다양한 교류 활동을 이어오고 있다.이희제 교수는 “Covid-19의 원활한 방역을 위해서는 의료 인력의 안전이 매우 중요하다”며 “양 대학의 긴밀한 협력관계를 통해 세계적인 질병 확산을 신속하게 극복하는데 도움이 될 수 있도록 국립 인도네시아대학교 의과대학에 방호용품을 지원하게 됐다”고 밝혔다.조성준 의학전문대학원장은 “인도네시아 국민과 의료진들의 단합된 힘으로 빠른 시일내에 위기를 극복할 것으로 믿으며 앞으로도 양 대학이 긴밀히 소통하고 협력을 강화해 나가기를 희망한다”고 메시지를 전달했다.한편, 이번 방역용품 전달은 정부의 신남방 정책에 따라 한국무역진흥공사（KOTRA）가 자카르타 무역관을 통해 방호용품의 통관, 배송 등을 지원해 성사됐다."
719,"춘천 외국학술지지원센터, ㈜휴젤과 「생명공학분야 학술연구지원 업무협약」 체결","우리대학 외국학술지지원센터（센터장 박종찬）는 4월 22일（수） 춘천시에 위치한 의약품 생산업체 ㈜휴젤（대표이사 손지훈）과 「생명공학분야 학술연구지원을 위한 업무협약」을 체결했다.이번 협약에 따라 양 기관은 생명공학분야 학술연구 지원 및 정보 교류 상호기관 사업 홍보 등에 협력하기로 했으며, ㈜휴젤은 외국학술지지원센터 발전기금으로 300만원을 기탁했다.‘외국학술지지원센터 사업’은 해외 학술정보를 국가적으로 공동 활용해 연구경쟁력을 강화하고자 하는 목적으로 전국 10개 대학도서관에 주제별 센터를 선정하여 운영하고 있는 사업이다.㈜휴젤은 춘천시 거두농공단지에 입주한 생명공학분야 의약품 생산업체로, ‘우리지역 일하기 좋은 기업’, ‘제3세대 기업가정신 우수기업’으로 선정되기도 했다.박종찬 외국학술지지원센터장은 “이번 협약으로 대학 구성원들이 이용할 수 있는 해외 학술정보의 질을 높이고, 협력기업의 연구력 향상에 도움이 될 것으로 기대한다”고 밝혔다.한편, 이번 협약은 코로나19 확산 예방을 위해 별도의 협약식없이 양 기관 대표가 서명하는 서면협약으로 진행됐다."
720,"춘천 GTEP사업단, 「제13기 연차성과평가」 2년 연속 ‘상’등급 획득","지역특화청년무역전문가양성（GTEP） 사업단（단장 김태인）이 4월 20일（월） 「GTEP사업단 제13기 연차성과평가」에서 2년 연속 최고등급인 ‘상’등급을 획득했다.이번 평가는 전국 20개 대학 사업단을 대상으로 교육, 무역현장실습, 수출실적 등 사업 운영 전반을 종합적으로 평가했으며, 우리대학은 이번 평가 결과에 따라 국고보조금 1,000만원을 인센티브로 받게 됐다.GTEP사업단은 지난 1월 제14기 요원 39명을 대상으로 ‘무역 기본교육’을 실시했으며, 2월부터는 코로나19 확산 방지를 위해 e러닝을 활용한 심화교육 실습을 진행하고 있다.또한, 최근 전세계적으로 전통적인 무역 거래가 침체되어 있는 상황을 고려해, 전자상거래를 활용한 해외수출 판로 개척에 집중할 예정이다.한편, 「GTEP」은 산업통상자원부와 한국무역협회, 강원도청, 우리대학의 지원으로 글로벌 무역인재를 양성하는 산·관·학 협력사업으로, 우리대학은 2007년부터 올해 14기까지 400여명의 글로벌무역 전문인력 양성하며, 우수한 미래 무역전문가 배출의 산실로 명성을 넓혀가고 있다."
721,"전체 강원권 지역선도대학육성사업단, 「OJT （NCS, 자기소개서, 면접코칭） 프로그램」 실시","강원권 지역선도대학육성사업단（단장 김명동）은 4월 1일（수）부터 4월 4일（토）까지 「OJT （NCS, 자기소개서, 면접코칭） 프로그램」 을 실시했다.이번 프로그램은 SNS를 이용한 블랜디드러닝 방식으로 진행됐으며, 우리대학을 비롯해 강릉원주대, 경동대, 연세대 미래캠퍼스, 한림대 학생 총 77명이 참여해 76명이 수료했다.이번 프로그램은 ‘코로나19’ 확산을 방지하기 위해 집체교육 대신 SNS를 이용한 블랜디드 러닝으로 실시됐으며, NCS 수업을 통한 의사소통역량, 문제해결역량, 수리능력, 정보능력 향상 자기소개서를 잘 쓰는 방법 및 교정 실전 면접코칭 및 면접 노하우 습득 등의 프로그램을 진행했다.특히, 학생들은 만족도 조사에서 5.0점 만점에 4.7점으로 매우 높은 만족도를 나타냈으며, 효능감과 동기부여 부문에서도 각각 4.7점, 4.6점을 기록했다.앞서, 사업단은 「Good Start 프로그램」, 「영어몰입 Clinic 프로그램」을 성공적으로 마무리해 큰 호응을 얻었으며, 2020년 여름방학 계절학기에 미래융합가상학과인 공공인재융합전공 공공건강보험융합전공 디지털헬스케어융합전공 등 3개 전공을 기숙형（Resident College） 집중과정으로 운영할 예정이다.학생들은 “SNS를 이용한 수업방식이 친숙하면서도 참여율도 높일 수 있고 학습효과도 좋은 것 같다”며 “이러한 수업이 다른 정규 교육과정에도 확대됐으면 좋겠다”고 밝혔다."
722,"전체 김헌영 총장, 「코로나19 극복 희망 캠페인」 릴레이 참여","김헌영 총장은 4월 16일（목） 「코로나19 극복을 위한 희망 캠페인」 릴레이에 참여했다.이번 캠페인은 코로나19로 어려움을 겪고 있는 이들에게 희망의 마음을 담은 응원 문구를 보내는 것으로, SNS에 메시지를 게재하고 다음 참여자를 추천해 릴레이를 이어가는 방식으로 진행된다.김헌영 총장은 오세정 서울대학교 총장의 지목을 받아 캠페인에 참여했으며, ‘#힘내라 대한민국! #힘내라 청춘! #이기자 코로나19’라는 메시지를 직접 손으로 쓰고 사진을 찍어 SNS에 올렸다.김헌영 총장은 “현장에서 사투를 벌이는 보건당국 및 의료진과 위기를 슬기롭게 헤쳐 나가는 우리 국민들께 존경과 응원의 박수를 보낸다”며 “사태가 안정될 때까지 모든 역량을 동원해 대학 구성원과 지역주민의 건강과 안전을 지키는데 앞장서겠다”고 밝혔다.이어, 다음 릴레이 주자로 김중수 한림대학교 총장과 곽병선 군산대학교 총장을 지목했다."
723,전체 「2020년 융합보안대학원」 참여대학 선정,"우리대학이 과학기술정보통신부가 주관하는 「2020년 융합보안대학원」 참여대학에 선정됐다.‘융합보안대학원’은 지역 전략산업과 연계한 문제해결형 과제 중심의 교육과정을 통해 현장맞춤형 융합보안 핵심인재를 양성하고 지역 융합보안 생태계 조성의 중심 역할을 수행하는 교육기관이다.과학기술정보통신부는 4월 10일（금） 우리대학（디지털헬스케어）을 비롯해 부산대（핀테크）, 성균관대（디지털헬스케어）, 순천향대（자율주행차）, 충남대（스마트시티） 등 5개교를 신규 참여대학으로 선정해 발표했다.이번 사업은 지난 2월부터 한국인터넷진흥원이 참여대학 공모를 진행했으며, 총 13개 대학이 신청해 2.6대 1의 경쟁률을 기록했다.참여대학들은 총 120여개의 국내외 유수기업·기관 및 지자체 등과 협력해 올해 연말까지 전략산업 분야별로 특화된 교육과정을 개발한다.또한, 개발·실습 기자재 확보 및 연구실 구축 등 대학원 개설을 위한 준비과정을 거쳐 2021년부터 정식 운영에 들어갈 예정이다."
724,전체 「2020년 대학정보공시 운영협력대학」 선정,"우리대학이 한국대학교육협의회가 주관하는 「2020년 대학정보공시 운영협력대학」에 선정됐다.한국대학교육협의회는 4월 2일（목） 대학정보공시 대상학교（416개교） 가운데 우리대학을 포함한 일반대학 33개교와 전문대학 7개교 등 총 40개 대학을 대학정보공시 운영협력대학으로 선정했다.대학정보공시는 학생·학부모·산업체·정부 등이 학교 선택과 산학협력, 직원 채용, 정책 집행 시 활용할 수 있도록 대학의 주요정보를 인터넷 홈페이지를 통해 제공하는 제도다.이번 협력대학 선정에 따라 우리대학은 운영협력대학 간 정보 교류를 통해 대학정보공시 최신 정보 수집 및 공시 운영방법, 제도 개선에 기여할 것으로 기대된다.또한, 대학정보공시 양식과 지침 개선에 의견을 제시할 수 있으며, 대학정보공시 통합시스템 개선을 위한 검증 업무와 전문가 협의회 등 공시 관련 이슈에 대한 자문 역할을 수행하게 된다."
725,"춘천 지역선도대학육성사업단, 「영어몰입 Clinic OPIc 프로그램」 개최","강원권 지역선도대학육성사업단（단장 김명동 기획처장）은 3월 23일（월）부터 3월 27일（금）까지 우리대학을 비롯해 강릉원주대, 경동대, 연세대 미래캠퍼스, 한림대 학생을 대상으로 SNS를 이용한 이러닝 방식으로 「영어몰입 Clinic OPIc 프로그램」을 개최했다.이번 프로그램은 총 58명의 학생이 참여해 50명이 수료했으며, 참가 학생들의 OPIc（Oral Proficiency Interview-Computer, 공인인증 영어 말하기 시험） 등급은 전체 평균 4.42등급에서 프로그램 시행 이후 5.64등급으로 1.22 등급이 상승한 것으로 분석됐다.특히, 학생들은 프로그램에 대한 만족도 조사에서도 5점 만점에 4.6점으로 매우 높은 만족도를 나타냈다.이번 프로그램에 참여한 윤혜연 학생은“SNS를 이용해 편하게 강의를 들어 학습효과도 좋은 것 같다”며 “이러한 수업이 다른 정규 교육과정에도 확대돼 많은 학생들이 참여했으면 좋겠다”고 밝혔다.한편, 교육부와 한국연구재단이 주관하는‘지역선도대학 육성사업’은 지역대학 간 연계협력을 통한 동반성장을 도모하고, 지역균형발전의 거점역할을 수행할 수 있도록 지원하는 사업이다.사업단은 코로나19 사태로 인해 교육부가 학생대상 집체교육을 지양할 것을 권고함에 따라 기존 교육 프로그램들을 SNS 블랜디드러닝으로 진행하고 있으며, 학생들의 적극적 참여는 물론 높은 교육적 효과를 거두고 있다.또한, 사업단은 2020년 여름방학 계절학기부터 공공인재융합전공 공공건강보험융합전공 디지털헬스케어융합전공 등의 복수전공 또는 부전공교육과정을 신설하여 원주 소재 협력대학에서 기숙형（Resident College） 집중과정으로 운영할 계획이다.앞서, 사업단은 2019년 겨울방학 동안 ‘영어몰입프로그램’, ‘법의학 실습’, ‘OJT실무 실습을 위한 자소서·면접코칭 프로그램’, ‘NCS 직업 기초능력 향상을 위한 프로그램’, ‘Good Start 프로그램’을 수행했다."
726,"춘천 하늘평안교회, KOICA-KNU SP사업단·농업자원경제학과에 「수제 필터 면 마스크」 전달","하늘평안교회（담임목사 오생락）가 3월 30일（월） 우리대학 KOICA-KNU SP사업단（단장 이종인）과 농업자원경제학전공（전공주임교수 이상현）에 코로나19 극복을 위한 「수제 필터 면 마스크」 50매를 전달했다.이 마스크는 오생락 목사의 부인인 조금란 씨가 직접 제작한 것으로 재사용이 가능하고, 필요할 경우에는 마스크에 필터를 넣어 사용할 수 있도록 만들어졌다.하늘평안교회는 코로나19 유행 이후 국민들이 마스크 구입에 어려움을 겪자, 수제 마스크를 제작해 교인, 춘천시보건소, 지역주민 등에게 무료로 제공하는 봉사활동을 펼치고 있다.오생락 목사는 “한국인도 마스크를 구입하기가 어려운데 외국에서 온 유학생들은 더 어렵지 않을까하는 걱정스러운 마음에 마스크를 전달하게 됐다”며 “마음 같아서는 춘천의 모든 유학생들에게 마스크를 제공하고 싶지만 그러지 못해 미안한 마음이다”라고 밝혔다.마스크를 받은 학생들은 “이제는 마음 놓고 다닐 수 있겠다”, “디자인과 색이 너무 예쁘다”, “마스크로도 훌륭하지만 좋은 기념품이 될 것 같다”며 감사의 뜻을 전했다."
727,"전체 김헌영 총장, 「플라워 버킷 챌린지」 동참","김헌영 총장은 4월 6일（월） 코로나19 확산에 따라 졸업·입학식 등 각종 행사가 취소돼 어려움을 겪고 있는 화훼농가를 돕기 위해 「플라워 버킷 챌린지」 캠페인에 참여했다.‘플라워 버킷 챌린지’ 캠페인은 루게릭 환자를 돕기 위한 ‘아이스 버킷 챌린지’에서 착안해, 얼음물을 뒤집어 쓰는 대신 꽃바구니를 전달하고 꽃바구니를 받은 사람이 다음 대상자를 지명하고 직접 꽃을 구매해 전달하는 릴레이 방식으로 진행되는 캠페인이다.김헌영 총장은 지난 4월 1일（수） 성지용 춘천지방법원장의 지명을 받아 꽃바구니를 전달받았으며, 이날 김양호 삼척시장을 방문해 꽃바구니를 전달하고 캠페인 동참을 요청했다.현재 강원도에서 ‘플라워 버킷 챌린지’는 최문순 강원도지사와 민병희 강원도교육감 등 지역 기관·단체장을 중심으로 확산되고 있다.김헌영 총장은 “코로나19 확산에 따라 경영난을 겪는 화훼농가를 돕는 이번 캠페인에 동참할 수 있어서 기쁘게 생각한다”며 “이번 캠페인이 국가적 어려움을 슬기롭게 극복하고 국민들에게 희망을 전하는 계기가 되기를 바란다”고 밝혔다."
728,전체 「강원녹색환경지원센터」 주관기관 선정,"우리대학이 환경부 산하 원주지방환경청이 공모한 「강원녹색환경지원센터」 주관기관으로 선정됐다.강원녹색환경지원센터는 2020년 4월 1일부터 2021년 10월 28일까지 환경부와 강원도로부터 사업비를 지원받아 도내 지자체, 대학, 환경전문가 등과 공조해 미세먼지, 한강상류 흙탕물 등 강원지역 환경현안문제 해결을 위한 조사·연구 기업 지원 환경 교육 지자체 위탁사업 등을 수행할 계획이다.원주지방환경청과 강원 녹색환경지원센터는 4월 중 행정협의회, 사무국 등을 구성하고, 5월부터 본격적인 업무 수행을 위해 적극 협의해 나갈 예정이다.한편, 녹색환경지원센터는 환경기술 및 환경산업지원법에 의해 1998년부터 환경부가 지정·운영하는 연구기관으로, 지역 내 대학과 연구소, 기업체, 민간단체, 행정기관 등의 환경역량을 결집하고 지역환경 개선을 위한 주도적인 역할을 담당하고 있다."
729,"전체 과학기술정보통신부 지원 ""X-Corps 사업"" 최우수 평가","개방형 실전문제해결 K-특공대연구단（단장 송동섭）이 이공계 교육 및 연구의 현장 지향성 제고를 위해 과학기술정보통신부（이하 ‘과기정통부’）가 지원하는 ‘현장맞춤형 이공계 인재양성 지원사업（이하 X-Corps 사업）’의 2단계 평가에서 최우수 평가를 받았다.이번 평가에서는 X-Corps 사업에 참여하고 있는 서울대학교, 성균관대학교 등 14개 대학을 대상으로 지난 2년간의 사업 성과에 대해 이틀간 전문 평가단의 집중 평가를 통해 3단계 사업의 지원 여부를 결정하였다.우리대학 학부생으로 구성된 연구팀의 성과가 산업체와의 기술협약 체결과 학부생 창업으로 이어지는 선순환 성과 체계에 대해 높은 평가 점수를 받았다. 또한, X-Corps 사업 실전문제연구팀의 지원체계, 주제 발굴 절차, 팀 선정 과정의 연구단 운영 성과에 대해서도 매우 긍정적인 평가를 받았다.이로써 우리대학은 앞으로 3단계 사업비 지원을 포함하여 연속 5년간 총 23억 3천만 원의 X-Corps 사업비를 지원받게 되었다.개방형 실전문제해결 K-특공대 연구단 송동섭 단장 은 “3단계 사업에서는 4차 산업혁명 시대에 대비하여 본 인력양성 사업에 참여하는 이공계 학생들을 대상으로 창업과 아이디어 씽킹 향상을 위한 교육프로그램 참여를 적극적으로 유도하고, 창의적이고 융합적인 사고를 바탕으로 자기주도적 미래 설계를 위해 더욱 노력하겠다.”라고 밝혔다."
730,춘천 강원도교육청과 「교육대학원 AI융합교육전공 석사과정 운영」 업무협약 체결,"우리대학과 강원도교육청（교육감 민병희）은 3월 16일（월） 「AI（인공지능）융합교육전공 교육대학원 석사과정 운영」을 위한 업무협약을 체결했다.이번 협약에 따라 양 기관은 강원도교육청 소속 교원의 교육지회 확대 및 직무능력 향상을 위한 AI융합교육전공 석사과정을 편성하고, 운영 및 학생 선발 등에 협력하기로 했다.김헌영 총장은 “이번 업무협약으로 우수한 AI 전문교사를 양성해 초중등 학생들이 4차 산업혁명 시대의 첨단기술을 배우게 될 것으로 기대된다”며 “앞으로도 지역인재 양성을 위한 적극적인 협력에 최선을 다하겠다”고 밝혔다.한편, 이번 협약은 코로나19 확산 예방을 위해 별도의 협약식없이 양 기관 대표가 서명하는 서면협약으로 진행됐다."
731,전체 ‘코로나19’ 사태 종식까지 긴장 늦추지 않고 확산방지 총력 대응,"우리대학은 ‘코로나바이러스감염증-19（코로나19）’ 확산 방지를 위한 중국인 유학생들의 격리조치 해제와 새학기 시작을 앞두고, 감염병 사태가 종식될 때까지 긴장의 끈을 다시 조이며 모든 역량을 집중해 선제적인 대응을 펼쳐 나가기로 했다.먼저, 우리대학은 ‘코로나19’ 차단을 위해 14일간 격리 생활을 해온 중국인 유학생 78명（기숙사 45명 / 자가（원룸 등） 33명）에 대해 3월 9일（월） 격리조치를 해제했다.이들은 지난 2월 24일（월） 이후 입국한 학생들로, 우리대학은 1인1실을 지원하고, 매일 2회 체온 측정 및 건강상태 확인, 도시락 식사 제공 등을 통해 엄격한 자가격리 수준을 집중 관리해왔다.특히, 우리대학은 강원대병원（원장 이승준）과 보건진료소（소장 천인국） 의료진을 파견해 2월 11일（화）부터 기숙사 및 자가격리 중인 중국인 유학생 121명, 확진자 동선 접촉의심 교직원·학생 등 8명 등 총 129명에 대한 전수검사를 시행했으며, 모두 ‘음성’ 판정을 받았다.우리대학은 이들 유학생의 격리기간 동안 교직원 및 전문가의 전화상담과 SNS 채팅을 통해 긴밀한 연락을 취하며, 생활 편의물품을 제공하는 등 불편을 최소화했다. 격리 해제된 유학생들은 3월 10일（화） 오전 퇴소 이후 대부분 자택（원룸 등）으로 귀가하게 되며, 일부는 기숙사에서 생활하게 된다.아울러, ‘코로나19’ 감염병 위기 경보가 ‘심각’단계로 격상됨에 따라 2020학년도 1학기 개강을 3월 2일（월）에서 16일（월）로 2주 연기한데 이어, 1학기 학사과정 4,009개 교과목에 대해 개강 이후 ‘재택（온라인） 수업’을 실시하기로 했다.이 밖에도, 학내 다중이용시설 휴관 백령아트센터 공연 취소 학내 전 시설 24시간 출입통제 및 마스크 착용 등 선제적인 대응방안을 마련해 나서고 있다.우리대학은 학생들의 등교가 시작되는 3월 30일（월）을 앞두고 학생들의 건강과 지역사회 감염병 차단을 위해 학생별 거주지 파악 및 지속적인 예방 교육·관리에 힘쓸 예정이다.한광석 총장직무대리는 “강원대는 코로나19 확산 소식이 전해진 1월 하순 이후 대학 차원의 비상대책위원회를 설치해 실시간 예방활동과 질병 감시상황 보고체계를 구축하는 등 강력히 대응해 왔다”며 “강원도 지역에서도 확진자가 발생하는 등 외국인 유학생 뿐만 아니라 국내 재학생들에 대한 관리가 더욱 중요한 시점에 도달한 만큼, 앞으로도 위기사태를 극복하기 위해 모든 역량을 총동원해 최선의 노력을 다하겠다”고 강조했다."
