,제목,내용
229,춘천 「MSTAR OPEN LAB-보이는 바이오(BIO)」 행사 개최,"우리대학은 1월 18일(화)부터 20일(목)까지 집현관 3층에서 「2022년 MSTAR Open Lab-보이는 바이오(BIO)」 행사를 개최했다.‘MSTAR’는 ‘Multicore Space for Teaching And Research’의 약자로, 집현관 3층에 구축된 다학제 공간을 의미하며, 현재 강원대 누룩연구소 강원연계형융합이미징특화센터 강원방사선융복합연구지원센터 등 다양한 분야의 첨단 연구기관이 설립·운영되고 있다.이번 행사는 ‘개방형 자율 분석 방식’을 통한 장비 사용 및 분석 기술 교육을 목적으로 마련됐으며, 이·공학 분야 대학원생 및 학생을 대상으로 각 연구센터가 보유한 첨단 연구 장비에 대한 기초 이론 교육 및 실습 기회를 제공했다.특히, 강원대 누룩연구소는 ‘Electronic Nose’ 강원연계형융합이미징특화센터는 ‘Transmission Electronic Microscope(TEM)’ 강원방사선융복합연구지원센터는 ‘Raman Spectrometer’를 이용한 다양한 연구 분야를 소개하고, 데이터 산출 및 해석방법을 교육하는 등 참여 대학원생 및 학생들이 연구장비에 대한 이해와 활용성을 높일 수 있도록 했다.누룩연구소(소장 김명동 식품생명공학전공 교수)는 전자코 가스크로마토그래피 질량분석기 등의 발효산업에 필요한 분석 장비를 보유하고 있으며, 미생물의 발효 특성을 규명하고 우수한 발효 종균을 개발하기 위한 연구를 수행하고 있다.강원연계형융합이미징특화센터(센터장 정현석 생화학전공 교수)는 다중스케일 이미징 장비들을 이용해 원자와 분자 수준에서 세포, 생체수준까지 관찰이 가능한 ‘One-stop 이미징 분석지원 시스템’을 운영하고 있다.강원방사선융복합연구지원센터(센터장 정영미 화학전공 교수, 연구처장)는 생물학적 방사선 조사기 분광분석 장비 생물학 분석 장비 환경/에너지 소재 연구 장비 AI 장비를 보유하고 있으며, 바이오-나노·소재-에너지 분야 융복합 연구 수행을 지원하고 있다.정영미 연구처장은 “이번 행사를 통해 연구 장비의 공동 활용을 촉진하고 대학의 연구역량 강화 및 전문 인력 양성에 기여할 수 있는 뜻깊은 계기가 됐다”며 “참여자들의 의견을 적극 반영하여, 향후 대학 및 외부 연구자를 대상으로 실습 위주의 맞춤형 교육을 더욱 확대할 계획이다”고 말했다.김헌영 총장은 “이번 행사는 참여 학생들이 최신 연구 기술을 직접 접하고 실습하는 새로운 교육 패러다임의 시도로, 융합과 공유로 미래 산업에 대비하는 인재양성에 기여할 것으로 기대한다”며 “앞으로도 학내에 구축된 연구장비 플랫폼 간의 유기적인 협력관계를 구축하여 인재 양성과 지역산업 발전에 지속적으로 기여할 수 있도록 최선을 다하겠다”고 밝혔다."
230,"삼척 삼척총학생회, 정시 실기고사 수험생을 위한 격려 응원 펼쳐","우리대학 삼척총학생회가 지난 20일 삼척캠퍼스 내에서 진행된 2022학년도 신입학 정시 실기고사 수험생들을 격려ㆍ응원하는 자리를 가졌다.총학생회(회장 엄성호, 재난관리공학전공 3)는 이날 정시 실기고사에 응시한 수험생들에게 총학생회에서 직접 마련한 핫팩과 초콜릿 등 소정의 간식을 나눠주었고, 오후에는 시험을 마치고 나오는 수험생을 대상으로 강원대학교 기념품을 증정하며 신입생 유치에 힘을 보태었다.엄성호 삼척총학생회장은 “시험 당일 갑작스러운 폭설에도 불구하고 정시 실기응시한 수험생들을 응원하고 더 나아가 3월에 강원대학교에서 신입생으로 볼 수 있기를 희망하며 행사를 기획하였다.”고 말하였다.한편, 윤정의 삼척부총장은 “궃은 날씨에도 불구하고 수험생과 학부모들을 위한 응원 행사를 기획한 삼척총학생회에 감사드리며, 앞으로도 총학생회와 함께 꿈과 젊음이 가득한 캠퍼스문화를 만들기 위해 더욱 노력하겠다.”고 밝혔다."
231,"도계 도계캠퍼스, 지역 청소년 대상 동계스포츠 프로그램 운영","우리대학 도계총괄본부는 지난 13일과 20일 양일간, 하이원리조트 스키장에서 ‘지역 청소년 대상 동계스포츠(스키캠프) 프로그램’을 운영했다.이번 스키캠프 프로그램은 대학혁신지원사업의 Open Campus 프로그램의 일환으로 강원대학교 학교기업 해양관광레저스포츠센터와 연계, 청소년 및 학부모를 포함한 지역주민 70여 명을 대상으로 총 2회에 걸쳐 수준별 스키와 보드 강습을 진행했다.김태형 도계총괄본부장은 “도계캠퍼스에서는 앞으로도 코로나19 상황에 맞춰 지속·탄력적으로 지역사회와 연계한 다양한 프로그램을 운영할 예정이며, 지역 주민분들의 적극적인 참여와 관심을 당부드린다.”라고 밝혔다.프로그램에 참여한 도계고등학교 1학년 재학생은 “도계 지역 인근 스키장에서 스키 강습을 받을 수 있어 좋았고, 앞으로도 지역 청소년들을 위한 체험 프로그램이 있다면 또 참여하고 싶다.”라며 소감을 말했다.한편, 강원대학교 도계캠퍼스에서는 지난 11월 지역 청소년 대상 드론 캠프를 시작으로, 초등학생 대상 코딩교육과 보건과학대학 학과가 참여하는 전공봉사 프로그램을 운영했으며, 2022학년도에도 동계스포츠에 이어 서핑, 수상스키 등 다양한 하계스포츠 프로그램도 운영할 계획이다."
232,춘천 SPC그룹과 「New Yeast Frontier Center」 현판식 개최,"우리대학과 SPC그룹(회장 허영인)은 1월 21일(금) 누룩연구소에서 「New Yeast Frontier Center」 현판식을 개최했다.이번 현판식에는 김헌영 총장과 김명동 누룩연구소장, 서진호 SPC식품생명공학연구소장을 비롯해 이재수 춘천시장, 이상천 강원지방중소벤처기업청장 등 대학·기관 관계자 20여명이 참석했다.우리대학과 SPC그룹은 ‘New Yeast Frontier Center’ 설립을 통해 우수 효모 개발 및 산업화를 위한 다양한 협력사업을 펼쳐나갈 계획이다.앞서, 우리대학과 SPC그룹은 2021년 9월 「제빵용 우수 효모 자원 확보를 위한 연구협력 협약」을 체결하고, 우수 산업미생물(효모) 종균 개발과 미생물산업 관련 우수 인재 양성 등을 위한 긴밀한 협력체계를 구축했다.우리대학은 2020년 2월 춘천시와 공동으로 춘천캠퍼스 집현관에 ‘누룩연구소’를 설립하고, 우수 종균 발굴 및 기술 지원 사업을 진행하고 있다.SPC그룹은 2005년 미생물과 식품 소재 등 기초연구를 수행하는 ‘SPC식품생명공학연구소’를 설립했으며, 토종효모와 상미종 등 우리 고유의 발효종 개발과 상용화를 통해 우리의 발효기술과 맛이 담긴 베이커리 제품을 국내는 물론 해외시장에 적극 출시함으로써 기술의 차별성을 인정받고 있다.서진호 SPC식품생명공학연구소장은 “이번 센터 설립을 통해 차세대 제빵 발효종을 개발해 K-Food의 글로벌화를 위한 기술적 기틀을 더욱 공고히 할 것”이라며 “ESG 경영철학을 바탕으로 긴밀한 산학협력 체계를 구축하고 국내 발효산업의 글로벌 경쟁력을 확보하는데 앞장서겠다”고 말했다.이재수 춘천시장은 “춘천시와 강원대학교의 협력사업으로 설립된 누룩연구소가 SPC그룹과 연계하여 세계적인 수준의 제품 개발에 필요한 우수 토종효모를 발굴한다는 점에서 감회가 남다르다”며 “앞으로도 더욱 다양한 협력사업을 펼쳐나가기를 바란다”고 말했다.김헌영 총장은 “누룩 기반 토종 미생물 종균의 발굴과 사업화에 선도적인 역할을 수행해 온 양 기관의 경험과 기술을 바탕으로 우리나라 발효산업의 발전에 크게 기여할 것으로 기대한다”며 “‘New Yeast Frontier Center’가 국제적인 경쟁력을 갖춘 연구센터로 자리매김할 수 있도록 지원을 아끼지 않겠다”고 밝혔다."
233,춘천 「2022 한반도 평화 포럼」 개최,"우리대학은 1월 25일(화) 오후 1시 30분부터 60주년기념관 국제회의실에서 「2022 한반도 평화 포럼」을 개최했다.이날 행사에는 김헌영 총장과 최문순 강원도지사, 이광재 국회 외교통일위원장, 김기정 국가안보전략연구원장, 이헌수 (사)남북강원도협력협회 이사장 등 관계자 50여명이 참석했으며며, 행사장과 유튜브 온라인 생중계를 통한 온·오프라인 병행 방식으로 진행됐다.이번 포럼은 LINC+사업단, (사)남북강원도협력협회가 주최하고, 통일부, 강원일보, 춘천MBC가 후원했으며, ‘남북기본합의서 체결’과 ‘남북한 동시 유엔 가입’이 지난해 30주년을 맞이한 것을 기념하고, 한반도의 평화, 경제, 생명 공동체로서 남북관계의 새로운 비전을 모색하기 위하여 마련됐다.이날 포럼은 김헌영 총장의 환영사, 이인영 통일부 장관의 축하 영상메시지 및 최문순 강원도지사의 축사를 시작으로, 이광재 국회 외교통일위원장이 기조연설을 했으며, 김기정 국가안보전략연구원장이 ‘한반도 종전선언의 의미와 평화협력의 과제’를 주제로 발표했다.이어, 종합토론에서는 이헌수 (사)남북강원도협력협회 이사장이 좌장을 맡고, 송영훈 강원대학교 통일강원연구원장 김기정 국가안보전략연구원장 이무철 통일연구원 연구위원 김동엽 북한대학원대학교 교수 최병수 통일문제연구소장이 패널로 참가해‘한반도의 평화와 번영’을 위한 방안을 모색했다.김헌영 총장은 “이번 포럼을 통해 급변하는 국제 정세와 포스트 코로나 시대의 새로운 통일 로드맵을 모색하는 뜻깊은 자리가 되기를 바란다”며 “앞으로도 ‘통일한국의 중심대학’이라는 강원대학교의 비전을 실현하고, 한반도와 강원도의 평화를 앞당기는데 최선을 다하겠다”고 밝혔다."
234,"춘천 사회과학대학, 「강원도의회 모니터링 보고회」 개최","사회과학대학(학장 임의영)은 1월 20일(목) 강원도의회 세미나실에서 「강원대학교 사회과학대학 강원도의회 모니터링 보고회」를 개최했다.이번 보고회는 철저한 방역수칙을 준수한 가운데, 임의영 사회과학대학장과 신도현 강원도의회 부의장을 비롯해 강원도의원, 대학생 등 10여명이 참석했다.이날 보고회는 ‘강원도의회, 강원 청년의 눈으로 보다’를 주제로, 사회과학대학 학부생들이 수행한 강원도의회 의정활동 모니터링 결과와 정책제안을 발표하고, 강원도의회 부의장 및 의원들과 간담회를 진행했다.앞서, 사회과학대학과 강원도의회는 2019년 3월 22일 ‘지역 청년 정치인 인재 양성을 위한 공동협력’협약을 체결하고, 차세대 정치인재 양성 교육프로그램 공동 개발 및 운영 현장실습 및 장·단기 인턴 제도화 등 다양한 협력 사업을 펼쳐왔다."
235,"춘천 사회과학대학, 「춘천시의회 모니터링 보고회」 개최","사회과학대학(학장 임의영)은 1월 18일(화) 춘천시의회 소회의실에서 「강원대학교 사회과학대학 춘천시의회 모니터링 보고회」를 개최했다.이날 보고회에는 임의영 사회과학대학장과 황환주 춘천시의회 의장을 비롯해 춘천시의원, 대학 관계자 및 학생 등 10여명이 참석했으며, 철저한 방역수칙을 준수한 가운데 진행됐다.이번 보고회는 ‘춘천시의회, 춘천 청년의 눈으로 보다’를 주제로, 사회과학대학 학부생들이 수행한 춘천시의회 의정활동 모니터링 결과와 정책제안을 발표하고, 춘천시의회 의장 및 의원들과 간담회를 진행했다.앞서, 사회과학대학과 춘천시의회는 2019년 8월 20일 ‘청년 정치인 인재 양성 공동협력’협약을 체결하고, 차세대 정치인재 양성 교육프로그램 공동 개발 및 운영 현장실습 및 장·단기 인턴 제도화 등 다양한 협력 사업을 펼쳐왔다.황환주 춘천시의장은 “코로나19로 인한 어려움 속에서도 적극적인 참여와 훌륭한 아이디어를 발표해 준 학생들에게 감사하다”며 “청년들의 목소리가 실질적인 정책으로 이어질 수 있도록 노력하겠다”고 말했다.임의영 사회과학대학장은 “춘천시민이자 청년의 시각으로 지방의회 활동을 점검하고 대학에서 배운 이론을 현장에 적용하는 경험을 통해 청년들의 정치 참여에 기여할 수 있기를 기대한다”며 “앞으로도 학생들이 차세대 지역리더로서 역량을 기를 수 있도록 적극 지원하겠다”고 밝혔다."
236,"춘천 GTEP사업단, 「美 CES박람회」 참가","지역특화청년무역전문가양성사업단(GTEP사업단, 단장 김태인)이 1월 5일(수)부터 7일(금)까지 미국 라스베가스 베니시안센터에서 열린 「CES 2022 박람회」에 참가했다.세계 최대 가전·IT 전시회인 ‘CES 2022 박람회’는 코로나19 팬데믹 이후 2년만에 오프라인 행사로 진행됐으며, 삼성, LG, SK, 현대자동차, 현대중공업 등을 포함하여, 전세계 119개국 2,200개 업체와 전문 바이어 등 약 4만여명이 참가했다.이번 박람회에서 GTEP사업단 소속 박연수(국제무역 19학번), 오은선(국제무역 18학번) 학생은 서울 소재 스타트업 기업‘비즈니스 캔버스’의「Typed」 제품 홍보 및 시연활동을 펼쳤으며, 약 128건의 수출상담 실적을 달성했다.특히, GTEP사업단은 바이어 사전 발굴 및 영문 매뉴얼 작성, 현장 홍보부스 설치 및 운영, 해외 바이어 상담, 제품 안내 및 판매, 사후 관리까지 박람회 참가 전 과정을 자체적으로 진행했다.이번 박람회에 참가한 박연수 학생은 “미래 IT산업을 이끌어갈 전세계 다양한 기술들을 보고, 배울 수 있는 좋은 기회였다”며 “GTEP사업단 교육을 통해 배운 마케팅, 제품 홍보 역량을 직접 발휘해 볼 수 있는 소중한 경험이었다”고 밝혔다.한편, ‘지역특화청년무역전문가양성사업(GTEP)’은 전국 20개 대학에서 무역 이론과 실무를 겸비한 글로벌 무역인재를 집중 양성하는 프로그램으로, 산업통상자원부가 주관하고, 한국무역협회가 위탁운영하고 있다."
237,춘천 「지자체-대학 협력기반 지역혁신사업(RIS) 전략 포럼」 개최,"우리대학은 1월 14일(금) 글로벌경영관 AMP컨퍼런스홀에서「지자체-대학 협력기반 지역혁신사업(RIS) 전략 포럼」을 개최했다.이번 포럼은 우리대학과 산학협력단, LINC+ 사업단, 강원도민일보가 공동 주최했으며, 김헌영 총장, 김중석 강원도민일보 사장을 비롯한 관계자 및 RIS사업 참여기관 담당자 등 50여명이 참석했다.이번 포럼은 ‘대학 및 지역산업 연계 혁신방향’을 주제로, 일자리 창출 및 청년 정주여건 개선 등 지역의 혁신 생태계 구축을 통한 대학과 지역의 당면한 위기 극복·지역 발전의 새로운 동력을 만들기 위해 마련됐다.이날 포럼에서는 이민우 더존비즈온 플랫폼사업부문 부장이 ‘산업의 디지털전환을 위한 빅데이터·AI를 활용한 혁신모델’조형환 강원TP 에너지방재지원센터 에너지팀장이 ‘강원도 액화수소 산업현황’을 주제로 각각 발표했다.이어, 종합토론에서는 강원TP 노범식 정책기획단장이 사회를 맡고, 원홍식 강원도 일자리정책과장 손경호 소프트웨어중심대학사업단 부단장 김경훈 한국생산기술연구원 강원지역본부장이 패널로 참여해 지역과 대학 간 협력 방안을 모색하는 시간을 가졌다.김헌영 총장은 “학령인구 급감과 지역 소멸에 대한 위기 극복을 위해 지자체와 대학, 그리고 지역혁신 기관들이 역량을 결집해야 한다”며 “이번 포럼이 대학과 지역의 위기 극복을 위한 혁신적인 아이디어를 구체화하고, 다양한 지역혁신주체들의 의지를 결집하는 뜻깊은 자리가 되기를 바란다”고 밝혔다."
238,춘천 「‘일자리가 있는 대학도시’ 지역·대학 토론회」 개최,"우리대학은 1월 12일(수) 춘천캠퍼스 KNU스타트업큐브에서 「‘일자리가 있는 대학도시, 강원도의 새로운 성장엔진으로’ 지역·대학 토론회」를 개최했다.이날 토론회에는 김헌영 총장을 비롯한 강원지역 9개 대학 총장·관계자와 이광재(원주갑)·허영(춘천철원화천양구갑) 국회의원 등 20여명이 참석했다.이번 토론회는 ‘대학도시’를 주제로, 청년에게 일자리 및 주거 기회를 대폭 제공하고, 일자리 창출 및 청년창업 활성화, 산학연 협력을 통해 대학과 지역의 위기 극복 모멘텀을 조성하기 위해 마련됐다.이번 토론회에서는 김세용 고려대학교 교수의 ‘대학이 일자리 엔진이 되는 대학도시의 전국 확산 가능성’ 장철성 산학협력단장의 ‘강원 지자체-대학 협력기반 지역혁신(RIS) 사업’ 주제발표가 각각 진행됐다.이어, 종합토론에서는 김헌영 총장이 좌장을 맡고, 이광재 국회의원 허영 국회의원 가톨릭관동대 김덕현 총장 경동대 전성용 총장 상지대 홍석우 총장 춘천교대 이주한 총장 한림대 김인영 부총장 강릉원주대 신일식 산학협력단장 연세대 미래캠퍼스 최항석 원주기획처장 한라대 이용희 창업보육센터장 등이 패널로 참여해 대학과 지역의 현안문제에 대한 논의를 진행했다.허영 국회의원은 “인구 소멸로 인해 대학이 위기를 맞고 있다. 대학교육 지원 확대, 지학협력 및 대학도시, 지역과 국가를 초월한 교육 등으로의 전환이 필요한 때”라며 “이번 토론회에서 대학과 지역의 협력을 통한 지역균형발전의 대안을 모색하기를 기대한다”고 말했다.이광재 국회의원은 “이번 토론회를 통해 대학의 토지문제 활용과 고등교육 예산 확대 등 기존의 생각에서 벗어난 과감한 접근이 이루어지기를 바란다”며 “대학도시가 강원도에 정착될 수 있도록 국회 안팎에서 최선을 다해 노력하겠다”고 강조했다.김헌영 총장은 “현재의 산학연 협력 패러다임을 지역사회와 대학이 전방위적으로 협력하는 ‘지학(地學)협력’의 패러다임으로 전환해야 할 것으로 생각한다”며 “앞으로도 대학과 지역이 안고 있는 문제들을 해결하기 위해 관련 기관·단체들과 긴밀한 소통의 기회가 늘어나길 바란다”고 밝혔다."
239,춘천 「공학교육혁신센터 프로그램 참여수기 공모전」수상작 발표,"우리대학 공학교육혁신센터(센터장 정구환)는 1월 10일(월) 「공학교육혁신센터 프로그램 참여 수기 공모전」을 개최하고, 총 10개의 작품을 우수작으로 선정했다.이번 공모전은 ‘창의융합형 공학인재 양성지원사업 2주기 3단계(2018~2021년)’ 사업기간 동안 공학교육혁신센터 프로그램에 참여한 공과대학 및 IT대학 재학생을 대상으로, 프로그램 운영 우수사례를 발굴하고 공학교육혁신센터 프로그램의 체계화·내실화를 도모하고자 마련했다.‘대상’은 컴퓨터정보통신공학전공 백지연 학생이 ‘나를 돌아보고 사회생활 입문을 도와주는 알짜배기 캠프’라는 주제로 작품을 발표해 상장 및 상금 30만원 수상의 영예를 안았다.‘금상’은 기계의용공학전공 김동호 화학공학전공 주유림 학생이 각각 수상자로 선정됐다.‘은상’은 메카트로닉스공학과 남기윤 기계의용공학전공 서승원 기계의용공학전공 임종화 학생, ‘동상’은 전기전자과 김찬혁 메카트로닉스공학전공 이준일 화학공학전공 이지윤 재료공학전공 김정아 학생이 각각 수상했다.정구환 공학교육혁신센터장은 “이번 공모전을 통하여 참여 학생에게 성취감과 자신감을 부여하고, 프로그램 참여를 희망하는 학생들의 동기 부여 및 방향 설정에 도움을 주는 기회가 되었다”며 “앞으로 학생들에게 꼭 필요한 비교과 프로그램 개발을 추진하겠다”고 밝혔다.한편, ‘공학교육혁신센터 프로그램 참여 수기 공모전’ 수상작은 공학교육혁신센터 홈페이지(https://icee.kangwon.ac.kr/)를 통해 확인할 수 있다."
240,삼척 LINC+사업단 푸드트럭 사업 ‘붕샌드 마음을 잇(EAT)다' 지역사회 공헌 행사 실시,"우리대학 LINC+사업단(단장 최성웅)이 운영하는 「푸드트럭 사업」 ‘붕샌드(대표 곽지은, 권민정)’는 지난 12월 30일 연말연시를 맞이하여 지역 취약계층 아동 학생들에게 직접 만든 샌드위치로 무료 나눔 행사를 실시하였다.코로나19의 어려움 속에 따뜻한 나눔을 실천한 ‘붕샌드’는 2021년 7월부터 ‘샌드위치, 붕어빵’을 아이템으로 「푸드트럭 사업」에 참여하여 사업 수익을 창출하고 이를 지역에 환원하고자 ‘한마음지역아동센터’를 방문하여 샌드위치 40여개와 음료를 전달하며 아이들에게 따뜻한 마음을 전하였다.붕샌드는 ""지난 9월 「푸드트럭 창업교육컨설팅」에 참여하여 아낌없는 조언을 준 선배기업 ‘Good Burger brothers’처럼 저희도 작은 정성이지만 지역사회에 환원하여 함께 나눌 수 있어 기쁘다”라고 소감을 전했다.LINC+사업단은 산・학・지역의 네트워크 공유의 장 마련을 위해 2017년~2021년 5년간 삼척시(지자체) 대응자금 연1억원을 지원받아 푸드트럭 창업실습교육 유튜브 크리에이터 양성교육 취업 컨설팅 디자인씽킹교육 3D메이커교육 드론교육 등 관내 지역주민, 강원대학교 학생들의 취・창업 기술 및 역량강화를 위한 프로그램을 운영 및 지원하고 있다."
241,"춘천 박범계 법무부장관, 「강원대학교 청년 창업가와의 대화」 개최","박범계 법무부장관이 1월 6일(목) 우리대학을 방문해, 「강원대학교 청년 창업가와의 대화」를 가졌다.이날 춘천캠퍼스 KNU스타트업큐브에서 열린 간담회에는 박범계 법무부장관과 이상갑 법무실장, 정진근 법학전문대학원장, 장철성 산학협력단장 등이 참석했다.이번 행사는 법무부의 ‘스타트업 창업 법무지원 플랫폼 구축사업’ 추진을 위해 대학생 등 청년 창업가들의 법률적 애로사항과 법무 지원 수요를 파악하는 소통의 자리로 마련됐다.이날 간담회에 앞서, 박범계 법무부장관은 우리대학 관계자들과 함께 캠퍼스를 탐방하고, 캠퍼스 혁신파크 조성 부지와 KNU 스타트업 큐브를 둘러봤다.이번 행사는 박범계 법무부장관의 인사말을 시작으로, 법무부의 ‘스타트업 창업 법무지원 플랫폼 구축사업’의 개요 및 현황 발표, 청년 창업가와의 대담 및 토론으로 진행됐다.이날 간담회에는 ㈜늘품내진이앤씨 송준혁 대표 ㈜렌즈웨어 이재경 대표 감자아일랜드 김규현 대표 컨플 최원준 대표 BS Eco 이희철 예비창업자 등이 참석해 현장에서 느끼는 애로사항을 전달했다.박범계 법무부장관은 “법무부는 IT, 지식재산 등 각 분야의 전문 변호사들로 구성된 ‘법무부 법률지원단’을 통해 이미 수년간 스타트업과 중소기업을 위한 법률지원 사업을 시행하고 있다”며 “청년 창업가 여러분이 현장에서 겪은 생생한 경험과 아이디어를 경청해 창업지원 서비스를 원스톱으로 제공할 수 있도록 하겠다”고 밝혔다.한편, ‘㈜늘품내진이앤씨’는 2021년에 설립된 건축물 구조 및 내진 성능 보강공법 전문업체이며, ‘㈜렌즈웨어’는 2018년 설립된 콘텍트렌즈 관련 용품 전문 제조기업이다.‘감자아일랜드’는 2020년 설립되어 수제 감자맥주를 생산·판매하고 있으며, ‘컨플’은 2019년 설립해 AI 알고리즘 기반 맛집 추천 서비스를 제공하고 있다. ‘BS Eco’는 식용 코팅제 기술을 바탕으로 내년 창업할 예정이다."
