,국가,대학교명,내용,번역,영한_재번역,추출요약,분류,5분류
435,미국,UC Davis University,"UC Davis is engaged in an expanding range of partnerships both locally and around the world that are advancing SDG-related research, teaching, service and operations. UC Davis currently has more than 140 active faculty-led Agreements of Cooperation with international partner institutions in more than 40 countries. There are many more international linkages and collaborative initiatives with partners around the world that are not formalized as international agreements.","UC Davis는 SDG 관련 연구, 교육, 서비스 및 운영을 발전시키는 광범위한 파트너십을 현지 및 전 세계적으로 수행하고 있습니다. UC Davis는 현재 40개국 이상의 국제 파트너 기관과 140개 이상의 활발한 교수진 주도 협력 협정을 체결하고 있습니다. 국제 협약으로 공식화되지 않은 전 세계 파트너와의 더 많은 국제 연계 및 협력 이니셔티브가 있다.","UC Davis는 SDG 관련 연구, 교육, 서비스 및 운영을 발전시키는 현지 및 전 세계의 확장 범위의 파트너십에 종사하고 있습니다.UC Davis는 현재 40 개국 이상의 국제 파트너 기관과의 협력에 대한 140 개 이상의 활발한 교수진 계약을 체결했습니다.국제 계약으로 공식화되지 않은 전 세계 파트너들과 더 많은 국제 연계와 협력 이니셔티브가 있습니다.", 계약으로 공식화되지 않은 전 세계 파트너들과 더 많은 국제 연계와 협력 이니셔티브가 있습니다.,17,5
236,파키스탄,National University of Sciences & Technology,"NUST holds “Building nation through
transformative higher education” outreach event
With a view to enhancing its collaboration reach across Pakistan, and establishing partnerships with local
industry and community, National University of Sciences & Technology (NUST) held an outreach event
in Lahore, based on the theme of ‘Building nation through transformative higher education’ to engage
representation from Lahore’s Industry and Corporate Leadership. The event was attended by notable
leaders and business owners from Cement Industry, Electronic & IT organisations, Manufacturing, Chemical,
Banking & Finance, Fertilizers and Engineering sectors etc. of Lahore.
Celebrity fro, showbiz and sports fraternity also supported and attended the event. Film star Mr Shaan
Shahid, singer Mr Sahir Ali Bagga, and cricketers Mr Amir Sohail, Mr Taufeeq Umar and Mr Muhammad
Yousaf showed their support for higher education, terming it an instrument of change and progress for
the country.","NUST는 ""Building nation to through""를 개최합니다.
혁신적 고등교육"" 봉사활동 행사
파키스탄 전역의 협업 범위를 강화하고 현지와의 파트너십을 구축하기 위해
산업과 지역사회, 국립 과학 기술 대학 (NUST)은 아웃리치 행사를 열었다.
라호르에서 '변혁적인 고등교육을 통해 국가를 건설한다'는 주제에 기반하여 참여하기 위해
라호르 산업 및 기업 리더십의 대표자. 그 행사에는 저명한 사람들이 참석했다.
시멘트 산업, 전자 및 IT 조직, 제조, 화학, 그리고 기업의 리더와 사업주.
라호르의 은행 및 금융, 비료 및 엔지니어링 부문 등.
연예계, 연예계, 스포츠계의 유명인들도 이 행사를 지지하고 참석했습니다. 영화배우 산씨
샤히드, 가수 사히르 알리 바가, 크리켓 선수 아미르 소하일, 타우페크 우마르, 무함마드
Yousaf는 고등교육에 대한 그들의 지지를 보여주었고, 그것을 변화와 진보의 도구라고 불렀다.
시골","Nust는 파키스탄 전역의 협력 도달 범위를 강화하기 위해“혁신적 고등 교육을 통한 건물 국가”봉사 활동을 개최하고, 지역 산업 및 지역 사회와의 파트너십을 구축하고, 국립 과학 기술 대학 (NUST)은 라호르에서 봉사 활동을 개최했습니다.Lahore의 산업 및 기업 리더십에서 대표하는 '혁신적 고등 교육을 통한 국가 건축 국가'라는 주제.이 행사에는 시멘트 산업, 전자 및 IT 조직, 제조, 화학, 은행 및 금융, 비료 및 엔지니어링 부문 등의 유명한 리더 및 비즈니스 소유자가 참석했습니다.유명인 Fro, Showbiz 및 Sports Fraternity 도이 행사에 지원하고 참석했습니다.영화 스타 Shaan Shahid, 가수 Mr Sahir Ali Bagga 및 크리켓 선수 Amir Sohail, Taufeeq Umar 씨 및 Muhammad Yousaf는 고등 교육에 대한 지원을 보여 주었고,이를 국가의 변화와 진보라고 불렀습니다.", 산업 및 기업 리더십에서 대표하는 '혁신적 고등 교육을 통한 국가 건축 국가'라는 주제,17,5
96,오스트레일리아,Charles Sturt University,"Indigenous Rangers Program (SDG15 and
SDG10 - National Engagement)
In August, Associate Professor Dale Nimmo was appointed as a member of the National Indigenous Australians Agency’s Independent Reference Group for the Federal Government’s $750M Indigenous Rangers Program (2021–28). He is helping to design the implementation of the program.","""원주민 레인저 프로그램(SDG15 및
SDG10 - 국가 참여)
8월, 데일 님모 부교수는 연방 정부의 7억 5천만 달러(2021–28년)의 원주민 레인저 프로그램을 위한 호주 원주민청의 독립 참조 그룹의 일원으로 임명되었다. 그는 이 프로그램의 구현을 설계하는 데 도움을 주고 있습니다.""",원주민 레인저스 프로그램 (SDG15 및 SDG10- 국가 참여) 8 월에 Dale Nimmo 부교수는 연방 정부의 750 만 달러의 토착민 레인저스 프로그램 (2021–28)에 대한 National Fivenous Australians Agency의 독립 참조 그룹의 일원으로 임명되었습니다.그는 프로그램 구현을 설계하는 데 도움을주고 있습니다., 프로그램 구현을 설계하는 데 도움을주고 있습니다.,17,5
77,캐나다,Concordia University,"SUSTAINABILITY EDUCATION
Concordia students can explore the concept and practice of
sustainability through an extensive array of courses, programs,
and certificates, including a Sustainability Studies minor and
elective group. These two offerings are organized by the
Loyola College for Sustainability and Diversity, the university’s
interdisciplinary hub for sustainability work.
Concordia’s Massive Open Online Courses (MOOCs) provide
free, accessible, quality educational resources to people across
the globe interested in sustainability. Developed by the Loyola
Sustainability Research Centre in collaboration with the United
Nations Environment Programme (UNEP), these courses
feature case studies from around the world, with contributions
from expert faculty and distinguished visiting lecturers.
In partnership with Manulife Investment Management,
Concordia’s John Molson School of Business launched the first
sustainable investing practicum at a Canadian university. The
three-credit practicum will enable undergraduate business
students to better understand the principles of environmental,
social and governance (ESG) investment in a capital
market environment. In addition to the hands-on learning
opportunity the practicum represents, Manulife will sponsor
up to 12 scholarships awarded annually to top performing
students. Some students may also be selected for internships
with Manulife.
Under the Sustainability Action Plan, Concordia has identified
targets and strategies to increase access to sustainability
learning opportunities into new and existing courses and
programs. These opportunities will help faculty foster an
understanding and practice of sustainability across the
curriculum and equip graduates to link their disciplinary training
to broader social, environmental and economic issues, and be
ready to enact change in their respective fields.","""지속가능성 교육
Concordia 학생들은 의 개념과 연습을 탐구할 수 있다.
다양한 과정, 프로그램을 통한 지속 가능성
그리고 지속가능성 연구 부전공, 그리고 증명서를 포함한다.
선택 그룹 이 두 가지 제품은
로욜라 대학의 지속가능성과 다양성 대학
지속가능성 작업을 위한 학제간 허브
콩코디아의 대규모 개방형 온라인 강좌(MOOC) 제공
전 세계 사람들에게 무료, 접근성, 양질의 교육 자원
지속가능성에 관심이 있는 지구 로욜라에서 개발
유엔과 협력한 지속가능성 연구센터
국가 환경 프로그램(UNEP), 이 과정
세계 각지의 사례 연구, 기여도 포함
전문 교수진과 저명한 방문 강사로부터.
Manulife Investment Management와 제휴하여,
콩코디아의 존 몰슨 경영대학원은 첫번째를 시작했다.
캐나다 대학의 지속 가능한 투자 관행 그
3학점 실습은 학부 사업을 가능하게 할 것이다.
학생들은 환경의 원리를 더 잘 이해할 수 있다.
자본에 대한 사회 및 거버넌스(ESG) 투자
시장 환경 실습 학습 외에도
실습이 나타내는 기회, Manullife가 후원할 것이다.
최고 성과자에게 매년 수여되는 최대 12개의 장학금
학생들. 일부 학생들은 또한 인턴쉽을 위해 선발될 수 있다.
마눌라이프와 함께.
지속가능성 행동계획에 따라 콩코디아는
지속가능성에 대한 접근성을 높이기 위한 목표와 전략
신규 및 기존 과정에 대한 학습 기회 및
프로그램입니다. 이 기회들은 교수들이 학교를 육성하는 것을 도울 것이다.
전 세계의 지속가능성에 대한 이해와 실천
교육과정과 졸업생들이 그들의 규율 훈련을 연계할 수 있도록 준비하다.
보다 광범위한 사회, 환경 및 경제적 이슈로, 그리고
각자의 분야에서 변화를 가져올 준비가 되어 있습니다.""","지속 가능성 교육 콩코르 디아 학생들은 지속 가능성 연구 미성년자 및 선택적 그룹을 포함하여 다양한 과정, 프로그램 및 인증서를 통해 지속 가능성의 개념과 실습을 탐구 할 수 있습니다. 이 두 가지 제품은 Loyola College for Sustainability and Diversity에서 주최합니다. Concordia의 MOOC (Open Online Courses)는 지속 가능성에 관심이있는 전 세계 사람들에게 무료로 접근 가능한 양질의 교육 리소스를 제공합니다. UNEP (United Nations Environment Program)와 협력하여 Loyola Sustainability Research Center가 개발 한이 과정은 전 세계의 사례 연구를 특징으로하며 전문가 교수진 및 저명한 방문 강사의 기여를 제공합니다. Concordia의 John Molson School of Business는 Manulife Investment Management와 협력하여 캐나다 대학에서 최초의 지속 가능한 투자 실습을 시작했습니다. 3 학점 실습은 학부 비즈니스 학생들이 자본 시장 환경에 대한 환경, 사회 및 거버넌스 (ESG) 투자의 원칙을 더 잘 이해할 수있게 해줄 것입니다. 실습이 대표하는 실습 학습 기회 외에도 Manulife는 매년 최고 공연 학생들에게 수여되는 최대 12 개의 장학금을 후원 할 것입니다. 일부 학생들은 Manulife와 함께 인턴쉽을 위해 선정 될 수도 있습니다. 지속 가능성 행동 계획에 따라 Concordia는 지속 가능성 학습 기회에 대한 새로운 과정 및 기존 과정 및 프로그램으로의 접근성을 높이기위한 목표와 전략을 확인했습니다. 이러한 기회는 교수진이 커리큘럼 전반에 걸쳐 지속 가능성의 이해와 실천을 장려하고 졸업생이 징계 교육을 광범위한 사회적, 환경 및 경제 문제와 연결하고 각 분야의 변화를 제정 할 준비를 할 수 있도록 도와 줄 것입니다.","지속 가능성 교육 콩코르 디아 학생들은 지속 가능성 연구 미성년자 및 선택적 그룹을 포함하여 다양한 과정, 프로그램 및 인증서를 통해 지속 가능성의 개념과 실습을 탐구 할 수 있습니다. 이 두 가지 제품은 Loyola College for Sustainability and Diversity에서 주최합니다. Concordia의 MOOC (Open Online Courses)는 지속 가능성에 관심이있는 전 세계 사람들에게 무료로 접근 가능한 양질의 교육 리소스를 제공합니다. UNEP (United Nations Environment Program)와 협력하여 Loyola Sustainability Research Center가 개발 한이 과정은 전 세계의 사례 연구를 특징으로하며 전문가 교수진 및 저명한 방문 강사의 기여를 제공합니다. Concordia의 John Molson School of Business는 Manulife Investment Management와 협력하여 캐나다 대학에서 최초의 지속 가능한 투자 실습을 시작했습니다. 3 학점 실습은 학부 비즈니스 학생들이 자본 시장 환경에 대한 환경, 사회 및 거버넌스 (ESG) 투자의 원칙을 더 잘 이해할 수있게 해줄 것입니다. 실습이 대표하는 실습 학습 기회 외에도 Manulife는 매년 최고 공연 학생들에게 수여되는 최대 12 개의 장학금을 후원 할 것입니다. 일부 학생들은 Manulife와 함께 인턴쉽을 위해 선정 될 수도 있습니다. 지속 가능성 행동 계획에 따라 Concordia는 지속 가능성 학습 기회에 대한 새로운 과정 및 기존 과정 및 프로그램으로의 접근성을 높이기위한 목표와 전략을 확인했습니다. 이러한 기회는 교수진이 커리큘럼 전반에 걸쳐 지속 가능성의 이해와 실천을 장려하고 졸업생이 징계 교육을 광범위한 사회적, 환경 및 경제 문제와 연결하고 각 분야의 변화를 제정 할 준비를 할 수 있도록 도와 줄 것입니다.",17,5
191,오스트레일리아,Charles Sturt University,"The recent increase in water development projects
throughout Southeast Asia threatens the long-term
sustainability of productive inland capture fisheries.
Capture fisheries are important as they are often
the main source of protein and cash income for
river communities, often the most vulnerable to
climate change and nutrient deprivation.
This project, being implemented in three South East
Asian countries (Laos, Myanmar, and Indonesia),
aims to:
• understand the motivations of donors
and irrigation agencies for choosing
whether to include fish passage within
development projects
• define institutional capacity needs to enable
design and implementation of future fish
passage programs
• fill critical knowledge gaps needed
to demonstrate proof of concept to
donor agencies
• understand and define policy needs of the
partner countries and donors.","최근 물 개발 프로젝트의 증가
동남아시아 전역에 걸쳐서 장기간에 걸친 위협이 있다.
생산적인 내륙 포획 어업의 지속 가능성
어획량은 종종 중요하기 때문에 중요하다.
단백질과 현금 수입의 주요 원천
종종 에 가장 취약한 하천 공동체
기후 변화와 영양 결핍
이 프로젝트는 세 개의 남동부에서 시행되고 있다.
아시아 국가(라오스, 미얀마, 인도네시아),
목적:
• 기부자의 동기를 이해하다
선택하기 위한 관개 기관
안에 물고기 통로를 포함할지 여부
개발 계획
• 다음을 가능하게 하는 제도적 역량 정의
미래 물고기의 설계 및 구현
통과 프로그램
• 필요한 중요한 지식 격차를 메우다
개념 증명을 보여주다
기증자 기관
• 의 정책 요구를 이해하고 정의한다.
파트너 국가 및 기증자.","최근 동남아시아 전역의 물 개발 프로젝트의 증가는 생산적인 내륙 캡처 어업의 장기적인 지속 가능성을 위협합니다.포획 어업은 종종 강 지역 사회의 단백질과 현금 소득의 주요 원천이므로 기후 변화와 영양소 박탈에 가장 취약한 경우가 많기 때문에 중요합니다.이 프로젝트는 동남아시아 3 개국 (LAOS, 미얀마 및 인도네시아)에서 시행되는이 프로젝트는 다음과 같이 목표미래의 어류 통과 프로그램의 구현 • 기부자 기관에 개념 증명을 보여주기 위해 필요한 중요한 지식 격차를 메 웁니다. • 파트너 국가 및 기부자의 정책 요구를 이해하고 정의합니다.",최근 동남아시아 전역의 물 개발 프로젝트의 증가는 생산적인 내륙 캡처 어업의 장기적인 지속 가능성을 위협합니다,17,5
251,캐나다,Western University,"World’s Challenge Challenge
World’s Challenge Challenge
is an annual internationalcompetition hosted by Western in which teams from morethan a dozen universities offer up their best solutions tourgent environmental, educational, and social issues. Themission of the competition is to bring together studentsfrom a wide range of institutions, cultures, and continentsto form a strong international network and create evengreater potential solutions to significant global issues. Thebest of ideas from
Western competitors
advance to the
global competition
held at Western.","세계의 도전 도전
세계의 도전 도전
웨스턴은 매년 12개 이상의 대학에서 온 팀들이 환경, 교육, 사회적 이슈에 대해 최고의 해결책을 제시하는 웨스턴에 의해 주최되는 국제 대회이다. 이 대회의 임무는 광범위한 기관, 문화, 그리고 대륙의 학생들을 한데 모아 강력한 국제 네트워크를 형성하고 중요한 글로벌 이슈에 대한 훨씬 더 큰 잠재적 해결책을 만드는 것이다. 최고의 아이디어:
서양의 경쟁자들
로 진출하다.
세계적 경쟁
웨스턴에서 개최되다","World 's Challenge Challenge World's Challenge Challenge는 Morethan의 12 개 대학 팀이 최고의 솔루션 Tourgent 환경, 교육 및 사회적 문제를 제공하는 Western이 주최하는 연례 국제 경쟁입니다.경쟁의 주제는 광범위한 기관, 문화 및 대륙에서 학생들을 모아 강력한 국제 네트워크를 형성하고 중요한 글로벌 문제에 대한 잠재적 인 해결책을 만들어내는 것입니다.서양 경쟁자들의 아이디어는 서부에서 열린 글로벌 경쟁으로 진출합니다."," 주제는 광범위한 기관, 문화 및 대륙에서 학생들을 모아 강력한 국제 네트워크를 형성하고 중요한 글로벌 문제에 대한 잠재적 인 해결책을 만들어내는 것입니다",17,5
16,이탈리아,Bologna University,"The Alma Mater is part of the Coimbra Group withthe particolar attention to the Working Group ofDevelopment Cooperation. The Coimbra Groupwas founded in 1985 and it is an association oflong-established European multidisciplinaryuniversities of high international standard, whosegoals is to create special academic and culturalties in order to promote internationalisation,academic collaboration, excellence in learning andresearch, and service to society. The Working Groupof Development Cooperation is focused on globalsocial responsibility of universities which requirestheir active engagement with development issuesand challenges.","Alma Mater는 Coimbra Group의 일부이며 개발 협력 작업 그룹에 특별한 관심을 가지고 있습니다. Coimbra Group은 1985년에 설립되었으며 국제화, 학문적 협력, 학습 및 연구의 우수성, 사회에 대한 봉사를 촉진하기 위해 특별한 학문 및 문화를 창출하는 것을 목표로 하는 높은 국제 수준의 오랜 유럽 다학문 대학의 협회입니다. 개발 협력 워킹 그룹은 개발 문제 및 도전 과제에 대한 적극적인 참여를 요구하는 대학의 글로벌 사회적 책임에 중점을 둡니다.","Alma Mater는 발달 협력의 실무 그룹에주의를 기울인 Coimbra 그룹의 일부입니다.Coimbra Group은 1985 년에 설립되었으며, 국제 표준의 유럽의 다 분야 단위 대학의 연관성이며, 국제화, 학습 학습, 학습의 우수성, 사회에 대한 서비스를 촉진하기 위해 특별한 학문적 및 문화 기능을 만드는 것입니다.개발 협력의 실무 그룹은 개발 문제와 도전에 대한 적극적인 참여를 요구하는 대학의 글로벌 사회적 책임에 초점을 맞추고 있습니다.", 협력의 실무 그룹은 개발 문제와 도전에 대한 적극적인 참여를 요구하는 대학의 글로벌 사회적 책임에 초점을 맞추고 있습니다.,17,5
387,영국,London School of Economics and Political Science,"LSE has contributed to policy development, both through public consultations and giving expert evidence to local and national government. This includes contributing to the development of the Environment Bill, the government’s voluntary public sector carbon targets in the Clean Growth Strategy, the London Plan and the London Environment Strategy.","LSE는 공공 협의와 지방 및 중앙 정부에 대한 전문가 증거 제공을 통해 정책 개발에 기여했습니다. 여기에는 청정 성장 전략, 런던 계획 및 런던 환경 전략에서 정부의 자발적인 공공 부문 탄소 목표인 환경 법안의 개발에 기여하는 것이 포함됩니다.","LSE는 공공 협의와 지역 및 국가 정부에 전문가의 증거를 제공함으로써 정책 개발에 기여했습니다.여기에는 청정 성장 전략, 런던 계획 및 런던 환경 전략의 정부의 자발적인 공공 부문 탄소 목표 인 환경 법안의 개발에 기여하는 것이 포함됩니다."," 청정 성장 전략, 런던 계획 및 런던 환경 전략의 정부의 자발적인 공공 부문 탄소 목표 인 환경 법안의 개발에 기여하는 것이 포함됩니다.",17,5
52,영국,University of Glasgow,"We offer a number of undergraduate,
postgraduate taught and research programmes
focusing on sustainability and have introduced
a student-designed course, Introduction to
Climate Change and Sustainability, which
is open to all students across the University.
Our Centre for Sustainable Solutions, which
help launch the course, also runs courses and
events that are open to anyone, helping to raise
awareness of sustainability within the wider
community.","저희는 다수의 학부생들을 제공하고 있습니다._x000D_
대학원의 교수 및 연구 프로그램_x000D_
지속가능성에 초점을 맞추고 도입하였습니다._x000D_
학생이 디자인한 강좌, 소개_x000D_
기후 변화와 지속 가능성,_x000D_
대학의 모든 학생들에게 개방되어 있다._x000D_
NAT의 지속 가능한 솔루션 센터,_x000D_
코스 시작, 코스 운영 및_x000D_
누구나 참여할 수 있는 이벤트, 모금에 도움이 되는 이벤트_x000D_
더 넓은 범위의 지속가능성에 대한 인식_x000D_
공동체제를 도입했습니다.","우리는 지속 가능성에 중점을 둔 여러 학부, 대학원 교육 및 연구 프로그램을 제공하며 대학 전역의 모든 학생들에게 개방 된 기후 변화 및 지속 가능성 소개를 소개했습니다.코스를 시작하는 데 도움이되는 지속 가능한 솔루션 센터는 또한 누구나 개방적인 코스와 행사를 운영하여 더 넓은 커뮤니티 내에서 지속 가능성에 대한 인식을 높이는 데 도움을줍니다.", 시작하는 데 도움이되는 지속 가능한 솔루션 센터는 또한 누구나 개방적인 코스와 행사를 운영하여 더 넓은 커뮤니티 내에서 지속 가능성에 대한 인식을 높이는 데 도움을줍니다.,17,5
