,국가,대학교명,내용,번역,영한_재번역,추출요약,분류,5분류
1987,영국,University of East Anglia,"Working towards water security
Researchers at UEA’s Water Security Research Centre work to address the challenges of managing water resources to meet changing human, economic and environmental needs. Their approach to water security focuses on the need to understand the physical and social drivers of global water challenges. Research projects include examining the resilience of fruit production to water and drought risks; facilitating law-based, sustainable water arrangements in the Yarmouk tributary of the Jordan River; and understanding issues of water stress in the semi-arid regions of Africa and Asia – exploring the causes of people’s vulnerability to risk and ways to promote resilient, sustainable use.","수상 보안을 위한 작업
UEA의 Water Security Research Center의 연구원들은 변화하는 인적, 경제적, 환경적 요구를 충족시키기 위해 수자원을 관리하는 문제를 해결하기 위해 노력하고 있습니다. 물 보안에 대한 그들의 접근 방식은 세계적인 물 문제의 물리적 및 사회적 동인을 이해할 필요성에 초점을 맞추고 있다. 연구 프로젝트에는 물과 가뭄 위험에 대한 과일 생산의 복원력을 조사하는 것, 요르단 강의 야르무크 지류에서 법에 기반한 지속 가능한 물 배치의 촉진, 그리고 아프리카와 아시아의 반건조 지역의 물 스트레스 문제를 이해하는 것, 위험과 방법에 대한 사람들의 취약성의 원인을 탐구하는 것이 포함된다.s 탄력적이고 지속 가능한 사용을 촉진합니다.","UEA의 수자원 보안 연구 센터 (Water Security Research Center)의 수자원 보안 연구원을 향한 노력은 변화하는 인간, 경제 및 환경 요구를 충족시키기 위해 수자원 관리의 과제를 해결하기 위해 노력하고 있습니다.물 안보에 대한 그들의 접근 방식은 글로벌 물 문제의 물리적, 사회적 동인을 이해해야 할 필요성에 중점을 둡니다.연구 프로젝트에는 과일 생산의 회복력과 물에 대한 탄력성과 가뭄 위험을 조사하는 것이 포함됩니다.요르단 강의 Yarmouk 지류에서 법률 기반의 지속 가능한 물 계약을 촉진;아프리카와 아시아의 반 건조 지역에서의 물 스트레스 문제 이해-위험에 대한 사람들의 취약성과 탄력적이고 지속 가능한 용도를 촉진하는 방법의 원인을 탐색합니다."," 안보에 대한 그들의 접근 방식은 글로벌 물 문제의 물리적, 사회적 동인을 이해해야 할 필요성에 중점을 둡니다",14,2
1833,미국,UC Davis University,"UC Davis Arboretum
The UC Davis Arboretum was founded in 1936 to support teaching and research at the University of California. The Arboretum occupies 100 acres along the banks of the old north channel of Putah Creek, in California's Central Valley. The collections include 22,000 trees and plants adapted to a Mediterranean climate, with hot, dry summers and cool, wet winters. The plants are arranged in a series of gardens that represent different geographic areas, plant groups or horticultural themes.","UC 데이비스 수목원
UC 데이비스 수목원은 1936년 캘리포니아 대학교에서 교수와 연구를 지원하기 위해 설립되었다. 수목원은 캘리포니아의 센트럴 밸리에 있는 푸타 크릭의 오래된 북쪽 수로의 둑을 따라 100에이커를 차지하고 있다. 이 컬렉션에는 덥고 건조한 여름과 시원하고 습한 겨울의 지중해성 기후에 적응한 22,000 그루의 나무와 식물이 포함되어 있다. 식물들은 서로 다른 지리적 지역, 식물 그룹 또는 원예 테마를 나타내는 일련의 정원에 배치된다.","UC Davis Arboretum UC Davis Arboretum은 1936 년 캘리포니아 대학교에서 교육 및 연구를 지원하기 위해 설립되었습니다.수목원은 캘리포니아의 중앙 계곡에있는 Putah Creek의 오래된 노스 채널의 강둑을 따라 100 에이커를 차지합니다.컬렉션에는 지중해 기후에 적합한 22,000 그루의 나무와 식물이 있으며 뜨겁고 건조한 여름과 시원하고 젖은 겨울이 포함됩니다.식물은 다양한 지역, 식물 그룹 또는 원예 테마를 나타내는 일련의 정원으로 배열됩니다."," 다양한 지역, 식물 그룹 또는 원예 테마를 나타내는 일련의 정원으로 배열됩니다.",15,2
7,영국,Leicester,The Geography student society successfully bid for SEED funding to run an awareness raising campaign using metal water bottles as a reward for staff and students to pledge to behave more sustainably,지리학 학생회는 직원과 학생들이 보다 지속 가능한 행동을 서약하는 데 대한 보상으로 금속 물병을 사용하여 인식 제고 캠페인을 실행하기 위해 SEED 기금에 성공적으로 입찰했습니다,지리학 학생 협회는 종자 자금 지원에 성공적으로 입찰하여 금속 물병을 직원과 학생들에게보다 지속적으로 행동 할 것을 약속 할 수있는 보상으로 금속 물병을 사용하여 인식 조달 캠페인을 운영합니다.,지리학 학생 협회는 종자 자금 지원에 성공적으로 입찰하여 금속 물병을 직원과 학생들에게보다 지속적으로 행동 할 것을 약속 할 수있는 보상으로 금속 물병을 사용하여 인식 조달 캠페인을 운영합니다.,14,2
1989,영국,University of East Anglia,"Public Engagement
Promoting sustainable society
Working in partnership with Anglia Water, The Anglian Centre for Water Studies delivers a range of public engagement events focusing on how society uses and values water, and the need to use water sustainably. A central theme of the collaboration is engaging society – working with local communities to drive changes in the behaviour towards water use and wastage, and offering practical steps to promote water conservation.","공공 참여
지속가능사회 추진
Anglian Center for Water Studies는 Anglian Water와 협력하여 사회가 물을 어떻게 사용하고 가치를 부여하는지, 그리고 물을 지속 가능하게 사용할 필요성에 초점을 맞춘 다양한 공공 참여 이벤트를 제공합니다. 이 협력의 중심 주제는 사회 참여이다 – 지역 사회와 협력하여 물 사용과 낭비에 대한 행동의 변화를 주도하고, 물 보존을 촉진하기 위한 실질적인 단계를 제공하는 것이다.",Anglian Water Studies의 Anglian Water와 협력하여 지속 가능한 사회를 촉진하는 공공 참여는 사회가 물을 사용하고 가치를 평가하는 방법에 중점을두고 물을 지속적으로 사용 해야하는 다양한 공공 참여 행사를 제공합니다.협력의 중심 주제는 사회를 매료시키는 것입니다. 지역 사회와 협력하여 물 사용 및 낭비에 대한 행동의 변화를 주도하고 물 절약을 촉진하기위한 실질적인 단계를 제공합니다., 중심 주제는 사회를 매료시키는 것입니다. 지역 사회와 협력하여 물 사용 및 낭비에 대한 행동의 변화를 주도하고 물 절약을 촉진하기위한 실질적인 단계를 제공합니다.,14,2
1954,영국,University of East Anglia,"Public Engagement
Promoting sustainable society
Working in partnership with Anglia Water, The Anglian Centre for Water Studies delivers a range of public engagement events focusing on how society uses and values water, and the need to use water sustainably. A central theme of the collaboration is engaging society – working with local communities to drive changes in the behaviour towards water use and wastage, and offering practical steps to promote water conservation.","공공 참여
지속가능사회 추진
Anglian Center for Water Studies는 Anglian Water와 협력하여 사회가 물을 어떻게 사용하고 가치를 부여하는지, 그리고 물을 지속 가능하게 사용할 필요성에 초점을 맞춘 다양한 공공 참여 이벤트를 제공합니다. 이 협력의 중심 주제는 사회 참여이다 – 지역 사회와 협력하여 물 사용과 낭비에 대한 행동의 변화를 주도하고, 물 보존을 촉진하기 위한 실질적인 단계를 제공하는 것이다.",Anglian Water Studies의 Anglian Water와 협력하여 지속 가능한 사회를 촉진하는 공공 참여는 사회가 물을 사용하고 가치를 평가하는 방법에 중점을두고 물을 지속적으로 사용 해야하는 다양한 공공 참여 행사를 제공합니다.협력의 중심 주제는 사회를 매료시키는 것입니다. 지역 사회와 협력하여 물 사용 및 낭비에 대한 행동의 변화를 주도하고 물 절약을 촉진하기위한 실질적인 단계를 제공합니다., 중심 주제는 사회를 매료시키는 것입니다. 지역 사회와 협력하여 물 사용 및 낭비에 대한 행동의 변화를 주도하고 물 절약을 촉진하기위한 실질적인 단계를 제공합니다.,6,2
1052,영국,University of Essex,"The varied cross-disciplinary research
generally focuses on the management
options for reefs threatened by environmental
change, so it encompasses the natural
and social science disciplines, and utilises
molecular, microbial, physiological, ecological
and environmental approaches.","""다양한 학제적 연구""
일반적으로 관리에 초점을 맞춘다.
환경에 의해 위협받는 암초에 대한 선택권
변화, 그래서 그것은 자연을 아우른다.
사회과학 분야 및 활용
분자, 미생물, 생리학, 생태학
그리고 환경적 접근""이라고 말했다.","다양한 학제 간 연구는 일반적으로 환경 변화에 의해 위협받는 암초 관리 옵션에 중점을 두므로 자연 및 사회 과학 분야를 포함하고 분자, 미생물, 생리 학적, 생태 학적 및 환경 적 접근법을 활용합니다.","다양한 학제 간 연구는 일반적으로 환경 변화에 의해 위협받는 암초 관리 옵션에 중점을 두므로 자연 및 사회 과학 분야를 포함하고 분자, 미생물, 생리 학적, 생태 학적 및 환경 적 접근법을 활용합니다.",14,2
1816,미국,UC Davis University,"SeaDoc Society
The mission of the SeaDoc Society is to ensure the health of marine wildlife and their ecosystems through science and education. The society strives to find science-based solutions for marine wildlife in the Salish Sea through a multi-species approach. The SeaDoc Society conducts and sponsors ground-breaking marine research to uncover the environmental factors threatening to unravel the web of life in the Salish Sea and surrounding watersheds. One of SeaDoc’s unique strengths is translating science into action. SeaDoc acts as a catalyst, bringing together interested parties to share information, forge common understandings and design region-wide solutions. SeaDoc is a program of the Karen C. Drayer Wildlife Health Center at the UC Davis School of Veterinary Medicine.","SeaDoc 협회
SeaDoc Society의 임무는 과학과 교육을 통해 해양 야생동물과 그 생태계의 건강을 보장하는 것이다. 그 협회는 다종다양한 접근을 통해 살리쉬해의 해양 야생동물을 위한 과학 기반 해결책을 찾기 위해 노력한다. SeaDoc Society는 샐리시 해와 주변 분수령에서 생명의 그물을 풀어낼 수 있는 환경적 요인을 발견하기 위해 획기적인 해양 연구를 수행하고 후원한다. SeaDoc의 독특한 장점 중 하나는 과학을 행동으로 옮기는 것이다. SeaDoc은 이해 당사자들이 정보를 공유하고, 공통의 이해를 구축하며, 지역 전체의 솔루션을 설계하는 촉매 역할을 합니다. SeaDoc은 카렌 C의 프로그램입니다. UC 데이비스 수의과 대학의 드레이어 야생동물 보건 센터.",Seadoc Society Seadoc Society의 사명은 과학과 교육을 통해 해양 야생 동물과 생태계의 건강을 보장하는 것입니다.사회는 다중 종 접근법을 통해 살리쉬 바다에서 해양 야생 동물을위한 과학 기반 솔루션을 찾기 위해 노력하고 있습니다.Seadoc Society는 살리기 바다와 주변 유역의 삶의 웹을 풀겠다고 위협하는 환경 적 요인을 밝히기 위해 획기적인 해양 연구를 수행하고 후원합니다.Seadoc의 독특한 강점 중 하나는 과학을 행동으로 번역하는 것입니다.SEADOC은 촉매제 역할을하며 이해 관계자가 모여 정보를 공유하고 공통 이해를 위조하며 지역 전체 솔루션을 설계합니다.SEADOC는 UC Davis School of Veterinary Medicine의 Karen C. Drayer Wildlife Health Center의 프로그램입니다., 다중 종 접근법을 통해 살리쉬 바다에서 해양 야생 동물을위한 과학 기반 솔루션을 찾기 위해 노력하고 있습니다,14,2
220,캐나다,York University,"SDG 14: Life Below Water
Healthy oceans and seas are essential to our existence. They cover 70 percent of our planet and we rely on them for food, energy and water.
Yet, we have managed to do tremendous damage to these precious resources. Goal 14 is all about reversing this damage, protecting them by
eliminating pollution and overfishing and immediately start to responsibly manage and protect all marine life around the world.","""SDG 14: 물 아래의 삶""
건강한 바다와 바다는 우리의 존재에 필수적이다. 그것들은 우리 지구의 70%를 덮고 있고 우리는 음식, 에너지, 그리고 물을 그들에게 의존하고 있습니다.
하지만, 우리는 이 귀중한 자원들에 엄청난 피해를 입힐 수 있었습니다. 목표 14는 이 손상을 되돌리고, 다음을 통해 그들을 보호하는 것입니다.
오염과 남획을 제거하고 즉시 전 세계의 모든 해양 생물을 책임감 있게 관리하고 보호하기 시작합니다.""","SDG 14 : 물의 건강한 바다와 바다 아래의 삶은 우리의 존재에 필수적입니다.그들은 우리 지구의 70 %를 커버하고 우리는 음식, 에너지 및 물에 의존합니다.그러나 우리는 이러한 소중한 자원에 엄청난 피해를 입었습니다.목표 14는이 피해를 뒤집는 것에 관한 것이며, 오염과 남획을 제거함으로써 그들을 보호하고 즉시 전 세계의 모든 해양 생물을 책임감있게 관리하고 보호하기 시작합니다.", 우리는 이러한 소중한 자원에 엄청난 피해를 입었습니다,14,2
289,오스트레일리아,RMIT University,"Dry lakes and rivers release more CO2 than thought
A major study spanning six continents revealed that greenhouse
gas emissions from dry inland waterways have been significantly
underestimated. Waterways have long been recognised as an
important part of the global carbon cycle. But researchers have now
shown they release higher levels of CO2 as they dry, meaning that as
waterways continue to dry out with climate change, they will release
more and more greenhouse gases.
Testing of sediments from dried parts of nearly 200 rivers, ponds,
lakes and reservoirs around the world confirmed this is a global
phenomenon, which collectively accounts for around 6% of carbon
dioxide emissions. The global collaboration was led by the Helmholtz
Centre for Environmental Research (UFZ) in Germany and the Catalan
Institute for Water Research (ICRA) in Spain. The study published in
Nature Communications revealed an important piece of the puzzle
for predicting carbon emissions more accurately.","""마른 호수와 강은 생각보다 많은 이산화탄소를 배출한다.
6개 대륙에 걸친 주요 연구는 온실가스를 밝혀냈다.
건조한 내륙 수로의 가스 배출은 상당히 많았다.
과소평가된 수로는 오랫동안 인식되어 왔다.
지구 탄소 순환의 중요한 부분 하지만 연구자들은 이제
그들이 건조할 때 더 높은 수준의 CO2를 방출한다는 것을 보여주었습니다. 즉,
수로는 기후 변화와 함께 계속 말라가고, 그것들은 방출될 것이다.
점점 더 많은 온실 가스
200개 가까운 강, 연못, 그리고 건조된 부분의 퇴적물 테스트
전세계의 호수와 저수지는 이것이 세계적인 것임을 확인했다.
탄소의 약 6%를 차지하는 현상
이산화 탄소 배출 세계적인 협업이 헬름홀츠에 의해 주도되었다.
독일 및 카탈루냐 환경 연구 센터
스페인의 물 연구소 (ICRA)입니다. 에 발표된 연구
Nature Communications는 퍼즐의 중요한 조각을 밝혔다.
탄소 배출량을 보다 정확하게 예측할 수 있습니다.""","드라이 호수와 강은 6 개 대륙에 걸친 주요 연구에 따르면 마른 내륙 수로에서 온 온실 가스 배출량이 상당히 과소 평가되었다고 생각했던 것보다 더 많은 CO2를 방출합니다.수로는 오랫동안 글로벌 탄소 사이클의 중요한 부분으로 인식되어 왔습니다.그러나 연구자들은 이제 건조함에 따라 더 높은 수준의 CO2를 방출하는 것으로 나타났습니다. 즉, 기후 변화로 수로가 계속 건조함에 따라 점점 더 많은 온실 가스가 방출 될 것입니다.전 세계 거의 200 개의 강, 연못, 호수 및 저수지의 건조 된 부분에서 퇴적물을 테스트 한 결과, 이것이 이산화탄소 배출량의 약 6%를 차지하는 글로벌 현상임을 확인했습니다.글로벌 협업은 독일의 Helmholtz 환경 연구 센터 (UFZ)와 스페인의 Catalan Institute for Water Research (ICRA)가 주도했습니다.Nature Communications에 발표 된이 연구는 탄소 배출량을보다 정확하게 예측하는 데 중요한 퍼즐 조각을 보여주었습니다.", 오랫동안 글로벌 탄소 사이클의 중요한 부분으로 인식되어 왔습니다,13,2
1025,영국,University of Essex,"As a University, we are taking action to reduce
water consumption across our three sites,
focusing on waste avoidance and increasing
rain/grey water use.","""대학으로서, 우리는 감소하기 위한 조치를 취하고 있습니다.
3개 사이트에 걸친 물 소비량
폐기물 회피 및 증가에 집중하기
비/회수 사용.""",대학으로서 우리는 폐기물 회피에 중점을두고 비/회색 물 사용을 증가시키는 세 곳에서 물 소비를 줄이기 위해 조치를 취하고 있습니다.,대학으로서 우리는 폐기물 회피에 중점을두고 비/회색 물 사용을 증가시키는 세 곳에서 물 소비를 줄이기 위해 조치를 취하고 있습니다.,6,2
380,오스트레일리아,WESTERN SYDNEY UNIVERSITY,"Green Star accredited buildings constructed on our campuses, with more underway","우리 캠퍼스에 건설된 Green Star 인증 건물, 더 진행 중입니다","우리 캠퍼스에 건설 된 그린 스타 공인 건물, 더 많은 것이 있습니다.","우리 캠퍼스에 건설 된 그린 스타 공인 건물, 더 많은 것이 있습니다.",12,2
656,Australia,WESTERN SYDNEY UNIVERSITY,"Green Star accredited buildings constructed on our campuses, with more underway","우리 캠퍼스에 건설된 Green Star 인증 건물, 더 진행 중입니다","우리 캠퍼스에 건설 된 그린 스타 공인 건물, 더 많은 것이 있습니다.","우리 캠퍼스에 건설 된 그린 스타 공인 건물, 더 많은 것이 있습니다.",6,2
657,Australia,WESTERN SYDNEY UNIVERSITY,"Green Star accredited buildings constructed on our campuses, with more underway","우리 캠퍼스에 건설된 Green Star 인증 건물, 더 진행 중입니다","우리 캠퍼스에 건설 된 그린 스타 공인 건물, 더 많은 것이 있습니다.","우리 캠퍼스에 건설 된 그린 스타 공인 건물, 더 많은 것이 있습니다.",12,2
379,오스트레일리아,WESTERN SYDNEY UNIVERSITY,"Green Star accredited buildings constructed on our campuses, with more underway","우리 캠퍼스에 건설된 Green Star 인증 건물, 더 진행 중입니다","우리 캠퍼스에 건설 된 그린 스타 공인 건물, 더 많은 것이 있습니다.","우리 캠퍼스에 건설 된 그린 스타 공인 건물, 더 많은 것이 있습니다.",6,2
1926,홍콩,The Chinese University of Hong Kong,"A campaign called ‘Love Food, Hate Waste @CUHK’ was also launched to educate CUHK members on the urgency of food resource conservation and wastage prevention.  Its activities include appointing ambassadors, promoting waste reduction in canteens, and setting up recycling facilities for caterers.","또한 '사랑하는 음식, 싫어하는 폐기물 @CUHK'라는 캠페인이 시작되어 CUHK 회원들에게 식자원의 보존과 폐기물 방지의 시급성에 대해 교육하고 있다.  그것의 활동에는 대사 임명, 구내식당의 폐기물 감소 촉진, 그리고 음식 제공자들을 위한 재활용 시설 설립이 포함된다.","'Love Food, Rate Waste @Cuhk'라는 캠페인이 시작되어 CUHK 회원들에게 식품 자원 보존 및 낭비 예방의 시급성에 대해 교육했습니다.그 활동에는 대사 임명, 매점의 폐기물 감소 촉진, 케이터링자를위한 재활용 시설 설립이 포함됩니다."," 활동에는 대사 임명, 매점의 폐기물 감소 촉진, 케이터링자를위한 재활용 시설 설립이 포함됩니다.",12,2
1667,캐나다,Carleton University,Carleton University offers several locations that operate the E-waste Recycling Program which provides environmentally friendly and secure disposal of e-waste free of charge. See the following list of Carleton’s accepted e-waste items list.,칼튼 대학교는 환경 친화적이고 안전한 전자 폐기물 처리를 무료로 제공하는 전자 폐기물 재활용 프로그램을 운영하는 여러 곳을 제공합니다. 다음 칼튼의 승인된 전자 폐기물 품목 목록을 참조하십시오.,칼튼 대학교 (Carleton University)는 전자 폐기물을 무료로 무료로 처리하는 전자 폐기물 재활용 프로그램을 운영하는 여러 지역을 제공합니다.Carleton의 허용 된 전자 폐기물 항목 목록의 다음 목록을 참조하십시오., 허용 된 전자 폐기물 항목 목록의 다음 목록을 참조하십시오.,14,2
1518,영국,London School of Economics and Political Science,Improve recycling facilities and signage in halls to increase recycling rates.,재활용 시설을 개선하고 홀의 간판을 개선하여 재활용률을 높입니다.,재활용 시설과 홀에서의 간판을 개선하여 재활용률을 높이십시오.,재활용 시설과 홀에서의 간판을 개선하여 재활용률을 높이십시오.,12,2
212,캐나다,York University,"ECOLOGICAL FOOTPRINT COLLABORATION
The “ecological footprint” of human consumption
is 70 per cent more today than it was in 1970, with
a large attribution of the increase coming from
our carbon footprint, or emissions. Those were
the findings of an initiative at York University
measuring how consumption of renewable
resources has changed over the last 50 years.
Research out of York’s Ecological Footprint
Initiative in the Faculty of Environmental Studies
is informing governments about the way humans
use the Earth’s resources and the planet’s capacity
to provide them. This work is empowering the
Footprint Data Foundation to inform individuals,
communities and government leaders to better
manage limited resources. Learn more here.","""생태 발자국 협업
인간 소비의 ""생태적 발자국""
오늘날 1970년보다 70퍼센트 더 많다.
에서 오는 증가의 큰 원인.
우리의 탄소 발자국, 또는 배출. 저것들은
요크 대학에서의 이니셔티브의 결과
재생 가능한 소비량 측정
자원은 지난 50년 동안 변화해 왔습니다.
요크 생태발자국 연구
환경학부의 이니셔티브
인간들의 방식에 대해 정부에게 알리고 있다.
지구의 자원과 지구의 능력을 이용하다
제공할 수 있을 거야 이 일은 우리에게 힘을 실어주고 있다.
개인에게 정보를 제공하는 풋프린트 데이터 재단
더 나은 지역사회와 정부 지도자들
한정된 자원을 운용하다 자세한 내용은 여기를 참조하십시오.""","생태 발자국 협력 공동 작업 인간 소비의“생태 학적 발자국”은 1970 년보다 오늘날보다 70 % 더 많으며, 탄소 발자국 또는 배출량으로 인한 증가의 큰 귀속이 있습니다.요크 대학교 (York University)에서 재생 가능한 자원의 소비가 지난 50 년 동안 어떻게 변했는지를 측정하는 이니셔티브의 결과였습니다.환경 학부에서 요크의 생태 풋 프린트 이니셔티브에서 연구에 따르면 정부는 인간이 지구의 자원을 사용하는 방식과 지구의 제공 능력에 대해 알리고 있습니다.이 작업은 Footprint Data Foundation을 통해 개인, 지역 사회 및 정부 리더에게 제한된 자원을 더 잘 관리하도록 알리기 위해 힘을 실어주고 있습니다.여기에서 자세히 알아보십시오.", 학부에서 요크의 생태 풋 프린트 이니셔티브에서 연구에 따르면 정부는 인간이 지구의 자원을 사용하는 방식과 지구의 제공 능력에 대해 알리고 있습니다,12,2
