,국가,대학교명,내용,번역,영한_재번역,추출요약,분류,5분류
1335,인도네시아,IPB University,"we maintain water supply and waste
management facilities on a regular basis.
In 2020, 3 units of WTP sand filter were
replaced, water pumps were procured,
clean water piping was repaired, and
routine drains were drained. In addition,
IPB also always takes care of the lake
ecosystem in the campus area, namely
Lake Leutik by cleaning and monitoring
water quality. Through LPPM and aquatic
r e s o u r c e m a n a g e m e n t s t u d e n t
association (Himasper), monitoring and
cleaning of the lake is carried out regularly.
IPB university cooperates with PT
Prasadha Pamunah Limbah Industri (PPLI)
in handling B3 waste and ensures that
waste is processed, physically, biologically,
or chemically so that it becomes harmless
or reduces its toxicity.","우리는 물 공급과 낭비를 유지한다.
상시 관리 시설
2020년 WTP 샌드필터 3대는
교체, 양수기 조달,
깨끗한 물 배관이 수리되었다.
일상적인 배수관이 배수되었습니다. 게다가.
IPB는 또한 항상 호수를 돌본다.
캠퍼스 지역의 생태계, 즉
청소 및 모니터링을 통한 레이크 레이크
수질 LPPM 및 아쿠아틱을 통해
resources management 학생
연결(Himasper), 모니터링 및
호수의 청소는 정기적으로 수행된다.
IPB 대학교는 PT와 협력합니다.
프라사다 파문아 림바 인더스트리(PPLI)
B3 폐기물을 처리할 때 그리고 다음을 보장합니다.
폐기물은 물리적, 생물학적으로 처리된다.
또는 화학적으로 무해해지도록
또는 독성을 감소시킨다.","우리는 정기적으로 급수 및 폐기물 관리 시설을 유지합니다.2020 년에 3 단위의 WTP 모래 필터를 교체하고, 워터 펌프를 조달하고, 깨끗한 물 배관을 수리하고, 일상적인 배수구를 배출했습니다.또한 IPB는 항상 수질을 청소하고 모니터링하여 캠퍼스 지역의 호수 생태계를 관리합니다.LPPM 및 수생 R E S O U R C E M A N A G E M E N T S T U D E N T ASSOCIAC (HIMASPER)를 통해 호수의 모니터링 및 청소가 정기적으로 수행됩니다.IPB University는 B3 폐기물을 처리하는 데 PT Prasadha Pamunah Limbah Industri (PPLI)와 협력하여 폐기물이 가공, 물리적, 생물학적 또는 화학적으로 가공되어 무해하거나 독성을 줄이도록합니다.",우리는 정기적으로 급수 및 폐기물 관리 시설을 유지합니다,6,2
938,캐나다,McMaster University,"The #TrashTalk brand on social media and in-house signage actively
raises awareness in the campus community about recycling and
composting, educating students about what goes where — organic
waste, recycling and “trash goes last.” All organic material is taken
away daily by composting hauler, Planet Earth, to an environmental
compost facility. The collected organic waste is used to produce
high-quality soil blends, compost, and mulches for the agricultural and
landscaping industries. The #TrashTalk campaign doubled the number
of organic waste bins needed from 2018 to 2019.","#TrashTalk 브랜드는 소셜 미디어 및 사내 사이니지를 통해 활발히 활동하고 있습니다.
캠퍼스 커뮤니티에서 재활용에 대한 인식을 높인다.
퇴비화, 학생들에게 어디로 가는지 교육하기 - 유기농
폐기물, 재활용 그리고 ""폐기물은 마지막에 간다"". 모든 유기물을 가져갑니다.
매일 지구 행성을 환경적으로 퇴비화함으로써
퇴비 시설 수집된 유기 폐기물은 생산하기 위해 사용된다.
농업을 위한 고품질의 토양 혼합, 퇴비, 그리고 멀치.
조경업 #TrashTalk 캠페인은 그 수를 두 배로 늘렸다.
2018년부터 2019년까지 필요한 유기 폐기물 수거함.","소셜 미디어 및 사내 간판의 #TrashTalk 브랜드는 캠퍼스 커뮤니티에서 재활용 및 퇴비화에 대한 인식을 적극적으로 높이고 학생들이 유기농 폐기물, 재활용 및 ""쓰레기가 마지막으로가는 곳""에 대해 교육하는 것에 대해 교육합니다.모든 유기 물질은 퇴비 운반기 인 Planet Earth, 환경 퇴비 시설로 매일 제거됩니다.수집 된 유기 폐기물은 농업 및 조경 산업을위한 고품질 토양 혼합, 퇴비 및 뿌리 덮개를 생산하는 데 사용됩니다.#TrashTalk 캠페인은 2018 년부터 2019 년까지 필요한 유기 폐기물 빈의 수를 두 배로 늘 렸습니다."," 된 유기 폐기물은 농업 및 조경 산업을위한 고품질 토양 혼합, 퇴비 및 뿌리 덮개를 생산하는 데 사용됩니다",12,2
733,영국,Oxford University,"In 2011/12 the University reduced its carbon emissions from 78,267 tCO2 to77, 349 tCO2 – a decrease of 918 tCO2 (1.2%). The reduction was due to investment in new energy efficient systems and significant efforts by all members of the University to use energy more efficiently","2011/12년에 대학은 탄소 배출량을 78,267 tCO2에서 77,349 tCO2로 줄였으며 이는 918 tCO2(1.2%) 감소였다. 그 감소는 새로운 에너지 효율적인 시스템에 대한 투자와 에너지를 더 효율적으로 사용하기 위한 대학의 모든 구성원들의 상당한 노력 때문이다.","2011/12 년 에이 대학은 탄소 배출량을 78,267 TCO2 ~ 77, 349 TCO2 - 918 TCO2 (1.2%)로 줄였습니다.감소는 새로운 에너지 효율적인 시스템에 대한 투자와 대학의 모든 구성원이 에너지를보다 효율적으로 사용하려는 상당한 노력으로 인한 것입니다.", 새로운 에너지 효율적인 시스템에 대한 투자와 대학의 모든 구성원이 에너지를보다 효율적으로 사용하려는 상당한 노력으로 인한 것입니다.,13,2
931,캐나다,McMaster University,"The McMaster University Centre for Climate Change studies
water resources and hydroclimate — vital research, considering the
availability of fresh, clean water is expected to decline due to climate
change. The Spencer Creek Watershed adjacent to campus offers a
living laboratory for McMaster researchers to collect data and better
understand how land use affects drinking water quality, lake health
and biological ecosystems, from the creek to Hamilton Harbour and
out into the Great Lakes","맥마스터 대학교 기후변화 연구 센터
수자원과 하이드로 기후—중요한 연구, 고려,
신선하고 깨끗한 물의 가용성은 기후로 인해 감소할 것으로 예상된다.
캠퍼스에 인접한 스펜서 크릭 유역은 이 지역을
McMaster 연구원들이 데이터를 수집하고 더 나은 결과를 얻을 수 있는 살아있는 실험실
토지 사용이 식수 수질, 호수 건강에 어떤 영향을 미치는지 이해한다.
그리고 개울에서부터 해밀턴 항구에 이르는 생물 생태계와
오대호로 나가다.","McMaster University Center for Climate Change Studies 수자원 및 구속선 - 신선하고 깨끗한 물의 가용성이 기후 변화로 인해 감소 할 것으로 예상됩니다.캠퍼스에 인접한 스펜서 크릭 유역은 맥 마스터 연구원들이 데이터를 수집 할 수있는 살아있는 실험실을 제공하고 토지 사용이 개울에서 해밀턴 하버 (Hamilton Harbour), 그레이트 레이크 (Great Lakes)까지 식수 품질, 호수 건강 및 생물학적 생태계에 어떤 영향을 미치는지 더 잘 이해합니다."," 인접한 스펜서 크릭 유역은 맥 마스터 연구원들이 데이터를 수집 할 수있는 살아있는 실험실을 제공하고 토지 사용이 개울에서 해밀턴 하버 (Hamilton Harbour), 그레이트 레이크 (Great Lakes)까지 식수 품질, 호수 건강 및 생물학적 생태계에 어떤 영향을 미치는지 더 잘 이해합니다.",6,2
1939,홍콩,The Chinese University of Hong Kong,"Oceans, rivers and marine resources are crucial components of the ecosystem.  CUHK strives to protect aquatic ecosystems by establishing policies to balance the use of ocean resources with the demands of conservation.  We also try to promote the importance of marine conservation by providing educational programmes to secondary school students and the general public.","바다, 강, 해양 자원은 생태계의 중요한 구성 요소이다.  CUHK는 해양 자원의 이용과 보존의 요구를 균형 있게 하기 위한 정책을 수립함으로써 수생 생태계를 보호하기 위해 노력하고 있다.  우리는 또한 중등학교 학생들과 일반 대중들에게 교육 프로그램을 제공함으로써 해양 보존의 중요성을 홍보하려고 노력한다.","바다, 강 및 해양 자원은 생태계의 중요한 구성 요소입니다.CUHK는 해양 자원의 사용과 보존 요구의 균형을 맞추기위한 정책을 확립함으로써 수생 생태계를 보호하기 위해 노력합니다.우리는 또한 중등 학교 학생들과 일반 대중에게 교육 프로그램을 제공함으로써 해양 보존의 중요성을 홍보하려고 노력합니다.","바다, 강 및 해양 자원은 생태계의 중요한 구성 요소입니다",14,2
1520,영국,London School of Economics and Political Science,Devise new waste training for Facilities Management teams.,시설 관리 팀을 위한 새로운 폐기물 교육을 고안합니다.,시설 관리 팀을위한 새로운 폐기물 교육을 고안하십시오.,시설 관리 팀을위한 새로운 폐기물 교육을 고안하십시오.,12,2
1692,남아프리카 공화국,University of Cape Town,The reduction of waste is another key area being tackled at UCT. Civil engineers are investigating ways to harness the ‘liquid gold’ of wastewater. Among their outputs are a process for creating a building material using urine as a resource and an innovative fertiliser-producing urinal.,폐기물 감소는 UCT에서 다루어지고 있는 또 다른 핵심 분야이다. 토목 기술자들은 폐수의 '액상 금'을 활용하는 방법을 연구하고 있다. 생산물 중에는 소변을 자원으로 사용하는 건축자재를 만드는 공정과 혁신적인 비료 생산 소변기가 있다.,폐기물 감소는 UCT에서 해결되는 또 다른 주요 영역입니다.토목 기술자들은 폐수의 '액체 금'을 활용하는 방법을 조사하고 있습니다.생산량 중에는 소변을 자원으로 사용하여 건축 자재를 만들고 혁신적인 비료 생산 소변기를 만드는 과정이 있습니다., 중에는 소변을 자원으로 사용하여 건축 자재를 만들고 혁신적인 비료 생산 소변기를 만드는 과정이 있습니다.,12,2
566,뉴질랜드,Auckland universitiy,"SINGLE USE PACKAGING REDUCTIONThe University’s Campus Life division has partnered with the Sustainabilityand Environment team to launch the Single Use Reduction pilot (SURe),which aims to work with five key food retailers on campus to help reducethe amount of single-use packaging. In order to minimise the need forplastic water bottles the University is also working to ensure that waterfountains are available across all campuses.","일회용 포장 절감

대학의 캠퍼스 라이프 부서는 지속가능성 및 환경 팀과 제휴하여 캠퍼스 내 주요 식품 소매점 5곳과 협력하여 일회용 포장재의 양을 줄이는 것을 목표로 하는 SURE(Single Use Reduction Pilot)를 출시했습니다. 플라스틱 물병의 필요성을 최소화하기 위해 대학은 또한 모든 캠퍼스에서 물 분수를 사용할 수 있도록 하기 위해 노력하고 있다.",단일 사용 패키징 감소 대학의 캠퍼스 라이프 부서는 지속 가능성 및 환경 팀과 제휴하여 캠퍼스의 5 개의 주요 식품 소매 업체와 협력하여 단일 사용량 포장을 줄이는 데 도움이되는 단일 사용 감소 파일럿 (SER)를 시작했습니다.다형성 물병에 대한 필요성을 최소화하기 위해 대학은 모든 캠퍼스에서 수역을 이용할 수 있도록 노력하고 있습니다., 물병에 대한 필요성을 최소화하기 위해 대학은 모든 캠퍼스에서 수역을 이용할 수 있도록 노력하고 있습니다.,12,2
574,뉴질랜드,Auckland universitiy,"ENERGY CONSUMPTIONThe University’s energy use has remained relatively stable over time despitean extensive building programme, which has significantly enhanced ourgross floor area. The new buildings are designed to be energy efficientwith many energy saving initiatives in place e.g. energy-efficient operatingequipment, lighting, and energy-saving behaviours by staff and students.","에너지 소비
대학의 에너지 사용은 광범위한 건축 프로그램에도 불구하고 시간이 지남에 따라 비교적 안정적으로 유지되어 왔으며, 이는 우리의 총 바닥 면적을 상당히 증가시켰다. 새 건물은 에너지 효율적인 운영 장비, 조명 및 직원 및 학생의 에너지 절약 행동과 같은 많은 에너지 절약 이니셔티브를 통해 에너지 효율을 높이도록 설계되었습니다.","에너지 소비 대학의 에너지 사용은 시간이 지남에 따라 비교적 안정적으로 남아 있으며, 광범위한 건축 프로그램은 우리의 바닥 면적을 크게 향상 시켰습니다.새로운 건물은 많은 에너지 절약 이니셔티브와 함께 에너지 효율성으로 설계되었습니다.직원과 학생의 에너지 효율적인 운영 장비, 조명 및 에너지 구조 행동.", 건물은 많은 에너지 절약 이니셔티브와 함께 에너지 효율성으로 설계되었습니다,13,2
609,뉴질랜드,University of Cantebury,"Marine Ecology Research / The Marine Ecology Research Group is affiliated with the National Institute of Water and Atmospheric Research (NIWA). Students focus on field-based, marine ecological research in the nearshore environment. Research projects include larval fish ecology, the ecology of coastal fishes, the effects of wave exposure on settlement and recruitment of habitatforming species, the effects of humans on intertidal platforms, and life history studies on a wide range of invertebrates, algae and seagrass.","해양생태연구

해양생태연구그룹은 국립수상대기연구소(NIWA)에 소속되어 있다. 학생들은 가까운 해안 환경에서 현장 기반의 해양 생태 연구에 집중한다. 연구 프로젝트에는 유충 어류 생태, 연안 어류의 생태, 파도 노출이 서식지를 형성하는 종의 정착과 모집에 미치는 영향, 조간대에 미치는 인간의 영향, 다양한 무척추동물, 조류, 해초에 대한 생명사 연구가 포함된다.","해양 생태 연구 / 해양 생태 연구 그룹은 NIWA (National Institute of Water and Atmospheric Research)와 제휴합니다.학생들은 근해 환경에서 현장 기반 해양 생태 연구에 중점을 둡니다.연구 프로젝트에는 애벌레 어류 생태학, 해안 어류의 생태학, 습관 형성 종의 정착 및 모집에 대한 파도 노출의 영향, 조간 플랫폼에 대한 인간의 영향 및 광범위한 무척추 동물, 조류 및 해초에 대한 생명력 연구가 포함됩니다.", 근해 환경에서 현장 기반 해양 생태 연구에 중점을 둡니다,14,2
1624,핀란드,University of Eastern Finland,"Startup company 3AWater, which
has its roots in the University of
Eastern Finland, is developing technology
to help reduce the risk of environmental
damage in mining. The
company develops portable instruments
for measuring metal content
of water on-site in real time.","스타트업 기업 3물, 어느 것?
의 대학에 뿌리를 두고 있다.
동부 핀란드는 기술을 개발하고 있다.
환경 위험을 줄이는 데 도움이 되다
광업 피해 그
회사는 휴대용 악기를 개발한다.
금속 함량을 측정하기 위해
실시간으로 현장에 있는 물의.",핀란드 대학교에 뿌리를두고있는 스타트 업 회사 인 3awater는 광업의 환경 손상 위험을 줄이는 데 도움이되는 기술을 개발하고 있습니다.이 회사는 현장에서 물의 금속 함량을 실시간으로 측정하기위한 휴대용 기기를 개발합니다., 회사는 현장에서 물의 금속 함량을 실시간으로 측정하기위한 휴대용 기기를 개발합니다.,14,2
773,영국,Oxford University,We’ll work with one of our preferred furniture suppliers to identify sustainable opportunities such as using recycled packaging and using sustainably-sourced biodiesel to reduce carbon emissions from transportation of goods and services,"당사는 선호하는 가구 공급업체 중 한 곳과 협력하여 재활용 포장재 사용, 상품 및 서비스 운송에서 발생하는 탄소 배출을 줄이기 위한 지속 가능한 바이오디젤 사용 등 지속 가능한 기회를 파악할 예정입니다.",우리는 선호하는 가구 공급 업체 중 하나와 협력하여 재활용 포장재 사용 및 지속 가능한 소스 바이오 디젤 사용과 같은 지속 가능한 기회를 식별하여 상품 및 서비스 운송으로부터 탄소 배출량을 줄입니다.,우리는 선호하는 가구 공급 업체 중 하나와 협력하여 재활용 포장재 사용 및 지속 가능한 소스 바이오 디젤 사용과 같은 지속 가능한 기회를 식별하여 상품 및 서비스 운송으로부터 탄소 배출량을 줄입니다.,12,2
8,영국,Leicester,"Raising awareness of and reducing the climate impact of land uses on peat soils. Professor Sue Page’s research includes a particular emphasis on the impacts of land-use change and fire on the carbon cycle of tropical peatlands. By developing engagement opportunities with external organisations and businesses, her expertise has been crucial to sciencebased approaches to peatland management that, when implemented, support the mitigation and management of peat carbon and greenhouse gas emissions.",토양에 대한 토지 사용의 기후 영향에 대한 인식 제고 및 감소. Sue Page 교수의 연구에는 열대 이탄 지대의 탄소 순환에 대한 토지 사용 변화와 화재의 영향에 대한 특별한 강조가 포함됩니다. 외부 조직 및 기업과의 참여 기회를 개발함으로써 그녀의 전문 지식은 이탄 탄소 및 온실 가스 배출의 완화 및 관리를 지원하는 이탄 관리에 대한 과학 기반 접근 방식에 매우 중요했습니다,"이탄 토양에 대한 토지 사용의 기후 영향에 대한 인식을 높이고 감소시킵니다.Sue Page 교수의 연구에는 열대 이탄의 탄소주기에 대한 토지 이용 변화와 화재의 영향에 대한 특히 강조가 포함됩니다.외부 조직 및 비즈니스와의 참여 기회를 개발함으로써, 그녀의 전문 지식은 이탄 경영에 대한 과학 기반 접근 방식에 결정적이어서 이탄 탄소 및 온실 가스 배출의 완화 및 관리를 지원합니다.",이탄 토양에 대한 토지 사용의 기후 영향에 대한 인식을 높이고 감소시킵니다,15,2
831,호주,University of Wollongong,"The project ‘Strengthening and scaling community-based approaches to Pacific coastal fisheries management in support of the New Song’ has undertaken outreach on sustainable community-based management of coastal fisheries with over 100 local communities in Kiribati, Solomon Islands and Vanuatu. Outreach involves community awareness presentations, facilitation of development of community-based fisheries management plans, and training for community monitors to track fisheries catch in select sites with the goal to support adaptive management by communities.","'신곡을 뒷받침하는 태평양 연안 어업 경영에 대한 지역 기반 접근 강화 및 확대' 프로젝트는 키리바시, 솔로몬 제도, 바누아투 지역의 100개 이상의 지역 커뮤니티와 함께 연안 어업의 지속 가능한 지역 기반 관리에 대한 아웃리치를 수행하였습니다. 아웃리치에는 지역사회 인식 프레젠테이션, 지역사회 기반 어업 관리 계획의 개발 촉진, 지역사회에 의한 적응형 관리를 지원하기 위한 목표와 함께 선별된 현장의 어업 어획량을 추적하기 위한 지역사회 감시자 교육이 포함됩니다.","'새로운 노래를 지원하기 위해 태평양 해안 어업 관리에 대한 커뮤니티 기반 접근 방식 강화 및 스케일링'이 프로젝트는 키리 바티, 솔로몬 제도 및 바누아투에 100 개가 넘는 지역 사회와 함께 해안 어업의 지속 가능한 지역 사회 기반 관리에 대한 봉사 활동을 수행했습니다.봉사 활동에는 지역 사회 인식 프레젠테이션, 지역 사회 기반 어업 관리 계획의 개발 촉진, 지역 사회 모니터 교육을위한 교육을 추적하여 커뮤니티의 적응 관리를 지원하기위한 선택된 사이트에서 어업 캐치를 추적합니다."," 활동에는 지역 사회 인식 프레젠테이션, 지역 사회 기반 어업 관리 계획의 개발 촉진, 지역 사회 모니터 교육을위한 교육을 추적하여 커뮤니티의 적응 관리를 지원하기위한 선택된 사이트에서 어업 캐치를 추적합니다.",14,2
1646,캐나다,Carleton University,"Carry a reusable water bottle
Bottled water costs consumers 240 to 10,000 times more per gallon than tap water. Additionally, bottling water comes with tremendous environmental and social costs. Save yourself some money and help save the planet by bringing your own water bottle everywhere.","재사용 가능한 물병을 휴대하십시오.
생수는 수돗물보다 갤런당 240~1만배 비싸다. 게다가, 물을 병에 담는 것은 엄청난 환경적, 사회적 비용을 수반한다. 여러분의 돈을 절약하고 여러분의 물병을 모든 곳에 가져옴으로써 지구를 구하는 것을 돕으세요.","재사용 가능한 물병 생수 비용 소비자는 수돗물보다 갤런 당 240 ~ 10,000 배 더 많은 소비자를 휴대하십시오.또한, 병 링수에는 엄청난 환경 및 사회적 비용이 제공됩니다.돈을 절약하고 자신의 물병을 어디에나 가져 와서 지구를 구하는 데 도움이됩니다.", 절약하고 자신의 물병을 어디에나 가져 와서 지구를 구하는 데 도움이됩니다.,6,2
1515,영국,London School of Economics and Political Science,"Our reduction was also helped by our electricity from the national grid being less carbon intensive, due to coal-fired power stations being phased out.",석탄 화력 발전소가 단계적으로 폐지됨에 따라 국가 전력망에서 나오는 전력의 탄소 집약도가 낮아진 것도 이러한 감소에 일조했습니다.,우리의 감소는 또한 석탄 화력 발전소가 단계적으로 폐지 되었기 때문에 국가 그리드의 전기가 탄소 집약적이지 않다는 데 도움이되었습니다.,우리의 감소는 또한 석탄 화력 발전소가 단계적으로 폐지 되었기 때문에 국가 그리드의 전기가 탄소 집약적이지 않다는 데 도움이되었습니다.,13,2
