,국가,대학교명,내용,번역,영한_재번역,추출요약,분류,5분류
1007,오스트레일리아,University of Sydney,"This goal aims to ensure the availability of clean water and at least basic sanitation worldwide by 2030.
Efficient and well-managed water resources and services and protected water ecosystems are key in the
provision of access to water and sanitation. Global water scarcity and the lack of access to basic sanitation is
so important that the United Nations declared 2018-2028 the International Decade for Action on Water for
Sustainable Development.
The University offers a humanitarian engineering major that looks at the needs of global communities with a
focus on sustainability, including developing communities and addressing issues of sanitation and clean water.
Our civil engineering study area aims to improve the way communities live by providing research and
education into systems for managing drinking water, sewage, floodwaters and irrigation.
The preservation of potable water for drinking and sanitation purposes is acknowledged in the new
Sustainability Strategy contains targets to reduce the amount of potable water by 30% by 2025. The first
initiative towards this target was to switch the irrigation on the University’s famous Quadrangle lawns from
potable water to water from our underground rainwater recapture tanks.
We have considerable education and research activities that support the aims of SDG6.","이 목표는 2030년까지 전 세계적으로 깨끗한 물과 최소한 기본적인 위생시설을 확보하는 것이다.
효율적이고 잘 관리되는 수자원 및 서비스와 보호수 생태계는
물과 위생 시설에 대한 접근 제공 세계적인 물 부족과 기본적인 위생에 대한 접근의 부족은
국제연합은 2018-2028을 물 위에서 행동하기 위한 국제 10년으로 선언할 정도로 매우 중요하다.
지속 가능한 개발.
그 대학은 세계 공동체의 필요를 보는 인도주의 공학 전공을 제공한다.
지역사회 개발과 위생 및 깨끗한 물의 문제를 다루는 것을 포함하여 지속가능성에 초점을 맞춘다.
우리의 토목공학 연구 분야는 연구 및 연구를 제공함으로써 지역사회가 살아가는 방식을 개선하는 것을 목표로 한다.
식수, 하수, 홍수 및 관개 관리 시스템에 대한 교육.
음용 및 위생 목적을 위한 음용수의 보존은 새로운 것에서 인정된다.
지속가능성 전략에는 2025년까지 식수량을 30% 줄이겠다는 목표가 담겨 있다. 첫 번째
이 목표를 향한 이니셔티브는 대학의 유명한 사각 잔디밭의 관개를 바꾸는 것이었다.
우리의 지하 빗물 회수 탱크에서 식수로의 물.
SDG6의 목표를 지원하는 상당한 교육 및 연구 활동을 보유하고 있습니다.","이 목표는 2030 년까지 깨끗한 물과 최소 기본 위생의 가용성을 보장하는 것을 목표로합니다. 효율적이고 잘 관리 된 수자원 및 서비스 및 보호 된 수자원 생태계는 물 및 위생에 대한 접근을 제공하는 데 중요합니다. 세계적인 물 부족과 기본 위생에 대한 접근 부족은 매우 중요하여 유엔은 2018-2028 년 지속 가능한 개발을위한 물에 대한 행동을위한 국제 10 년을 선언했습니다. 이 대학은 지역 사회 개발 및 위생 및 깨끗한 물 문제 해결을 포함하여 지속 가능성에 중점을 둔 글로벌 지역 사회의 요구를 바라 보는 인도주의 공학 전공을 제공합니다. 우리의 토목 공학 연구 영역은 식수, 하수, 홍수 및 관개 관리를위한 시스템에 연구 및 교육을 제공함으로써 지역 사회의 생활 방식을 개선하는 것을 목표로합니다. 음주 및 위생 목적으로 식수의 보존은 새로운 지속 가능성 전략에서 인정됩니다. 2025 년까지 식수의 양을 30% 줄이기위한 목표가 포함되어 있습니다.이 목표에 대한 첫 번째 이니셔티브는 대학의 유명한 사각형 잔디밭에서 관개를 전환하는 것이 었습니다. 지하 빗물 회수 탱크에서 물에 물에 물이 있습니다. 우리는 SDG6의 목표를 지원하는 상당한 교육 및 연구 활동이 있습니다.",목표에 대한 첫 번째 이니셔티브는 대학의 유명한 사각형 잔디밭에서 관개를 전환하는 것이 었습니다. 지하 빗물 회수 탱크에서 물에 물에 물이 있습니다. 우리는 SDG6의 목표를 지원하는 상당한 교육 및 연구 활동이 있습니다.,6,2
1717,바레인,Bahrain University,"NATIONAL ENVIRONMENTAL
LEGISLATIONS
UOB is committed to national environmental legislation to
reduce the negative impacts of waste generation from daily
activities. A waste hierarchy that focuses on preventing
waste from being produced, reusing items and segregating
materials for recycling is followed.","국가 환경
법제정
UOB는 다음과 같은 국가 환경 입법에 전념하고 있다.
매일 발생하는 폐기물 발생의 부정적인 영향을 줄이다.
활동. 다음을 방지하는 데 중점을 둔 폐기물 계층
생산, 품목 재사용 및 분리로 인한 폐기물
재활용을 위한 재료들이 뒤따른다.","국가 환경 법률 UOB는 일상 활동으로부터 폐기물 생성의 부정적인 영향을 줄이기 위해 국가 환경 법률에 전념하고 있습니다.폐기물이 생산되는 것을 방지, 품목 재사용 및 재활용 재료를 분리하는 데 중점을 둔 폐기물 계층 구조가 이어집니다."," 생산되는 것을 방지, 품목 재사용 및 재활용 재료를 분리하는 데 중점을 둔 폐기물 계층 구조가 이어집니다.",12,2
1865,캐나다,Brock University,"Initiatives at Brock University
WATER REFILL STATIONS  
Brock has 44 water refill stations across  campus that can be used to reduce the need for single use plastic bottles. There are many negative effects from the use of single use plastics, and any effort made by using these water refill stations is greatly appreciated.","Brock University의 이니셔티브
급수 스테이션  
브록은 1회용 플라스틱 병의 필요성을 줄이는 데 사용할 수 있는 44개의 물 리필 스테이션이 캠퍼스 전역에 있습니다. 일회용 플라스틱 사용으로 인한 많은 부정적인 영향이 있으며, 이러한 물 리필 스테이션을 사용하는 모든 노력은 매우 감사합니다.","Brock University Water Refill Station의 이니셔티브 Brock에는 단일 사용 플라스틱 병의 필요성을 줄이는 데 사용할 수있는 캠퍼스 전역에 44 개의 물 리필 스테이션이 있습니다.단일 사용 플라스틱의 사용으로 인한 많은 부정적인 영향이 있으며, 이러한 물 리필 스테이션을 사용한 노력은 대단히 감사합니다."," 사용 플라스틱의 사용으로 인한 많은 부정적인 영향이 있으며, 이러한 물 리필 스테이션을 사용한 노력은 대단히 감사합니다.",6,2
1663,캐나다,Carleton University,"Electronic waste (e-waste) is one of the biggest environmental challenges of our time. E-Waste is otherwise known as electronic waste and includes old, broken or obsolete items such as computer monitors, keyboards, printers, and projectors. E-Waste is the fastest growing source of waste in North America. Landfilling e-waste is harmful to the environment because of substances such as cadmium, lead, and nickel which can leach into the soil and water sources.","전자 폐기물(e-waste)은 우리 시대의 가장 큰 환경 과제 중 하나입니다. 전자폐기물은 전자폐기물로 알려져 있으며 컴퓨터 모니터, 키보드, 프린터 및 프로젝터와 같은 오래되거나 고장나거나 오래된 품목이 포함되어 있습니다. 전자폐기물은 북아메리카에서 가장 빠르게 증가하는 쓰레기 원천이다. 매립 전자 폐기물은 토양과 수원으로 스며들 수 있는 카드뮴, 납, 니켈과 같은 물질 때문에 환경에 해롭다.","전자 폐기물 (전자 폐기물)은 우리 시대의 가장 큰 환경 문제 중 하나입니다.전자 폐기물은 전자 폐기물로 알려져 있으며 컴퓨터 모니터, 키보드, 프린터 및 프로젝터와 같은 오래된, 부서 지거나 쓸모없는 품목을 포함합니다.전자 폐기물은 북미에서 가장 빠르게 성장하는 폐기물 공급원입니다.매립 전자 폐기물은 카드뮴, 납 및 니켈과 같은 물질로 인해 토양과 수원에 침출 할 수 있기 때문에 환경에 유해합니다."," 전자 폐기물은 카드뮴, 납 및 니켈과 같은 물질로 인해 토양과 수원에 침출 할 수 있기 때문에 환경에 유해합니다.",14,2
1550,영국,London School of Economics and Political Science,"LSE is supporting efforts to move to the circular economy. We apply the “Reduce, reuse, recycle, recover” hierarchy to avoid sending waste to landfill, decrease overall amount of waste and increase recycling rates.","LSE는 순환 경제로의 전환을 위한 노력을 지원하고 있습니다. 당사는 쓰레기 매립지로의 폐기물 전송을 방지하고 전체 폐기물의 양을 줄이고 재활용률을 높이기 위해 ""감소, 재사용, 재활용, 회수"" 계층을 적용합니다.","LSE는 순환 경제로 이동하려는 노력을 지원하고 있습니다.우리는“감소, 재사용, 재활용, 복구”계층을 적용하여 매립지로 폐기물을 보내지 않고 전반적인 폐기물의 양을 줄이며 재활용률을 증가시킵니다."," 재사용, 재활용, 복구”계층을 적용하여 매립지로 폐기물을 보내지 않고 전반적인 폐기물의 양을 줄이며 재활용률을 증가시킵니다.",12,2
586,뉴질랜드,Auckland universitiy,"LEGAL RIGHTS FOR SUSTAINABLE USE OFNATURAL RESOURCESProperty rights are an important cause of ecological harm, but can also bea powerful tool to provide effective solutions to environmental and resourceuse conflicts. Significant new research by Ms Prue Taylor (School ofArchitecture and Planning) and Professor David Grinlinton (Faculty of Law)considers the legal duty of property owners to use land sustainably, andthe emergence of the ‘public trust’ doctrine requiring governments to moreproactively protect environmental values. The work covers internationalenvironmental law and the development of a legal order based uponecological sustainability and New Zealand law and policy and aims todevelop creative solutions to respond to the ecological challenges.","천연 자원의 지속 가능한 사용을 위한 법적 권리

재산권은 생태학적 해악의 중요한 원인이지만, 환경 및 자원 사용 분쟁에 대한 효과적인 해결책을 제공하는 강력한 도구가 될 수 있다. 프루 테일러(건축 및 계획 학교)와 데이비드 그린린턴(법학부) 교수의 중요한 새로운 연구는 토지를 지속 가능하게 사용해야 하는 재산 소유주의 법적 의무와 정부가 환경 가치를 보다 적극적으로 보호해야 한다는 '공공 신뢰' 교리의 출현을 고려한다. 이 작업은 생태학적 지속가능성과 뉴질랜드의 법과 정책을 기반으로 한 국제 환경법과 법적 질서의 개발을 다루고 있으며, 생태학적 도전에 대응할 수 있는 창의적인 해결책을 개발하는 것을 목표로 하고 있다.","자연 자원의 지속 가능한 사용에 대한 법적 권리는 생태 학적 피해의 중요한 원인이지만 환경 및 자원 분쟁에 대한 효과적인 솔루션을 제공 할 수있는 강력한 도구도 할 수 있습니다.Prue Taylor (School ofarchitecture and Planning)와 David Grinlinton 교수 (법학 교수)의 중요한 새로운 연구는 재산 소유자가 토지를 지속적으로 사용 해야하는 법적 의무를 고려하고, 정부가 환경 적 가치를보다 효과적으로 보호하도록 요구하는 '공공 신뢰'교리의 출현을 고려합니다..이 작업은 국제 환경법과 제압 성 지속 가능성과 뉴질랜드 법률 및 정책을 기반으로 한 법적 질서의 발전을 다루고 있으며 생태 학적 도전에 대응하기 위해 창조적 솔루션을 개발했습니다.",자연 자원의 지속 가능한 사용에 대한 법적 권리는 생태 학적 피해의 중요한 원인이지만 환경 및 자원 분쟁에 대한 효과적인 솔루션을 제공 할 수있는 강력한 도구도 할 수 있습니다,15,2
958,캐나다,McMaster University,"A team of researchers in the department of chemical engineering is
looking for solutions to large environmental problems using very, very
small materials: nanoparticles. One project is a Global Water Futures
initiative to resolve the issue of water quality on Six Nations of the
Grand River. Along with analyzing the contaminants in the water,
they’re developing nanocomposite membranes that not only filter
water, but also resist getting clogged with biofilms, bacteria and
other foulants.","화학공학과에 있는 한 연구팀은
큰 환경 문제에 대한 해결책을 찾기 위해 매우, 매우
작은 물질: 나노 입자. 한 프로젝트는 글로벌 워터 퓨처스이다.
6개국의 수질 문제를 해결하기 위한 이니셔티브
그랜드 리버. 물속의 오염물질 분석과 함께
나노복합체 막이 개발되고 있어 필터뿐만 아니라
물, 그러나 또한 바이오필름, 박테리아, 그리고 박테리아로 막히는 것에 저항한다.
기타 오염 물질","화학 공학과의 연구팀은 매우 작은 재료를 사용하여 나노 입자를 사용하는 큰 환경 문제에 대한 해결책을 찾고 있습니다.하나의 프로젝트는 그랜드 리버의 6 개국에서 수질 문제를 해결하기위한 글로벌 수자원 선물 이니셔티브입니다.물의 오염 물질을 분석하는 것과 함께, 그들은 물을 여과 할뿐만 아니라 바이오 필름, 박테리아 및 기타 오염 물질로 막히지 않는 나노 복합체 막을 개발하고 있습니다.",화학 공학과의 연구팀은 매우 작은 재료를 사용하여 나노 입자를 사용하는 큰 환경 문제에 대한 해결책을 찾고 있습니다,14,2
1018,오스트레일리아,University of Sydney,"This goal aims promote the conservation and sustainable use of oceans and marine resources. Oceans regulate
and drive the global systems, like the weather and climate, that provide our drinking water and oxygen, and
they provide a key source of protein for more than 3 billion people worldwide (SDG14). Australia’s marine
jurisdiction is the third largest in the world and its contribution of approximately $50 billion annually to the
economy is expected to double within the next decade.
The University manages a research field station, One Tree Island, with one of the highest levels of
protection within the World Heritage-listed Great Barrier Reef. It provides staff and students with
opportunities to access one of the most vulnerable marine ecosystems. The Marine Studies Institute is one of the
largest marine research and education centres in Australia.
We have a range of research and education activities supporting life below water. One research project,
awarded an Australian Research Council PFAS Remediation Research Program grant, in the School of
Chemical and Biomolecular Engineering looks to develop a system that effectively removes per-and
polyfluoroalkyl substances (PFAS) from contaminated water. Often referred to as “forever chemicals”, PFAS
are persistent pollutants that do not readily break down, accumulating in the environment and often leading
to the contamination of water sources and food. It is hoped the technology could also be applied to other
difficult to treat pollutants including pesticides, pharmaceuticals and endocrine disruptors.","이 목표는 해양과 해양 자원의 보존과 지속 가능한 사용을 촉진하는 것을 목표로 한다. 바다는 조절한다.
그리고 날씨와 기후와 같은 우리의 식수와 산소를 공급하는 지구 시스템을 운전한다.
그들은 전 세계 30억 명 이상의 사람들에게 단백질의 핵심 공급원을 제공한다. 오스트레일리아의 해병대
사법권은 세계에서 세 번째로 크고 매년 약 500억 달러의 기여가 있다.
경제는 다음 10년 안에 두 배로 증가할 것으로 예상된다.
그 대학교는 연구 현장 스테이션인 One Tree Island를 관리한다.
세계문화유산에 등재된 그레이트 배리어 리프 내의 보호 그것은 직원과 학생들에게 다음을 제공한다.
가장 취약한 해양 생태계에 접근할 수 있는 기회들 해양연구소는 다음 중 하나이다.
호주에서 가장 큰 해양 연구 및 교육 센터
우리는 수중 생활을 지원하는 다양한 연구 및 교육 활동을 하고 있습니다. 하나의 연구 프로젝트,
Australian Research Council PFAS 교정조치 연구 프로그램 보조금을 수여했다.
화학 및 생체 분자 공학은 효과적인 제거 시스템을 개발하려고 합니다.
오염된 물에서 나온 PFAS(폴리플루오로알킬 물질) 흔히 ""영원한 화학물질""로 언급되는 PFAS
쉽게 분해되지 않는 지속성 오염물질이며, 환경에 축적되고 종종 유도된다.
수원과 음식의 오염까지. 그 기술이 다른 기술에도 적용될 수 있기를 바란다.
살충제, 의약품, 내분비 교란제를 포함한 오염물질을 처리하기 어렵다.","이 목표는 바다와 해양 자원의 보존 및 지속 가능한 사용을 촉진합니다. 해양은 식수와 산소를 제공하는 날씨와 기후와 같은 전 세계 시스템을 조절하고 주도하며 전 세계 30 억 명 이상의 사람들에게 단백질의 주요 원천을 제공합니다 (SDG14). 호주의 해양 관할 구역은 세계에서 세 번째로 큰 것으로, 경제에 매년 약 500 억 달러의 기여가 향후 10 년 내에 두 배가 될 것으로 예상됩니다. 이 대학은 연구 현장 스테이션 인 One Tree Island를 관리하며, 세계 문화 유산에 등재 된 Great Barrier Reef 내에서 가장 높은 수준의 보호 기능 중 하나가 있습니다. 직원과 학생들에게 가장 취약한 해양 생태계 중 하나에 접근 할 수있는 기회를 제공합니다. 해양 연구 연구소는 호주에서 가장 큰 해양 연구 및 교육 센터 중 하나입니다. 우리는 물 아래의 삶을 지원하는 다양한 연구 및 교육 활동이 있습니다. 한 연구 프로젝트는 화학 및 생체 분자 공학 학교에서 호주 연구위원회 PFAS 개선 연구 프로그램 보조금을 수상했습니다. 종종“Forever Chemicals”라고도하는 PFA는 지속적으로 분해되지 않는 지속적인 오염 물질이며, 환경에서 축적되며 종종 수원과 음식의 오염으로 이어집니다. 이 기술은 살충제, 제약 및 내분비 교란을 포함한 오염 물질을 치료하기 어려운 다른 오염 물질에도 적용될 수 있기를 희망합니다.","이 목표는 바다와 해양 자원의 보존 및 지속 가능한 사용을 촉진합니다. 해양은 식수와 산소를 제공하는 날씨와 기후와 같은 전 세계 시스템을 조절하고 주도하며 전 세계 30 억 명 이상의 사람들에게 단백질의 주요 원천을 제공합니다 (SDG14). 호주의 해양 관할 구역은 세계에서 세 번째로 큰 것으로, 경제에 매년 약 500 억 달러의 기여가 향후 10 년 내에 두 배가 될 것으로 예상됩니다. 이 대학은 연구 현장 스테이션 인 One Tree Island를 관리하며, 세계 문화 유산에 등재 된 Great Barrier Reef 내에서 가장 높은 수준의 보호 기능 중 하나가 있습니다. 직원과 학생들에게 가장 취약한 해양 생태계 중 하나에 접근 할 수있는 기회를 제공합니다. 해양 연구 연구소는 호주에서 가장 큰 해양 연구 및 교육 센터 중 하나입니다. 우리는 물 아래의 삶을 지원하는 다양한 연구 및 교육 활동이 있습니다. 한 연구 프로젝트는 화학 및 생체 분자 공학 학교에서 호주 연구위원회 PFAS 개선 연구 프로그램 보조금을 수상했습니다. 종종“Forever Chemicals”라고도하는 PFA는 지속적으로 분해되지 않는 지속적인 오염 물질이며, 환경에서 축적되며 종종 수원과 음식의 오염으로 이어집니다. 이 기술은 살충제, 제약 및 내분비 교란을 포함한 오염 물질을 치료하기 어려운 다른 오염 물질에도 적용될 수 있기를 희망합니다.",14,2
192,영국,University of Glasgow,"Our College of Arts is also involved in research
to develop new tools and approaches that will
help trees and woodlands adapt to climate
change and enable the UK to reach net-zero
greenhouse emissions. The research will also
improve public understanding of the value of
trees to people and the planet, and support the
expansion of treescapes across the UK.","우리 예술대학도 연구에 참여하고 있습니다._x000D_
다음과 같은 새로운 도구와 접근 방식을 개발하다_x000D_
나무와 숲이 기후에 적응하도록 돕다_x000D_
변화하고 영국이 순제로에 도달할 수 있도록 한다._x000D_
온실 효과 배출 그 연구는 또한_x000D_
의 가치에 대한 대중의 이해를 높이다_x000D_
나무들은 사람들과 행성에, 그리고 지지합니다_x000D_
영국 전역의 수목경관 확장이라고 말했다.",우리의 예술 대학은 또한 나무와 삼림이 기후 변화에 적응하고 영국이 네트 제로 온실 배출에 도달 할 수 있도록 새로운 도구와 접근 방식을 개발하기위한 연구에 참여하고 있습니다.이 연구는 또한 사람들과 지구에 대한 나무의 가치에 대한 대중의 이해를 향상시키고 영국 전역의 트레 스케이프의 확장을 지원할 것입니다., 연구는 또한 사람들과 지구에 대한 나무의 가치에 대한 대중의 이해를 향상시키고 영국 전역의 트레 스케이프의 확장을 지원할 것입니다.,15,2
